,question,retrieved_contexts,reference,reference_contexts
0,¿Quién es Joaquín Sabina?,"['Consiguió tres discos de platino por Vinagre y rosas (2009)\u200b y uno de oro por Lo niego todo (2017),\u200b sus últimos discos hasta el momento. Biografía Primeros años Joaquín Sabina nació el 12 de febrero de 1949 en el municipio de Úbeda (Jaén, España), segundo hijo de Adela Sabina del Campo, ama de casa y de Jerónimo Martínez Gallego, inspector de policía.\u200b Cursó sus estudios primarios con las monjas carmelitas y con catorce años comenzó a escribir poemas y a componer música en una banda formada con sus amigos llamada Merry Youngs, que se dedicaban sobre todo a versionar a cantantes de rock como Elvis Presley, Chuck Berry o Little Richard.\u200b Por esa época, tuvo a su primera novia, Virtudes Antero «Chispa», que le sirvió como inspiración para crear algunos poemas de amor.', 'Balbino Gutiérrez Quesada (Campillo de Arenas, 8 de diciembre de 1944-Madrid, 29 de octubre de 2019)\u200b fue un escritor, periodista y flamencólogo español, destacado por su faceta como divulgador y crítico de flamenco y por ser el biógrafo oficial del cantaor Enrique Morente.\u200b\u200b\u200b Trayectoria Nació en la provincia de Jaén y, tras la guerra civil española, su familia se mudó a Granada. En su juventud, estuvo en contacto en la clandestinidad con el Partido Comunista de España (PCE) y viajó a París, donde participó en el Mayo del 68. A principios de los años 70, se instaló en Madrid donde obtuvo el título de Licenciado en Historia Moderna y Contemporánea por la Universidad Autónoma de Madrid (UAM).', 'Joaquín Ramón Martínez Sabina (Úbeda, 12 de febrero de 1949) es un cantautor, poeta y pintor español.\u200b Ha publicado diecisiete discos de estudio y siete en directo, y ha colaborado con distintos artistas cantando dúos y realizando otras colaboraciones. Los álbumes en directo son grabaciones de actuaciones en las que ha intervenido en solitario o junto con otros artistas: La mandrágora (1981), junto a Javier Krahe y Alberto Pérez; Joaquín Sabina y Viceversa en directo (1986), junto a la banda Viceversa; Enemigos íntimos (1998) junto a Fito Paez; Nos sobran los motivos (2000) y Dos pájaros de un tiro (2007) junto a Joan Manuel Serrat. Se estima que ha vendido más de diez millones de discos y también ha compuesto para otros artistas como Ana Belén, Andrés Calamaro o Miguel Ríos, entre otros. En su faceta literaria ha publicado nueve libros con recopilaciones de letras de canciones o poemas publicados en el semanario Interviú.', 'Su antigua compañía, viendo la fama que estaba ganando el artista, publicó sin su consentimiento una colección a la que titularon Joaquín Sabina y todos sus éxitos. Se separó de Viceversa y se asoció con Víctor Claudín y Pedro Sauquillo para dirigir la sala de conciertos Elígeme, en el barrio de Malasaña de Madrid. En 1988 publicó El hombre del traje gris, que estrenó en la Plaza de Toros de Las Ventas de Madrid y después realizó una multitudinaria gira por México, Argentina y Venezuela. El álbum incluía la banda sonora, escrita junto a Pancho Varona, de la película Sinatra.', 'Paco Gámez (Úbeda, Jaén, 1982) es un dramaturgo, actor, poeta y director teatral español. Biografía Desde muy joven, estuvo vinculado al teatro, ya que su hermana es cofundadora de La Paca, una de las compañías teatrales de referencia en Andalucía. En esta compañía dio sus primeros pasos en el arte dramático, como actor, hasta que comenzó a escribir sus propios textos. Entre sus influencias más claras están Carlos Be, Sergio Blanco, Itziar Pascual, José Carlos Plaza, María Velasco, Antonio Rojano, Marco Antonio de la Parra, Alfonso Zurro, y su paisano Tomás Afán, que también es cofundador de La Paca. Es Licenciado en Filología Inglesa por la Universidad de Jaén, Licenciado en Interpretación por la Escuela Superior de Arte Dramático de Sevilla y posgraduado en Ciencias del Espectáculo. Entre sus obras, destacan El fin, Inquilino (Numancia 9, 2º A), Katana o El suelo que sostiene a Hande y versiones como Eneida: playlist para un continente a la deriva o Las Calatravas.']","Joaquín Sabina es un cantautor y poeta de Úbeda, Jaén. Es conocido por algunas de sus canciones más famosas como '19 Días y 500 Noches', o 'Y nos dieron las diez'.","Joaquín Ramón Martínez Sabina (Úbeda, 12 de febrero de 1949), conocido como Joaquín Sabina, es un cantautor, poeta y pintor español​. Ha publicado diecisiete discos de estudio y siete en directo, y ha colaborado con distintos artistas cantando dúos y realizando otras colaboraciones. Los álbumes en directo son grabaciones de actuaciones en las que ha intervenido en solitario o junto con otros artistas: La mandrágora (1981), junto a Javier Krahe y Alberto Pérez; Joaquín Sabina y Viceversa en directo (1986), junto a la banda Viceversa; Enemigos íntimos (1998) junto a Fito Paez; Nos sobran los motivos (2000) y Dos pájaros de un tiro (2007) junto a Joan Manuel Serrat. Se estima que ha vendido más de diez millones de discos y también ha compuesto para otros artistas como Ana Belén, Andrés Calamaro o Miguel Ríos, entre otros. En su faceta literaria ha publicado nueve libros con recopilaciones de letras de canciones o poemas publicados en el semanario Interviú."
1,¿Cuando nació Juan Eslava Galán?,"['Juan Eslava Galán (Arjona, Jaén, 7 de marzo de 1948) es un escritor español del género histórico, tanto de ficción como de no ficción. Saltó a la popularidad con la obtención del Premio Planeta en 1987. Ha publicado algunas novelas bajo el pseudónimo de Nicholas Wilcox. Biografía Hijo de olivareros, estudió en los colegios de Arjona hasta que, al cumplir los diez años, su familia se trasladó a Jaén, donde prosiguió el bachillerato. Estos primeros años de estudios quedaron plasmados en su novela Escuela y prisiones de Vicentito González. Cursó Filosofía y Letras en la Universidad de Granada, licenciándose en Filología Inglesa, y luego realizó un viaje al Reino Unido con el objetivo de ampliar sus estudios. Allí estuvo viviendo en Bristol y Lichfield, y fue alumno y profesor asistente en la Universidad de Aston, Birmingham.', 'La documentación se refiere a él como «vecino de Córdoba», probablemente por haber nacido en la diócesis. Debía ser muy joven, ya que todavía era subdiácono y no había dado el paso al sacerdocio. Por lo demás, el musicólogo Andrés Llordén afirma que «[n]inguna otra noticia podemos apuntar de este maestro de capilla pero ya en 11 de diciembre de 1593 refiere el acta que estaba vacante la plaza por estar ausente Juan de Riscos, que la disfrutaba».\u200b En 1586 se presentó a las oposiciones al magisterio de la Catedral de Málaga, pero «quedó excluido Juan Martínez Risco por no tener la edad, según los estatutos», lo que confirma la juventud del maestro.', 'Biografía Nació en Andújar (Jaén) el 17 de marzo de 1893 en el seno de una familia de clase media acomodada. Familia conservadora y de gran tradición católica, afincada en Andújar (Jaén) y oriunda de la ciudad de Onda (Castellón). Antonio, hijo de Celestino Mezquita Gaya y de Rosa Mezquita Vilar, fue el mayor de tres hermanos (Antonio, Teresa y Celestino) y estuvo siempre muy unido y vinculado a su familia. En su juventud realizó trabajos como ayudante en el despacho que poseía su padre como Agente de Comercio. Más tarde, él mismo regentaría sus propias representaciones comerciales. Posteriormente y siguiendo la tradición familiar, crearía su propia industria de cerámica, industria que mantendría en funcionamiento hasta el año 1937, año en el que por las circunstancias de la guerra, se vio obligado a suspender su actividad. En 1918 contrajo matrimonio con Luisa García-Rabadán López con la que tendría once hijos, de los cuales, solo nueve de ellos alcanzarían la vida adulta.', 'Biografía Nacido el 2 de julio de 1843 en Úbeda, era hijo de Rafael y Purificación, naturales de la misma ciudad.\u200b Gallego, que perdió a su madre a los siete años de edad, cursó las primeras letras y latín en su ciudad natal.\u200b Su padre falleció cuando él tenía doce años, lo que le condujo a ser tutelado por sus abuelos maternos, Diego Díaz de Ortego y Catalina Tamayo, propietarios ubetenses.\u200b Marchó al Instituto de Jaén como colegial interno, y allí estudió filosofía, obteniendo en 1859 el grado de bachiller en artes.\u200b Ese año partió a Granada, en cuya universidad se matriculó para el primer año de la carrera de Derecho, si bien solo estudió allí dos años.\u200b En 1861 se mudó a Madrid, donde estudió la hacienda pública española, con Segismundo Moret.\u200b Vuelto a Granada en 1862, recibió el grado de bachiller en derecho civil y canónico.\u200b Regresó después a la Universidad Central, donde el 16 de junio de 1864 se licenció en derecho administrativo y en 1864 se investía como abogado.\u200b Durante su último año de carrera tuvieron lugar los acontecimientos de la noche de San Daniel, que le impulsaron a manifestarse en contra del marqués de Zafra.\u200b Gallego, que desempeñó el oficio de abogado, colaboró en la redacción de La Publicidad, además de en El Faro de la Loma.\u200b Apoyó la revolución de 1868 y fue elegido diputado en la circunscripción jienense de Baeza con 14 234 votos, cuando apenas contaba veinticinco años.\u200b Adscrito a los progresistas independientes en las Cortes constituyentes de 1869, quienes defendían ideas como la abolición de la pena de muerte y la esclavitud, la creación de una sola cámara o la necesidad de la Milicia voluntaria, entre otras.\u200b Más adelante desempeñó el cargo de consejero de Instrucción Pública, además de ser miembro correspondiente de la Real Academia de la Historia.\u200b Gallego, que era senador vitalicio desde 1898,\u200b falleció en febrero de 1917 en su localidad natal.\u200b', 'Conocedor y heredero de la larga tradición gótica en la península, fue el inventor de la bóveda vaída y de otras ingeniosas soluciones constructivas. Biografía Primeros años De posible origen flamenco, atendiendo a su apellido,\u200b debe descartarse que se formase al lado de su supuesto padre al que Antonio Ponz y Eugenio Llaguno y Amirola llamaron Pedro de Vandelvira, que había estudiado en Italia.\u200b En todo caso, ya en 1523, cuando rondaría los dieciocho años, se le documenta haciendo modestos trabajos de cantería en Alcaraz, como el convento de San Francisco y la iglesia de San Ignacio.\u200b Pudo aprender el oficio con Francisco de Luna, maestro de cantería, pues contrajo matrimonio con su hija Luisa de Luna, de Villacarrillo, con la que tuvo siete hijos, uno de los cuales, Alonso de Vandelvira, escribió un Libro de cortes de piedra, en el cual difunde la disciplina de la montea o estereotomía o plano constructivo en tres dimensiones, que ayudó a que la obra técnica de su padre fuera conocida en Europa.']","Juan Eslava Galán nació el 7 de marzo de 1948 en Arjona, Jaén.","Juan Eslava Galán (Arjona, Jaén, 7 de marzo de 1948) es un escritor español del género histórico, tanto de ficción como de no ficción. Saltó a la popularidad con la obtención del Premio Planeta en 1987. Ha publicado algunas novelas bajo el pseudónimo de Nicholas Wilcox. Biografía Hijo de olivareros, estudió en los colegios de Arjona hasta que, al cumplir los diez años, su familia se trasladó a Jaén, donde prosiguió el bachillerato. Estos primeros años de estudios quedaron plasmados en su novela Escuela y prisiones de Vicentito González. Cursó Filosofía y Letras en la Universidad de Granada, licenciándose en Filología Inglesa, y luego realizó un viaje al Reino Unido con el objetivo de ampliar sus estudios. Allí estuvo viviendo en Bristol y Lichfield, y fue alumno y profesor asistente en la Universidad de Aston, Birmingham."
2,¿Cuál es la formación de Maite Martín Valdivia?,"['Dionisio Jordán Infante. (Valdepeñas de Jaén, 29 de julio de 1887 – Alicante,1963). Pintor y profesor, natural de Valdepeñas de Jaén. Formado en Madrid con Emilio Sala. Desde 1917 profesor de Dibujo en las Escuelas Normales de Alicante, lugar al que estuvo vinculado hasta su muerte.\u200b Biografía Nacido en Valdepeñas de Jaén el 29 de julio de 1887. Hijo de José Jordán Cobo, natural de Valdepeñas de Jaén y de Dionisia Infante Marcos, natural de Valdemoro, Madrid. Casó con Rogelia Peña Serrano en Sorihuela del Guadalimar el 1 de septiembre de 1921. A su vez una hermana de ésta casó con el pintor ubetense José María Tamayo Serrano. El matrimonio entre Dionisio Jordán y Rogelia Peña dejó dos hijos: José Luis Jordán Peña, y Mª Ángeles Jordán Peña. Formado en la Escuela especial de Pintura, Escultura y Grabado de Madrid, bajo la dirección del pintor Emilio Sala, donde obtuvo el título de profesor de Dibujo (1914).', 'Manuel Valdivia Ureña (Martos, 12 de noviembre de 1928 - Valencia, 29 de abril de 2014)\u200b fue un ingeniero agrónomo, matemático, catedrático universitario y académico español.\u200b Biografía Manuel Valdivia se graduó como ingeniero agrónomo en la Escuela Técnica Superior de Ingenieros Agrónomos de Madrid en 1958. Se doctoró en la misma en 1961, mismo año en el que obtuvo la licenciatura en Matemáticas por la Universidad Complutense de Madrid, materia en la que se doctoró también dos años más tarde (1963) de la mano de Ricardo San Juan Llosá.', 'Juan Pascual Valdivia y Valenzuela (Alcalá la Real, c. 1737 - Olivares, 12 de marzo de 1811) fue un compositor y maestro de capilla español.\u200b Vida Juan Pascual Valdivia y Valenzuela nació en Alcalá la Real, en la provincia de Jaén, hijo de Gregorio Valenzuela y Valdivia y Ana Valdivia, hacia 1735 o 1737.\u200b La fecha de su nacimiento se calcula por su ordenación de sacerdote en 1762. En ese momento la edad mínima para ordenarse era de 25 años, por lo que debió nacer hacia 1737 o poco antes. No se ha encontrado la documentación de su bautizo en Alcalá la Real, posiblemente porque los archivos eclesiásticos de las iglesias parroquiales y la Colegiata de Alcalá la Real fueron destruidos durante la Guerra de la Independencia Española en 1812 y durante la Guerra civil en 1936. Se desconoce cuál fue su formación musical, pero es de suponer que sería en la Colegiata de Alcalá la Real, con la capilla de música.', 'Se desconoce cuál fue su formación musical, pero es de suponer que sería en la Colegiata de Alcalá la Real, con la capilla de música. De hecho, se desconoce la trayectoria de Valdivia hasta su llegada a Olivares.\u200b Oposiciones al magisterio de la Colegiata de Olivares El 10 de septiembre de 1759 fallecía el maestro de la Colegiata de Olivares, Antonio González Guerrero. Antes de su fallecimiento ya debía estar muy enfermo y el capellán músico Francisco Mayés y el organista Juan Mayorga ejercían sus funciones en sustitución. Se decidió que el tribunal de las oposiciones fuese presidido Juan Roldán, organista segundo de la Catedral de Sevilla, «sujeto mui avil en composición, y de mucha consiencia». Otros participantes del tribunal de las oposiciones serían el citado Juan Mayorga, el racionero Juan Bejarano y el secretario capitular José Hernández Araujo. Solo se presentaron dos aspirantes: Francisco Delgado Montero y Juan Domingo Vidal.', 'Andrés de Valdivia y Salido (Úbeda, 1517\u200b- San Juan de Úbeda —actual Valdivia—, 25 de abril de 1575)\u200b fue un escribano y conquistador español de mediados del siglo xvi, muerto por los indios en la comarca de su gobernación en San Andrés de Cuerquia en 1575. Era escribano de Anserma. Biografía Andrés de Valdivia nació en el barrio del Alcázar de la castellana ciudad de Úbeda, siendo sus padres Rodrigo de Valdivia e Inés Salido, y bautizado el 13 de enero de 1517.\u200b Casó en Úbeda con Juana de Loaisa y tuvo cuatro hijos llamados Luis, Luisa, María y Elena.']","Maite Martín Valdivia consiguió la diplomatura en Informática por la Universidad de Granada en 1990. Más tarde, en 1992, obtuvo la licenciatura en Informática en la misma universidad, realizando más tarde su tesis doctoral en la Universidad de Málaga.","María Teresa (ó Maite) Martín Valdivia (Jaén) es doctora en informática. Desde 1995 trabaja en la Universidad de Jaén como profesora del área de Lenguajes y Sistemas Informáticos del Departamento de Informática. Desde 2019 es catedrática de universidad. Forma parte del equipo de investigación SINAI (Sistemas Inteligentes de Acceso a la Información) desde su creación en 2001.​ Su área de especialización es el Procesamiento del Lenguaje Natural, y en la actualidad investiga dentro de los temas de análisis de opiniones y emociones, minería de textos, aprendizaje automático y búsqueda y recuperación de información en biomedicina. Biografía Se diplomó (1990) y licenció (1992) en Informática en la Universidad de Granada."
3,Dame un resumen de la Leyenda del Lagarto de la Malena,"['De judiciis, Matr., 1636. Tratado de las obligaciones de los jueces', 'Los vicios irremediables del jurado: (es preciso suprimirle), Centro Editorial de Góngora, Madrid, 1911. Régimen de la autonomía municipal, Editorial Reus, Madrid, 1919. Accidentes del trabajo: comentarios, jurisprudencia y formularios a la ley de 10 de enero de 1922, Reglamento de 29 de diciembre del mismo año, con el procedimiento de la de tribunales industriales y legislación complementaria, Talleres Reus, Madrid, 1923, en colaboración con Salvador Alarcón Horcas. Accidentes de trabajo. Jurisprudencia y comentarios del libro tercero del Código del Trabajo. Tipografía de la Revista de Tribunales Sevilla, 1927, en colaboración con Antonio Luna García, Sevilla. “La Real Orden sobre redacción de las actas en el juicio penal”, en: Revista de los Tribunales y de Legislación Universal, Tomo XLVII, n º 42, Madrid, 1913. “Política orgánica”, en: Revista de Jurisprudencia y de Legislación Universal, Madrid, 1924.', '7.ª- La cuota de entrada era de 4 reales, la mitad en caso de herencia del puesto por hijo de cofrade. 8.ª- Se ordena asistir a los entierros de hermanos “con toda la cera”; y a los de sus familiares con la mitad. 9.ª- Se dispone que haya un arca para guardar los estatutos, el libro de cuentas, actas y registro y los fondos, con tres llaves, en manos del gobernador, el alférez y el mayordomo, bajo cuya custodia quedaría de no poder estar en la iglesia. 10.ª- Prohíben jurar en nombre de Dios en las juntas de hermanos, y la pertenencia a la hermandad de “morisco, mulato, negro, (...) esclavo (...) guarda, pregonero ni de estraña nación”. 11.ª- Mandan decir misas por el alma de los hermanos difuntos, pagando cada hermano 4 maravedíes para sufragarlas. 12.ª- Se acuerda celebrar una Junta de Gobierno (sólo los cargos) el cuarto domingo de Cuaresma para preparar la procesión del Viernes Santo. 13.ª- Los hermanos debían acompañar los entierros de los “frailes y monjas” del monasterio con toda la cera.', 'Como parte de la conmemoración y recuerdo se publicó una antología de su obra con el nombre de Decirte lo que pienso, lo que vivo. Obra Cancionero Premios y reconocimientos Pregonero de la Semana Santa de Úbeda (1956) Fiesta de la poesía de Úbeda (Flor Natural, 1957) Notas acerca del substratum humano en la Novísima recopilación (1957) Ensayos sobre Abrahan Lincoln (Tercer Premio, 1959) Ministerio de Educación Nacional (1960) Pregonero de la Semana Santa de Úbeda (1973) Pregonero de la Fiesta de la Vendimia de la Rioja (1973) Pregonero de la Semana Santa de Úbeda (1985) Hijo adoptivo de Úbeda (1986)', 'El Tribunal Constitucional declaró que se vulneraron los derechos de Vallejo a la legalidad penal y a la presunción de inocencia. Como resultado, se ordenó que la Audiencia Provincial de Sevilla emita un nuevo fallo. La sentencia explica que los órganos judiciales hicieron una interpretación imprevisible del delito de prevaricación, prohibida por el derecho a la legalidad penal. Vallejo fue condenado por participar en la aprobación de presupuestos y modificaciones presupuestarias que permitieron el pago de ayudas sociolaborales, pero el Tribunal Constitucional consideró que estos actos, como parte del ejercicio de funciones del Poder Legislativo, no pueden ser constitutivos de prevaricación ya que no son resoluciones administrativas. Asimismo, el Tribunal Constitucional determinó que la participación de Vallejo en las modificaciones presupuestarias, aprobadas por el Parlamento de Andalucía, no podía considerarse ilegal y, por lo tanto, no justifica una condena por malversación.']","Aunque existen varias versiones, la más aceptada es la siguiente: ""En el barrio de la magdalena había un temible lagarto que atacaba a todas las personas que pasaban por allí a por agua, pues Jaén es muy rica en agua. Los ciudadanos ya estaban hartos y pidieron al rey que enviase a alguien a combatir contra el lagarto. Un preso que estaba condenado se ofreció a cambio de que le liberasen. Pidió la piel de una oveja, pólvora, panes y un caballo. Fue hacía el raudal y empezó a tirarle los panes al enorme lagarto. llegó a una calle sin salida y le tiro la oveja con la pólvora dentro. El lagarto se la tragó. Al cabo de unos minutos explotó y el preso retomó su libertad.""","En la ciudad de Jaén es más común el uso de \""reventar como el lagarto la Malena\"", pues el barrio y la leyenda son conocidos y es tanto una maldición como un dicho tradicional cuando alguien come en exceso, a modo de una advertencia. Actualmente es candidata a ser catalogada por la UNESCO como Patrimonio Cultural Inmaterial de la Humanidad, ya que previamente, el día 2 de julio de 2009 fue declarada como uno de los diez Tesoros del Patrimonio Cultural Inmaterial de España​ por parte del Bureau Internacional de Capitales Culturales.​ Posteriormente el Ayuntamiento de Jaén decidió declarar el 2 de julio como Día del Lagarto de La Magdalena.​​ Leyenda Según el mito, cuya primera referencia escrita data de 1628, en una cueva junto a la fuente de la Magdalena apareció un lagarto de grandes dimensiones (Gran Sierpe o Dragón), que atemorizaba a la gente y (dependiendo de la versión) se comía a quien iba a por agua o a las ovejas de los alrededores. Los vecinos de la Magdalena, asustados, no se atrevían a salir al manantial, por lo que buscaron una solución al problema del lagarto. En este punto, la leyenda se diversifica, habiendo tres versiones distintas de la muerte del reptil: El preso y los panes Un preso condenado a muerte solicitó su libertad a cambio de matar al lagarto. Tal era la desesperación de los vecinos que se le concedió la oportunidad de intentarlo. Para ello, solicitó un caballo, un costal de panes calientes y un saco con pólvora. Por la noche, el preso se presentó junto a la cueva y fue dejando una hilera de panes. El animal se despertó y se los fue comiendo tras el preso, que continuaba lanzando panes mientras huía a caballo. Al llegar a la plaza de San Ildefonso, en lugar de un pan le lanzó el saco de pólvora, que el animal devoró del mismo modo y, acto seguido, explotó."
