,question,retrieved_contexts,reference,reference_contexts
16,¿Por qué se libró la batalla de Bailén?,"['Cuando este cesó, interpretó su victoria. Dejó a la mitad de sus tropas en Guarromán y a las cinco de la tarde llegó a Bailén. Reding reforzó las tropas que había en los cerros San Cristóbal y el Ahorcado. Vedel, al ver las tropas, se resistió a creer que la batalla había acabado y ordenó atacar. Una vez iniciado este ataque, llegó una orden escrita de Dupont del cese del combate, con lo que a las seis de la tarde cesó todo fuego en Bailén. El hecho de que el enfrentamiento tuviese lugar a las mismas puertas de Bailén pudo ser decisivo para la victoria española: la población local apoyó en todo cuanto pudo a sus tropas. La ayuda más importante fue sin duda el suministro de agua para los soldados, en un día que los cronistas señalan como «especialmente caluroso» —en una región que ya de por sí registra elevadísimas temperaturas en esa época—. El suministro de agua no fue menos importante para las piezas de la artillería española, que no dejaron de cumplir su cometido contra las tropas francesas.', 'La batalla de Bailén se libró durante la Guerra de la Independencia Española y supuso la primera derrota en campo abierto de la historia del ejército napoleónico. Tuvo lugar el 19 de julio de 1808 junto a la ciudad jienense de Bailén. Enfrentó a un ejército francés de unos 21 000 soldados al mando del general Dupont con otro español más numeroso (unos 27 000) a las órdenes del general Teodoro Reding, aunque el general en jefe del llamado Ejército de Andalucía era el general Castaños. Aunque la primera derrota del Ejército de Napoleón en territorio español ocurrió entre el 8 y el 14 de junio de 1808, en la batalla de la Poza de Santa Isabel, en la bahía de Cádiz. Preliminares Las Juntas de gobierno de Sevilla (Junta Suprema de España e Indias) y Granada, bajo la presidencia de Francisco de Saavedra, comenzaron el reclutamiento de dos ejércitos, que debían cortar el camino a través de Sierra Morena a los franceses.', 'Todos estos monumentos se encuentran ubicados dentro del casco histórico de Bailén, en el que también puede admirarse las numerosas casas y palacetes de entre los siglos XVII al XIX. La fama universal de Bailén se debe a la batalla de Bailén (19 de julio de 1808) en las que fueron vencidas por primera vez en campo abierto las tropas de Napoleón, capitaneadas por Dupont, a manos del general Castaños y el general Teodoro Reding. La batalla se celebró a las puertas de la ciudad, donde los españoles en despliegue sobre una zona elevada sobre el campo y con sus flancos apostados en cerros, recibieron al contingente de tropas de Dupont, que salieron desde Andújar. El Plan de Porcuna diseñado por Castaños no contaba con la celebración del combate allí, sino en Andújar, pero la marcha de los franceses obligó a los españoles de Reding a formar en Bailén, donde estaban vivaqueando. De este modo, el combate empieza alrededor de las tres de la madrugada y termina a mediodía.', 'Y tercero, por qué no intentó bloquear el paso de Asdrúbal Barca por los Pirineos, pues para hacerlo debía despachar muchos soldados y sería vulnerable a un ataque desde el oeste.\u200b Gabriel también se pregunta por qué los generales cartagineses no atacaron juntos a Escipión.\u200b No podían hacerlo mientras las legiones estuvieran en Baecula, pues el terreno montañoso sólo permitiría un combate de infantería donde los legionarios tendrían toda la ventaja.\u200b Magón Barca y Asdrúbal Giscón llegaron pocos días después de la batalla, eso significaba que los romanos debían a unas decenas de kilómetros y los púnicos debían tener ventaja numérica.\u200b Polibio indica que la rivalidad entre Asdrúbal Barca y los otros generales impidió toda acción conjunta,\u200b pero seguramente se debió a las deserciones entre los íberos. Asdrúbal Barca se vio obligado a dar batalla porque su ejército estaba sufriendo tantas que pronto no podría ser operativo.', 'La batalla de Úbeda tuvo lugar entre el 16 y el 24 de julio de 1212 entre los cristianos del rey de Castilla Alfonso VIII y los restos del ejército musulmán recién derrotado en la batalla de las Navas de Tolosa, llamada por los musulmanes batalla de Hisn al-Iqab, realizada poco antes al principio de ese mismo lapso; la toma de Úbeda era tan importante que incluso los cronistas llamaban a la batalla de Las Navas ""batalla de Úbeda"" en sus obras, ya que de algún modo entendían que constituía el final o conclusión de la misma. Tras la victoria de Las Navas, era esencial para los cristianos tomar Baeza y Úbeda, llaves del valle del Guadalquivir. Al parecer, como refiere Argote de Molina, los musulmanes habían prevenido quizá una rebelión de los inquietos mozárabes de Baeza y la habían vaciado para recluirse en Úbeda, conocida entre ellos como Ubbadat al-arab,\u200b a causa de sus imponentes murallas, que incluían una torre albarrana octogonal al Norte.']","La batalla de Bailén se libró durante la Guerra de la Independencia Española para detener el avance del ejército napoleónico hacia el sur de España y proteger Andalucía, donde se organizaban tropas españolas para resistir la ocupación francesa.","La batalla de Bailén se libró durante la Guerra de la Independencia Española y supuso la primera derrota en campo abierto de la historia del ejército napoleónico. Tuvo lugar el 19 de julio de 1808 junto a la ciudad jienense de Bailén. Enfrentó a un ejército francés de unos 21 000 soldados al mando del general Dupont con otro español más numeroso (unos 27 000) a las órdenes del general Teodoro Reding, aunque el general en jefe del llamado Ejército de Andalucía era el general Castaños. Aunque la primera derrota del Ejército de Napoleón en territorio español ocurrió entre el 8 y el 14 de junio de 1808, en la batalla de la Poza de Santa Isabel, en la bahía de Cádiz. Preliminares Las Juntas de gobierno de Sevilla (Junta Suprema de España e Indias) y Granada, bajo la presidencia de Francisco de Saavedra, comenzaron el reclutamiento de dos ejércitos, que debían cortar el camino a través de Sierra Morena a los franceses."
17,¿Qué representa el Mosaico de los Amores?,"['En la parte inferior se extiende un sotabanco de mármol negro con vetas calizas y molduras de pedestal gótico, interrumpido en su mitad para el altar. El conjunto se corona con un medallón en cuyo centro hay un triángulo donde está grabado, en letras hebreas, el nombre que Dios reveló a Moisés en la zarza ardiendo, YaHWeH. Este símbolo está escoltado por cuatro ángeles que se encuentran sobre los pedestales de la balaustrada de la parte superior. Dos están orando, mientras que los otros dos, san Miguel y san Rafael, miran a los fieles que entran en el templo. Sala Capitular y Sacristía Mayor Ambas estancias fueron proyectadas y dirigidas por Andrés de Vandelvira, y se encuentran sobre el antiguo «panteón de los canónigos», actualmente museo de la catedral. El conjunto es una de las obras más importantes del renacimiento español. Sala capitular La sala capitular, también llamada capilla de san Pedro de Osma, es la estancia en la que mensualmente se reúnen los canónigos para tratar los asuntos de la catedral.', 'Esta presidido por el camarín de la Virgen enmarcado por cuatro columnas salomónicas en las que se enredan sarmientos de vid con pámpanas y racimos de uva. Están situados en los extremos y se sostienen al banco sobre cuatro ménsulas con ángeles tallados. El ático tiene forma de arco medio punto en él que se presenta un relieve de la Visitación de la Virgen María a Santa Isabel, cuya celebración coincide con la fiesta principal de la cofradía de la Virgen de la Capilla. El retablo fue realizado por el tallista Cristóbal Téllez que lo finalizó en 1600, siendo párroco el prior Melchor de Soria y Vera. El dorado y la policromía se encargaron posteriormente a otros artesanos.\u200b La capilla esta cubierta por bóveda de media naranja sobre pechinas y culminada por una claraboya cenital. El intradós de la bóveda está decorado con imágenes de ángeles, en su parte superior, y los ocho patriarcas de Israel, en su parte inferior. Sobre las pechinas se ubican los cuatro evangelistas.', 'En la parte superior, a la derecha, se incluye un crismón (anagrama del nombre de Cristo) flanqueado por las letras griegas ""alfa y omega"", que simbolizan la condición eterna de Dios. La pieza se halló durante la excavación de un edificio paleocristiano del yacimiento de Cástulo, a cuyo ajuar pertenecía. Se exhibe en el Museo Arqueológico de Linares. Iconografía comparable Según el folleto del Museo Arqueológico de Linares:\u200b', 'Dicha portada está dedicada a la Asunción de Nuestra Señora y presenta arco de medio punto con decoración de doce rosetas en su trasdós, dispuestas en cada una de sus dovelas, flanqueado por balaustres. El segundo cuerpo de la portada se presenta a modo de frontis acogiendo una hornacina bajo dosel, enmarcada por columnillas acanaladas de capiteles platerescos que acoge la imagen de la Virgen con el Niño. A los extremos del frontón, se aprecian sendos jarrones. En las enjutas de los arcos aparecen los escudos episcopales del cardenal Merino, quedando flanqueados por columnas abalaustradas sobre basamentos y capiteles. Sobre la portada, ventana de pronunciado derrame. A los pies del templo, el muro oeste está rematado por un sistema de contrafuertes en las esquinas y ventanal tripartito de estilo serliano de fábrica moderna. La fachada termina en hastial rematándose su vértice por cruz de hierro forjado de factura moderna.', 'La compleja decoración escultórica de emblemas y escudos nobiliarios de la fachada principal y del interior (que contrasta con la rancia austeridad hispánica de palacio, de sobriedad castellana extrema, en la cercana calle de Francisco de los Cobos), encierra un simbolismo funerario que conduce a la finalidad del espacio centralizado de la cripta acogida en una grandiosa y simbólica rotonda de forma circular, la más perfecta para expresar la Unidad o esencia infinita emanada de la uniformidad y Justicia de Dios, según la tratadística arquitectónica renacentista (Palladio). Siloé, siguiendo a Vitrubio, aplicó principios neo-pitagóricos a los planos, que determinaron para la nave central una longitud de ochenta pies de vara (algo más de 22 metros) y una anchura de 40 pies (unos once metros), y una altura de 100 pies (unos veintiocho metros).']","El Mosaico de los Amores representa que el exceso de pasión tiene sus consecuencias trágicas. A través de historias mitológicas como el Juicio de Paris y el mito de Selene y Endimión, se muestra cómo el amor y el deseo pueden llevar a resultados destructivos y finales trágicos. Los animales y Erotes en el mosaico refuerzan esta idea, simbolizando el engaño y la seducción.","A partir del año 2011, con la creación del Conjunto Arqueológico de Cástulo,​ y a través del proyecto de investigación Forum MMX,​ se han retomado las excavaciones arqueológicas que han sacado a la luz restos de edificaciones públicas, concretamente un posible templo de época imperial del siglo II​ que cuenta con muros estucados con motivos geométricos​ y un pavimento de mosaico en un gran estado de conservación.​ Hallazgos Mosaico de los Amores El mosaico es una alfombra de más de 750.000 teselas enlazadas en el suelo de un edificio, que data alrededor del siglo II o I a. C.​ Se trata de una composición geométrica en blanco, negro y ocre, marcando los emblemas por sus cuatro lados. Muestra una composición de cuadriculado de bandas trazadas, integrado por una estructura de calles de cuadrados rectos y oblicuos separados por rectángulos, cada uno de ellos compuesto en su interior por figuras geométricas como rectángulos, círculos, cuadrados, entre otros. Que logran proporcionar una sensación de geometrismo."
18,¿Dónde puede crecer la Viola cazorlensis?,"['La Violeta de Cazorla o Viola cazorlensis es una especie endémica de la Sierra de Cazorla, Segura y las Villas, de carácter rupícola florece en primavera sobre las rocas calizas de la Sierra. También se han encontrado ejemplares en las vecinas Sierra Mágina y Sierra Del Segura. Taxonomía Viola cazorlensis fue descrita por Michel Gandoger y publicado en Bull. Assoc. Franç. Bot. 5: 226, en el año 1902.\u200b\u200b', 'Los alfilerillos de Cazorla (Erodium cazorlanum) es una herbácea perenne perteneciente a la familia de las geraniáceas que aparece de forma endémica en zonas de alta montaña de la serranía de Segura. Descripción Pequeña mata herbácea sin tallo que alcanza un tamaño de hasta 15 cm de altura, algo ascendente, pilosa, no glandulosa, de hojas imparipinnadas dispuestas en roseta, con los foliolos dentados o pinnatífidos, con inflorescencias en umbelas de 3 a 9 flores zigomorfas pentámeras, con pétalos desiguales blanco-violáceos rosados de los cuales los dos superiores presentan una mancha de color púrpura en la mitad basal.', 'Flora Las sierras están dominadas por bosques de pino laricio, negral y carrasco. En zonas restringidas del parque natural de las Sierras de Cazorla, Segura y Las Villas existen Ilex aquifolium y se pueden encontrar Taxus baccata muy diseminados. En la zona norte de la sierra de Segura aparecen bosques de Quercus faginea y Quercus pyrenaica.\u200b Las sierras de Cazorla\u200b y Segura presentan destacados endemismos como Viola cazorlensis, Hormathophylla baetica,\u200b Geranium cazorlense, Erodium cazorlanum, Aquilegia cazorlensis, Narcissus longispatus, o Pinguicola vallisneriifolia.', 'Destacan sobre los endemismos subbéticos la violeta de Cazorla (Viola cazorlensis) y Lithodora nitida. En los canchales o ríos de piedra, se observan los endemismos exclusivos de Sierra Mágina que son Jurinea fontqueri y Vicia glauca subsp. giennensis, endemismos de la Sierra de Mágina.\u200b El Monumento Natural del Pinar de Cánava lo constituye un pequeño bosque de pinos carrascos centenarios y de tamaño excepcional. Fauna Se dan las especies propias de los diferentes pisos bioclimáticos y del monte mediterráneo como jabalíes, garduñas o zorros y aves como mirlos, pinzones, carboneros y herrerillos. En las cumbres se observan collalbas, colirojos, y roquedos solitarios. Se trata de una zona de paso migratorio de aves catalogada como zona ZEPA siendo el halcón abejero el más numeroso durante las migraciones de primavera y otoño.', 'Poco después al juntarse con el Montoro forman el Jándula. Flora y fauna La vegetación fluvial se compone de fresnedas, tamujales y adelfares. Entre las comunidades rupicolas de mayor interés se encuentran las originadas por Genista polyanthos, Polypodium interjectum, y Coincya longirostra.\u200b 38.545365, -3.871877']","La Viola cazorlensis es una especie endémica que crece en la Sierra de Cazorla, Segura y las Villas.","La Violeta de Cazorla o Viola cazorlensis es una especie endémica de la Sierra de Cazorla, Segura y las Villas, de carácter rupícola florece en primavera sobre las rocas calizas de la Sierra. También se han encontrado ejemplares en las vecinas Sierra Mágina y Sierra Del Segura. Taxonomía Viola cazorlensis fue descrita por Michel Gandoger y publicado en Bull. Assoc. Franç. Bot. 5: 226, en el año 1902."
19,¿Cuánto pesa una serrana?,"['Es un animal de 85-100 cm de longitud en los machos y de 84-88 cm en las hembras. Tiene unos 50-70 cm de altura en la cruz y una cola de 12-14 cm. Los machos pesan entre 11 y 20 kg y las hembras menores, entre 9 y 12 kg, aunque puede haber grandes diferencias de unos ejemplares a otros. Especie endémica de la península ibérica. En la actualidad solo habita en las Sierras de Cardeña y Andújar (Sierra Morena) y en el área de Doñana. Se calcula que quedan unos 200 ejemplares. Alimentación: Más del ochenta por ciento lo constituye el conejo de monte, también puede alimentarse de aves y otros mamíferos. El lince ataca y expulsa de su territorio a otros predadores generalistas como el zorro, que consume más conejos que el mismo lince, y al que a veces mata. Así establece un vínculo adicional con su presa básica, el conejo, favoreciendo a su población. La familia de Cardeña y Montoro habita en una zona muy concreta del parque y a salvo de la intervención humana.', 'Los pilotos traseros vendrían del Suzuki Samurai que se fabricaba en el mismo lugar. En lugar del motor con el que se vendió al público, equipaban uno más pequeño y con menos de 100 cv de potencia. Características técnicas Pesos P.M.A. : 3050 kg Sobre eje 1: 1072 kg Sobre eje 2: 2150 kg Peso en orden de marcha: 2140 kg Sobre eje 1: 980 kg Sobre eje 2: 1160 kg Carga máxima: 1000 kg Peso máximo remolcable: Sin freno auxiliar: 750 kg Con freno auxiliar: 3000 kg Asientos 5/7 Caja de cambios y transmisión Modelos Caja de velocidades (1.ª serie): Santana LT85, manual de 5 velocidades, incluye reversa Caja de velocidades (2.ª serie): ZF-85-31, manual de 5 velocidades, incluye reversa (a partir de 2005) Tipo de la caja de transferencia: de doble reducción. Tracción: 4x2/4x4 Frenos Sistema de frenado delantero: discos, ventilado con un radio efectivo de 123,8. Sistema de frenado trasero: disponible de tambor y de disco, con un radio de 125.', 'Se trata de animales de proporciones armónicas ligeramente alargadas, de perfil subconvexo o convexo y de tamaño medio, con un peso que oscila entre los 65 y los 70 kg. en los carneros y entre los 40 y 50 kg. en las ovejas. Ambos sexos suelen carecer de cuernos, aunque hay tanto machos como hembras con cuernos pero la selección tiende a su eliminación. Son animales de gran rusticidad que pueden entrar en gestación en cualquier época del año. Características productivas El objetivo principal de la cría de la raza es la producción de carne. Se ha generalizado la finalización de los corderos en cebadero, sacrificados a la edad de noventa días con un peso próximo a los 25 kg. También tiene una buena aptitud lechera que le permite sacar adelante sus crías. Sistemas de explotación La oveja montesina está sometida a un régimen muy extensivo en zonas de altura, frecuentemente por encima de los 1000 m s. n. m., con clima extremo, con una pluviosidad baja próxima a los 400 mm.', 'La pajuna o serrana es una raza vacuna española autóctona de Andalucía. Se distribuye por las provincias de Granada y Jaén. Con un peso de entre 375 kilos en hembras y 600 kilos en machos,\u200b esta raza posee un pelaje castaño con zonas oscurecidas; su cabeza es desproporcionadamente grande y su cara larga y recta. Utilizada para la tracción y la producción de carne.', 'Fue sufragada principalmente por el canónigo baezano Diego de Cózar Serrano. Está realizada en plata con algunas zonas de cobre, teniendo un coste total de más de 10 745 onzas. Es de estilo barroco, dividido en tres cuerpos sustentados cada uno por doce pares de columnas muy decoradas, haciendo un total de setenta y dos, siendo salomónicas las interiores y de capitel corintio las exteriores. Tiene una altura total de 2,20 m. Cada cuerpo posee ricos entablamentos, mientras en sus basamentos se despliegan treinta y seis relieves con escenas del Antiguo y Nuevo Testamento, y sobre sus cornisas y balaustradas se encuentran las esculturas de los doce apóstoles (primer cuerpo), veinticuatro ángeles, seis querubines y dieciocho jarroncillos; todo lo cual configura un programa iconográfico de exaltación de la eucaristía.']","Una pajuna o serrana puede pesar alrededor de 600 kilos en el caso de los machos, y 375 kilos en el caso de las hembras.","La pajuna o serrana es una raza vacuna española autóctona de Andalucía. Se distribuye por las provincias de Granada y Jaén. Con un peso de entre 375 kilos en hembras y 600 kilos en machos,​ esta raza posee un pelaje castaño con zonas oscurecidas; su cabeza es desproporcionadamente grande y su cara larga y recta. Utilizada para la tracción y la producción de carne."
20,¿Cuál es la altura de Jabalcuz?,"['Jabalcuz es un monte situado al sur de la ciudad de Jaén (España), a escasos kilómetros de ésta. Se sitúa entre los términos municipales de Los Villares, Jamilena, Torredelcampo y Jaén, y su altitud es de 1614 m s. n. m. Jabalcuz suele ser considerada erróneamente de manera popular como un volcán,\u200b siendo en realidad una elevación caliza de origen sedimentario donde existen manantiales termales de origen kárstico, cuyas aguas se calientan debido al gradiente geotérmico.\u200b La existencia de estos manantiales termales determinó la construcción del antiguo balneario y jardines de Jabalcuz. En la falda noroeste de la sierra, término municipal de Torredelcampo, se encuentra el espacio natural de Cerro Miguelico, donde se localiza el bosque de la Bañizuela. Toponimia El arabista español Asín Palacios planteaba el origen del nombre Jabalcuz de la derivación del nombre árabe yabal al-kūz (جبل الكوز) o «monte de la jarra», basándose en la semejanza final del topónimo con el nombre árabe kūz (""jarra"").', 'La Torre de la Moraleja se encuentra en el municipio de Alcalá la Real, provincia de Jaén (España). Descripción Es una torre de vigilancia o atalaya de planta circular, en su alzado se pueden diferenciar varias partes: La base de la torre que está reforzada por una estructura troncocónica con 2,52 metros de altura y un perímetro en la zona inferior de 25,6 metros. El cuerpo con el vano de entrada en alto por el que se accede al único espacio interior. En el extremo superior de la torre se sitúan canecillos que circundan su perímetro y que forman parte de un pequeño balcón. Se conserva en buen estado. Desde ella de divisan la fortaleza de La Mota, la Torre del Cascante, la de las Mimbres y la Torre del Norte.\u200b', 'Jabalquinto es una localidad y municipio español de la provincia de Jaén, Andalucía. Se encuentra a 496 m de altitud y 38 km al norte de la capital provincial. Pertenece a la comarca de Sierra Morena. Tiene 2.013 habitantes (según datos del INE de 2021), sobre un término municipal de 73,24 km². Sus habitantes reciben el gentilicio de jabalquinteños, o el menos habitual de gevalcantíes. Entre sus paisanos de cierto relieve, puede destacarse a Paco Nájera. Jabalquinto es una de las nueve localidades seseantes de la provincia de Jaén. Historia A falta de investigaciones arqueológicas sistemáticas, el lugar ha dado muestras de haber sido ocupado en un momento de la Edad del Cobre o del Bronce.', 'El pico Mágina es una montaña situada en el parque natural de Sierra Mágina en la provincia de Jaén. Su altitud es de 2167 m s. n. m.\u200b Es el pico más alto de esta provincia y se encuentra en la divisoria de los términos municipales de Albanchez de Mágina y de Huelma, en una larga cuerda que supera los dos mil metros a lo largo de 5 km, desde la Peña de Jaén (2147 m s. n. m.), Miramundos (2077 m s. n. m.) hasta Peña Grajera (2014 m s. n. m.).', 'El monte Gibalbín es la cota más alta de la Sierra Gibalbín. Tiene una altura de 410 m s. n. m. (metros sobre el nivel del mar), señalada por un vértice geodésico. En su cumbre destacan diversas instalaciones de comunicación. Se encuentra en la frontera entre las provincias andaluzas de Sevilla y Cádiz. La localización del monte Gibalbín es próxima a la localidad de Lebrija (Sevilla), situada en el sur de la provincia sevillana.\u200b Rodeado por la sierra Gibalbín, que a su vez está rodeada de llanuras, correspondientes a los valles del Guadalquivir y del Guadalete, ofrece una atalaya para divisar una enorme extensión en 360°. Así, en lo más alto, se puede divisar una vista completa de la ciudad de Jerez de la Frontera, Lebrija y alrededores: desde los cercanos llanos de Nueva Jarilla, el aeropuerto y la autopista Sevilla-Cádiz, así como el pueblo de Gibalbín, ya en la provincia de Cádiz.']",El monte de Jabalcuz tiene una altitud de 1614 metros sobre el nivel del mar.,"Jabalcuz es un monte situado al sur de la ciudad de Jaén (España), a escasos kilómetros de ésta. Se sitúa entre los términos municipales de Los Villares, Jamilena, Torredelcampo y Jaén, y su altitud es de 1614 m s. n. m. Jabalcuz suele ser considerada erróneamente de manera popular como un volcán,​ siendo en realidad una elevación caliza de origen sedimentario donde existen manantiales termales de origen kárstico, cuyas aguas se calientan debido al gradiente geotérmico.​ La existencia de estos manantiales termales determinó la construcción del antiguo balneario y jardines de Jabalcuz. En la falda noroeste de la sierra, término municipal de Torredelcampo, se encuentra el espacio natural de Cerro Miguelico, donde se localiza el bosque de la Bañizuela. Toponimia El arabista español Asín Palacios planteaba el origen del nombre Jabalcuz de la derivación del nombre árabe yabal al-kūz (جبل الكوز) o «monte de la jarra», basándose en la semejanza final del topónimo con el nombre árabe kūz (\""jarra\"")."
