,question,retrieved_contexts,reference,reference_contexts
8,¿Cómo se llama el estadio del equipo de fútbol sala de Jaén?,"['Su estadio, La Victoria, es de uso exclusivo del club, y que cuenta con capacidad para 12 569 espectadores.También ha sido creado en la temporada 2017-18, el Inter de Jaén C.F., que milita en Segunda Andaluza. Cómo este último, el resto de equipos y aficionados jiennenses al fútbol cuentan con los campos de fútbol de césped artificial «Sebastián Barajas» con capacidad para 2500 espectadores, el de la Universidad de Jaén y el campo de fútbol «Manu del Moral» en el polideportivo «Las Fuentezuelas».\u200b El fútbol sala siempre ha tenido gran tradición en la ciudad, que actualmente cuenta con dos equipos, el Jaén Fútbol Sala, que milita en la división de honor de la Liga Nacional de fútbol sala,\u200b y el Club Deportivo Jaén, que milita en el grupo 8 de la Primera Nacional ""A"". Ambos disputan sus partidos en el pabellón del polideportivo «La Salobreja».', 'El estadio fue construido pensando que el Real Jaén CF se mantendría en Segunda División, por lo que cuenta con unas buenas instalaciones y un acabado impecable. Cuenta con terreno de juego de césped artificial debajo del terreno de césped natural (al cual se accede desde los vestuarios) que se usa para la preparación física de los jugadores. El estadio se encuentra a las afueras de la ciudad de Jaén, en la Carretera de Granada, lo que lo hace menos accesible para los aficionados que su predecesor. Otra desventaja es la lejanía entre el terreno de juego y las gradas, que así exigía la legislación deportiva por entonces por motivos de seguridad, lo que lo hace mucho más frío que el Antiguo Estadio de la Victoria, donde las pequeñas dimensiones y cercanía de los aficionados lo convertían en un fortín difícil de superar. Palmarés Nota: en negrita competiciones vigentes en la actualidad.', 'Uniforme Uniforme titular: Camiseta verde, pantalón blanco y medias verdes. Estadio Municipal de San Miguel, con capacidad para 12 000 personas. El estadio fue inaugurado en 1992, en un partido frente al Atlético Madrileño. Datos del club Temporadas en 1.ª: 0 Temporadas en 2.ª: 0 Temporadas en 2.ª B: 0 Temporadas en 3.ª: 33 Peor puesto en la liga: 18.º (Regional temporada 07) Jugadores Muchos son los grandes futbolistas que han vestido la camiseta de la ciudad de los Cerros: Anquela Arregui Vela Luis Aragonés\u200b Paquirrini Cherno Samba Ficha Martialay José Álvarez Somavilla Domínguez Espinosa Unamuno II Rafael Berrocal Sola Sutil Edu Villegas Esteve Óscar Quesada Bjørn Johnsen Entrenadores Adolfo Bracero Camoto Diego Villalonga Francisco Viguera Miguel Vela Gregorio Manzano\u200b Víctor Expósito Berzosa Palmarés Torneos nacionales Torneos amistosos Trofeo Fiestas de San Miguel Este trofeo se disputa en el mes de septiembre por motivo de la feria ubetense.', 'El antiguo estadio de La Victoria (Jaén) fue el estadio donde disputó sus partidos como local el Real Jaén C. F. entre 1944 y 2001. Se inauguró el 29 de octubre de 1944, cuando al Real Jaén CF todavía se le conocía como la Olímpica Jiennense. El equipo militaba por aquel entonces en Tercera División, y a esta categoría correspondió el partido inaugural, que enfrentó al equipo jiennense contra el Algeciras CF y que terminó con empate a 2 goles. Por sus reducidas dimensiones y la cercanía de las gradas, durante mucho tiempo La Victoria fue un fortín para el Real Jaén CF, ya que los equipos que acudían a enfrentarse a él se veían atenazados por la afición jiennense o no se desenvolvían bien en un campo de esas dimensiones. Por su localización en el centro de la ciudad, eran muchos los aficionados que veían el partido no desde el estadio, sino desde edificios colindantes, especialmente en la azotea del Colegio El Almadén y en los pasillos de la Escuela Politécnica Superior, cuyas ventanas daban a La Victoria.', 'Escudo Uniforme Uniforme titular: Camiseta de rayas rojas y blancas, pantalón azul y medias rojiblancas. Uniforme alternativo: Camiseta verde, pantalón y medias negras. Estadio Juega sus partidos como local en el Estadio Municipal Matías Prats, inaugurado en el año 1934 por Matías Prats (padre) y con una capacidad de 4500 espectadores de los cuales 3000 son sentados. El estadio posee césped natural y está considerado uno de los mejores de la provincia de Jaén. Durante los años se han ido realizando reformas en el estadio para adecuarlo a los requerimientos de la competición. En el año 2020 está prevista la sustitución del césped natural del estadio por uno artificial de última generación. También se llevará a cabo el cambio de asientos, nueva iluminación led, nueva publicidad, megafonía.']",El estadio del Jaén Fútbol Sala es el Olivo Arena.,"El Palacio de Deportes Olivo Arena , conocido simplemente como Olivo Arena es un pabellón de la ciudad de Jaén (España). En él juega sus partidos de Primera División de fútbol sala el Jaén Paraíso Interior y también se albergan grandes eventos.​ Historia El pabellón se inaugura en 2021 y se convierte en la nueva casa del Jaén Paraíso Interior para disputar sus partidos de Primera División de fútbol sala.​ Puede albergar distintos tipos de eventos. Del 31 de marzo al 3 de abril de 2022 se disputó la Copa de España de fútbol sala 2022.​ Instalaciones El pabellón dispone de una pista principal, mayormente utilizada para el fútbol sala o baloncesto y también dispone de: vestuarios, camerinos, salas polivalentes, oficinas, salas de prensa Y salón de actos. Eventos Se disputan los partidos de Primera División de fútbol sala del Jaén Paraíso Interior. Se celebran distintos eventos, especialmente deportivos. El 5 de marzo de 2022 se disputó el Campeonato de España Junior de taekwondo."
9,¿Cuando se prevé que acabarán las obras del CETEDEX?,"['Por el momento, a mediados de 2024 y una vez vallado el recinto, si no se acumulan nuevos retrasos, se espera que las obras comiencen a finales de 2024. \u200b Polémica El anuncio de la construcción del CETEDEX se produjo en medio de la polémica por la asignación del Plan Colce a Córdoba, cuando la ciudad de Jaén parecía contar con el apoyo de las administraciones autonómica y nacional para la asignación de la Base Logística del Ejército de Tierra, lo que supuso la denuncia por prevaricación contra el Ministerio de Defensa.\u200b Esta decisión conllevó grandes manifestaciones contra el ninguneo percibido hacia la provincia de Jaén,\u200b así como el auge del partido Jaén Merece Más\u200b y su posterior concurrencia a las Elecciones al Parlamento de Andalucía de 2022 (como parte de la plataforma de la España Vaciada), en las que se quedaron a las puertas de conseguir un escaño.', 'No obstante, el contrato de 11 de diciembre de 1542, realizado esta vez sin pública licitación, establece como condiciones la culminación del proyecto por un total de 3700 ducados y en un plazo de dos años y medio: a finales de mayo de 1543 la obra debería estar a nivel de basas; en junio de 1544 a altura de capiteles; en Navidad de 1544 terminadas las paredes y selladas las capillas; y el último plazo, en junio de 1545, debería estar fechada y acabada.', 'Aun así, su desciframiento aún no se puede dar por cerrado, puesto que no hay consenso entre los diferentes investigadores que han hecho propuestas concretas. Bibliografía García-Bellido, M. P. «Célticos y túrdulos en la Beturia según sus documentos monetales», en Celtas y túrdulos: la Beturia, Cuadernos emeritenses 9, Mérida, 255-292. 1995. VV. AA. Celtas y túrdulos: la Beturia, Museo Nacional de Arte Romano de Mérida, Mérida, 1995.', 'El Centro Tecnológico de Desarrollo y Experimentación o CETEDEX es un centro dependiente del Ministerio de Defensa, y adscrito al Instituto Nacional de Técnica Aeroespacial (INTA) anunciado en diciembre de 2022\u200b y cuya construcción se proyecta entre 2023 y 2029 en Jaén. El centro contará con un campus principal de 8 hectáreas y un campo de pruebas avanzado de 600 hectáreas\u200b en el Parque Empresarial Nuevo Jaén. Programas El proyecto ubicado en el norte de Jaén, está diseñado por la firma de arquitectura Morph Estudio en Madrid junto a la Ingeniería Typsa. Es un proyecto generativo que desarrolla su propuesta integrando arquitectura con el paisaje existente adaptándose al relieve y a su entorno. El resultado es una construcción flexible, desmontable, innovadora y circular. Inicialmente el Campus CETEDEX se distribuye a través de varios edificios independientes y autónomos y plantea tres pilares de actuación:\u200b Sistemas de defensa anti-dron.', 'Aunque el contrato firmado por Vandelvira fijaba un plazo de ejecución de dos años y medio, la actuación del arquitecto se prolongaría un total de veintiséis anualidades, lo cual derivaría en un nuevo encargo a Francisco del Castillo ""El Mozo"", que ejecutaría la bóveda que cubre el coro, el cerramiento de la fachada, daría fin a la galería del claustro y adornaría este con una fuente dedicada a María Magdalena, advocación principal del convento. En 1577 se fecha esta fuente, año que es considerado cierre de este último periodo constructivo, y final de las obras del convento. Tras la Guerra Civil, la iglesia pasa a ser templo parroquial, recuperándose así tras un largo periodo de abandono motivado por la desamortización.']","Se prevé que para diciembre de 2026 se alcance una capacidad inicial, mientras que para finales de 2029 sería la capacidad completa.","El Centro Tecnológico de Desarrollo y Experimentación o CETEDEX es un centro dependiente del Ministerio de Defensa, y adscrito al Instituto Nacional de Técnica Aeroespacial (INTA) anunciado en diciembre de 2022​ y cuya construcción se proyecta entre 2023 y 2029 en Jaén. El centro contará con un campus principal de 8 hectáreas y un campo de pruebas avanzado de 600 hectáreas​ en el Parque Empresarial Nuevo Jaén. Programas El proyecto ubicado en el norte de Jaén, está diseñado por la firma de arquitectura Morph Estudio en Madrid junto a la Ingeniería Typsa. Es un proyecto generativo que desarrolla su propuesta integrando arquitectura con el paisaje existente adaptándose al relieve y a su entorno. El resultado es una construcción flexible, desmontable, innovadora y circular. Inicialmente el Campus CETEDEX se distribuye a través de varios edificios independientes y autónomos y plantea tres pilares de actuación​: Sistemas de defensa anti-dron. Obras La construcción del campus principal se compone de dos fases: Vallado. Licitación prevista para abril de 2023 y ejecución entre julio y diciembre de 2023. Urbanización y edificaciones. Licitación prevista para septiembre de 2023 y ejecución de las obras durante 24 meses, a partir de julio de 2024. Por su parte, la recepción de la capacidad inicial se espera para diciembre de 2026 y la capacidad completa para finales de 2029​. El proyecto aún no tiene concreción alguna en planos o presupuesto. En documentos internos del propio INTA, en su Plan de Actuación Anual de 2023​reconoce que el proyecto depende de la aprobación del PERTE de Defensa y de los fondos finalmente asignados, el cual no está ni en fase de borrador. Por el momento, a mediados de 2024 y una vez vallado el recinto, si no se acumulan nuevos retrasos, se espera que las obras comiencen a finales de 2024."
10,¿A qué se dedica la empresa Doña Jimena?,"['Doña Jimena es la marca comercial del grupo Productos J. Jiménez S. A. dedicada a la producción de turrones, bombones y dulces navideños entre otros productos. Posee tres fábricas, la principal en Alcaudete en la provincia de Jaén, otra en Sonseca, en la provincia de Toledo y la última en Noguerones (pedanía de Alcaudete) dedicada a la producción de aceite de oliva. En la actualidad está presente en 60 países, en algunos de ellos a través de filiales propias. Historia En 1961 Jerónimo Jiménez funda en Alcaudete (provincia de Jaén) la empresa Productos J. Jiménez con la intención de producir dulces navideños. Registró la marca Doña Jimena en honor a la historia y tradición española en el nombre de la esposa del Cid Campeador, Jimena Díaz (Doña Jimena). Durante los primeros 30 años, Doña Jimena produjo los típicos productos navideños como mazapanes, turrones de almendra, hojaldres, etc.', 'La fábrica de harinas Nuestra Señora del Rosario es una antigua fábrica situada entre la avenida de Jaén y la calle Llana, en la localidad española de Fuerte del Rey, provincia de Jaén.\u200b Historia y descripción La fábrica fue fundada en 1930 por Francisco Arroyo Toro y hasta 1974 recogía y molía los granos, fundamentalmente trigo, de buena parte de la campiña, formando parte de un sistema productivo y comercial que ya en los años setenta empezó a resquebrajarse. En torno a esta fábrica ha girado la vida económica de Fuerte del Rey hasta tal punto que aún a principios del siglo XXI, tras años de cese de su actividad, forma parte de la memoria colectiva y constituye un referente identitario principal para esta población.', 'Firmas como Pieralisi, Software DELSOL, Patrimonio Comunal Olivarero o Caja Rural de Jaén, que han adquirido suelo para construir una sede propia, o Asociación de Jóvenes empresarios de Jaén, el CTAER (Centro Tecnológico Avanzado de Energías Renovables de Andalucía), Mengisoft, Innovasur, Marwen Ingeniería, Citoliva, AONSolutions, Interóleo o SGS, que trabajan en el Completo Tecnológico de Servicios Avanzados, ya han unido su futuro al de Geolit. Promotores Geolit es un modelo de colaboración público-privado, producto de la suma de esfuerzos entre las administraciones y las empresas para favorecer los procesos de innovación. La sociedad promotora de Geolit nació en 2000 y en ella participaron inicialmente la Diputación de Jaén, la Consejería de Agricultura y Pesca de la Junta de Andalucía y la Universidad de Jaén.', 'El acuerdo supone la constitución de una nueva sociedad participada en la que Iturri es el socio mayoritario con el 75 % y Santana Motor participa con el 25 %. La nueva empresa ha iniciado su actividad sobre una planta de 7000 metros cuadrados de superficie, de los que 4.000 van destinados a producción y oficinas, y el resto se utilizan para el almacenaje del producto terminado o de vehículos aún pendientes de adaptar a otros usos específicos (contra incendios, blindados, unidades repostadoras...) Iturri Santana, que en una primera fase se dedica a la fabricación de vehículos sanitarios, incorporará posteriormente otro tipo de modelos industriales del sector de las emergencias, contra incendios y catástrofes. La nueva planta ha comenzado con una producción de 170 unidades/año para llegar a una producción de 750 unidades/año, y emplea inicialmente a una plantilla aproximada de 20 personas, que se espera ampliar en los próximos tres años hasta alcanzar las 150.', 'En su parque empresarial, se ha estado realizando una apuesta de diversificación, destinada a la fabricación de componentes de aerogeneradores por parte de la empresa Aemsa-Santana\u200b y vagones de metro y tranvía por la empresa CAF-Santana. No obstante, tras el cierre de su planta de fabricación de trenes en Santana, CAF está focalizando su trabajo en la división de ingeniería en el ámbito ferroviario.\u200b Actualmente, la propiedad del capital social de las empresas del parque industrial de Santana es de la Junta de Andalucía, habiéndose convertido en una empresa de capital público como consecuencia de la multitudinaria protesta que en 1994 consiguió impedir su cierre ante la posible salida de Suzuki de la ciudad. En 2011, y tras la disolución de la compañía Santana Motor debido a sus cuantiosas pérdidas, se dio a conocer el plan «Linares Futuro», un plan presentado por los sindicatos para que tuvieran cabida empresas dedicadas a las energías renovables o a la fabricación de componentes electrónicos.']","La marca comercial Doña Jimena se dedica a la producción de turrones, bombones y dulces navideños, entre otros productos.","Doña Jimena es la marca comercial del grupo Productos J. Jiménez S. A. dedicada a la producción de turrones, bombones y dulces navideños entre otros productos. Posee tres fábricas, la principal en Alcaudete en la provincia de Jaén, otra en Sonseca, en la provincia de Toledo y la última en Noguerones (pedanía de Alcaudete) dedicada a la producción de aceite de oliva. En la actualidad está presente en 60 países, en algunos de ellos a través de filiales propias. Historia En 1961 Jerónimo Jiménez funda en Alcaudete (provincia de Jaén) la empresa Productos J. Jiménez con la intención de producir dulces navideños. Registró la marca Doña Jimena en honor a la historia y tradición española en el nombre de la esposa del Cid Campeador, Jimena Díaz (Doña Jimena). Durante los primeros 30 años, Doña Jimena produjo los típicos productos navideños como mazapanes, turrones de almendra, hojaldres, etc."
11,¿Qué es el Expoliva?,"['Expohuelma Desde 1983 se celebra uno de los hitos de la comarca, la Feria de Muestras del parque natural Sierra Mágina o ExpoHuelma. Se trata de una importante muestra de maquinaria agrícola junto con una feria ganadería con una señalada muestra de razas autóctonas en peligro de extinción y una feria empresarial de industria agroalimentaria, turismo activo, la innovación y energía renovables, mueble, aceite de oliva, entre otros sectores.\u200b Evolución de la deuda viva municipal Comunicaciones Por carretera el eje norte sur es la A-401, desde la A-92 en Darro a la A-32 en Úbeda. Hacia el este la A-324 enlaza con la A-44. Cuenta con líneas de autobuses que conectan con Jaén (Mágina Sur & Bayona),\u200b Granada (Marcos Muñoz)\u200b y Úbeda (Muñoz Amezcua)\u200b y Almería (Alsa).\u200b Cuenta con la estación de tren de Huelma, en la línea Madrid - Almería y actualmente sin parada. Tiene también la vía pecuaria vereda de Mágina.', 'El yacimiento de Las Atalayuelas es un oppidum ibérico\u200b situado en un relieve geográfico denominado, por su relevancia topográfica, Atalayuelas, dentro el término municipal de Fuerte del Rey, provincia de Jaén, España. Acogió un espacio de culto ibero, asimilado después por la religión romana. Durante época altoimperial se configuró como vicus.\u200b\u200b Presenta una ocupación desde el Neolítico hasta época emiral.\u200b Historia La zona ya era conocida por tradición en esta comarca de la campiña, a través de leyendas de hallazgos fabulosos del «tiempo de los moros».\u200b En 1920 Alfredo Cazabán recoge informaciones sobre el yacimiento.', 'Además, con carácter bianual, en la institución ferial, se celebra Expoliva, Feria Internacional del Aceite de Oliva e Industrias Afines, referente a nivel mundial del sector del olivar, el aceite de oliva y su industria.\u200b En el mes de junio tienen lugar las «Ferias y fiestas en honor a la Virgen de la Capilla», co-patrona de la ciudad, además de conciertos, como el Lagarto Rock, y festejos taurinos. El día 2 de julio está declarado como «Día del Lagarto de La Magdalena»,\u200b se conmemora la declaración de esta leyenda como uno de los diez Tesoros del Patrimonio Cultural Inmaterial de España\u200b por parte del «Bureau Internacional de Capitales Culturales» en 2009.\u200b El 25 de noviembre se celebra el día de Santa Catalina, la otra co-patrona de la ciudad, se conmemora la conquista de la ciudad por Fernando III de Castilla en 1246.', 'La Asociación Meteorológica del Sureste ( AMETSE ) es una asociación meteorológica\u200b\u200b sin ánimo de lucro nacida a partir de la iniciativa de varios aficionados a la meteorología de la zona sureste del estado español.\u200b Fue creada a finales de marzo de 2008 e inscrita en el registro de asociaciones, el 9 de octubre de 2008, con el objetivo principal de dotar de una estructura y organización formal a todos los amantes de la meteorología dentro de área geográfica formada por las provincias del sureste de la península ibérica: Albacete, Alicante, Almería, Granada, Jaén y Murcia. Todas estas provincias comparten similares características bioclimáticas.\u200b', 'La Fiesta de la Aceituna es una celebración festiva típica del municipio de Martos (Jaén) España. Dicha fiesta simboliza el inicio oficial de la campaña de recolección de la aceituna y tiene el objetivo de rendir homenaje a los aceituneros y aceituneras que trabajan en la campaña.\u200b Cuenta con más de treinta años de tradición.\u200b La festividad culmina el día 8 de diciembre con la realización de actos oficiales como la emulación de extracción del primer Aceite de oliva del año por medio de una prensa de husillo de tracción manual y la repartición gratuita del llamado hoyo aceitunero, que consiste en una bolsa que contiene un bollo de pan, aceite de oliva, aceitunas, bacalao y agua. Actividades Durante los días que se celebra la Fiesta de la Aceituna, tiene lugar la realización de numerosas actividades y eventos como los siguientes: Actividades culturales como exposiciones, teatro y conciertos musicales, a cargo de la Agrupación musical Maestro Soler. Actividades deportivas como la Carrera popular del aceite.']",Expoliva es una feria internacional del aceite de oliva que se celebra cada dos años en la ciudad de Jaén.,"Feria Internacional del Aceite de oliva e Industrias Afines Se trata de una feria de carácter bienal promovida desde 1990 por la Fundación del Olivar, que se en la ciudad de Jaén, en la Comunidad Autónoma de Andalucía, en España. Su carácter internacional la convierte en la referencia mundial de las ferias dedicadas al sector del aceite de oliva. Se celebra desde el año 1983, y desde 1997 tiene lugar en el Recinto Provincial de Ferias y Congresos de Jaén (IFEJA). Cifras y datos En el año 2007 se cumplió la edición número 13 de Expoliva, que se cerró con un nuevo récord de visitantes y expositores. Con unos 15.000 m² de feria, distribuidos en 4 pabellones, con más de 300 empresas expositoras procedentes de 27 provincias españolas y 12 países extranjeros, y más de 100.000 visitas, de las que unas 40.000 fueron de profesionales. En ella se dan cita las empresas nacionales e internacionales más importantes del sector."
