,question,retrieved_contexts,reference,reference_contexts
12,¿Cuántos habitantes tiene Santiago de Calatrava?,"['Este artículo trata sobre el municipio jiennense. Para el arquitecto valenciano, véase Santiago Calatrava. Santiago de Calatrava es una localidad y municipio español situado en la parte occidental de la comarca Metropolitana de Jaén, en la provincia de Jaén. Limita con los municipios jienenses de Higuera de Calatrava, Torredonjimeno y Martos; y con los municipios cordobeses de Baena y Valenzuela. El municipio santiagueño comprende el núcleo de población de Santiago de Calatrava —capital municipal— y diversos diseminados. Historia En Santiago de Calatrava se han hallado vestigios arqueológicos de la época romana y árabe, lo que certifica la presencia en su territorio de población romana y árabe, de ahí su ancestral historia y cultura. Tras la entrega de las fortalezas de Martos al Reino de Castilla en 1225, el rey Fernando III dona Martos y su término a la Orden Religiosa-Militar de Calatrava en 1228.', 'Se cree que el lugar de Santiago recibió este nombre de los caballeros de la Orden de Santiago. Como lugar de frontera el pueblo se vio afectado por las razzias que desde el reino nazarí de Granada se lanzaban contra los territorios de la Orden de Calatrava, destacando la del 29 de septiembre de 1471 que asoló las entonces Higuera de Martos y Santiago. A la muerte del maestre García López de Padilla el maestrazgo de la Orden de Calatrava pasó a manos de la Corona de Castilla, así que las villas y lugares pasaron a ser posesiones del rey.', 'Se encuentra a unos 27 km aprox. por carretera de Santiago de la Espada,\u200b dentro del Parque natural de Cazorla, Segura y Las Villas. Junto al núcleo de la aldea se encuentran, a pocos cientos de metros al Este, la cortijada de El Cortijillo, el Cortijo del Tobazo, y un poco más retirada, la pequeña aldea de Marchenica, dispuestas a lo largo del barranco del arroyo Marchena.\u200b Cuenta con una población a 1 de enero de 2020 según el INE de 99 personas.\u200b Demografía Evolución de la población Economía La actividad económica de la aldea y las cortijadas del entorno está basada principalmente en actividades relacionadas con el medio, como la ganadería (pastoreo de montaña y trashumante, principalmente de ganado ovino y caprino), la agricultura, la caza, y las tareas silvícolas y forestales.\u200b Fiestas de la Inmaculada Concepción El primer fin de semana de septiembre de cada año se conmemora en la aldea del día de la Natividad de la Virgen María.', 'Santiago de la Espada es una localidad perteneciente al municipio de Santiago-Pontones, Jaén (España). Era un municipio independiente hasta que en 1975 se fusionó con la localidad de Pontones. Está situado al sureste de la Comarca de Sierra de Segura. Limita con las provincias de Albacete (norte) y Granada (sur). Tiene 1492 habitantes y está situado a 1340 m de altura. Su gentilicio es hornillero debido a que en la Edad Media había un horno en el cual coincidieron unos pastores de las serranías de Cuenca para fundar lo que sería “El Hornillo”. Aunque el más comúnmente utilizado por los habitantes de la zona es el de santiagueño. Historia Nacimiento El origen de Santiago de la Espada tiene lugar en la prehistoria. En las Cuevas de “El Engarbo” (Santiago de la Espada) se ha demostrado, con fechas seguras, la ocupación humana más antigua en la provincia. En el 9250 a. C. existió en este lugar una comunidad de parentesco que vivían de la caza del ciervo, el rebeco, la cabra montés, el corzo y el jabalí.', 'La Matea es una aldea perteneciente al municipio de Santiago-Pontones,\u200b en la provincia de Jaén (Andalucía, España). Se encuentra a unos 6 km al suroeste de Santiago de la Espada, dentro del Parque natural de Cazorla, Segura y Las Villas. Junto a la aldea discurre el arroyo del Muso.\u200b Cuenta con una población a 1 de enero de 2020 según el INE de 301 personas.\u200b Demografía Evolución de la población Economía La actividad económica de la aldea está basada en el turismo rural, con distintas posibilidades de alojamiento rural y restauración, y en otras actividades relacionadas con el medio, como la ganadería (pastoreo de montaña y trashumante), la agricultura, la caza, y las tareas silvícolas y forestales.\u200b\u200b Fiestas de la Virgen Milagrosa Durante la festividad de San Pedro, el 29 de junio de cada año, se procesiona por la aldea a la Virgen Milagrosa.']","Santiago de Calatrava cuenta con una población de 657 habitantes a fecha de 2023, según el INE.","En el siglo XVI un grupo de vecinos de Santiago acudieron como repobladores de la villa de Arenas, en Málaga. Algunos de esos repobladores se apellidaban \""Pareja\"", siendo en la actualidad un apellido muy típico de esta localidad de la Axarquía malagueña. Ya en el siglo XX la Guerra Civil, como en el resto del país, supuso un antes y un después para esta población. En abril de 1939, el Ejército Franquista, aprovechando que la población había sido evacuada durante la guerra, instaló en la localidad un campo de concentración de prisioneros. Según testimonios orales los propios cautivos fueron forzados a rodear el pueblo con alambradas de espino. Se ha documentado el hacinamiento, en condiciones precarias, de 4800 personas allí.​ Geografía Se encuentra a 386 m de altitud y 44 km al oeste de la capital provincial, lindando con la provincia de Córdoba. Forma parte de la Comarca Metropolitana de Jaén. Tiene 655 habitantes (según datos del INE de 2022), sobre un término municipal de 47,66 km²."
13,¿Qué animales se pueden encontrar en Despeñaperros?,"['Otros animales que encuentran cobijo entre su verdor son el ciervo, el gamo y el jabalí, muy preciados en la caza mayor, y otros mamíferos propios del área mediterránea, como el zorro y el tejón. Junto a ellos habitan el meloncillo (Herpestes ichneumon), la jineta, la lagartija colilarga, etc. Además de éstas, y ligadas estrechamente a la vegetación, conviven en este marco especies de aves, algunas ya desaparecidas del resto de la provincia, tales como el águila calzada, el águila real, el águila imperial, y los buitres negros. El azor, el gavilán, el águila culebrera, el búho real, el cárabo también surcan sus cielos, junto a otras aves típicas del bosque mediterráneo como la abubilla, el abejaruco, el pájaro carpintero, el herrerillo, el cernícalo vulgar, el cernícalo primilla, etc. No faltan especies cinegéticas como la perdiz y la paloma torcaz.', 'El frescor de las zonas boscosas dominadas por quejigos es propicio para la culebrilla ciega. [nota 3]\u200b En la zona del parque natural son frecuentes el jabalí, el gamo, el ciervo, el zorro y otros animales salvajes como la ardilla, la liebre y el conejo. El águila real y el buitre leonado son especies que también se encuentran presentes en sus bosques, y hasta mediados de la década de 1950 existían algunos ejemplares de lobos. Geología Desde el punto de vista geológico cuenta con una privilegiada extensión territorial, ya que en ella confluyen las tres grandes unidades geológicas que se reconocen en la provincia de Jaén: el borde meridional del Macizo Hespérico, las zonas externas de las Cordilleras Béticas y la Depresión del Guadalquivir. Materiales que están parcialmente recubiertos por los más recientes depósitos cuaternarios.', 'Abundan también otros reptiles y anfibios con gran importancia, como son: el lagarto ocelado y escasamente el tiro, así como el escorpión. Entre la fauna fluvial podemos reseñar las carpas y el barbo. Además de todos los animales nombrados en este apartado, merece una especial atención debido a su poca frecuencia, no solo aquí sino en toda España, el cernícalo primilla que anida formando colonias en el casco antiguo de la localidad, las águilas reales, perdiceras, culebreras y el aguilucho cenizo y ratonero que se ubican en Begíjar en ciertas épocas del año, entre otras especies de aves rapaces nocturnas y diversa avifauna que se establecen en todo el término municipal y sus núcleos. Historia La estratégica posición geográfica de Begíjar, en un entorno de gran riqueza agrícola, hizo posible que el lugar fuese habitado desde la más remota antigüedad.', 'Fauna Es muy variable, y se puede encontrar ardillas rojas y comunes, zorros, conejos, liebres, ciervos, abubillas, lechuzas, búhos, jinetas, hurones, culebras... En las sierras próximas como la loma el pino, la carnicera y muchas más. Es posible encontrar buitres leonados, buitres negros, quebrantahuesos, águilas imperiales, jabalíes, corzos, águilas reales cernícalos... Hay que destacar la presencia del lince ibérico que campea por el término, la mayoría son ejemplares asentados en el valle del río Guarrizas. Historia Edad Antigua A mediados del II milenio a. C. el territorio que hoy ocupa Navas de San Juan ya presentaba ocupación humana, como atestigüan los asentamientos de Castellón y la Atalaya. Pero no es hasta la etapa íbera, probablemente por una colonización promovida desde el gran centro íbero de Cástulo, en torno al siglo IV a. C. cuando se funda el pueblo. En esta época perteneció a la provincia íbera de Oretania, con capital en la cercana Orissia (Vilches).', 'Además hay presencia de malvasía cabeciblanca (Oxyura leucocephala) en invernada y en paso. Otras especies menos comunes pero que también pueden observarse en este paraje natural son el ánade real (Anas platyrhynchos), la cerceta común (Anas crecca), el pato cuchara (Anas clypeata), el ánade silbón (Anas penelope), el porrón común (Aythya ferina), el porrón moñudo (Aythya fuligula), el ánade friso (Anas strepera), el ánade rabudo (Anas acuta), la garza imperial (Ardea purpurea) y la garza real (Ardea cinerea).']","En Despeñaperros se pueden encontrar principalmente ciervos y jabalíes, aunque también pueden encontrarse con menor probabilidad linces, lobos y zorros. En cuanto a aves, destacan el águila imperial y el buitre leonado.","Flora La vegetación dominante es similar en toda la Sierra Morena oriental, el bosque mediterráneo, con predominio de encinas y alcornoques, pero también quejigo, roble melojo, arizónicas y pinos (piñonero, carrasco y negral). El matorral es de madroños, brezos, jaras, mirtos y coscojas. También merecen mención los bosques galería que aparecen en los distintos ríos y arroyos, más umbríos y húmedos, con alisos, fresnos y sauces. Por otra parte, en el parque natural existen treinta endemismos únicos en el mundo y otras especies únicas en la península ibérica. Fauna Hay una importante presencia de ciervo y jabalí, sobre los que se mantienen autorizadas monterías de caza, pero es más destacable la existencia de algunos pocos ejemplares de lince ibérico y de lobo ibérico, así como pequeños carnívoros como el zorro, el meloncillo y el gato montés. Entre las aves que habitan Despeñaperros destaca el águila imperial y el buitre leonado."
14,¿Cuál es la longitud del río Cambil?,"['Este río tiene uno longitud total, hasta su unión con el río San Juan, de 37 km. Dentro del término posee unos 15,5 km de su recorrido total. Río San Juan Nace en el término municipal del Castillo de Locubín, aunque su nacimiento no está muy claro, parece que nace en los montes Gracia y cerro Marroquí, cerca de Valdepeñas. Entra en el término de Alcaudete por el puente de Alcalá, continua por Saltobazos dejando a su izquierda la Torre de Ajos y otros parajes. Recibe por la derecha el arroyo de Chiclana, que sirve de línea divisoria con el término del Castillo en gran longitud. Por este mismo lado recibe el arroyo Meneses. Ente río forma límite con Fuente Tójar, en el transcurso del cual recibe por la derecha el arroyo de Fuente Nueva. Vuelve a formar límite con Priego de Córdoba hasta cerca del puente de Baena, donde se le une el río Salado. A partir de la confluencia del Salado se le da el nombre de Guadajoz.', 'El río Frío,\u200b a veces también refereido como arroyo Frío, es un río del sur de la península ibérica que transcurre por la parte suroccidental de la provincia de Albacete, casi limítrofe con la provincia de Jaén (España). Aporta sus aguas al río Guadalimar, junto al Molino de Pataslargas. Curso Nace a 1000 m s. n. m., a los pies del Calar del Mundo, formando una curiosa surgencia de agua a los pies de una pronunciada ladera. Nada más nacer, sus aguas se embalsan por una pequeña presa en un paraje de gran belleza, donde existe una pequeña área recreativa. Pertenece el nacimiento a los términos municipales de Cotillas y Villaverde de Guadalimar. Su caudal es escaso y su longitud, hasta desembocar en el Guadalimar es de 4.5 km.', 'Siete meses antes ya había vuelto a ocurrir.\u200b Geografía El término municipal de Torreblascopedro ofrece un relieve suave, ligeramente alomado, con unas cotas máximas en las proximidades del Cagasebo (452 m). Las cotas mínimas, unos 230 m, se alcanzan en el límite occidental del término municipal, en la confluencia de los ríos Guadalquivir y Guadalimar. Estos dos ríos, límites meridional y septentrional, respectivamente, constituyen las arterias principales de drenaje, a las que vierten sus aguas los distintos arroyos del sector. Pedanías Campillo del Río está situada a 8 km del núcleo urbano y tiene la mayor producción de espárrago blanco de la provincia de Jaén. Ha sido pionera en la introducción de cultivos alternativos y producción de energía eléctrica solar. Demografía Cuenta con una población de 2402 habitantes (INE 2024). Economía Evolución de la deuda viva municipal Administración y política Alcaldía', 'Tiene unos 400 m de longitud y sus arcos son más altos que los de los acueductos cercanos de Guerra y Caramaco, con una altura máxima de 10 metros.Varios de sus arcos cuentan con un suplemento de altura para corregir las irregularidades del terreno. EL 19 de junio de 1875 el ingeniero vasco José María Iturralde recibe la autorización para construir un canal derivado del río Guadalentin, para poder fertilizar una superficie de 8000 Hectáreas, en los términos de Pozo Alcon y Fontanar (Jaén), Cuevas del Campo y Zújar (Granada). El caudal máximo se limitaba a 3000 litros por segundo, y la concesión fue otorgada a perpetuidad y con libertad de tarifas. Columpio mirador: Se encuentra situado muy cerca del Acueducto de catalina, desde donde se puede observar todo el valle del Guadiana menor a vista de pájaro.Mirador del Lirio: Se sitúa a 898 metros de altitud, a unos cuantos kilómetros de la aldea del Fontanar.', 'Por lo tanto, significaría el río de la quiebra o más comúnmente río de la quebrada, correspondiendo bien con la fisonomía del mismo, ya que es un río encajonado. En este caso sería río «quiebra-ano», siendo -ano un sufijo que denota procedencia, pertenencia o adscripción.\u200b']",El río Cambil tiene una extensión de 9 kilómetros.,"El río Cambil es un río del sur de la península ibérica perteneciente a la cuenca hidrográfica del Guadalquivir, que discurre íntegramente por la provincia de Jaén (España). Curso El río nace en pleno centro de la localidad de Cambil, de la confluencia del río Oviedo y el río Villanueva. Realiza un recorrido de unos 9 km, primero en dirección norte-sur y después en sentido este-oeste hasta su desembocadura en el río Guadalbullón, a su vez afluente del río Guadalquivir. Tiene por afluente al río Arbuniel. Historia Con la construcción en 1906 del salto sobre el río Cambil llamado Piedra Romera llegó por primera vez la energía eléctrica a Cambil.​"
15,Cuéntame la historia del tesoro de Torredonjimeno,"['El tesoro de Torredonjimeno es un conjunto de orfebrería visigoda compuesto por varias coronas votivas que los reyes visigodos ofrecieron a la Iglesia. Es muy parecido al Tesoro de Guarrazar aunque algo más tosco, posiblemente las coronas estuvieran dedicadas a las santas Justa y Rufina. Fue encontrado en 1926 en Torredonjimeno, provincia de Jaén, cerca de la actual Ermita de la Virgen de Consolación, en una finca de olivar, a 2 km del núcleo urbano del pueblo y a 4 km de Martos, por un campesino que se encontraba trabajando en el campo. Pensando que las piezas carecían de valor, se las dio a los hijos que se entretenían desmontando las joyas y mezclándolas con barro. Tiempo después apareció un trapero que compró las piezas. Ahí se le pierde el rastro, hasta que vuelve a aparecer en los años 40, fragmentado.', 'El castillo de Torredonjimeno alberga, hoy día, el centro de interpretación del tesoro visigodo que fue hallado en los alrededores del municipio de forma fortuita a principios del siglo XX. Considerado el segundo legado visigodo más importante de la Península después del encontrado en Guarrazar (Toledo), sus piezas originales se encuentran hoy repartidas por varios museos españoles.\u200b Descripción del Castillo El castillo de Torredonjimeno tenía originalmente en el siglo XIII planta cuadrangular de 80 metros de largo por 50 de ancho, con ángulos reforzados por torres cuadradas y circulares de más de once metros de altura y cinco de diámetro. Tenía una Torre del Homenaje de la que nada ha quedado al quedar muy dañada por un terremoto, posiblemente el Terremoto de Lisboa. En el interior de esta torre se escribió el primer libro sobre el arte de torear, datado del año 1551, cuyo único ejemplar se encuentra en la Universidad de Salamanca.', 'Va en el interior de una urna de plata repujada con los símbolos de la Pasión procedente de la casa madrileña de Meneses que data del siglo XIX. Viernes Santo (Noche) Muy Antigua y Venerable Cofradía de la Santísima Virgen de los Dolores Llegamos a una de las Cofradías más icónicas de la Semana Santa tosiriana, fundada en 1642, es quizás la cofradía más popular y conocida de Torredonjimeno.Obra de Manuel Salvatierra en 1942. De gran arraigo se pudo costear la construcción de capilla propia anexa a la iglesia de Santa María (la conocida nave de los Dolores) con bello y barroco camarín donde se encuentra la imagen. Dicha popularidad viene, en gran parte, de una rasgo propio que la diferencia de las demás imágenes y estaciones procesionales de la provincia, son las conocidas “corrías” que realizan sus anderos con el paso en diversos tramos de su recorrido y en las entradas a los templos de la localidad.', 'El castillo de Torredonjimeno, de origen almohade (siglos XI-XII), se localiza en la localidad homónima de la provincia de Jaén, Andalucía. Historia El castillo de Torredonjimeno se asienta en el lugar que ocupaba un caserío que, entre los siglos VIII y X, conformaba la alquería árabe que criaba ganadería y cultivaba las ricas tierras regadas por el río Salado. Entre los siglos XI y las primeras décadas del siglo XIII, los árabes levantaron un castillo con la intención de proteger a los campesinos y ganaderos de ésta y otras alquerías del entorno de los conflictos internos árabes y del avance de las huestes cristianas, así como para controlar la ruta entre Yayyan (Jaén) y Tuss (Martos). Tras el pacto de Las Navas de Tolosa en que al-Bayyasi, cedió a Fernando III Martos, y a partir de que, en 1228, Martos se convirtió en cabeza del maestrazgo de Calatrava, Torredonjimeno quedó integrado en el territorio de la Orden de Calatrava y el antiguo castillo árabe experimentó una profunda transformación.', 'El edificio del molino aceitero alberga el centro de interpretación del Tesoro Visigodo (Tesoro de Torredonjimeno) y una exposición permanente de fósiles. El Castillo de Torredonjimeno fue declarado Bien de Interés Cultural en el año 1985.\u200b Puente de San Sebastián (s. XVI) El puente de San Sebastián, contiguo por un lado a la desaparecida Puerta de Martos y por el otro con el pilar del mismo nombre que se alza sobre el cauce del arroyo salado. Responde a una traza renacentista, realizada en cantería y bellas proporciones. Está compuesto por solo ojo de medio punto enmarcado por fuertes estribos. Palacio Municipal (s. XVII) De fachada elegante y proporcionada propia del clasicismo manierista del siglo XVII. La fachada se divide en dos pisos, el de abajo tiene en el centro una portada y a los lados dobles ventanales rectangulares adintelados. La superior presenta una galería con 11 arcos de medio punto apoyadas sobre dobles columnas.']","El tesoro de Torredonjimeno es un conjunto de orfebrería visigoda compuesto por varias coronas votivas que los reyes visigodos ofrecieron a la Iglesia. Fue encontrado en 1926 en Torredonjimeno, provincia de Jaén, cerca de la actual Ermita de la Virgen de Consolación por un campesino que se encontraba trabajando en el campo. Pensando que las piezas carecían de valor, se las dio a los hijos que se entretenían desmontando las joyas y mezclándolas con barro. Tiempo después apareció un trapero que compró las piezas. Ahí se le pierde el rastro, hasta que vuelve a aparecer en los años 40. Actualmente está repartido entre los Museos Arqueológicos de Madrid, Barcelona y Córdoba, aunque en el castillo de Torredonjimeno se exponen sus réplicas.","El tesoro de Torredonjimeno es un conjunto de orfebrería visigoda compuesto por varias coronas votivas que los reyes visigodos ofrecieron a la Iglesia. Es muy parecido al Tesoro de Guarrazar aunque algo más tosco, posiblemente las coronas estuvieran dedicadas a las santas Justa y Rufina. Fue encontrado en 1926 en Torredonjimeno, provincia de Jaén, cerca de la actual Ermita de la Virgen de Consolación, en una finca de olivar, a 2 km del núcleo urbano del pueblo y a 4 km de Martos, por un campesino que se encontraba trabajando en el campo. Pensando que las piezas carecían de valor, se las dio a los hijos que se entretenían desmontando las joyas y mezclándolas con barro. Tiempo después apareció un trapero que compró las piezas. Ahí se le pierde el rastro, hasta que vuelve a aparecer en los años 40, fragmentado."
