{
    "test_1": {
        "question": "¿Quién es Joaquín Sabina?",
        "reference": "Joaquín Sabina es un cantautor y poeta de Úbeda, Jaén. Es conocido por algunas de sus canciones más famosas como '19 Días y 500 Noches', o 'Y nos dieron las diez'.",
        "response": "Joaquín Sabina es un cantautor, poeta y pintor español. Ha publicado diecisiete discos de estudio y siete en directo, y ha colaborado con distintos artistas cantando dúos y realizando otras colaboraciones. También ha compuesto para otros artistas como Ana Belén, Andrés Calamaro o Miguel Ríos, entre otros.",
        "reference_contexts": "[\"Joaquín Ramón Martínez Sabina (Úbeda, 12 de febrero de 1949), conocido como Joaquín Sabina, es un cantautor, poeta y pintor español\\u200b. Ha publicado diecisiete discos de estudio y siete en directo, y ha colaborado con distintos artistas cantando dúos y realizando otras colaboraciones. Los álbumes en directo son grabaciones de actuaciones en las que ha intervenido en solitario o junto con otros artistas: La mandrágora (1981), junto a Javier Krahe y Alberto Pérez; Joaquín Sabina y Viceversa en directo (1986), junto a la banda Viceversa; Enemigos íntimos (1998) junto a Fito Paez; Nos sobran los motivos (2000) y Dos pájaros de un tiro (2007) junto a Joan Manuel Serrat. Se estima que ha vendido más de diez millones de discos y también ha compuesto para otros artistas como Ana Belén, Andrés Calamaro o Miguel Ríos, entre otros. En su faceta literaria ha publicado nueve libros con recopilaciones de letras de canciones o poemas publicados en el semanario Interviú. En 2001 sufrió un leve infarto cerebral que puso su vida en peligro, recuperándose unas pocas semanas más tarde sin sufrir secuelas físicas, pero viéndose inmerso en una importante depresión, lo que le llevó a abandonar los escenarios un tiempo. Durante su retiro, publicó Dímelo en la calle (2002), al que seguiría su decimoctavo álbum, Alivio de luto (2005), cuyas canciones reflejan cómo influyó el incidente en su forma de pensar. Consiguió tres discos de platino por Vinagre y rosas (2009)\\u200b y uno de oro por Lo niego todo (2017),\\u200b sus últimos discos hasta el momento. Biografía Primeros años Joaquín Sabina nació el 12 de febrero de 1949 en el municipio de Úbeda (Jaén, España), segundo hijo de Adela Sabina del Campo, ama de casa y de Jerónimo Martínez Gallego, inspector de policía.\\u200b Cursó sus estudios primarios con las monjas carmelitas y con catorce años comenzó a escribir poemas y a componer música en una banda formada con sus amigos llamada Merry Youngs, que se dedicaban sobre todo a versionar a cantantes de rock como Elvis Presley, Chuck Berry o Little Richard.\\u200b Por esa época, tuvo a su primera novia, Virtudes Antero «Chispa», que le sirvió como inspiración para crear algunos poemas de amor. Esta relación fue un poco accidentada ya que el padre de Chispa, un notario de Úbeda, se opuso a ella desde un principio y algunos años después, siendo Joaquín universitario, se llevó la hija consigo a Granollers con el fin de apartarla definitivamente de él. Pero Joaquín emprendió, en compañía de un amigo, un viaje en su busca y se instaló en una tienda de campaña junto a la casa familiar de Chispa. Los dos jóvenes se escaparon juntos recalando finalmente en el Valle de Arán (Lérida) donde vivieron juntos unos días, disfrutando del vino y la lujuria.\\u200b\\u200b Posteriormente, cursó el bachillerato en los salesianos. En esa época siguió escribiendo versos y leyó a fray Luis de León, Jorge Manrique y José Hierro pero también a Marcel Proust, James Joyce y Herbert Marcuse. El día en que aprobó cuarto y reválida su padre quiso recompensar a Joaquín con un reloj de pulsera, a lo que él se negó manifestando que prefería una guitarra; petición que fue satisfecha. En cambio, su hermano mayor sí que aceptó el reloj y, según Joaquín, ese pequeño detalle sería el que los empezaría a distanciar: su hermano se acabaría convirtiendo, como el padre de ambos, en policía, y él, en cantante.\\u200b Exilio en Londres (1968-1976) En 1968 se trasladó a Granada para matricularse en la Facultad de Filosofía y Letras e iniciar los estudios de Filología románica en la universidad de la ciudad, donde descubrió la poesía de César Vallejo y Pablo Neruda. Joaquín vivió por primera vez con una mujer, llamada Lesley, que preparaba su tesis de español en Granada.\\u200b Su ideología izquierdista le llevó a relacionarse con movimientos contrarios al régimen franquista. Ese mismo año, tras la declaración del estado de excepción, su padre, que era comisario en Úbeda, recibió la orden de detenerlo por pertenecer al Partido Comunista.\\u200b En 1970 comenzó a colaborar con la revista Poesía 70, donde coincidió con otros autores como Luis Eduardo Aute o Carlos Cano. En ese mismo año, lanzó un cóctel molotov contra una sucursal del Banco de Bilbao en Granada en protesta por el proceso de Burgos, por lo que se vio obligado a exiliarse. Como no tenía pasaporte, no pudo salir inmediatamente del país, pero conoció a un hombre, Mariano Zugasti, que, tras unas horas de conversación, le cedió el suyo.\\u200b Con nombre falso y acompañado de Lesley, Joaquín puso rumbo a París, donde pasó unos meses, y posteriormente a Londres, donde vivió como squatter —okupa— durante su primer año de estancia en la ciudad.\\u200b\\u200b Sabina necesitó sensibilizar a la opinión pública a su favor, ya que de otro modo sería repatriado a España, y gracias a Lesley consiguió que le hicieran una entrevista y presentara su caso. El Daily Mirror publicó que a su vuelta a España le esperaría la pena de muerte,\\u200b pero consiguió que las autoridades británicas le concedieran el asilo político por un año. Se marchó a vivir a Edimburgo con Lesley. Permanecieron allí cuatro meses, tras los cuales se marchó a Londres y abandonó a Lesley.\\u200b Durante esta época, su casa en Londres sirvió de refugio para miembros de la banda terrorista ETA. Años más tarde afirmó que «la izquierda de este país, a la que orgullosamente he pertenecido y creo pertenecer, debiera pedir perdón por su complacencia con ETA durante muchos años. Yo tuve en mi casa de Londres a etarras y era una gente encantadora que pegaban tiros en la nuca, algo que nos parecía una cosa muy graciosa en ese momento. Y hacíamos mal. Porque de aquellos polvos vinieron estos lodos. Así que creo que la gente como yo está muy obligada a estar muy en contra y a decirlo muy alto por cobardes que sean. Y yo lo soy como el que más».\\u200b En Londres, realizó distintas actividades culturales: cooperó con el Club Antonio Machado, al que asistían asiduamente emigrantes y exiliados; escribió sus primeras canciones y organizó un cineclub donde se exhibían películas de Luis Buñuel, prohibido entonces en la España franquista, y reconstruyó el grupo de teatro Juan Panadero, que montó obras teatrales como La excepción de la regla, de Bertolt Brecht, y El cepillo de dientes, de Jorge Díaz. Se ganó la vida cantando en el metro, restaurantes y cafés.\\u200b En 1974, según una de las anécdotas más divulgadas sobre su vida, George Harrison se encontraba en el bar Mexicano-Taberna celebrando su cumpleaños y Sabina actuó para él. El exbeatle le dio una propina de cinco libras.\\u200b En algunas entrevistas, Sabina relató que conservaba el billete que recibió como un tesoro, en otras que lo perdió en una mudanza y en otras ocasiones ha desmentido su propia leyenda —«En realidad, me los bebí aquella misma noche»—. Durante ese tiempo mantuvo una relación con una mujer llamada Sonia.\\u200b En 1976 publicó el libreto de canciones Memoria del exilio y comenzó a organizar conciertos para la colonia de exiliados españoles en Reino Unido, en los que actuaron entre otros Paco Ibáñez, Lluís Llach, Francesc Pi de la Serra y Elisa Serna.\\u200b Estos versos constituirían el grueso principal dos años más tarde de su primer disco, Inventario. El libro fue editado por la editorial Nueva Voz, con una tirada de 1000 ejemplares que el propio Sabina se encargó de distribuir por el área de Portobello Road; vendió hasta el último de ellos gracias a su don de gentes y a las muchas amistades trabadas en el más de medio lustro transcurrido en la capital británica.\\u200b Más tarde compuso la banda sonora de la serie The Last Crusade, de la BBC.\\u200b Regreso a España (1977-1986) En 1977, dos años después de la muerte de Franco, regresó a España gracias a un pasaporte legal facilitado por Fernando Morán, cónsul español en Londres. En ese mismo año se casó con Lucía Inés Correa Martínez, una argentina que había conocido en Londres durante su exilio. La ceremonia de enlace, eclesiástica, tuvo lugar el 18 de febrero de 1977.\\u200b En realidad el enlace se celebró con el único propósito de conseguir el «pase de pernocta» —permiso que se da a los soldados para que puedan ir a dormir a sus casas— en el cuartel durante el servicio militar que se había visto obligado a cumplir en Mallorca tras regresar a España. Esto le permitió trabajar en el diario local Última Hora.\\u200b Su propietario, Pedro Serra, le ofreció quedarse en plantilla, pero rehusó y, al acabar el servicio militar en 1978, se instaló en Madrid con su mujer.\\u200b Poco después, consiguió editar su primer LP, Inventario. El director de la discográfica CBS, Tomás Muñoz, le había ofrecido su primer contrato con la referencia de su tema «¡Qué demasiao!», que por aquel entonces, interpretada por el cantante Pulgarcito, sonaba en Popgrama, espacio de Televisión Española presentado por Carlos Tena. Empezó a actuar en bares y en los actos electorales de diferentes partidos y sindicatos de izquierdas, como PSP, UGT, PCE y PSOE, así como en actos de la CNT. En esa época realizó entrevistas para Carta de España. Al año siguiente, comenzó a cantar junto a Javier Krahe y Alberto Pérez en el sótano del café madrileño La Mandrágora.\\u200b Uno de los temas que interpretaron fue «El hombre puso nombre a los animales (Con su bikini)», versión paródica del tema de Bob Dylan «Man Gave Names to All the Animals» que, según parece, el propio autor le prohibió tocar.\\u200b Al local acudió un día el periodista Fernando García Tola, que los invitó a su programa de televisión Esta noche, presentado por Carmen Maura.\\u200b Tras su primer disco, abandonó el perfil prototípico del cantautor, ya que, según él mismo afirmó, el uso de ese término le hacía sentir como si le pusieran un ladrillo en la cabeza y «poeta» le parecía «un traje que le queda demasiado ancho».\\u200b En 1980 publicó su segundo trabajo, Malas compañías, álbum en el que destacan varios temas que se convirtieron en clásicos, como «Calle Melancolía» o «¡Qué demasiao!», pero muy especialmente «Pongamos que hablo de Madrid», convertido para muchos en una especie de himno oficioso de la ciudad y que fue grabado primero por Antonio Flores, versión que alcanzó el número 1 en el programa de radio Los 40 Principales.\\u200b En 1981 apareció La mandrágora, disco grabado en directo junto con Krahe y Pérez en el que intentaron recoger el espíritu de sus actuaciones en el local. Además de los conciertos en pubs, tradujo canciones célebres en italiano para la discográfica CBS y compuso para otros artistas como Miguel Ríos y Ana Belén.\\u200b Comenzó a actuar con la que sería su primera banda, Ramillete de Virtudes y le añadió a su viejo repertorio nuevas composiciones cada vez más orientadas hacia el rock y con más ritmo como «Pisa el acelerador» y «Juana la Loca», canciones que, poco después, formarían parte del que sería su tercer LP —sin contar el disco grabado en La Mandrágora—, Ruleta rusa, publicado en 1984.\\u200b En 1984 escribió para Diario 16 un artículo de bienvenida a Bob Dylan y ese mismo año grabó con Gloria van Aerssen, de Vainica Doble, «Con las manos en la masa», la sintonía del programa de cocina homónimo de Elena Santonja en Televisión Española. Durante la temporada 1983-1984 actuó además asiduamente en el programa de TVE Si yo fuera presidente, de Fernando García Tola.\\u200b Posteriormente, Sabina y Krahe se separaron artísticamente. En 1985 cambió a CBS por Ariola como compañía discográfica, a cambio de mayor libertad artística y para obtener una más alta remuneración.\\u200b Ese mismo año comenzó a trabajar con Viceversa, banda con la que en 1985 sacó el álbum Juez y parte y, un año después, el disco Joaquín Sabina y Viceversa en directo, grabado en el Teatro Salamanca de Madrid, y que cuenta con la participación como invitados de Javier Gurruchaga y Ricardo Solfa, que interpretaron temas de su anfitrión, y de Luis Eduardo Aute, que le dedicó la canción «Pongamos que hablo de Joaquín». El álbum fue un éxito de ventas y supuso su salto al gran público.\\u200b Participó en fiestas a favor de un referéndum para la salida de España de la OTAN.\\u200b También, publicó «Si te he visto no me acuerdo», una canción que relataba los tres años de Felipe González al frente del gobierno de España. En las elecciones municipales apoyó a su amigo Juan Barranco, candidato a la alcaldía de la capital.\\u200b Además, en marzo de ese mismo año, publicó De lo cantado y sus márgenes, un conjunto de textos que reúne gran parte de los escritos que formaron parte de Memoria del exilio y de las canciones de Inventario.\\u200b Éxito multitudinario (1987-2000) Los éxitos comenzaron a sucederse con la publicación de sus siguientes elepés. En 1987 vendió más de 400 000 copias de Hotel, dulce hotel, lo que le ayudó a afianzar su éxito. Su antigua compañía, viendo la fama que estaba ganando el artista, publicó sin su consentimiento una colección a la que titularon Joaquín Sabina y todos sus éxitos. Se separó de Viceversa y se asoció con Víctor Claudín y Pedro Sauquillo para dirigir la sala de conciertos Elígeme, en el barrio de Malasaña de Madrid. En 1988 publicó El hombre del traje gris, que estrenó en la Plaza de Toros de Las Ventas de Madrid y después realizó una multitudinaria gira por México, Argentina y Venezuela. El álbum incluía la banda sonora, escrita junto a Pancho Varona, de la película Sinatra. Paco Betriu fue el director de la película, que contó con Alfredo Landa y Maribel Verdú como protagonistas y el propio cantante actuó interpretando un personaje secundario.\\u200b Ese mismo año, produjo un álbum doble en directo del trío madrileño Los Chichos, obtuvo el divorcio de su mujer, Lucía,\\u200b y la Junta de Andalucía lo galardonó con la Medalla de Plata.\\u200b En 1989, fundó junto a Pancho Varona, convertido en su inseparable guitarrista, Ripio, una empresa editorial con la que a partir de ese momento registró todas sus canciones. En ese mismo año, el 16 de enero, nació su primera hija, Carmela Juliana, de su relación con Isabel Oliart, y a quien dedicó la canción «Ay, Carmela» de su disco Vinagre y rosas de 2009.\\u200b De nuevo sin el visto bueno del cantante, su antigua discográfica lanzó otro recopilatorio: Mucho Sabina.\\u200b Los discos y las giras se sucedieron en el comienzo de los noventa, a partir de la publicación de Mentiras piadosas (1990). Posteriormente aparecería Física y química (1992), del cual se vendieron más de un millón de discos y en el que contó con la colaboración de Andrés Calamaro en el tema «Pastillas para no soñar»\\u200b y que popularizó en Sudamérica a través de una gran gira internacional de 188 conciertos. Le siguió Esta boca es mía (1994), álbum que fue el octavo más vendido en la lista anual de 1994 en España.\\u200b\\u200b El 26 de julio de 1992, nació su segunda hija con Isabel Oliart, Rocío, y comenzó una relación sentimental con la modelo mallorquina Cristina Zubillaga. Junto a otros artistas, tomó parte de acciones de protesta por el cierre del Teatro Alfil en 1994. En junio, dio su apoyo a Izquierda Unida en las elecciones legislativas.\\u200b Este mismo año participó, junto con otros importantes artistas, en la gira Mucho más que dos de Ana Belén y Víctor Manuel. En 1995 colaboró en el programa de televisión Con Hermida y compañía, presentado por Jesús Hermida.\\u200b En 1996, publicó Yo, mi, me, contigo, disco que le llevó de gira con más de 30 conciertos por España, que se iniciaron el 18 de julio en Gijón (Asturias), en compañía de Los Rodríguez y que prosiguieron por varios países de Latinoamérica, como Perú, México, Chile, Argentina y Uruguay. El disco fue el más vendido de la Asociación Fonográfica y Videográfica Española (AFYVE), con 80 000 copias vendidas en la semana de su estreno y el séptimo álbum más comprado en la lista anual de ese año en España.\\u200b\\u200b En él se incluía la canción «Y sin embargo» de la que Joaquín afirmó «Es mi canción de amor preferida».\\u200b En 1997 fue recibido por Fidel Castro, con quien conversó durante cinco horas\\u200b y se embarcó en un proyecto con el músico argentino Fito Páez, que admiraba las cualidades poéticas de Sabina. El resultado fue el disco Enemigos íntimos, que salió a la venta en España en 1998, aunque la gira promocional programada fue suspendida por desavenencias entre los dos artistas. En esa oportunidad se cancelaron más de 70 conciertos que tenían vendidos y promocionados alrededor del mundo. El escándalo fue mayor cuando se conoció una carta que el mismo Joaquín Sabina le había escrito a Fito Páez en forma de poesía, donde resumía los motivos que determinaron el final de su relación laboral: «El rol del patito feo, no me va te lo aseguro, y menos el de hombre duro, que a ti te cuesta tan poco» recitaba Joaquín en la mencionada carta.\\u200b Joaquín hizo una gira en solitario por teatros llamada Sabina, viuda e hijos en paños menores, de importante éxito y que destacó por la gran duración de los recitales, que llegaban a las tres horas. En esta gira se acompañó solamente de tres músicos: Pancho Varona —guitarra—, Antonio García de Diego —guitarra y teclados— y Olga Román —coros, percusiones y guitarra—.\\u200b\\u200b Tras romper con Cristina Zubillaga, comenzó a salir con una porteña de 23 años, Paula Seminara, relación que duró un año y medio.\\u200b Durante el mismo año 1998, Sabina colaboró con el cantautor argentino Charly García en su disco El aguante y cantó en el tema «Tu arma en el sur».\\u200b En 1999 publicó 19 días y 500 noches, que fue el sexto álbum más liquidado en la lista anual de ese año en España y en el veinticinco en la lista anual del año siguiente,\\u200b\\u200b al vender en total 500 000 copias. Obtuvo cuatro de los Premios de la Música de la Sociedad General de Autores de España (SGAE) del año 2000, además del Premio Ondas como el mejor artista español en 1999\\u200b y el Premio Ondas a la mejor canción en 2000.\\u200b Dentro de este disco se encuentran dos de sus canciones preferidas: «Una canción para la Magdalena» y «Noches de boda», esta última a dúo con la cantante Chavela Vargas, con quien años antes había entablado una estrecha amistad.\\u200b Ese mismo año, su discográfica le homenajeó en el Hotel Palace de Madrid para celebrar el logro de vender más de cuatro millones de discos desde su primer disco en dicha discográfica, Juez y parte, hasta 19 días y 500 noches. En diciembre actuó en el segundo concierto Principales Solidarios, organizado por Los 40 Principales, junto a otros artistas como La Oreja de Van Gogh, Hevia y Celtas Cortos, con el objetivo de recaudar fondos a favor de los refugiados de la guerra de Los Balcanes.\\u200b En 2000, le otorgaron cuatro de los cinco galardones a los que estaba nominado en los Premios de la Música en las categorías de mejor autor pop, mejor artista pop, mejor disco del año y mejor canción del año por «19 días y 500 noches».\\u200b Ese mismo año, comenzó la gira acústica Nos sobran los motivos, una revisión mejorada de En paños menores y, en septiembre, finalizó la gira eléctrica de 19 días y 500 noches. El 6 de noviembre, recibió el Premio Ondas a la mejor canción por «19 días y 500 noches».\\u200b Problemas de salud (2001-2004) La madrugada del 24 de agosto de 2001, tras la publicación ese mismo año del álbum Nos sobran los motivos, doble disco en directo, recopilatorio de la gira del mismo nombre, y que fue el sexto álbum más vendido en la lista anual de 2001 en España,\\u200b sufrió un leve infarto cerebral, que puso su vida en peligro. Aunque pocas semanas más tarde se recuperó sin sufrir secuelas físicas, el incidente influyó en su forma de pensar y se vio inmerso en una importante depresión. Todo esto hizo recapacitar al cantante sobre su modo de vida y su relación con las drogas, por lo que decidió dejar de consumir cocaína y afirmó que «por las drogas sólo siento nostalgia».\\u200b Sin embargo, en la entrevista durante el documental Joaquín Sabina - 19 días y 500 noches él mismo indicó que había dejado de consumir cocaína cuatro meses antes de su accidente cerebrovascular.\\u200b Durante ese tiempo, también logró dejar de fumar durante 8 meses y llegó a confesar que «fueron los ocho meses más largos de mi vida».\\u200b\\u200b Decidido a relanzar a su amiga María Jiménez, le cedió sus temas para que lanzara el disco Donde más duele y cantó con ella el tema «Con dos camas vacías».\\u200b En 2002, año en que posó desnudo para El País Semanal,\\u200b salió a la venta el libro Con buena letra, que incluía ilustraciones y las letras de todas sus canciones, y el disco Dímelo en la calle, que la crítica consideró como uno de los álbumes más importantes de ese año, y que se dio a conocer con el sencillo «69.G». También contenía el tema «Como un dolor de muelas», escrito parcialmente por Pancho Varona y el subcomandante Marcos, portavoz del Ejército Zapatista de Liberación Nacional (EZLN) y líder del levantamiento zapatista en Chiapas (México) el 1 de enero de 1994.\\u200b Ese disco también comprendía la canción «Semos diferentes», que formaba parte de la banda sonora de la película Torrente 2: Misión en Marbella, y por la que obtuvo una nominación a los Premios Goya de 2002 como «mejor canción original».\\u200b Dicho álbum se posicionó como el decimosexto más vendido en la lista anual de 2002 en España.\\u200b Sabina suspendió la gira programada para promocionar el álbum y adujo problemas en las cuerdas vocales, aunque posteriormente haría público que el verdadero motivo fue la depresión que sufría.\\u200b Sin embargo, en abril de 2003 sacó un nuevo disco doble, Diario de un peatón, que integraba Dímelo en la calle con un segundo CD donde presenta algunos de sus temas recientes y otros antiguos que seguían inéditos.\\u200b En el disco contó con la colaboración de Pablo Milanés en «La canción más hermosa del mundo», que antes ya había versionado con Pasión Vega.\\u200b En este tiempo seguía bajo los efectos de la depresión y redujo su actividad musical, pero potenció enormemente su faceta literaria como poeta. Como muestra de apoyo, surgió el proyecto que finalizaría con el disco Entre todas las mujeres, aparecido en octubre de 2003, donde trece artistas femeninas, como Rosario Flores, Ana Belén, Chavela Vargas o Julieta Venegas, versionaron varios de sus temas.\\u200b Pese a su enfermedad, compuso e interpretó en 2003 «Motivos de un sentimiento», el himno del Centenario del club de fútbol del que siempre se declaró fiel seguidor, el Atlético de Madrid. Se encargó de dar forma a tres versiones diferentes: una instrumental, otra al estilo de las chirigotas gaditanas y una última con sonido rock, esta última cantada por Rosendo Mercado, Germán «Mono» Burgos, Lichis —cantante de La cabra mecánica—, Josele Santiago y él mismo.\\u200b En 2004 creó con unos socios el restaurante La Cantina de la Mordida, en Madrid.\\u200b Ese mismo año, compuso la canción «La rubia de la cuarta fila» para la banda sonora de la película Isi/Disi. Amor a lo bestia, con la que obtuvo de nuevo una nominación a los Premios Goya de 2005 como mejor canción original.\\u200b También participó en el proyecto colectivo en homenaje al poeta Pablo Neruda en su centenario, de título Neruda en el corazón.\\u200b Recuperación y vuelta a la actividad (2005-2010) En 2005, el alcalde de Madrid Alberto Ruiz-Gallardón le ofreció ser el pregonero de las fiestas de San Isidro, patrón de la ciudad, honor que Sabina aceptó componiendo un pregón en verso que tuvo gran acogida popular.\\u200b\\u200b Publicó el disco Alivio de luto y gracias a ello y a su dedicación a la literatura logró salir de la depresión.\\u200b Fue el octavo álbum más vendido en la lista anual de 2005 en España y certificado con dos discos de platino.\\u200b También publicó la segunda edición de Con buena letra, donde incluyó letras de canciones escritas por encargo o para amigos, para cine y televisión, y correspondientes a su disco Alivio de luto.\\u200b Regresó a los escenarios con la Gira ultramarina, en formato acústico y en pequeños escenarios o teatros, y supuso el retorno del artista después de más de tres años de inactividad, rodeado de sus músicos habituales, Pancho Varona, Olga Román, Antonio García de Diego y Pedro Barceló. Uno de los conciertos de esa gira, en la ciudad de Gijón, fue suspendido por una laringitis aguda, lo que dio una vez más lugar a comentarios en la prensa y entre el público acerca de su estado de salud.\\u200b En el año 2006, tras concluir la Gira ultramarina, comenzó otra serie de conciertos bajo el nombre Carretera y top manta. Esta referencia a la piratería musical le llevó a un agrio enfrentamiento con el cantante Ramoncín, miembro de la junta directiva de la SGAE.\\u200b La gira tuvo carácter eléctrico y se realizó en grandes escenarios y comenzó en Gijón —resarciéndose así de lo que él mismo llamó «gatillazo»—\\u200b y terminó a finales de año, después de recorrer gran parte de la geografía española, en Sudamérica.\\u200b Ese mismo año apareció un nuevo libro de entrevistas con Sabina bajo el título Sabina en carne viva. Su autor fue Javier Menéndez Flores, que ya escribió otro anterior, Perdonen la tristeza, en el año 2000. El nuevo libro fue un éxito de ventas, aunque estuvo momentáneamente apartado de las librerías por motivos de lucha editorial.\\u200b Al mismo tiempo, comenzó a colaborar con la revista Interviú, que le cedió la tercera página para publicar sus sonetos.\\u200b En octubre de dicho año, recibió de manos del rey Juan Carlos la Medalla de Oro al mérito en las Bellas Artes.\\u200b Un mes después, en noviembre, se publicó la doble caja antológica Punto... y seguido, que contenía todos sus discos, más colaboraciones, directos y rarezas.\\u200b En 2007 realizó una gira junto a Joan Manuel Serrat llamada Dos pájaros de un tiro, que comenzó el 29 de junio y que los llevó por 30 ciudades españolas y 20 americanas. En ella, el catalán interpretó las mejores canciones del ubetense mientras este hacía lo propio con el repertorio del noi del Poble-sec. De los conciertos celebrados en Madrid se grabó un disco en directo y un DVD con más material que se puso a la venta en diciembre de 2007.\\u200b El directo fue el segundo álbum más vendido en la lista anual de 2007 en España y el cuarto en la lista anual del año siguiente, al vender en total 320 000 copias y obteniendo así la certificación de cuatro discos de platino.\\u200b\\u200b En ese mismo año compuso la banda sonora de la película Un mundo para Julius, basada en la novela homónima de Alfredo Bryce Echenique, que interpretaron Ana Belén y Luz Casal.\\u200b También sacó a la venta Esta boca sigue siendo mía, segunda parte de los sonetos publicados para Interviú, y A vuelta de correo, epistolario que recoge la correspondencia entre el cantautor y diferentes personalidades como el subcomandante Marcos o Fito Páez, entre otros.\\u200b En 2008, el director neerlandés Ramon Gieling dirigió una película sobre la vida de Joaquín Sabina titulada «19 días y 500 noches» y cuyo tema principal es la depresión que sufrió hacía unos años.\\u200b Ese mismo año se concretó la reconciliación y posterior encuentro entre Sabina y Fito Páez. Éste lo invitó a su recital en Madrid y juntos grabaron una versión de «Contigo», que estaba incluida en el último CD del artista argentino titulado No sé si es Baires o Madrid. El encuentro está registrado también en el DVD que acompañó al disco.\\u200b El 5 de marzo de 2009 se anunció la concesión a Joaquín Sabina, junto a José Tomás, Raúl González Blanco y Paloma O'Shea, de la Medalla de Oro de la Ciudad de Madrid que otorga anualmente el Ayuntamiento como reconocimiento a personajes públicos que han contribuido con su trabajo a fomentar la buena imagen de la ciudad. El galardón lo recibió el 15 de mayo del mismo año.\\u200b El 17 de noviembre de ese año publicó su decimoquinto álbum de estudio, titulado Vinagre y rosas y cuyo sencillo, «Tiramisú de limón», lo cantaba junto al grupo Pereza, el cual se encargó además de ponerle música así como de los coros y la producción. Para presentar ese nuevo álbum, inició una gira en Salamanca, donde dio sus dos primeros conciertos los días 20 y 21 del mismo mes.\\u200b Esta gira, según afirmó, sería la última que realizara por grandes escenarios.\\u200b El álbum fue el más vendido en la lista anual de 2009 en España y el séptimo en la lista anual del año siguiente,\\u200b\\u200b certificado con un total de cinco discos de platino.\\u200b El 16 de noviembre de 2010, la revista Rolling Stone le otorgó el premio como Artista del año.\\u200b Su musical y debut en Estados Unidos (2011-presente) En 2011, el cantante inició la gira El penúltimo tren en la que recorrió Latinoamérica y en la que tenía previsto cantar por primera vez en Estados Unidos.\\u200b Sin embargo, en mayo de 2011, Sabina suspendió los conciertos en ciudades mexicanas y estadounidenses debido a una «diverticulitis aguda con riesgo de complicaciones» y los pospuso para el mes de octubre.\\u200b\\u200b Ya recuperado, regresó a los escenarios el 2 de julio en el festival Músicos en la naturaleza, celebrado en Hoyos del Espino (Ávila), en el que actuó junto a Andrés Calamaro.\\u200b Finalmente, pudo actuar en el Manhattan Center de Nueva York el 16 de octubre, en el que fue su primer concierto en Estados Unidos. Dentro de su gira, también actuó en el Nokia Theater de Los Ángeles el 20 de octubre y la finalizó el 23 de octubre en el American Airlines Arena de Miami.\\u200b El 6 de octubre de ese mismo año se estrenó el musical Más de cien mentiras, basado en sus canciones y dirigido por David Serrano y con el propio cantante como director musical, en compañía de Pancho Varona y José María Cámara.\\u200b El 6 de febrero de 2012, presentó junto a Joan Manuel Serrat, La orquesta del Titanic, su primer álbum de estudio grabado con el cantautor catalán. Además, anunciaron una gira de presentación del disco que los llevaría por Argentina, Chile, México, Estados Unidos, Costa Rica y España.\\u200b En la campaña electoral de las Elecciones al Parlamento de Cataluña de 2012, dio su permiso para que el partido Ciudadanos-Partido de la Ciudadanía utilizara los versos de «Anteproyectos para la letra del himno nacional (con perdón)» en dicha campaña.\\u200b En 2013, publicó el libro Muy personal, que incluía dibujos, poemas empezados y letras de canciones inacabadas. Era la primera vez que publicaba sus obras plásticas —denominados «garabatos» por el artista— pintadas con rotuladores y extraídas de una quincena de cuadernos ilustrados. Los dibujos estaban incluidos entre fragmentos de poemas, de reflexiones personales, esbozos de letras de canciones, impresiones sobre sus conciertos, comentarios de sus viajes y entradas de un diario frustrado.\\u200b El 16 de octubre de 2015, lanzó la caja Puro Sabina, que contenía trabajos de estudio y en directo, tanto en solitario como al frente de Viceversa, la banda que lo acompañó a mediados de los ochenta.\\u200b El 3 de febrero de 2016, puso a la venta Garagatos, un cuaderno de artista que comprendía un libro de arte, el libro Garagatos y un desplegable de casi tres metros de largo. El libro de arte constaba de 66 dibujos facsimiles en forma de láminas de diferente tamaño. Cada dibujo estaba acompañado por fragmentos de canciones, versos o «guiños de humor» del propio Sabina. En el libro Garagatos, diferentes personalidades hablaban sobre las influencias, arquetipos y personajes empleados por el artista en su obra.\\u200b Poco antes, se había sometido con éxito a una operación de estómago por una diverticulitis con riesgo de acabar en peritonitis.\\u200b Ese mismo mes, fue nombrado Hijo Predilecto de Andalucía, título concedido por la Junta de Andalucía.\\u200b\\u200b El 10 de marzo de 2017, estrenó su álbum Lo niego todo, producido por Leiva y en el que colaboró el poeta Benjamín Prado.\\u200b Además, lo nombraron Hijo Predilecto en su ciudad natal, Úbeda.\\u200b El 18 de junio de 2018, Sabina se vio en la obligación de cancelar la gira de Lo niego todo por problemas de salud, al quedarse «totalmente mudo» durante el concierto celebrado el 16 de junio en el WiZink Center de Madrid.\\u200b El 12 de febrero de 2020 sufrió una caída durante el concierto que daba junto a Joan Manuel Serrat en el WiZink Center de Madrid como parte de su gira No hay dos sin tres. El cantante se precipitó del escenario hasta caer al foso de seguridad, desde una altura de al menos un metro y medio.\\u200b Al cegarse con un foco, no se dio cuenta de que se encontraba en el mismo borde de las tablas, perdió pie y cayó al foso de seguridad entre el escenario y las primeras filas del público. Como consecuencia de la caída, sufrió un hematoma intracraneal. Tras el incidente, el propio Sabina salió en silla de ruedas al escenario, acompañado de Serrat, para aplazar el concierto y anunciar al público que se iba al hospital porque se había hecho daño en un hombro.\\u200b Tuvo que ser operado, con éxito,\\u200b e ingresado en la UCI.\\u200b Ese mismo año, Atresplayer estrenó una serie documental sobre Sabina, denominada Pongamos que hablo de Joaquín Sabina.\\u200b También le concedieron el Premio Ondas por su trayectoria.\\u200b En 2021, la Academia Latina de Artes y Ciencias de la Grabación anunció que le entregaría el Premio a la Excelencia Musical de los Premios Grammy Latinos, junto a Martinho da Vila, Emmanuel, Sheila E. & Pete Escovedo, Fito Páez, Milly Quezada y Gilberto Santa Rosa. Afirmaban que el cantante «elevó el arte de escribir canciones en español a alturas inesperadas, creando un universo musical caracterizado por su poesía excéntrica pero sencilla y sus agudas observaciones sociopolíticas que han influido a varias generaciones».\\u200b En 2022, se estreno en el Festival de Cine de San Sebastián el documental Sintiéndolo mucho, una película dirigida por el realizador español Fernando León de Aranoa y en la que colaboró el exmiembro de la banda Pereza, Leiva, como compositor de la banda sonora. Se trata de un documental intimista en el que León de Aranoa muestra a Sabina en diferentes aspectos de su vida cotidiana, con grabaciones realizadas durante varios años de seguimiento del artista y que muestra aspectos ocultos de su biografía. En el mismo, aparecen amigos reunidos en el piso del cantautor o imágenes de su gira por México. El 15 de noviembre de 2022, el músico Pancho Varona anuncia a través de sus redes la decisión de Sabina de no contar con él en la siguiente gira que estaba preparando, rompiendo así con el vínculo de más de 40 años entre ambos músicos. Esta noticia causó gran revuelo en redes sociales a gran parte del público, al no recibir ninguna explicación por parte del cantautor de la ruptura con el músico más activo y más veterado de la formación, tanto en estudio como en directo. En 2023 volvió a los escenarios con su nueva nueva gira «Contra todo pronóstico».\\u200b En julio de 2024 anunció su retirada de los escenarios con la que será su última gira titulada genéricamente «Hola y adiós», que tiene previsto arrancar en febrero de 2025.\\u200b En octubre de 2024 dio a conocer las fechas de su última gira, que visitaría ciudades como: Santa Cruz de Tenerife, Málaga, Madrid, Palma de Mallorca, Zaragoza, Pamplona, Murcia, Alicante, Valencia, Bilbao, Santander, Sevilla, A Coruña, Granada y Barcelona.\\u200b Obra Influencias[a]\\u200b La obra literaria de Sabina no es la propia de un poeta, ya que gran parte de sus composiciones son canciones. Para Juan Pablo Neyret, «su vida no es menos importante que su obra, más allá de la autorreferencialidad que presentan las letras de sus canciones».\\u200b Sobre este tema, Marcela Romano apunta en ¿La enunciación en persona?, que «al modelo de productor individual, discretamente implicitado en la escritura, sucede otro fuertemente explícito, presente, quien, simultáneamente con el texto, exhibe la voz, el cuerpo, los gestos, la vestimenta»,\\u200b al que denomina «sujeto espectacular». Aunque en los libros editados sobre Joaquín Sabina —al margen de los libros de poemas— aparezcan referencias a su obra, la mayor parte de ellos son biografías y recopilaciones de anécdotas, lo que para Neyret denota la «exhibición de la persona» del artista y afirma que «la exposición del artista posmoderno va mucho más allá y llega hasta los programas de televisión y de radio, sitios de internet, revistas de interés general y prensa del corazón, es decir, el sistema de producción y consumo del llamado mundo del espectáculo». Neyret considera que justo después de la publicación en 1978 de Inventario, su primer disco, Joaquín Sabina se «emancipa de la musicalización de la poesía y lo que precisamente lo caracteriza es, salvo en muy contados casos de coautoría o de interpretación de canciones de otros autores, la preeminencia de sus letras, tanto en el sentido de que estas son dominantes absolutas en su cancionero como en el de que posee una intervención limitada en su musicalización». De esta se encargaron, fundamentalmente desde mediados de los años 1980, Pancho Varona y Antonio García de Diego. Cabe destacar que el único texto de los poemas que forman las canciones de Inventario que Sabina musicalizó fue un texto medieval titulado el «Romance de la gentil dama y el rústico pastor».\\u200b Sabina, siguiendo la práctica bastante extendida entre los cantautores españoles e hispanoamericanos a partir de la década de 1960,[b]\\u200b escogió un texto de hacía varios siglos y que era cantado y lo remusicalizó. En él aparecen varios temas que usaría más tarde en sus canciones, como el amor, el sexo, el rechazo a la pareja formalizada y el estereotipo del varón solitario.\\u200b En sus estudios, Heinrich Wölfflin consideraba que el arte se desarrolla en períodos sucesivos de afirmación y de crisis. Neyret valora al Barroco como un período de crisis y lo vincula con la posmodernidad debido a su «pesimismo e ironía esenciales». Lola Pérez Costa vincula algunas canciones de Sabina, como «Calle Melancolía», «Inventario» o «Siete crisantemos», con el Barroco. Relaciona ese período, que «expresa la conciencia de una crisis, visible en los agudos contrastes sociales, el hambre, la guerra y la miseria», con la España en los años 1980, época en la que se publicó la canción «Calle Melancolía»,\\u200b y que se caracterizó por ser «una sociedad marcada por el paro, la desesperanza, el miedo atómico, la frustración laboral y académica, el absentismo, el terrorismo... junto con unas ganas de vivir a toda prisa, cierta euforia cultural, la confianza en las instituciones democráticas; y todo ello cifrando su hipotética salvación en un individualismo abrumador». Esta situación se reflejaba en «Calle Melancolía», en la que aparecen versos con amargos desengaños («no hallo más que puertas que niegan lo que esconden»); dolor vital («por las paredes ocres se desparrama el zumo / de una fruta de sangre crecida en el asfalto»), desesperación («me enfado con las sombras que pueblan los pasillos»), desamparo («trepo por tu recuerdo como una enredadera / que no encuentra ventanas donde agarrarse»), y, posiblemente, los versos que definen la España de los primeros años del posfranquismo: «un barco enloquecido / que viene de la noche y va a ninguna parte».\\u200b Las letras de Sabina están influidas por una gran variedad de estilos y artistas, que van desde el rock anglosajón —con autores como Bob Dylan, Leonard Cohen o The Rolling Stones—, el folclore latinoamericano —como por ejemplo, Atahualpa Yupanqui, Violeta Parra, Chavela Vargas o José Alfredo Jiménez—, el tango —Enrique Santos Discépolo, Homero Manzi o Celedonio Flores— o la canción melódica francesa de Georges Brassens, hasta poetas vanguardistas hispanoamericanos como César Vallejo, así como Pablo Neruda, Raúl González Tuñón y Rafael Alberti o a los autores que forman parte de sus primeras lecturas en su juventud, que incluyen a Fray Luis de León y Jorge Manrique, así como el resto de la tradición española.\\u200b Por encima de todos estos autores, destaca la influencia de Francisco de Quevedo, aunque Sabina insiste en que su máxima influencia entre la poesía española contemporánea es la de Jaime Gil de Biedma.\\u200b Para Neyret, el sarcasmo, la ironía y la mordacidad son determinantes en la obra poética de Joaquín Sabina, al igual que en la de Quevedo.\\u200b Del mismo modo, las características formales básicas del Barroco son evidentes en sus letras: «léxico de uso corriente entrelazado con cultismos, equívocos, retruécanos, contrastes y antítesis, así como construcciones anafóricas y enumeraciones asindéticas, estos últimos, las dos principales tropos de la poética sabiniana».\\u200b Para Juan Pablo Neyret, los discos más significativos y en los que Sabina alcanza la «cumbre de su barroquismo», por encima del resto de álbumes de su discografía, son Yo, mí, me, contigo y 19 días y 500 noches. El primero está lleno «deliberadamente de lecturas en clave» y en el segundo «se muestra definitivamente dueño de sus recursos de estilo». Se pueden establecer comparaciones entre la canción «Contigo» de Sabina\\u200b y el soneto de Quevedo «Amor constante más allá de la muerte».\\u200b\\u200b Sabina ha manifestado en reiteradas ocasiones una admiración por su compatriota la cantante María Dolores Pradera, con quien grabó en 2007 la canción «Jugar por jugar» para el disco En buena compañía de la artista. Esto los llevaría a fortalecer una amistad antigua que Sabina transcribió en las Coplas a María Dolores Pradera que le dedicó en la presentación de Canciones del alma, que grabó Pradera en 2003.\\u200b Discografía oficial Inventario (1978) Malas compañías (1980) La mandrágora (1981), con Alberto Pérez y Javier Krahe Ruleta rusa (1984) Juez y parte (1985), con Viceversa Joaquín Sabina y Viceversa en directo (1986), con Viceversa Hotel, dulce hotel (1987) El hombre del traje gris (1988) Mentiras piadosas (1990) Física y química (1992) Esta boca es mía (1994) Yo, mi, me, contigo (1996) Enemigos íntimos (1998), con Fito Páez 19 días y 500 noches (1999) Nos sobran los motivos (2000) Dímelo en la calle (2002) Alivio de luto (2005) Dos pájaros de un tiro (2007), con Joan Manuel Serrat Vinagre y rosas (2009) La orquesta del Titanic (2012), con Joan Manuel Serrat En el Luna Park (2012), con Joan Manuel Serrat 500 noches para una crisis (2015) Lo niego todo (2017) Lo niego todo en directo (2018) Obra literaria Cancioneros Memoria del exilio (Londres: Nueva Voz, 1976), libreto de canciones publicado durante su exilio De lo cantado y sus márgenes (Granada: Diputación de Granada, 1986), letras de su disco Inventario El hombre del traje gris (Madrid: Ripio, 1989), partituras Con buena letra (Barcelona: Temas de Hoy, 2002; ampliado en 2005 y 2010), recopilación de letras Poemarios Ciento volando de catorce (Madrid: Visor, 2001), sonetos Esta boca es mía (Barcelona: Ediciones B, 2005), versos satíricos publicados en el semanario Interviú Esta boca sigue siendo mía (Barcelona: Ediciones B, 2007), versos satíricos publicados en el semanario Interviú El grito en el suelo (Madrid: Visor, 2012), poemas editados en el diario Público Muy personal (Barcelona: Planeta, 2013), dibujos, poemas empezados y letras de canciones inacabadas Garagatos (Barcelona: Artika, 2016), cuaderno de artista que incluye un libro de arte, el libro Garagatos y un desplegable de casi tres metros de largo En román paladino (Úbeda: Juancaballos de Poesía, 2018), versos publicados en la revista mensual tintaLibre Correspondencia A vuelta de correo (Madrid: Visor, 2007), epistolario con personalidades como el subcomandante Marcos o Fito Páez, entre otros Premios y distinciones Medalla de Plata de Andalucía (1988)\\u200b Premio Ondas al mejor artista español (1999)\\u200b Premio Ondas a la mejor canción por «19 días y 500 noches» (2000)\\u200b Medalla de Oro al mérito en las Bellas Artes (2000)\\u200b Nominación al Premio Goya a la mejor canción original (2002)\\u200b Nominación al Premio Goya a la mejor canción original (2005)\\u200b Medalla de Oro de la Ciudad de Madrid (2009)\\u200b Hijo Predilecto de Andalucía (2016)\\u200b\\u200b Hijo Predilecto y Medalla de Oro de Úbeda (2017)\\u200b Premio Ondas a la trayectoria musical (2020)\\u200b Premio Grammy Latino a la Excelencia Musical (2021)\\u200b Premio Ciudad de Alcalá de las Artes y las Letras (2022)\\u200b Premio Goya a la mejor canción por «Sintiéndolo mucho» (2023) Notas\"]",
        "retrieved_contexts": [
            "Joaquín Ramón Martínez Sabina (Úbeda, 12 de febrero de 1949) es un cantautor, poeta y pintor español.​ Ha publicado diecisiete discos de estudio y siete en directo, y ha colaborado con distintos artistas cantando dúos y realizando otras colaboraciones. Los álbumes en directo son grabaciones de actuaciones en las que ha intervenido en solitario o junto con otros artistas: La mandrágora (1981), junto a Javier Krahe y Alberto Pérez; Joaquín Sabina y Viceversa en directo (1986), junto a la banda Viceversa; Enemigos íntimos (1998) junto a Fito Paez; Nos sobran los motivos (2000) y Dos pájaros de un tiro (2007) junto a Joan Manuel Serrat. Se estima que ha vendido más de diez millones de discos y también ha compuesto para otros artistas como Ana Belén, Andrés Calamaro o Miguel Ríos, entre otros. En su faceta literaria ha publicado nueve libros con recopilaciones de letras de canciones o poemas publicados en el semanario Interviú. En 2001 sufrió un leve infarto cerebral que puso su vida en peligro, recuperándose unas pocas semanas más tarde sin sufrir secuelas físicas, pero viéndose inmerso en una importante depresión, lo que le llevó a abandonar los escenarios un tiempo. Durante su retiro, publicó Dímelo en la calle (2002), al que seguiría su decimoctavo álbum, Alivio de luto (2005), cuyas canciones reflejan cómo influyó el incidente en su forma de pensar. Consiguió tres discos de platino por Vinagre y rosas (2009)​ y uno de oro por Lo niego todo (2017),​ sus últimos discos hasta el momento. Biografía Primeros años Joaquín Sabina nació el 12 de febrero de 1949 en el municipio de Úbeda (Jaén, España), segundo hijo de Adela Sabina del Campo, ama de casa y de Jerónimo Martínez Gallego, inspector de policía.​ Cursó sus estudios primarios con las monjas carmelitas y con catorce años comenzó a escribir poemas y a componer música en una banda formada con sus amigos llamada Merry Youngs, que se dedicaban sobre todo a versionar a cantantes de rock como Elvis Presley, Chuck Berry o Little Richard.​ Por esa época, tuvo a su primera novia, Virtudes Antero «Chispa», que le sirvió como inspiración para crear algunos poemas de amor. Esta relación fue un poco accidentada ya que el padre de Chispa, un notario de Úbeda, se opuso a ella desde un principio y algunos años después, siendo Joaquín universitario, se llevó la hija consigo a Granollers con el fin de apartarla definitivamente de él. Pero Joaquín emprendió, en compañía de un amigo, un viaje en su busca y se instaló en una tienda de campaña junto a la casa familiar de Chispa. Los dos jóvenes se escaparon juntos recalando finalmente en el Valle de Arán (Lérida) donde vivieron juntos unos días, disfrutando del vino y la lujuria.​​ Posteriormente, cursó el bachillerato en los salesianos. En esa época siguió escribiendo versos y leyó a fray Luis de León, Jorge Manrique y José Hierro pero también a Marcel Proust, James Joyce y Herbert Marcuse. El día en que aprobó cuarto y reválida su padre quiso recompensar a Joaquín con un reloj de pulsera, a lo que él se negó manifestando que prefería una guitarra; petición que fue satisfecha. En cambio, su hermano mayor sí que aceptó el reloj y, según Joaquín, ese pequeño detalle sería el que los empezaría a distanciar: su hermano se acabaría convirtiendo, como el padre de ambos, en policía, y él, en cantante.​ Exilio en Londres (1968-1976) En 1968 se trasladó a Granada para matricularse en la Facultad de Filosofía y Letras e iniciar los estudios de Filología románica en la universidad de la ciudad, donde descubrió la poesía de César Vallejo y Pablo Neruda. Joaquín vivió por primera vez con una mujer, llamada Lesley, que preparaba su tesis de español en Granada.​ Su ideología izquierdista le llevó a relacionarse con movimientos contrarios al régimen franquista. Ese mismo año, tras la declaración del estado de excepción, su padre, que era comisario en Úbeda, recibió la orden de detenerlo por pertenecer al Partido Comunista.​ En 1970 comenzó a colaborar con la revista Poesía 70, donde coincidió con otros autores como Luis Eduardo Aute o Carlos Cano. En ese mismo año, lanzó un cóctel molotov contra una sucursal del Banco de Bilbao en Granada en protesta por el proceso de Burgos, por lo que se vio obligado a exiliarse. Como no tenía pasaporte, no pudo salir inmediatamente del país, pero conoció a un hombre, Mariano Zugasti, que, tras unas horas de conversación, le cedió el suyo.​ Con nombre falso y acompañado de Lesley, Joaquín puso rumbo a París, donde pasó unos meses, y posteriormente a Londres, donde vivió como squatter —okupa— durante su primer año de estancia en la ciudad.​​ Sabina necesitó sensibilizar a la opinión pública a su favor, ya que de otro modo sería repatriado a España, y gracias a Lesley consiguió que le hicieran una entrevista y presentara su caso. El Daily Mirror publicó que a su vuelta a España le esperaría la pena de muerte,​ pero consiguió que las autoridades británicas le concedieran el asilo político por un año. Se marchó a vivir a Edimburgo con Lesley. Permanecieron allí cuatro meses, tras los cuales se marchó a Londres y abandonó a Lesley.​ Durante esta época, su casa en Londres sirvió de refugio para miembros de la banda terrorista ETA. Años más tarde afirmó que «la izquierda de este país, a la que orgullosamente he pertenecido y creo pertenecer, debiera pedir perdón por su complacencia con ETA durante muchos años. Yo tuve en mi casa de Londres a etarras y era una gente encantadora que pegaban tiros en la nuca, algo que nos parecía una cosa muy graciosa en ese momento. Y hacíamos mal. Porque de aquellos polvos vinieron estos lodos. Así que creo que la gente como yo está muy obligada a estar muy en contra y a decirlo muy alto por cobardes que sean. Y yo lo soy como el que más».​ En Londres, realizó distintas actividades culturales: cooperó con el Club Antonio Machado, al que asistían asiduamente emigrantes y exiliados; escribió sus primeras canciones y organizó un cineclub donde se exhibían películas de Luis Buñuel, prohibido entonces en la España franquista, y reconstruyó el grupo de teatro Juan Panadero, que montó obras teatrales como La excepción de la regla, de Bertolt Brecht, y El cepillo de dientes, de Jorge Díaz. Se ganó la vida cantando en el metro, restaurantes y cafés.​ En 1974, según una de las anécdotas más divulgadas sobre su vida, George Harrison se encontraba en el bar Mexicano-Taberna celebrando su cumpleaños y Sabina actuó para él. El exbeatle le dio una propina de cinco libras.​ En algunas entrevistas, Sabina relató que conservaba el billete que recibió como un tesoro, en otras que lo perdió en una mudanza y en otras ocasiones ha desmentido su propia leyenda —«En realidad, me los bebí aquella misma noche»—. Durante ese tiempo mantuvo una relación con una mujer llamada Sonia.​ En 1976 publicó el libreto de canciones Memoria del exilio y comenzó a organizar conciertos para la colonia de exiliados españoles en Reino Unido, en los que actuaron entre otros Paco Ibáñez, Lluís Llach, Francesc Pi de la Serra y Elisa Serna.​ Estos versos constituirían el grueso principal dos años más tarde de su primer disco, Inventario. El libro fue editado por la editorial Nueva Voz, con una tirada de 1000 ejemplares que el propio Sabina se encargó de distribuir por el área de Portobello Road; vendió hasta el último de ellos gracias a su don de gentes y a las muchas amistades trabadas en el más de medio lustro transcurrido en la capital británica.​ Más tarde compuso la banda sonora de la serie The Last Crusade, de la BBC.​ Regreso a España (1977-1986) En 1977, dos años después de la muerte de Franco, regresó a España gracias a un pasaporte legal facilitado por Fernando Morán, cónsul español en Londres. En ese mismo año se casó con Lucía Inés Correa Martínez, una argentina que había conocido en Londres durante su exilio. La ceremonia de enlace, eclesiástica, tuvo lugar el 18 de febrero de 1977.​ En realidad el enlace se celebró con el único propósito de conseguir el «pase de pernocta» —permiso que se da a los soldados para que puedan ir a dormir a sus casas— en el cuartel durante el servicio militar que se había visto obligado a cumplir en Mallorca tras regresar a España. Esto le permitió trabajar en el diario local Última Hora.​ Su propietario, Pedro Serra, le ofreció quedarse en plantilla, pero rehusó y, al acabar el servicio militar en 1978, se instaló en Madrid con su mujer.​ Poco después, consiguió editar su primer LP, Inventario. El director de la discográfica CBS, Tomás Muñoz, le había ofrecido su primer contrato con la referencia de su tema «¡Qué demasiao!», que por aquel entonces, interpretada por el cantante Pulgarcito, sonaba en Popgrama, espacio de Televisión Española presentado por Carlos Tena. Empezó a actuar en bares y en los actos electorales de diferentes partidos y sindicatos de izquierdas, como PSP, UGT, PCE y PSOE, así como en actos de la CNT. En esa época realizó entrevistas para Carta de España. Al año siguiente, comenzó a cantar junto a Javier Krahe y Alberto Pérez en el sótano del café madrileño La Mandrágora.​ Uno de los temas que interpretaron fue «El hombre puso nombre a los animales (Con su bikini)», versión paródica del tema de Bob Dylan «Man Gave Names to All the Animals» que, según parece, el propio autor le prohibió tocar.​ Al local acudió un día el periodista Fernando García Tola, que los invitó a su programa de televisión Esta noche, presentado por Carmen Maura.​ Tras su primer disco, abandonó el perfil prototípico del cantautor, ya que, según él mismo afirmó, el uso de ese término le hacía sentir como si le pusieran un ladrillo en la cabeza y «poeta» le parecía «un traje que le queda demasiado ancho».​ En 1980 publicó su segundo trabajo, Malas compañías, álbum en el que destacan varios temas que se convirtieron en clásicos, como «Calle Melancolía» o «¡Qué demasiao!», pero muy especialmente «Pongamos que hablo de Madrid», convertido para muchos en una especie de himno oficioso de la ciudad y que fue grabado primero por Antonio Flores, versión que alcanzó el número 1 en el programa de radio Los 40 Principales.​ En 1981 apareció La mandrágora, disco grabado en directo junto con Krahe y Pérez en el que intentaron recoger el espíritu de sus actuaciones en el local. Además de los conciertos en pubs, tradujo canciones célebres en italiano para la discográfica CBS y compuso para otros artistas como Miguel Ríos y Ana Belén.​ Comenzó a actuar con la que sería su primera banda, Ramillete de Virtudes y le añadió a su viejo repertorio nuevas composiciones cada vez más orientadas hacia el rock y con más ritmo como «Pisa el acelerador» y «Juana la Loca», canciones que, poco después, formarían parte del que sería su tercer LP —sin contar el disco grabado en La Mandrágora—, Ruleta rusa, publicado en 1984.​ En 1984 escribió para Diario 16 un artículo de bienvenida a Bob Dylan y ese mismo año grabó con Gloria van Aerssen, de Vainica Doble, «Con las manos en la masa», la sintonía del programa de cocina homónimo de Elena Santonja en Televisión Española. Durante la temporada 1983-1984 actuó además asiduamente en el programa de TVE Si yo fuera presidente, de Fernando García Tola.​ Posteriormente, Sabina y Krahe se separaron artísticamente. En 1985 cambió a CBS por Ariola como compañía discográfica, a cambio de mayor libertad artística y para obtener una más alta remuneración.​ Ese mismo año comenzó a trabajar con Viceversa, banda con la que en 1985 sacó el álbum Juez y parte y, un año después, el disco Joaquín Sabina y Viceversa en directo, grabado en el Teatro Salamanca de Madrid, y que cuenta con la participación como invitados de Javier Gurruchaga y Ricardo Solfa, que interpretaron temas de su anfitrión, y de Luis Eduardo Aute, que le dedicó la canción «Pongamos que hablo de Joaquín». El álbum fue un éxito de ventas y supuso su salto al gran público.​ Participó en fiestas a favor de un referéndum para la salida de España de la OTAN.​ También, publicó «Si te he visto no me acuerdo», una canción que relataba los trece años de Felipe González al frente del gobierno de España. En las elecciones municipales apoyó a su amigo Juan Barranco, candidato a la alcaldía de la capital.​ Además, en marzo de ese mismo año, publicó De lo cantado y sus márgenes, un conjunto de textos que reúne gran parte de los escritos que formaron parte de Memoria del exilio y de las canciones de Inventario.​ Éxito multitudinario (1987-2000) Los éxitos comenzaron a sucederse con la publicación de sus siguientes elepés. En 1987 vendió más de 400 000 copias de Hotel, dulce hotel, lo que le ayudó a afianzar su éxito. Su antigua compañía, viendo la fama que estaba ganando el artista, publicó sin su consentimiento una colección a la que titularon Joaquín Sabina y todos sus éxitos. Se separó de Viceversa y se asoció con Víctor Claudín y Pedro Sauquillo para dirigir la sala de conciertos Elígeme, en el barrio de Malasaña de Madrid. En 1988 publicó El hombre del traje gris, que estrenó en la Plaza de Toros de Las Ventas de Madrid y después realizó una multitudinaria gira por México, Argentina y Venezuela. El álbum incluía la banda sonora, escrita junto a Pancho Varona, de la película Sinatra. Paco Betriu fue el director de la película, que contó con Alfredo Landa y Maribel Verdú como protagonistas y el propio cantante actuó interpretando un personaje secundario.​ Ese mismo año, produjo un álbum doble en directo del trío madrileño Los Chichos, obtuvo el divorcio de su mujer, Lucía,​ y la Junta de Andalucía lo galardonó con la Medalla de Plata.​ En 1989, fundó junto a Pancho Varona, convertido en su inseparable guitarrista, Ripio, una empresa editorial con la que a partir de ese momento registró todas sus canciones. En ese mismo año, el 16 de enero, nació su primera hija, Carmela Juliana, de su relación con Isabel Oliart (hija del político Alberto Oliart), y a quien dedicó la canción «Ay, Carmela» de su disco Vinagre y rosas de 2009.​ De nuevo sin el visto bueno del cantante, su antigua discográfica lanzó otro recopilatorio: Mucho Sabina.​ Los discos y las giras se sucedieron en el comienzo de los noventa, a partir de la publicación de Mentiras piadosas (1990). Posteriormente aparecería Física y química (1992), del cual se vendieron más de un millón de discos y en el que contó con la colaboración de Andrés Calamaro en el tema «Pastillas para no soñar»​ y que popularizó en Sudamérica a través de una gran gira internacional de 188 conciertos. Le siguió Esta boca es mía (1994), álbum que fue el octavo más vendido en la lista anual de 1994 en España.​​ El 26 de julio de 1992, nació su segunda hija con Isabel Oliart, Rocío, y comenzó una relación sentimental con la modelo mallorquina Cristina Zubillaga. Junto a otros artistas, tomó parte de acciones de protesta por el cierre del Teatro Alfil en 1994. En junio, dio su apoyo a Izquierda Unida en las elecciones legislativas.​ Este mismo año participó, junto con otros importantes artistas, en la gira Mucho más que dos de Ana Belén y Víctor Manuel. En 1995 colaboró en el programa de televisión Con Hermida y compañía, presentado por Jesús Hermida.​ En 1996, publicó Yo, mi, me, contigo, disco que le llevó de gira con más de 30 conciertos por España, que se iniciaron el 18 de julio en Gijón (Asturias), en compañía de Los Rodríguez y que prosiguieron por varios países de Latinoamérica, como Perú, México, Chile, Argentina y Uruguay. El disco fue el más vendido de la Asociación Fonográfica y Videográfica Española (AFYVE), con 80 000 copias vendidas en la semana de su estreno y el séptimo álbum más comprado en la lista anual de ese año en España.​​ En él se incluía la canción «Y sin embargo» de la que Joaquín afirmó «Es mi canción de amor preferida».​ En 1997 fue recibido por Fidel Castro, con quien conversó durante cinco horas​ y se embarcó en un proyecto con el músico argentino Fito Páez, que admiraba las cualidades poéticas de Sabina. El resultado fue el disco Enemigos íntimos, que salió a la venta en España en 1998, aunque la gira promocional programada fue suspendida por desavenencias entre los dos artistas. En esa oportunidad se cancelaron más de 70 conciertos que tenían vendidos y promocionados alrededor del mundo. El escándalo fue mayor cuando se conoció una carta que el mismo Joaquín Sabina le había escrito a Fito Páez en forma de poesía, donde resumía los motivos que determinaron el final de su relación laboral: «El rol del patito feo, no me va te lo aseguro, y menos el de hombre duro, que a ti te cuesta tan poco» recitaba Joaquín en la mencionada carta.​ Joaquín hizo una gira en solitario por teatros llamada Sabina, viuda e hijos en paños menores, de importante éxito y que destacó por la gran duración de los recitales, que llegaban a las tres horas. En esta gira se acompañó solamente de tres músicos: Pancho Varona —guitarra—, Antonio García de Diego —guitarra y teclados— y Olga Román —coros, percusiones y guitarra—.​​ Tras romper con Cristina Zubillaga, comenzó a salir con una porteña de 23 años, Paula Seminara, relación que duró un año y medio.​ Durante el mismo año 1998, Sabina colaboró con el cantautor argentino Charly García en su disco El aguante y cantó en el tema «Tu arma en el sur».​ En 1999 publicó 19 días y 500 noches, que fue el sexto álbum más liquidado en la lista anual de ese año en España y en el veinticinco en la lista anual del año siguiente,​​ al vender en total 500 000 copias. Obtuvo cuatro de los Premios de la Música de la Sociedad General de Autores de España (SGAE) del año 2000, además del Premio Ondas como el mejor artista español en 1999​ y el Premio Ondas a la mejor canción en 2000.​ Dentro de este disco se encuentran dos de sus canciones preferidas: «Una canción para la Magdalena» y «Noches de boda», esta última a dúo con la cantante Chavela Vargas, con quien años antes había entablado una estrecha amistad.​ Ese mismo año, su discográfica le homenajeó en el Hotel Palace de Madrid para celebrar el logro de vender más de cuatro millones de discos desde su primer disco en dicha discográfica, Juez y parte, hasta 19 días y 500 noches. En diciembre actuó en el segundo concierto Principales Solidarios, organizado por Los 40 Principales, junto a otros artistas como La Oreja de Van Gogh, Hevia y Celtas Cortos, con el objetivo de recaudar fondos a favor de los refugiados de la guerra de Los Balcanes.​ En 2000, le otorgaron cuatro de los cinco galardones a los que estaba nominado en los Premios de la Música en las categorías de mejor autor pop, mejor artista pop, mejor disco del año y mejor canción del año por «19 días y 500 noches».​ Ese mismo año, comenzó la gira acústica Nos sobran los motivos, una revisión mejorada de En paños menores y, en septiembre, finalizó la gira eléctrica de 19 días y 500 noches. El 6 de noviembre, recibió el Premio Ondas a la mejor canción por «19 días y 500 noches».​ Problemas de salud (2001-2004) La madrugada del 24 de agosto de 2001, tras la publicación ese mismo año del álbum Nos sobran los motivos, doble disco en directo, recopilatorio de la gira del mismo nombre, y que fue el sexto álbum más vendido en la lista anual de 2001 en España,​ sufrió un leve infarto cerebral, que puso su vida en peligro. Aunque pocas semanas más tarde se recuperó sin sufrir secuelas físicas, el incidente influyó en su forma de pensar y se vio inmerso en una importante depresión. Todo esto hizo recapacitar al cantante sobre su modo de vida y su relación con las drogas, por lo que decidió dejar de consumir cocaína y afirmó que «por las drogas sólo siento nostalgia».​ Sin embargo, en la entrevista durante el documental Joaquín Sabina - 19 días y 500 noches él mismo indicó que había dejado de consumir cocaína cuatro meses antes de su accidente cerebrovascular.​ Durante ese tiempo, también logró dejar de fumar durante 8 meses y llegó a confesar que «fueron los ocho meses más largos de mi vida».​​ Decidido a relanzar a su amiga María Jiménez, le cedió sus temas para que lanzara el disco Donde más duele y cantó con ella el tema «Con dos camas vacías».​ En 2002, año en que posó desnudo para El País Semanal,​ salió a la venta el libro Con buena letra, que incluía ilustraciones y las letras de todas sus canciones, y el disco Dímelo en la calle, que la crítica consideró como uno de los álbumes más importantes de ese año, y que se dio a conocer con el sencillo «69.G». También contenía el tema «Como un dolor de muelas», escrito parcialmente por Pancho Varona y el subcomandante Marcos, portavoz del Ejército Zapatista de Liberación Nacional (EZLN) y líder del levantamiento zapatista en Chiapas (México) el 1 de enero de 1994.​ Ese disco también comprendía la canción «Semos diferentes», que formaba parte de la banda sonora de la película Torrente 2: Misión en Marbella, y por la que obtuvo una nominación a los Premios Goya de 2002 como «mejor canción original».​ Dicho álbum se posicionó como el decimosexto más vendido en la lista anual de 2002 en España.​ Sabina suspendió la gira programada para promocionar el álbum y adujo problemas en las cuerdas vocales, aunque posteriormente haría público que el verdadero motivo fue la depresión que sufría.​ Sin embargo, en abril de 2003 sacó un nuevo disco doble, Diario de un peatón, que integraba Dímelo en la calle con un segundo CD donde presenta algunos de sus temas recientes y otros antiguos que seguían inéditos.​ En el disco contó con la colaboración de Pablo Milanés en «La canción más hermosa del mundo», que antes ya había versionado con Pasión Vega.​ En este tiempo seguía bajo los efectos de la depresión y redujo su actividad musical, pero potenció enormemente su faceta literaria como poeta. Como muestra de apoyo, surgió el proyecto que finalizaría con el disco Entre todas las mujeres, aparecido en octubre de 2003, donde trece artistas femeninas, como Rosario Flores, Ana Belén, Chavela Vargas o Julieta Venegas, versionaron varios de sus temas.​ Pese a su enfermedad, compuso e interpretó en 2003 «Motivos de un sentimiento», el himno del Centenario del club de fútbol del que siempre se declaró fiel seguidor, el Atlético de Madrid. Se encargó de dar forma a tres versiones diferentes: una instrumental, otra al estilo de las chirigotas gaditanas y una última con sonido rock, esta última cantada por Rosendo Mercado, Germán «Mono» Burgos, Lichis —cantante de La cabra mecánica—, Josele Santiago y él mismo.​ En 2004 creó con unos socios el restaurante La Cantina de la Mordida, en Madrid.​ Ese mismo año, compuso la canción «La rubia de la cuarta fila» para la banda sonora de la película Isi/Disi. Amor a lo bestia, con la que obtuvo de nuevo una nominación a los Premios Goya de 2005 como mejor canción original.​ También participó en el proyecto colectivo en homenaje al poeta Pablo Neruda en su centenario, de título Neruda en el corazón.​ Recuperación y vuelta a la actividad (2005-2010) En 2005, el alcalde de Madrid Alberto Ruiz-Gallardón le ofreció ser el pregonero de las fiestas de San Isidro, patrón de la ciudad, honor que Sabina aceptó componiendo un pregón en verso que tuvo gran acogida popular.​​ Publicó el disco Alivio de luto y gracias a ello y a su dedicación a la literatura logró salir de la depresión.​ Fue el octavo álbum más vendido en la lista anual de 2005 en España y certificado con dos discos de platino.​ También publicó la segunda edición de Con buena letra, donde incluyó letras de canciones escritas por encargo o para amigos, para cine y televisión, y correspondientes a su disco Alivio de luto.​ Regresó a los escenarios con la Gira ultramarina, en formato acústico y en pequeños escenarios o teatros, y supuso el retorno del artista después de más de tres años de inactividad, rodeado de sus músicos habituales, Pancho Varona, Olga Román, Antonio García de Diego y Pedro Barceló. Uno de los conciertos de esa gira, en la ciudad de Gijón, fue suspendido por una laringitis aguda, lo que dio una vez más lugar a comentarios en la prensa y entre el público acerca de su estado de salud.​ En el año 2006, tras concluir la Gira ultramarina, comenzó otra serie de conciertos bajo el nombre Carretera y top manta. Esta referencia a la piratería musical le llevó a un agrio enfrentamiento con el cantante Ramoncín, miembro de la junta directiva de la SGAE.​ La gira tuvo carácter eléctrico y se realizó en grandes escenarios y comenzó en Gijón —resarciéndose así de lo que él mismo llamó «gatillazo»—​ y terminó a finales de año, después de recorrer gran parte de la geografía española, en Sudamérica.​ Ese mismo año apareció un nuevo libro de entrevistas con Sabina bajo el título Sabina en carne viva. Su autor fue Javier Menéndez Flores, que ya escribió otro anterior, Perdonen la tristeza, en el año 2000. El nuevo libro fue un éxito de ventas, aunque estuvo momentáneamente apartado de las librerías por motivos de lucha editorial.​ Al mismo tiempo, comenzó a colaborar con la revista Interviú, que le cedió la tercera página para publicar sus sonetos.​ En octubre de dicho año, recibió de manos del rey Juan Carlos la Medalla de Oro al mérito en las Bellas Artes.​ Un mes después, en noviembre, se publicó la doble caja antológica Punto... y seguido, que contenía todos sus discos, más colaboraciones, directos y rarezas.​ En 2007 realizó una gira junto a Joan Manuel Serrat llamada Dos pájaros de un tiro, que comenzó el 29 de junio y que los llevó por 30 ciudades españolas y 20 americanas. En ella, el catalán interpretó las mejores canciones del ubetense mientras este hacía lo propio con el repertorio del noi del Poble-sec. De los conciertos celebrados en Madrid se grabó un disco en directo y un DVD con más material que se puso a la venta en diciembre de 2007.​ El directo fue el segundo álbum más vendido en la lista anual de 2007 en España y el cuarto en la lista anual del año siguiente, al vender en total 320 000 copias y obteniendo así la certificación de cuatro discos de platino.​​ En ese mismo año compuso la banda sonora de la película Un mundo para Julius, basada en la novela homónima de Alfredo Bryce Echenique, que interpretaron Ana Belén y Luz Casal.​ También sacó a la venta Esta boca sigue siendo mía, segunda parte de los sonetos publicados para Interviú, y A vuelta de correo, epistolario que recoge la correspondencia entre el cantautor y diferentes personalidades como el subcomandante Marcos o Fito Páez, entre otros.​ En 2008, el director neerlandés Ramon Gieling dirigió una película sobre la vida de Joaquín Sabina titulada «19 días y 500 noches» y cuyo tema principal es la depresión que sufrió hacía unos años.​ Ese mismo año se concretó la reconciliación y posterior encuentro entre Sabina y Fito Páez. Éste lo invitó a su recital en Madrid y juntos grabaron una versión de «Contigo», que estaba incluida en el último CD del artista argentino titulado No sé si es Baires o Madrid. El encuentro está registrado también en el DVD que acompañó al disco.​ El 5 de marzo de 2009 se anunció la concesión a Joaquín Sabina, junto a José Tomás, Raúl González Blanco y Paloma O'Shea, de la Medalla de Oro de la Ciudad de Madrid que otorga anualmente el Ayuntamiento como reconocimiento a personajes públicos que han contribuido con su trabajo a fomentar la buena imagen de la ciudad. El galardón lo recibió el 15 de mayo del mismo año.​ El 17 de noviembre de ese año publicó su decimoquinto álbum de estudio, titulado Vinagre y rosas y cuyo sencillo, «Tiramisú de limón», lo cantaba junto al grupo Pereza, el cual se encargó además de ponerle música así como de los coros y la producción. Para presentar ese nuevo álbum, inició una gira en Salamanca, donde dio sus dos primeros conciertos los días 20 y 21 del mismo mes.​ Esta gira, según afirmó, sería la última que realizara por grandes escenarios.​ El álbum fue el más vendido en la lista anual de 2009 en España y el séptimo en la lista anual del año siguiente,​​ certificado con un total de cinco discos de platino.​ El 16 de noviembre de 2010, la revista Rolling Stone le otorgó el premio como Artista del año.​ Su musical y debut en Estados Unidos (2011-presente) En 2011, el cantante inició la gira El penúltimo tren en la que recorrió Latinoamérica y en la que tenía previsto cantar por primera vez en Estados Unidos.​ Sin embargo, en mayo de 2011, Sabina suspendió los conciertos en ciudades mexicanas y estadounidenses debido a una «diverticulitis aguda con riesgo de complicaciones» y los pospuso para el mes de octubre.​​ Ya recuperado, regresó a los escenarios el 2 de julio en el festival Músicos en la naturaleza, celebrado en Hoyos del Espino (Ávila), en el que actuó junto a Andrés Calamaro.​ Finalmente, pudo actuar en el Manhattan Center de Nueva York el 16 de octubre, en el que fue su primer concierto en Estados Unidos. Dentro de su gira, también actuó en el Nokia Theater de Los Ángeles el 20 de octubre y la finalizó el 23 de octubre en el American Airlines Arena de Miami.​ El 6 de octubre de ese mismo año se estrenó el musical Más de cien mentiras, basado en sus canciones y dirigido por David Serrano y con el propio cantante como director musical, en compañía de Pancho Varona y José María Cámara.​ El 6 de febrero de 2012, presentó junto a Joan Manuel Serrat, La orquesta del Titanic, su primer álbum de estudio grabado con el cantautor catalán. Además, anunciaron una gira de presentación del disco que los llevaría por Argentina, Chile, México, Estados Unidos, Costa Rica y España.​ En la campaña electoral de las Elecciones al Parlamento de Cataluña de 2012, dio su permiso para que el partido Ciudadanos-Partido de la Ciudadanía utilizara los versos de «Anteproyectos para la letra del himno nacional (con perdón)» en dicha campaña.​ En 2013, publicó el libro Muy personal, que incluía dibujos, poemas empezados y letras de canciones inacabadas. Era la primera vez que publicaba sus obras plásticas —denominados «garabatos» por el artista— pintadas con rotuladores y extraídas de una quincena de cuadernos ilustrados. Los dibujos estaban incluidos entre fragmentos de poemas, de reflexiones personales, esbozos de letras de canciones, impresiones sobre sus conciertos, comentarios de sus viajes y entradas de un diario frustrado.​ El 16 de octubre de 2015, lanzó la caja Puro Sabina, que contenía trabajos de estudio y en directo, tanto en solitario como al frente de Viceversa, la banda que lo acompañó a mediados de los ochenta.​ El 3 de febrero de 2016, puso a la venta Garagatos, un cuaderno de artista que comprendía un libro de arte, el libro Garagatos y un desplegable de casi tres metros de largo. El libro de arte constaba de 66 dibujos facsimiles en forma de láminas de diferente tamaño. Cada dibujo estaba acompañado por fragmentos de canciones, versos o «guiños de humor» del propio Sabina. En el libro Garagatos, diferentes personalidades hablaban sobre las influencias, arquetipos y personajes empleados por el artista en su obra.​ Poco antes, se había sometido con éxito a una operación de estómago por una diverticulitis con riesgo de acabar en peritonitis.​ Ese mismo mes, fue nombrado Hijo Predilecto de Andalucía, título concedido por la Junta de Andalucía.​​ El 10 de marzo de 2017, estrenó su álbum Lo niego todo, producido por Leiva y en el que colaboró el poeta Benjamín Prado.​ Además, lo nombraron Hijo Predilecto en su ciudad natal, Úbeda.​ El 18 de junio de 2018, Sabina se vio en la obligación de cancelar la gira de Lo niego todo por problemas de salud, al quedarse «totalmente mudo» durante el concierto celebrado el 16 de junio en el WiZink Center de Madrid.​ El 12 de febrero de 2020 sufrió una caída durante el concierto que daba junto a Joan Manuel Serrat en el WiZink Center de Madrid como parte de su gira No hay dos sin tres. El cantante se precipitó del escenario hasta caer al foso de seguridad, desde una altura de al menos un metro y medio.​ Al cegarse con un foco, no se dio cuenta de que se encontraba en el mismo borde de las tablas, perdió pie y cayó al foso de seguridad entre el escenario y las primeras filas del público. Como consecuencia de la caída, sufrió un hematoma intracraneal. Tras el incidente, el propio Sabina salió en silla de ruedas al escenario, acompañado de Serrat, para aplazar el concierto y anunciar al público que se iba al hospital porque se había hecho daño en un hombro.​ Tuvo que ser operado, con éxito,​ e ingresado en la UCI.​ Ese mismo año, Atresplayer estrenó una serie documental sobre Sabina, denominada Pongamos que hablo de Joaquín Sabina.​ También le concedieron el Premio Ondas por su trayectoria.​ En 2021, la Academia Latina de Artes y Ciencias de la Grabación anunció que le entregaría el Premio a la Excelencia Musical de los Premios Grammy Latinos, junto a Martinho da Vila, Emmanuel, Sheila E. & Pete Escovedo, Fito Páez, Milly Quezada y Gilberto Santa Rosa. Afirmaban que el cantante «elevó el arte de escribir canciones en español a alturas inesperadas, creando un universo musical caracterizado por su poesía excéntrica pero sencilla y sus agudas observaciones sociopolíticas que han influido a varias generaciones».​ En 2022, se estreno en el Festival de Cine de San Sebastián el documental Sintiéndolo mucho, una película dirigida por el realizador español Fernando León de Aranoa y en la que colaboró el exmiembro de la banda Pereza, Leiva, como compositor de la banda sonora. Se trata de un documental intimista en el que León de Aranoa muestra a Sabina en diferentes aspectos de su vida cotidiana, con grabaciones realizadas durante varios años de seguimiento del artista y que muestra aspectos ocultos de su biografía. En el mismo, aparecen amigos reunidos en el piso del cantautor o imágenes de su gira por México. El 15 de noviembre de 2022, el músico Pancho Varona anuncia a través de sus redes la decisión de Sabina de no contar con él en la siguiente gira que estaba preparando, rompiendo así con el vínculo de más de 40 años entre ambos músicos. Esta noticia causó gran revuelo en redes sociales a gran parte del público, al no recibir ninguna explicación por parte del cantautor de la ruptura con el músico más activo y más veterado de la formación, tanto en estudio como en directo. En 2023 volvió a los escenarios con su nueva nueva gira «Contra todo pronóstico».​ En julio de 2024 anunció su retirada de los escenarios con la que será su última gira titulada genéricamente «Hola y adiós», que tiene previsto arrancar en febrero de 2025.​ En octubre de 2024 dio a conocer las fechas de su última gira, que visitaría ciudades como: Santa Cruz de Tenerife, Málaga, Madrid, Palma de Mallorca, Zaragoza, Pamplona, Murcia, Alicante, Valencia, Bilbao, Gijón, Santander, Sevilla, A Coruña, Granada y Barcelona.​ Obra Influencias[a]​ La obra literaria de Sabina no es la propia de un poeta, ya que gran parte de sus composiciones son canciones. Para Juan Pablo Neyret, «su vida no es menos importante que su obra, más allá de la autorreferencialidad que presentan las letras de sus canciones».​ Sobre este tema, Marcela Romano apunta en ¿La enunciación en persona?, que «al modelo de productor individual, discretamente implicitado en la escritura, sucede otro fuertemente explícito, presente, quien, simultáneamente con el texto, exhibe la voz, el cuerpo, los gestos, la vestimenta»,​ al que denomina «sujeto espectacular». Aunque en los libros editados sobre Joaquín Sabina —al margen de los libros de poemas— aparezcan referencias a su obra, la mayor parte de ellos son biografías y recopilaciones de anécdotas, lo que para Neyret denota la «exhibición de la persona» del artista y afirma que «la exposición del artista posmoderno va mucho más allá y llega hasta los programas de televisión y de radio, sitios de internet, revistas de interés general y prensa del corazón, es decir, el sistema de producción y consumo del llamado mundo del espectáculo». Neyret considera que justo después de la publicación en 1978 de Inventario, su primer disco, Joaquín Sabina se «emancipa de la musicalización de la poesía y lo que precisamente lo caracteriza es, salvo en muy contados casos de coautoría o de interpretación de canciones de otros autores, la preeminencia de sus letras, tanto en el sentido de que estas son dominantes absolutas en su cancionero como en el de que posee una intervención limitada en su musicalización». De esta se encargaron, fundamentalmente desde mediados de los años 1980, Pancho Varona y Antonio García de Diego. Cabe destacar que el único texto de los poemas que forman las canciones de Inventario que Sabina musicalizó fue un texto medieval titulado el «Romance de la gentil dama y el rústico pastor».​ Sabina, siguiendo la práctica bastante extendida entre los cantautores españoles e hispanoamericanos a partir de la década de 1960,[b]​ escogió un texto de hacía varios siglos y que era cantado y lo remusicalizó. En él aparecen varios temas que usaría más tarde en sus canciones, como el amor, el sexo, el rechazo a la pareja formalizada y el estereotipo del varón solitario.​ En sus estudios, Heinrich Wölfflin consideraba que el arte se desarrolla en períodos sucesivos de afirmación y de crisis. Neyret valora al Barroco como un período de crisis y lo vincula con la posmodernidad debido a su «pesimismo e ironía esenciales». Lola Pérez Costa vincula algunas canciones de Sabina, como «Calle Melancolía», «Inventario» o «Siete crisantemos», con el Barroco. Relaciona ese período, que «expresa la conciencia de una crisis, visible en los agudos contrastes sociales, el hambre, la guerra y la miseria», con la España en los años 1980, época en la que se publicó la canción «Calle Melancolía»,​ y que se caracterizó por ser «una sociedad marcada por el paro, la desesperanza, el miedo atómico, la frustración laboral y académica, el absentismo, el terrorismo... junto con unas ganas de vivir a toda prisa, cierta euforia cultural, la confianza en las instituciones democráticas; y todo ello cifrando su hipotética salvación en un individualismo abrumador». Esta situación se reflejaba en «Calle Melancolía», en la que aparecen versos con amargos desengaños («no hallo más que puertas que niegan lo que esconden»); dolor vital («por las paredes ocres se desparrama el zumo / de una fruta de sangre crecida en el asfalto»), desesperación («me enfado con las sombras que pueblan los pasillos»), desamparo («trepo por tu recuerdo como una enredadera / que no encuentra ventanas donde agarrarse»), y, posiblemente, los versos que definen la España de los primeros años del posfranquismo: «un barco enloquecido / que viene de la noche y va a ninguna parte».​ Las letras de Sabina están influidas por una gran variedad de estilos y artistas, que van desde el rock anglosajón —con autores como Bob Dylan, Leonard Cohen o The Rolling Stones—, el folclore latinoamericano —como por ejemplo, Atahualpa Yupanqui, Violeta Parra, Chavela Vargas o José Alfredo Jiménez—, el tango —Enrique Santos Discépolo, Homero Manzi o Celedonio Flores— o la canción melódica francesa de Georges Brassens, hasta poetas vanguardistas hispanoamericanos como César Vallejo, así como Pablo Neruda, Raúl González Tuñón y Rafael Alberti o a los autores que forman parte de sus primeras lecturas en su juventud, que incluyen a Fray Luis de León y Jorge Manrique, así como el resto de la tradición española.​ Por encima de todos estos autores, destaca la influencia de Francisco de Quevedo, aunque Sabina insiste en que su máxima influencia entre la poesía española contemporánea es la de Jaime Gil de Biedma.​ Para Neyret, el sarcasmo, la ironía y la mordacidad son determinantes en la obra poética de Joaquín Sabina, al igual que en la de Quevedo.​ Del mismo modo, las características formales básicas del Barroco son evidentes en sus letras: «léxico de uso corriente entrelazado con cultismos, equívocos, retruécanos, contrastes y antítesis, así como construcciones anafóricas y enumeraciones asindéticas, estos últimos, las dos principales tropos de la poética sabiniana».​ Para Juan Pablo Neyret, los discos más significativos y en los que Sabina alcanza la «cumbre de su barroquismo», por encima del resto de álbumes de su discografía, son Yo, mí, me, contigo y 19 días y 500 noches. El primero está lleno «deliberadamente de lecturas en clave» y en el segundo «se muestra definitivamente dueño de sus recursos de estilo». Se pueden establecer comparaciones entre la canción «Contigo» de Sabina​ y el soneto de Quevedo «Amor constante más allá de la muerte».​​ Sabina ha manifestado en reiteradas ocasiones una admiración por su compatriota la cantante María Dolores Pradera, con quien grabó en 2007 la canción «Jugar por jugar» para el disco En buena compañía de la artista. Esto los llevaría a fortalecer una amistad antigua que Sabina transcribió en las Coplas a María Dolores Pradera que le dedicó en la presentación de Canciones del alma, que grabó Pradera en 2003.​ Discografía oficial Inventario (1978) Malas compañías (1980) La mandrágora (1981), con Alberto Pérez y Javier Krahe Ruleta rusa (1984) Juez y parte (1985), con Viceversa Joaquín Sabina y Viceversa en directo (1986), con Viceversa Hotel, dulce hotel (1987) El hombre del traje gris (1988) Mentiras piadosas (1990) Física y química (1992) Esta boca es mía (1994) Yo, mi, me, contigo (1996) Enemigos íntimos (1998), con Fito Páez 19 días y 500 noches (1999) Nos sobran los motivos (2000) Dímelo en la calle (2002) Alivio de luto (2005) Dos pájaros de un tiro (2007), con Joan Manuel Serrat Vinagre y rosas (2009) La orquesta del Titanic (2012), con Joan Manuel Serrat En el Luna Park (2012), con Joan Manuel Serrat 500 noches para una crisis (2015) Lo niego todo (2017) Lo niego todo en directo (2018) Obra literaria Cancioneros Memoria del exilio (Londres: Nueva Voz, 1976), libreto de canciones publicado durante su exilio De lo cantado y sus márgenes (Granada: Diputación de Granada, 1986), letras de su disco Inventario El hombre del traje gris (Madrid: Ripio, 1989), partituras Con buena letra (Barcelona: Temas de Hoy, 2002; ampliado en 2005 y 2010), recopilación de letras Poemarios Ciento volando de catorce (Madrid: Visor, 2001), sonetos Esta boca es mía (Barcelona: Ediciones B, 2005), versos satíricos publicados en el semanario Interviú Esta boca sigue siendo mía (Barcelona: Ediciones B, 2007), versos satíricos publicados en el semanario Interviú El grito en el suelo (Madrid: Visor, 2012), poemas editados en el diario Público Muy personal (Barcelona: Planeta, 2013), dibujos, poemas empezados y letras de canciones inacabadas Garagatos (Barcelona: Artika, 2016), cuaderno de artista que incluye un libro de arte, el libro Garagatos y un desplegable de casi tres metros de largo En román paladino (Úbeda: Juancaballos de Poesía, 2018), versos publicados en la revista mensual tintaLibre Correspondencia A vuelta de correo (Madrid: Visor, 2007), epistolario con personalidades como el subcomandante Marcos o Fito Páez, entre otros Premios y distinciones Medalla de Plata de Andalucía (1988)​ Premio Ondas al mejor artista español (1999)​ Premio Ondas a la mejor canción por «19 días y 500 noches» (2000)​ Medalla de Oro al mérito en las Bellas Artes (2000)​ Nominación al Premio Goya a la mejor canción original (2002)​ Nominación al Premio Goya a la mejor canción original (2005)​ Medalla de Oro de la Ciudad de Madrid (2009)​ Hijo Predilecto de Andalucía (2016)​​ Hijo Predilecto y Medalla de Oro de Úbeda (2017)​ Premio Ondas a la trayectoria musical (2020)​ Premio Grammy Latino a la Excelencia Musical (2021)​ Premio Ciudad de Alcalá de las Artes y las Letras (2022)​ Premio Goya a la mejor canción por «Sintiéndolo mucho» (2023) Notas",
            "José Luis Acosta Salmerón (Úbeda, España; 1961) es un director y guionista de cine y televisión. Biografía Empezó como técnico en más de quince películas, y siguió bajo la sombra del productor Elías Querejeta, con el que dirigió tres documentales y un mediometraje del proyecto Siete Huellas. Entre las series más destacadas en cuyos guiones ha participado se encuentran Los ladrones van a la oficina, Ana y los 7, A las once en casa, Fuera de lugar, UCO y la tvmovie Barreiros, que ha obtenido en la 45.ª edición del Word Festival Houston (2012) el Premio Platino a la mejor tvmovie. Ha dirigido dos películas, de cuyos guiones es, igualmente, autor: Gimlet (1995), un thriller turbio y obsesivo, con Viggo Mortensen y Ángela Molina en sus papeles protagonistas, seleccionada en el festival de San Sebastián y premio en el festival de Alejandría, y No dejaré que no me quieras (2002), una comedia de enredos románticos, con Pere Ponce, Alberto San Juan, Viviana Saccone y Ana Risueño al frente de su reparto. También el cortometraje Historia de un búho (2003), nominado al Goya al mejor cortometraje y con más de 35 premios nacionales e internacionales. En la actualidad trabaja para el mercado estadounidense y latinoamericano como guionista y productor ejecutivo a través de WTH, agencia de contenidos de México y Los Ángeles. Actualmente trabaja como director de contenidos de International Studios Telemundo NBCUniversal Miami USA donde ha desarrollado series com El Recluso, Jugar con Fuego y la última producción No te puedes esconder, las tres para Netflix. El 25 de julio de 2013 fue elegido presidente de la SGAE,​ dimitiendo el 31 de marzo de 2016.​",
            "Jacinto Higueras Cátedra (Santisteban del Puerto; 7 de enero de 1914 - Madrid; 25 de diciembre de 2009) fue un actor, escultor y pintor español.​ Perteneció a la compañía teatral La Barraca de Federico García Lorca, compartiendo escenario con algunos de los más importantes actores de los años 1930.​ Biografía Pertenece a una familia de gran tradición artística: su padre Jacinto Higueras fue también un escultor de prestigio, su hermano Modesto director y actor teatral y su hija Ana Higueras una cantante lírica de reconocimiento internacional. Trayectoria Jacinto Higueras Fuentes y Juana Cátedra Segura se trasladaron muy jóvenes a Madrid. Sin embargo, quisieron que sus descendientes nacieran en su pueblo de origen, Santisteban del Puerto, donde nacieron sus hijos Modesto, Luis y Jacinto. Jacinto estudió Filosofía y Letras en la capital, iniciándose también en los campos de la pintura y la cerámica.​ Se incorporó, junto con su hermano Modesto, al grupo teatral La Barraca que dirigía Federico García Lorca, donde compartió escenario con Germán Bleiberg, Rafael Calvo Revilla o Isabel García Lorca. Cuando desapareció el grupo, al inicio de la Guerra Civil Española, Jacinto fue uno de los últimos integrantes del mismo.​ Durante esa época, actuó también en algunas películas de cine, coincidiendo con Luis Buñuel, Edgar Neville o Luis Marquina, entre otros.​​ Tras la guerra, se hizo cargo del Teatro Español Universitario, y se incorporó al estudio de escultura de su padre, dedicándose a este arte hasta sus últimos días, aunque desde 2001 abandonó las obras de gran tamaño para dedicarse a pequeñas esculturas.​ Obra Monumento a Benito Pérez Galdós, 1945, \"Casa Canaria\" de Madrid. Monumento Público a la Virgen del Collado, 1954, Santisteban del Puerto, Jaén. Monumento a los Caídos en el castillo de Olite, 1957, Escombreras, Murcia. Virgen de la Luz, 1957. Colección Iberdrola Monumento a Jacinto Higueras Fuentes, 1960, Santisteban del Puerto, Jaén. Monumento al Artillero Cabot, 1963, Jaén. Monumento a José María Alvareda, 1966, Consejo Superior de Investigaciones Científicas, Madrid. Monumento al Minero, 1975, Guardo, Palencia. Monumento a Jacinto Higueras Fuentes, 1977, Plaza de los Jardinillos, Jaén Monumento a Manuel Quimper, 1991, Sooke, Canadá. Monumento a D. Fadrique de Toledo, 2001, Río de Janeiro, Brasil. El Regreso, 2001, Campus de la Universidad de Jaén.",
            "José Santiago Baeza más conocido como \"Ficha\", nació en (Linares, Jaén, España, 15 de mayo de 1939) es un exfutbolista, que actuaba de delantero centro y su primer club profesional fue el Club Deportivo Iliturgi, en Tercera División. Tiene un hermano, que también fue futbolista, Manuel Santiago Baeza, más conocido en el mundo del fútbol como piri, jugó en el Xerez y Úbeda o Iliturgi. Trayectoria Ficha, comenzó muy temprano a darle patadas a un balón, y a la edad de 17 años debutó, con el CD Iliturgi, en Tercera, disfrutando de algún que otro partido, tuvo un pequeño paso efímero, en las filas del Úbeda Club de Fútbol, en Tercera División, regresando nuevamente al club andujareño, al comienzo de la 57-58, tras jugar con el cuadro iliturgitano toda la temporada completa, disputando un buen número de partidos, demostrando detalles de gran calidad que le abren las puertas del Real Jaén, en Segunda División. Ficha, erá un jugador de alternancia desconcertante, que siempre actuaba contra lo precarito por el manual, normalmente extremo,\" ficha\", recorría el campo a su albedrío, intentando sorprender al contrario y al público con trucos de pillastre. En ataque se inventaba jugadas, en ocasiones francamente destinadas a la galería, con una velocidad y un dominió del balón muy superiores a su juego en colectivo. Con el Real Jaén, disfrutó de un total de diecinueve partidos jugados en segunda divisió, con tan solo diecinueve años, que le sirvieron para dar el salto a Primera División, de la mano del Valencia CF. Con el conjunto ché, disputaría un total de 6 temporadas alternando la segunda con el CD Mestalla, filial del Valencia, a lo largó de sus seis campañas disputó 129 partidos con la camisetas del Valencia. Su debut, fue el en un partido amistoso disputado en Mestalla, frente al AS Nancy, francés, su debut en Liga, se produjo el 8 de marzo, de 1959, en el Estadio de Sarria, frente al RCD Español, con victoria valencianista, por dos goles a cero. Disputó 71 partidos de liga en Primera División, 20 partidos de Copa del Rey, y 14 en la desaparecida Copa de Ferias, de la que se proclamó campeón en dos ocasiones, en su despedida del club valenciano en el partido que le enfrentó al Real Zaragoza, en Mestalla, logró marcar dos goles y llevarse en el recuerdo la ovación del público valencianista, siempre muy presionera. En 1964, aceptó la oferta de Balmaya y se marchó a las filas del CD Málaga, de Segunda División, en el club malagueño permaneció durante las siguientes cuatro temporadas, más tarde fichó por el Jerez Industrial CF, de la ciudad de Jerez de la Frontera, que también militaba en la Segunda División, al final de temporada causara baja y se marchará a las filas del CD Iliturgi, donde pondrá fin a su carrera como futbolista. Clubes Palmarés Campeonatos nacionales",
            "José Jiménez Fernández, más conocido como Joselito (Beas de Segura, Jaén, 11 de febrero de 1943), es un cantante y actor español, que alcanzó el éxito como niño prodigio bajo apodos como \"El niño ruiseñor\", \"El niño de la voz de oro\" y \"El pequeño ruiseñor\". Recordado por su interpretación de célebres temas del cancionero español como Campanera y Doce cascabeles. Biografía Nació el 11 de febrero de 1943 en el Barrio de Vista Alegre de Beas de Segura (Jaén), y fue el séptimo y último hijo de Baldomero Jiménez Fernández (natural de Sorihuela del Guadalimar) y de Petra Fernández Serrano (natural de Hornos). Actualmente vive y reside en Utiel (Valencia), apartado del mundo artístico.​ Contrajo matrimonio en 1966 con la actriz Chonette Laurent (hija del compositor y pianista Gonzalo Laurent y de Maruja Sánchez). Su nombre real es María de la Ascensión Laurent Sánchez, y con ella tuvo dos hijos, Isaac y Eva Jiménez Laurent. En 1978, se separaron.​ Contrajo matrimonio en segundas nupcias en 1986 con María Felisa Gabaldón, conocida como Marifé, con quien no ha tenido descendencia.​ En algunas fuentes se cita 1947 como el año de su nacimiento, debido al aspecto que presentaba en su primer filme, El pequeño ruiseñor (1956), más propio de un niño de nueve años que de trece. Fue porque había tenido problemas con su estatura y a causa de eso parecía que tenía menos edad que la real.​ Trayectoria profesional Sus primeras intervenciones como cantante, muy pequeño, fueron en programas radiofónicos. En uno de estos recitales, coincidió con el actor y cantante Luis Mariano, quien al ver el potencial de voz del niño le ofreció llevarlo a París y presentarlo en la radio y televisión. Allí trabajó durante un tiempo, y el director español Antonio del Amo le ofreció trabajo como actor cinematográfico.[cita requerida] Fue el protagonista de catorce películas, ocho de las cuales fueron dirigidas por del Amo. Las tres primeras formaron parte de la trilogía conocida como «trilogía del ruiseñor»: El pequeño ruiseñor (1956) - en la que interpretaba uno de sus mayores éxitos, el pasodoble Campanera -, seguida de Saeta del ruiseñor (1957) que grabó en Priego de Córdoba y El ruiseñor de las cumbres (1958). Estas tres películas tuvieron éxito no solo en España, sino en Francia, Italia, América y Japón, que fueron un lanzamiento a la fama, convirtiendo a Joselito en una estrella del cine español. Un éxito parejo tuvieron las canciones interpretadas en cada una de ellas. Incluso Pier Paolo Pasolini incluyó algunas en la banda sonora de su obra Mamma Roma.​ En 1964, el director Manuel Mur Oti lo dirigió en la película Loca juventud, y en 1965 Rafael Gil lo hizo en La vida nueva de Pedrito Andía, pero ambas sin el éxito obtenido por las anteriores, debido fundamentalmente a dos razones: no siguieron el estilo de folletín musical con inclusión de canciones y Joselito ya no era un niño prodigio, sino un adolescente que no llamaba tanto la atención.[cita requerida] Reaparición en televisión En 2008, participó como concursante en Supervivientes, un programa de telerrealidad de Telecinco,​ saliendo como segundo expulsado el 31 de enero de 2008.​ Durante el año 2009, participó en la película Spanish Movie.​ El 28 de abril del 2009, participó como invitado en el programa de TVE1 Los mejores años,​ y el 12 de diciembre del mismo año fue protagonista del programa especial Joselito: El pequeño ruiseñor, presentado por María Teresa Campos.​ Apareció en televisión el 12 de febrero de 2011 en el programa Cine de Barrio, con la emisión de la película Bello recuerdo.​ El 23 de septiembre del mismo año estuvo como invitado en el programa Sálvame Deluxe, donde se presentó su Caja Deluxe.​ El 11 de febrero de 2012 apareció en el programa Cine de barrio, con la emisión de la cinta «El pequeño coronel». Ese mismo año, 2012, forma parte del reparto de la película Torrente 4, dirigida por Santiago Segura. Reaparece en el espacio sabatino de cine español, de Televisión Española, el 9 de marzo de 2013, con la difusión de «El Pequeño Ruiseñor» en este espacio.​ Actualidad En la actualidad, José Jiménez Fernández \"Joselito\" reside en la localidad valenciana de Utiel, donde desde 2022 tiene una calle con su nombre.​​​ Filmografía El pequeño ruiseñor (1956) Saeta del ruiseñor (1957) El ruiseñor de las cumbres (1958) Escucha mi canción (1958) El pequeño coronel (1959) Aventuras de Joselito y Pulgarcito (1960) Los dos golfillos (1961) Bello recuerdo (1961) El caballo blanco (1962) El secreto de Tomy (1963) Loca juventud (1964) La nueva vida de Pedrito Andía (1965) El falso heredero /Joselito vagabundo /Joselito vagabundo borincano (1965) Prisionero en la ciudad (1968) El Irreal Madrid (1969) Spanish Movie (participación) (2009) Torrente 4 (2011)"
        ]
    },
    "test_2": {
        "question": "¿Cuando nació Juan Eslava Galán?",
        "reference": "Juan Eslava Galán nació el 7 de marzo de 1948 en Arjona, Jaén.",
        "response": "Juan Eslava Galán nació el 7 de marzo de 1948 en Arjona, Jaén.",
        "reference_contexts": "['Juan Eslava Galán (Arjona, Jaén, 7 de marzo de 1948) es un escritor español del género histórico, tanto de ficción como de no ficción. Saltó a la popularidad con la obtención del Premio Planeta en 1987. Ha publicado algunas novelas bajo el pseudónimo de Nicholas Wilcox. Biografía Hijo de olivareros, estudió en los colegios de Arjona hasta que, al cumplir los diez años, su familia se trasladó a Jaén, donde prosiguió el bachillerato. Estos primeros años de estudios quedaron plasmados en su novela Escuela y prisiones de Vicentito González. Cursó Filosofía y Letras en la Universidad de Granada, licenciándose en Filología Inglesa, y luego realizó un viaje al Reino Unido con el objetivo de ampliar sus estudios. Allí estuvo viviendo en Bristol y Lichfield, y fue alumno y profesor asistente en la Universidad de Aston, Birmingham. A su regreso obtuvo una cátedra de Instituto de Bachillerato y, posteriormente, se doctoró en la Universidad de Granada con una tesis sobre Poliorcética y fortificación bajomedieval en el reino de Jaén. Es miembro del Instituto de Estudios Giennenses. Su novela más conocida es En busca del unicornio, que ganó el Premio Planeta en 1987 (2.ª ed. corregida y ampliada en 2007), impulsando notablemente su carrera literaria. Se declara un apasionado de la Edad Media, como puede verificarse fácilmente por la temática de su obra. Su bibliografía comprende casi un centenar de libros, de narrativa, divulgación histórica, biografía y ensayos, entre los que destacan sus muy irónicas Historia de España contada para escépticos y El catolicismo explicado a las ovejas, entre otros títulos. Autor prolífico, puede publicar al año dos novelas además de libros de otros géneros. Tanto novelista como ensayista, hace gala de un particular sentido del humor, a veces satírico. Como narrador, opta por los géneros de la novela histórica, la fantasía y el misterio. Entre las primeras destacan especialmente En busca del unicornio, ambientada en el reinado de Enrique IV el Impotente, valiéndose de una prosa de regusto medieval; El comedido hidalgo, que refleja con ecos cervantinos la España de fines del siglo XVI, o La mula y Señorita, cuyas tramas se desarrollan durante la guerra civil española. Además, bajo el pseudónimo de Nicholas Wilcox, que es más bien un heterónimo con fotografía falsa incluso, ha escrito varias novelas que él mismo no duda en calificar como de estilo best-seller. Fue creado en un principio por el miedo a defraudar a sus lectores, pues el estilo y la narración de las novelas de Wilcox son realmente muy diferentes a las de Eslava Galán. Su libro reciente de mayor éxito es Una historia de la guerra civil que no va a gustar a nadie, que narra los sucesos más relevantes del conflicto fratricida español de un modo a medio camino entre la crónica periodística y la novela histórica; también destaca La conquista de América contada para escépticos,\\u200b en la que trata de clarificar un tema plagado de fanatismos y de medias verdades. Premios Premio Planeta (1987) por En busca del unicornio Premio Chianti Ruffino - Antico Fattore 1988 por En busca del unicornio traducida al italiano Premio Fernando Lara (1998) por Señorita Premio Andalucía de la Crítica (1998) por Señorita Premio Ateneo de Sevilla (1994) por El comedido hidalgo Premio Primavera de Novela (2015) por Misterioso asesinato en casa de Cervantes.\\u200b Obras Narrativa En busca del unicornio, 1987 Catedral, 1989 El mercedes del obispo y otros relatos edificantes, 1990 Cuentos crueles, 1990 Tu magistral amor, 1990 El viaje de Tobías, 1992 Statio Orbis (El magno evento), 1995 El comedido hidalgo, 1994 Escuela y prisiones de Vicentito González, 1999 Señorita, 1998 Los dientes del dragón, 2001 La mula, novela, 2003 La muerte de la abuela, novela, 2003 El mercenario de Granada, 2006 Rey lobo, 2010 Últimas pasiones del caballero Almafiera, novela, Planeta, 2012\\u200b Misterioso asesinato en casa de Cervantes, Planeta, 2015 (Premio Primavera de Novela) El amor en el jardín de las fieras, novela, 2016, Editorial Espasa Novelas como Nicholas Wilcox Los templarios y la Mesa de Salomón, 2004 La sangre de Dios, 2001 Las trompetas de Jericó, 2000 Los falsos peregrinos, 2000 La lápida templaria, 1996 Historia y divulgación Cinco tratados españoles de alquimia, 1986 Roma de los césares, 1988 Verdugos y torturadores, 1990 Grandes batallas de la historia de España, 1990 La vida y la época de los Reyes Católicos, 1996 Los Reyes Católicos, 2004 Los íberos. Los españoles como fuimos, 2004 Califas, guerreros, esclavas y eunucos. Los moros en España, 2008 Enciclopedia eslava, 2017 Una historia de toma pan y moja, 2018 La Tentación del Caudillo, 2020\\u200b Viaje a Tierra Santa, Planeta, 2022. Biografías Jofra, 1975 Yo, Aníbal, 1988 Yo, Nerón, 1989 Julio César, el hombre que pudo reinar, 1995 Cleopatra, la serpiente del Nilo, 1993 Leyendas y enigmas Templarios, griales, vírgenes negras y otros enigmas de la Historia, Planeta, 2011 La lápida templaria descifrada, 2008 España insólita y misteriosa, 2006 El fraude de la Sábana Santa y las reliquias de Cristo, 1997 Los templarios y otros enigmas medievales, ensayo, 1992\\u200b El enigma de Colón y los descubrimientos de América, 1992 Tartessos y otros enigmas de la historia, 1991 Leyendas de los castillos de Jaén, 1982 La leyenda del Lagarto de la Malena y los mitos del dragón, 1981 El enigma de la Mesa de Salomón, 1987 Viajes 1000 sitios que ver en España al menos una vez en la vida, 2009 Viaje a los escenarios del capitán Alatriste, 2006 Viaje a la costa de las ballenas, 2006 El paraíso disputado. Ruta de los castillos y las batallas, ensayo, Guías Aguilar, 2003 Otro Jaén (1999) Serie historia para escépticos Historia de España contada para escépticos, ensayo, 1995 Historia del mundo contada para escépticos, ensayo, Planeta, 2012\\u200b La Segunda Guerra Mundial contada para escépticos, divulgación histórica, Planeta, Juan Eslava Galán 2015\\u200b La Primera Guerra Mundial contada para escépticos, divulgación histórica, Planeta, Juan Eslava Galán 2014\\u200b Una historia de la guerra civil que no va a gustar a nadie, 2005 El catolicismo explicado a las ovejas, 2009 La revolución rusa contada para escépticos, divulgación histórica, Planeta, 2017 La conquista de América contada para escépticos, 2019 La Biblia contada para escépticos, 2020 Enciclopedia Nazi contada para escépticos, 2021\\u200b\\u200b\\u200b La Reconquista contada para escépticos, 2022 La Revolución Francesa contada para escépticos, 2023 La Revolución Rusa contada para escépticos (novela gráfica), 2023 Historia de Andalucía Viaje por el Guadalquivir y su historia. De los orígenes de Tarteso al esplendor del oro de América y los pueblos de sus riberas, divulgación histórica, Esfera de libros, 2016 Las ciudades de la Bética, ensayo, Fundación José Manuel Lara, 2012\\u200b Un jardín entre olivos (Las rutas del olivo en España. Masaru en el olivar III), ensayo, 2002 Las rutas del olivo en Andalucía (Masaru en el olivar II), 2001 Las rutas del olivo en Jaén (Masaru en el olivar I), 1999 Guadalquivir, 1990 Poliorcética Castillos y murallas del Reino de Jaén, 1989 Los castillos de Jaén, ensayo, Universidad de Jaén, 1999 Ensayo Historias de la Inquisición, 1992 50 estampas de la historia de España, ensayo, Círculo de Lectores, 2013 Friary Grange School. Estudio de una comprehensive school inglesa, 1978 La madre del cordero, divulgación artística, Planeta, 2016\\u200b Avaricia, Destino, 2015 Sociología Santos y pecadores. Álbum de recuerdos de los españolitos del siglo XX, ensayo, Planeta, 2002 Los años del miedo, 2008 La década que nos dejó sin aliento, Planeta, 2011\\u200b La España del 98. El fin de una era, 1997 La España de las libertades, 1997 De la alpargata al seiscientos, Planeta, 2010 Tumbaollas y hambrientos. Los españoles comiendo y ayunando a través de la historia, 1997 Sobre sexo Historia secreta del sexo en España, 1992 El sexo de nuestros padres, 1993. Coitus interruptus, 1997 La vida amorosa en Roma, 1996. Amor y sexo en la antigua Grecia, 1997 Lujuria, Destino, 2015 Homo erectus, Planeta, 2011 Cocina Cocina sin tonterías, con Diana Eslava; Planeta, 2013\\u200b Poesía Sonetos (2005) Traducción de T. S. Eliot, «El yermo», en Antología de poesía inglesa (siglos XVI-XIX) bilingüe Ed. de Ramón López y Román Álvarez, Salamanca, 1991']",
        "retrieved_contexts": [
            "Juan Eslava Galán (Arjona, Jaén, 7 de marzo de 1948) es un escritor español del género histórico, tanto de ficción como de no ficción. Saltó a la popularidad con la obtención del Premio Planeta en 1987. Ha publicado algunas novelas bajo el pseudónimo de Nicholas Wilcox. Biografía Hijo de olivareros, estudió en los colegios de Arjona hasta que, al cumplir los diez años, su familia se trasladó a Jaén, donde prosiguió el bachillerato. Estos primeros años de estudios quedaron plasmados en su novela Escuela y prisiones de Vicentito González. Cursó Filosofía y Letras en la Universidad de Granada, licenciándose en Filología Inglesa, y luego realizó un viaje al Reino Unido con el objetivo de ampliar sus estudios. Allí estuvo viviendo en Bristol y Lichfield, y fue alumno y profesor asistente en la Universidad de Aston, Birmingham. A su regreso obtuvo una cátedra de Instituto de Bachillerato y, posteriormente, se doctoró en la Universidad de Granada con una tesis sobre Poliorcética y fortificación bajomedieval en el reino de Jaén. Es miembro del Instituto de Estudios Giennenses. Su novela más conocida es En busca del unicornio, que ganó el Premio Planeta en 1987 (2.ª ed. corregida y ampliada en 2007), impulsando notablemente su carrera literaria. Se declara un apasionado de la Edad Media, como puede verificarse fácilmente por la temática de su obra. Su bibliografía comprende casi un centenar de libros, de narrativa, divulgación histórica, biografía y ensayos, entre los que destacan sus muy irónicas Historia de España contada para escépticos y El catolicismo explicado a las ovejas, entre otros títulos. Autor prolífico, puede publicar al año dos novelas además de libros de otros géneros. Tanto novelista como ensayista, hace gala de un particular sentido del humor, a veces satírico. Como narrador, opta por los géneros de la novela histórica, la fantasía y el misterio. Entre las primeras destacan especialmente En busca del unicornio, ambientada en el reinado de Enrique IV el Impotente, valiéndose de una prosa de regusto medieval; El comedido hidalgo, que refleja con ecos cervantinos la España de fines del siglo XVI, o La mula y Señorita, cuyas tramas se desarrollan durante la guerra civil española. Además, bajo el pseudónimo de Nicholas Wilcox, que es más bien un heterónimo con fotografía falsa incluso, ha escrito varias novelas que él mismo no duda en calificar como de estilo best-seller. Fue creado en un principio por el miedo a defraudar a sus lectores, pues el estilo y la narración de las novelas de Wilcox son realmente muy diferentes a las de Eslava Galán. Su libro reciente de mayor éxito es Una historia de la guerra civil que no va a gustar a nadie, que narra los sucesos más relevantes del conflicto fratricida español de un modo a medio camino entre la crónica periodística y la novela histórica; también destaca La conquista de América contada para escépticos,​ en la que trata de clarificar un tema plagado de fanatismos y de medias verdades. Premios Premio Planeta (1987) por En busca del unicornio Premio Chianti Ruffino - Antico Fattore 1988 por En busca del unicornio traducida al italiano Premio Fernando Lara (1998) por Señorita Premio Andalucía de la Crítica (1998) por Señorita Premio Ateneo de Sevilla (1994) por El comedido hidalgo Premio Primavera de Novela (2015) por Misterioso asesinato en casa de Cervantes.​ Obras Narrativa En busca del unicornio, 1987 Catedral, 1989 El mercedes del obispo y otros relatos edificantes, 1990 Cuentos crueles, 1990 Tu magistral amor, 1990 El viaje de Tobías, 1992 Statio Orbis (El magno evento), 1995 El comedido hidalgo, 1994 Escuela y prisiones de Vicentito González, 1999 Señorita, 1998 Los dientes del dragón, 2001 La mula, novela, 2003 La muerte de la abuela, novela, 2003 El mercenario de Granada, 2006 Rey lobo, 2010 Últimas pasiones del caballero Almafiera, novela, Planeta, 2012​ Misterioso asesinato en casa de Cervantes, Planeta, 2015 (Premio Primavera de Novela) El amor en el jardín de las fieras, novela, 2016, Editorial Espasa Novelas como Nicholas Wilcox Los templarios y la Mesa de Salomón, 2004 La sangre de Dios, 2001 Las trompetas de Jericó, 2000 Los falsos peregrinos, 2000 La lápida templaria, 1996 Historia y divulgación Cinco tratados españoles de alquimia, 1986 Roma de los césares, 1988 Verdugos y torturadores, 1990 Grandes batallas de la historia de España, 1990 La vida y la época de los Reyes Católicos, 1996 Los Reyes Católicos, 2004 Los íberos. Los españoles como fuimos, 2004 Califas, guerreros, esclavas y eunucos. Los moros en España, 2008 Enciclopedia eslava, 2017 Una historia de toma pan y moja, 2018 La Tentación del Caudillo, 2020​ Viaje a Tierra Santa, Planeta, 2022. Biografías Jofra, 1975 Yo, Aníbal, 1988 Yo, Nerón, 1989 Julio César, el hombre que pudo reinar, 1995 Cleopatra, la serpiente del Nilo, 1993 Leyendas y enigmas Templarios, griales, vírgenes negras y otros enigmas de la Historia, Planeta, 2011 La lápida templaria descifrada, 2008 España insólita y misteriosa, 2006 El fraude de la Sábana Santa y las reliquias de Cristo, 1997 Los templarios y otros enigmas medievales, ensayo, 1992​ El enigma de Colón y los descubrimientos de América, 1992 Tartessos y otros enigmas de la historia, 1991 Leyendas de los castillos de Jaén, 1982 La leyenda del Lagarto de la Malena y los mitos del dragón, 1981 El enigma de la Mesa de Salomón, 1987 Viajes 1000 sitios que ver en España al menos una vez en la vida, 2009 Viaje a los escenarios del capitán Alatriste, 2006 Viaje a la costa de las ballenas, 2006 El paraíso disputado. Ruta de los castillos y las batallas, ensayo, Guías Aguilar, 2003 Otro Jaén (1999) Serie historia para escépticos Historia de España contada para escépticos, ensayo, 1995 Historia del mundo contada para escépticos, ensayo, Planeta, 2012​ La Segunda Guerra Mundial contada para escépticos, divulgación histórica, Planeta, Juan Eslava Galán 2015​ La Primera Guerra Mundial contada para escépticos, divulgación histórica, Planeta, Juan Eslava Galán 2014​ Una historia de la guerra civil que no va a gustar a nadie, 2005 El catolicismo explicado a las ovejas, 2009 La revolución rusa contada para escépticos, divulgación histórica, Planeta, 2017 La conquista de América contada para escépticos, 2019 La Biblia contada para escépticos, 2020 Enciclopedia Nazi contada para escépticos, 2021​​​ La Reconquista contada para escépticos, 2022 La Revolución Francesa contada para escépticos, 2023 La Revolución Rusa contada para escépticos (novela gráfica), 2023 Historia de Andalucía Viaje por el Guadalquivir y su historia. De los orígenes de Tarteso al esplendor del oro de América y los pueblos de sus riberas, divulgación histórica, Esfera de libros, 2016 Las ciudades de la Bética, ensayo, Fundación José Manuel Lara, 2012​ Un jardín entre olivos (Las rutas del olivo en España. Masaru en el olivar III), ensayo, 2002 Las rutas del olivo en Andalucía (Masaru en el olivar II), 2001 Las rutas del olivo en Jaén (Masaru en el olivar I), 1999 Guadalquivir, 1990 Poliorcética Castillos y murallas del Reino de Jaén, 1989 Los castillos de Jaén, ensayo, Universidad de Jaén, 1999 Ensayo Historias de la Inquisición, 1992 50 estampas de la historia de España, ensayo, Círculo de Lectores, 2013 Friary Grange School. Estudio de una comprehensive school inglesa, 1978 La madre del cordero, divulgación artística, Planeta, 2016​ Avaricia, Destino, 2015 Sociología Santos y pecadores. Álbum de recuerdos de los españolitos del siglo XX, ensayo, Planeta, 2002 Los años del miedo, 2008 La década que nos dejó sin aliento, Planeta, 2011​ La España del 98. El fin de una era, 1997 La España de las libertades, 1997 De la alpargata al seiscientos, Planeta, 2010 Tumbaollas y hambrientos. Los españoles comiendo y ayunando a través de la historia, 1997 Sobre sexo Historia secreta del sexo en España, 1992 El sexo de nuestros padres, 1993. Coitus interruptus, 1997 La vida amorosa en Roma, 1996. Amor y sexo en la antigua Grecia, 1997 Lujuria, Destino, 2015 Homo erectus, Planeta, 2011 Cocina Cocina sin tonterías, con Diana Eslava; Planeta, 2013​ Poesía Sonetos (2005) Traducción de T. S. Eliot, «El yermo», en Antología de poesía inglesa (siglos XVI-XIX) bilingüe Ed. de Ramón López y Román Álvarez, Salamanca, 1991",
            "Juan Otazua y Madariaga, más conocido como Juan de Jesús y María, (Rigoitia, 8 de febrero de 1895 - 3 de abril de 1937) fue un religioso y sacerdote de la Orden Trinitaria, fusilado por los milicianos del Bando Republicano, durante la guerra Civil española del siglo XX, y beatificado por el papa Benedicto XVI en el 2007.​ Biografía Origen y formación Juan de Jesús y María nació el 8 de febrero de 1895 en la pequeña localidad de Rigoitia, en la provincia de Vizcaya (España).​ El 30 de septiembre de 1913 comenzó su noviciado con los religiosos trinitarios en el Santuario de la Bien Aparecida (Cantabria). Hizo su profesión simple en dicho santuario, el 11 de octubre de 1914, allí cambió su nombre a Juan de Jesús y María. Estudió la filosofía en la Bien Aparecida y en Córdoba y la teología en La Rambla. Profesó sus votos solemnes en la casa de la Trinidad de Córdoba el 17 de mayo de 1918. Fue ordenado sacerdote el 23 de octubre de 1921 en Madrid. Cargos Por muchos años fue conventual de la casa de la Trinidad de Madrid y ejerció su labor pastoral en la iglesia de los vascos de San Ignacio de Loyola, en el hoy conocido barrio de Las Letras. Era conocido por su excelente dominio de la música, especialmente del violoncelo. En marzo de 1936 la iglesia de San Ignacio fue incendiada por las turbas, en el ambiente de guerra civil, lo que llevó a la desintegración de la comunidad trinitaria y la repartición de los religiosos por diversos conventos de España. A Juan de Jesús y María le trasladaron al Santuario de la Virgen de la Cabeza en Andújar.​ Martirio El 28 de julio de 1936 la comunidad de los trinitarios del Santuario, también fue dispersada, algunos de sus religiosos fueron arrestados y ejecutados días después, sin embargo a Juan solo le condenaron a 20 años de prisión. A pesar de la sentencia, la noche del 2 de abril de 1937 milicianos le sacaron de la prisión y le llevaron al cementerio de la Mancha Real (Jaén), donde le fusilaron en la madrugada del día siguiente. Juan de Jesús y María contaba con 42 años de edad. Su cuerpo fue destrozado y sepultado en una fosa para no ser reconocido.​ Beatificación Juan de Jesús y María fue beatificado por el papa Benedicto XVI el 28 de octubre de 2007. Su nombre se encuentra incluido en la lista encabezada por Mariano de San José y compañeros mártires, que a su vez se halla en la numerosa lista de 498 mártires del siglo XX de España. La ceremonia de beatificación fue presidida por el prefecto de la Congregación para las Causas de los Santos, José Saraiva Martins, en la plaza de San Pedro de la Ciudad del Vaticano.​",
            "Juan del Valle y Caviedes (Porcuna, Jaén, España, 11 de abril de 1645 - Lima, 1698), conocido como «El poeta de la Ribera» fue un poeta y dramaturgo nacido en España que vivió casi toda su vida en el Perú, y la excepción literaria de la literatura peruana del siglo XVII, junto a otros como el Inca Garcilaso de la Vega o Juan de Espinosa Medrano conocido también como Lunarejo. Biografía Sus padres fueron Don Pedro del Valle y María Caviedes. Al morir su padre en 1661, viajó a Lima siendo un niño, para vivir con su tío materno Tomás Berjón de Caviedes, quien fue gobernador de Huancavelica. Regresó a España por solo tres años cuando el ya tenía veinte. Estuvo dedicado a la explotación de minas en Huancavelica y se casó en 1671 en Lima con Beatriz de Godoy y Ponce, dama de Moquegua, con quien tuvo cinco hijos. Luego de esto pasó muchas penurias y pobreza y sufrió de enfermedades. Entre 1678 y 1683 su esposa falleció, lo que causó en él honda pena.​ Sin embargo, fue también un bohemio y tenía amigos a los que leía y con los que festejaba sus escritos satíricos, puyas y mordacidades. Fue el más notable discípulo de Quevedo en el Perú. Convirtió en objeto de sus burlas a monjas, curas, militares, etc, pero especialmente a los médicos de su época, a quienes tenía verdadera tirria por dos motivos personales (los culpaba de la temprana muerte de su esposa y porque nunca pudieron aliviarlo de una enfermedad crónica que padecía). En su literatura, hace burla tanto de los médicos como de los curanderos y del \"Doctor Corcovado\", su archienemigo. Según algunas fuentes Del Valle dilapidó sus pocos ingresos y murió sumido en el alcoholismo. Aunque en algunos libros se señala su fecha de nacimiento como 1652, en Porcuna (Andalucía), una placa recordatoria señala la fecha de nacimiento de Caviedes como 1645. Caviedes no llegó a publicar una obra completa en vida, pero sí pudo sacar tres poemas en distintos años: 1687, 1689 y 1694. Algunas partes de su obra fueron publicadas por primera vez en 1873 en el tomo V de la Colección de documentos literarios del Perú, a cargo de Manuel de Odriozola. Unos años más tarde, en 1899 Ricardo Palma editaría la obra más conocida de Caviedes, Diente del Parnaso.​ Diente del Parnaso Diente del Parnaso, el único libro titulado conocido de Caviedes, es un conjunto de poemas satíricos, producidos aproximadamente entre 1683 y 1691, fue copiado en 1693, pero no se publicó hasta 1873.​ Sus versos satíricos fueron dirigidos a los médicos de la época. La figura de los médicos están representados en dos aspectos diferentes: Como representante del estado de la medicina durante este tiempo en Perú, así como individuos sujetos a burla y ridículo debido a sus fallas y defectos personales. Esta obra también muestra la vida cotidiana entre Lima, Perú en el siglo XVII. Aunque Caviedes es más conocido por su uso de sátira en Diente del Parnaso, también escribe en la misma sobre temas que rodean la religión, la filosofía y la metafísica.​ Estos temas muestran características comunes de la poesía dentro de la Literatura barroca, de la que Caviedes formaba parte. Caviedes enmarca los aspectos de su sátira médica en términos de dualidades opuestas,​ en las que los individuos y los conceptos se yuxtaponen como las antítesis de lo que sugiere el significado original. El tercer poema de Diente del Parnaso, \"Fe de Erratas\" proporciona este código de dualidades opuestas para indicar el propósito de su léxico poético. Este poema es una tabla de direcciones para que el lector entienda la sátira poética que escribe Caviedes. Dualidades opuestas incluyen , \"médico/verdugo\", \"purga/fin de la vida\", y \"receta/estoque\".​ Debido al alto estatus social y a los cargos de autoridad que los médicos ocupaban en el Perú durante el siglo XVII,​ se convirtió en un punto de discordia publicar la obra. Caviedes se dirige a múltiples figuras públicas conocidas e influyentes en este trabajo, atacando su ignorancia e inmoralidad.​ Los oficiales de la sociedad reconocieron la amenaza que representaba Diente del Parnaso y restringieron intencionalmente la publicación de las obras de Caviedes. La constante crítica y satirización de Caviedes a los médicos en Lima exhibió el papel en el que se desempeñaron la profesión médica en la corrupción de la sociedad. Casi doscientos años después de que Caviedes la escribiera, y una vez que la autoridad del Virreinato del Perú disminuyó y el Perú se independizó, la obra más influyente de Juan del Valle y Caviedes fue finalmente publicada. Referencias literarias Fue citado y elogiado por Ricardo Palma en El Nazareno, integrada dentro de Tradiciones peruanas (1897): \"un coplero de tres al cuarto, cuyos versos gozaban de gran boga, sin tener ni la chispa satírica ni la originalidad del poeta limeño Juan de Caviedes, escribió unas jácaras contra el capitán\".​ Obras Diente del Parnaso Guerras físicas, proezas medicinales ​ Caballeros Chanflunes Carta a Sor Juana Inés de la Cruz Entremés del amor alcalde Baile del amor",
            "Juan Pérez de Moya (Santisteban del Puerto, Jaén, ¿1512? - Granada, noviembre de 1596) fue un matemático, mitógrafo y escritor español. Biografía Debió nacer antes de 1513, pues los libros parroquiales de Santisteban del Puerto (lugar de donde era natural según declara en sus propias obras) empiezan en ese año y no recogen su nombre. Fue hijo de Gonzalo de Moya y estudió en la Universidad de Salamanca, donde alcanzó el grado de bachiller. Allí empezó a escribir su famosa Aritmética, impresa en 1562 dedicada al príncipe Carlos. También realizó estudios en Alcalá de Henares, en donde residió trece años. Ordenado sacerdote, obtuvo en 1536 una capellanía en su pueblo natal​ y fue beneficiado del Convento de San Marcos de León. Se dedicó muy probablemente a la enseñanza privada de las matemáticas, ya que así lo declara en uno de sus libros; en efecto, el primero que publicó fue un manual de cálculo mercantil para los centros de actividad económica y financiera de la época, el Libro de cuenta... (Toledo, 1554). Compuso después diversas obras de álgebra, geometría,​ aritmética, astronomía y navegación, así como una miscelánea y otras obras de mitología y moral, en general con bastante éxito. En 1583 presentó un memorial a Felipe II pidiendo un beneficio eclesiástico en recompensa a sus obras y, mientras esperaba resolución, en 1585 pagó al beneficiado Diego Marín el importe del rescate de su sobrino Juan de Feria, cautivo en Tetuán; en ese mismo año fue padrino en Santisteban del primer hijo de este sobrino felizmente rescatado. Al fin, en 1590, en contestación al memorial de 1583, Felipe II lo nombró canónigo de la catedral de Granada, ya con edad demasiado avanzada, en la plaza vacante del recién fallecido Diego de Berdeñoso. Los documentos certifican que su muerte se produjo allí entre el 29 de octubre y el 15 de noviembre de 1596.​​ Juan Pérez de Moya fue un buen difusor de las disciplinas matemáticas y escribió el libro más importante de la disciplina en lengua española en el siglo xvi, Diálogos de aritmética práctica y especulativa, Salamanca, 1562, que contiene un tratado de álgebra llamado Regla de la cosa. Llegó a conocer treinta reimpresiones hasta 1875 y fue elogiado por el matemático Simon Stevin. Entre las fuentes que cita, que trata con independencia y a veces con originalidad, cabe destacar en cuanto al álgebra a Marco Aurel, y en cuanto a navegación Martín Cortés y Pedro de Medina. Estos Diálogos fueron editados por el matemático del siglo xix Felipe Picatoste.​ Traducido a varias lenguas, el libro noveno es, además, una defensa de la dignidad y utilidad de las matemáticas y puede leerse con independencia de los otros, constituyendo la primera colección de matemática recreativa o amenidades matemáticas que se publicaba en lengua española. Compuso además, sin que llegara a publicarse,​ un Arte de marear (1564), verdadera exposición de los conocimientos del momento donde recogió cómo se trazaban las meridianas en las cartas de navegación, el uso del astrolabio, las alteraciones de la aguja o el uso de la ballesta para la estrella polar; un Tratado de matemáticas, Alcalá, 1573, un Tratado de Geometría, Alcalá, 1573, en que su fuente principal es el General trattato (1560) de Niccolò Fontana Tartaglia, entre otros​ y unas Reglas para contar sin pluma y de reducir unas monedas castellanas a otras entre otras curiosas obras.​ Como mitógrafo fue autor de un libro muy reimpreso en su tiempo, la Philosofia secreta, Madrid, 1585, un tratado de mitología grecorromana de sesgo humanístico donde se procura extraer una enseñanza moralizadora de cada mito. Pérez de Moya se inspira sobre todo en la Genealogia deorum gentilium de Giovanni Boccaccio, que interpola con algunos textos de la Mythologiae sive explicationis fabularum de Natale Conti. Propone para comprender las fábulas antiguas los cinco sentidos que se le suelen atribuir a las Santas Escrituras, que van desde el más exterior y superficial, hasta el sentido central, que denomina filosofía secreta; lo explica de la manera siguiente: Animado por el éxito de esta obra, el autor compuso otras obras morales, como la Varia historia de Sanctas e ilustres mujeres (Madrid, 1583) y Comparaciones o símiles para vicios y virtudes, Alcalá, 1584. Obras Libro de cuenta, que trata de las quatro Reglas generales de Arithmetica practica, por numerosos enteros y quebrados y de reducciones de monedas destos Reynos de Castilla, con un razonamiento sobre la misma facultad (Toledo: J. Ferrer, 1554) Sylva, eutrapelias id est Comitatis et urbanitatis ex variis probatae fidei Authoribus & vitae experimentis (Valladolid, 1557) Libro Segundo de Aritmética (Salamanca, 1557) Compendio de la Regla de la Cosa o Arte Mayor (Burgos, 1558), tratado de álgebra. Diálogos de aritmética práctica y especulativa, (Salamanca, 1562) Arte de marear (manuscrito, 1564) Obra intitulada Fragmentos mathematicos; en que se tratan cosas de Geometria y Astronomia y Geographia y Philosophia Natural y Sphera y Astrolabio y Nauegacion y Reloxes (Salamanca: Juan de Cánova, 1567 o 1568), 2 vols. Tratado de cosas de Astronomia y Cosmographia y Philosophia Natural (Alcalá de Henares, 1573) Tratado de Mathematicas: en que se contienen cosas de Arithmetica, Geometria, Cosmographia y Philisophia Natural (Alcalá de Henares, 1573) Manual de Contadores (Alcalá de Henares, 1582) Varia Historia de Sanctas e Ilustres Mujeres en Todo Género de Virtudes (Madrid, 1583) Comparaciones o símiles para los vicios y virtudes: muy util y necessario para predicadores y otras personas curiosas (Alcalá de Henares, 1584; el título tomado de la edición de Valencia: Pedro Patricio Mey, 1599) Principios de geometria, de que se pod[r]an aprovechar los estudiosos de artes liberales, y todo hombre que su officio le necessitare a tomar la regla y co[m]pas en la mano. Con el medir, y dividir tierras (Madrid, 1584) Philosofia secreta. Donde debaxo de historias fabulosas se contiene mucha doctrina, prouechosa, a todos estudios. Con el origen de los Idolos o Dioses de la Gentilidad. Es materia muy necessaria, para entender Poetas, y Historiadores (Madrid: Francisco Sánchez, 1585) Obligación del Cristianismo (perdida) Reglas para contar sin pluma y de reducir unas monedas castellanas a otras",
            "Fernando Bolívar Galiano -Ferbo Ligali- (Alcalá la Real, Jaén, 5 de octubre de 1965) es un artista y científico español. Biografía Pionero en estudios acerca del biodeterioro en bienes culturales, nace el 5 de octubre de 1965 en Alcalá la Real (Jaén) siendo hijo de José Bolívar Gómez de Urda y Concepción G. Suárez de Urbina, trasladándose junto a su familia a Granada en 1971. En los años ochenta: forma parte de la directiva en Granada de ADENA -WWF ejerciendo varios años como monitor en el campamento fundado por Félix Rodríguez de la Fuente en la provincia de Segovia y comienza simultáneamente sus estudios de Biología y Bellas Artes en la Universidad de Granada. En 1991 fue becado por el Ministerio de Educación y Ciencia para especializarse en biodeterioro en el laboratorio pionero en esta disciplina situado en Roma, el ICR (Istituto Centrale per il Restauro),​ donde colabora en la investigación y restauración del Coliseo y la Fontana di Trevi.​ Tras finalizar ambas licenciaturas obtuvo la primera beca de investigación de la primera promoción de la Facultad de Bellas Artes, con la que pudo realizar la primera tesis española sobre el biodeterioro de bienes culturales. Obtiene el doctorado en 1994 con el estudio descriptivo, analítico y experimental de organismos fotosintéticos en los palacios nazaríes de la Alhambra, tesis​ que pone por primera vez en relieve la importancia de las microalgas en la conservación del monumento más visitado de España. Actualmente es catedrático de Pintura​ en la Universidad de Granada, único con la capacitación para impartir asignaturas de Pintura,​ Restauración y Biología.​ A través de su pseudónimo Ferbo Ligali desarrolla su actividad como artista visual: creación de pinturas, esculturas, obra gráfica e instalaciones donde consigue plasmar la mixtión ciencia y el arte. Fue pionero en la defensa de los derechos de la infancia afectada por las separaciones, cofundando la Asociación de DEHISE.​ Hoy día es Presidente de la Asociación en Defensa de la Igualdad Efectiva + Justicia + Igualdad​ perteneciente a la Federación para la Defensa de la Igualdad Efectiva (). En la actualidad es el creador del movimiento cultural \"Ligalismo\"​ como corriente artístico-científica.​ Arte y Ciencia en su obra La búsqueda de aplicaciones científicas para el arte y de respuestas artísticas para la ciencia ha sido el eje de su formación, especialización y posteriores obras. Esta inquietud por la simbiosis arte y humanidades/ciencias]],​ propia del Renacimiento y muy vigente en la actualidad, ha caracterizado desde el inicio de su proyección todas sus actividades investigadoras, docentes, profesionales y de gestión muy útiles para la dirección de equipos que requieren de la integración de ambos campos, supuestamente, tan diferentes. 1.-Estudios de conservación-restauración de monumentos, Pintura de Caballete y Textiles: En especial en la Alhambra sobre el biodeterioro de arquitecturas del agua tal como las fuentes monumentales con la diagnosis y tratamiento del biodeterioro por agentes biológicos (bacterias, algas, plantas superiores, hongos, insectos y vertebrados). 2.-Creaciones artísticas. Principalmente de carácter pictórico, escultórico, de ilustraciones y fotografías. Actividad docente y profesional Su función docente comienza en 1991 impartiendo clases prácticas de introducción y procedimientos en el Departamento de Pintura de Granada. En el 1992 pasa a ser responsable de un grupo de Introducción a la Restauración y posteriormente de asignaturas relacionadas con la Restauración de Textiles -siendo entonces el único profesor de esta asignatura en España-, Agentes de Deterioro, Problemas de Conservación, Factores de Deterioro, Diseño de Exposiciones y otras relacionadas con la producción pictórica como Pintura y Figuración, Pintura y Entorno Natural, Técnicas y Tecnologías Pictóricas, Pintura y Representación: Entorno Natural, etc. Por otro lado, con el fin de aportar al alumnado de Bellas Artes las bases científicas para abordar el estudio del biodeterioro y las técnicas artísticas, crea las asignaturas de Libre Configuración Específica: “Biología básica aplicada a las Técnicas Artísticas y la Restauración” y “Biodeterioro y Restauración: materiales orgánicos”. El interés por la docencia le ha llevado a participar en Proyectos de Innovación Docente, en los que ha tratado de facilitar y actualizar la docencia de la restauración, el biodeterioro]], la pintura y la ilustración científica. Participando así en actividades involucradas en la adaptación de los estudios actuales al Espacio Europeo de Enseñanza Superior (EEES).​ Es director y fundador del aula BIO-ARTE​ (Artistas Granadinos por la Naturaleza, 2006) en la Facultad de Bellas Artes, que cuenta en el Barrio Albaycín, con un taller especializado en ilustración y “Wildlife Art”, donde organiza diversas actividades, salidas de campo, premios y concursos de Pintura, exposiciones de alumnos. También cuenta con la organización de diversas actividades como talleres en el Parque de las Ciencias, ilustración de libros, Webs, DVDs, exposiciones y cursos de formación continua sobre pintura e ilustración de la naturaleza; director del Aula Arte Musical y Escénico de la Facultad de Bellas Artes desde el 2005; director del Laboratorio de Biodeterioro. Actividad artística En 1989 realiza su primera exposición y desde ese momento participa y organiza numerosas exposiciones individuales y colectivas multidisciplinares que han repercutido en los medios de comunicación, locales y nacionales, tanto en televisión, radio, prensa de papel y digital, redes sociales, evidenciándose lo novedoso y trascendente de sus propuestas, tanto en los foros artísticos como en los científicos. Sus obras más conocidas se basan en el uso de algas vivas, desarrollando una pintura algal a partir de microalgas molidas y aglutinadas con polímeros sintéticos, y por otro lado cuadros vivos mediante el cultivo de microalgas entre cristales. Los 'cuadros vivos’ son obras pictóricas consistentes en algas aisladas y enmarcadas entre dos cristales, algunos con pequeñas aberturas que permiten el paso del aire, que van evolucionando en su composición y color en relación con los microorganismos que lo forman. También cuenta con singulares obras creadas específicamente para ser visualizadas con gafas 3D,​ así como ajedreces de autor ready-made.​ El Gabinete como Museo Su exposición: “El extraño Gabinete del Prof. Bolívar-Galiano”​ que nació de su particular combinación de ciencia y arte, le ha permitido recuperar el uso de los Gabinetes como museos. La idea de no exponer dicha obra en galerías o museos convencionales sino más bien en aquellos lugares donde están inspiradas, como es el caso de la titulada “Arte y Ciencia”​ que se ubicó en la Facultad de Ciencias de Granada, ha posibilitado la creación de un nuevo concepto de espacio museístico donde fue trasladada dicha exposición. Bolívar Galiano, en esta ocasión bajo el pseudónimo artístico de Ferbo Ligali, propone volver a la manera de exponer anterior a la disociación de los museos, cuando aún se les denominaba \"Gabinetes de Curiosidades\" o \"Cuartos de Maravillas\", y que, posteriormente pasaron a llamarse museos de historia natural o ciencias naturales por un lado y de bellas artes o pinacotecas por otro. Conduciéndole a la necesidad de recrear los ambientes lumínicos y estéticos de estos espacios singulares que atraían la atención, tanto de personas versadas en las letras como en las ciencias. De este modo y aprovechando su experiencia en montaje de exposiciones creó el Museo-Gabinete Ferbo Ligali, un espacio donde además de cumplir la labor de gabinete, es además un museo donde la ciencia y el arte se aúnan en un rincón de Granada donde la naturaleza, belleza y ciencia cohabitan un espacio que posibilita diferentes actividades culturales tales como ciclos de conferencias, cursos, talleres, coloquios, cinefórum, fotoforum, filmaciones para televisión, conciertos, teatro, etc., teniendo cabida además todas las disciplinas artísticas, científicas o filosóficas. Recientemente instaló un gabinete musical en la antesala del Auditorio del Real Conservatorio Superior de Música de Granada dentro de la Exposición Musik=Art=Science donde se mostraba artísticamente las relaciones entre la ciencia y la música.​ Exposiciones Exposición MUSIK=ART=SCIENCE con obras del Museo Ferbo Ligali en el Real Conservatorio Superior de Música de Granada. 2015.​​ \"Poéticas del color y del límite\". Exposición dedicada a José Guerrero en su Centenario. Palacio de la Madraza, noviembre-diciembre de 2014. \"Arte y Ciencia: El extraño Gabinete del Profesor Bolivar Galiano\". 2014.​ Exposición de pintura \" El color de las Algas en la Alhambra\". 2007 Exposición de pintura \"Los 12 rostros de la Alhambra\". 2007 Producción científica Bolívar Galiano, Fernando, \"L´Alhambra a Granada: 15 anni di indagini sulla conservazion delle fontane. L’acqua le pietre i bronzi. Le fontane momunentale. Palombi Editori. Roma. 2010. ISBN 978-88-6060-300-5. Bolívar Galiano, Fernando, \"El Color como punto de encuentro entre Ciencia y Arte. BOCETOS. Boletín Asociación Española de Artistas de Naturaleza, 3: 3. 2007. Bolívar Galiano, Fernando, \"Fauna en acción. Guía para observar comportamiento animal en España. 2006. Lynx Edicions. Bellaterra, Barcelona . ISBN: 84-96553-23-X. Bolívar Galiano, Fernando, \"Pintura Algal: paralelismos entre comunidades microalgales y técnicas pictóricas, ¿pudo ser la primera pintura?'''. ALGAS. Boletín de la Sociedad Española de Ficología, 30: 9-: 12. 2006. Bolívar Galiano, Fernando, \"Microalgae associated with deteriorated stonework of the fountain of Bibatauín. International Biodeterioration and Biodegradation, 55: 55- 61. 2005. England (UK) Bolívar Galiano, Fernando, \"Artificial marble stones as a solution for biodeterioration by microalgae on monumental fountains. International Biodeterioration and Biodegradation, 53. 2004. England (UK). Bolívar Galiano, Fernando, \"Indirect effects of a non target species, Pyrrhalta luteola (Chrysomelidae) on the biodeterioration of Brussels Tapestries. International Biodeterioration and Biodegradation, 54: 297-302. 2004. England (UK) Bolívar Galiano, Fernando, \"Le Fontane Monumentali dell’Alhambra di Granada. Problemi di Biodeterioramento\". Kermes 63- 68, octubre-diciembre de 2002. Nardini Editore. Florencia, Italia. Bolívar Galiano, Fernando, \"Il biodeterioramento delle fontane dei Reales Alcazares di Siviglia e dell’Alhambra di Granada (Spagna). Science and Technology for Cultural Heritage, 11(1-2): 111- 118. 2002. Pisa y Roma, Italia. Bolívar Galiano, Fernando, \"Biomineralization Processes in the Fountains of the Alhambra, Granada, Spain. International Biodeterioration and Biodegradation: 40 (2-4) 205-215. 1997. England (UK). Bolívar Galiano, Fernando, \"Preliminary Study on the Biodeterioration of Canvas Paintings from the Seventeenth Century By Microchiroptera. International Biodeterioration and Biodegradation: 40 (2-4): 161-169. 1997. England (UK). Bolívar Galiano, Fernando, \"Preliminary results on the study of the algal biodeterioration within the Alhambra (Granada, Spain). Bioderioration and Biodegradation 9. 210-216.1995. England. ISBN: 0 85295319 4. Bolívar Galiano, Fernando, \"Formas de deterioro en fuentes monumentales. Boletín del Colegio de Bellas artes de Andalucía (Teodosio 5). 19: 4- 5. 1995. Sevilla. Bolívar Galiano, Fernando, \"Los agentes de biodeterioro del patrimonio pictórico, textil y gráfico. PH. Boletín del Instituto Andaluz del Patrominio Histórico. 12: 50- 51. 1995. Sevilla."
        ]
    },
    "test_3": {
        "question": "¿Cuál es la formación de Maite Martín Valdivia?",
        "reference": "Maite Martín Valdivia consiguió la diplomatura en Informática por la Universidad de Granada en 1990. Más tarde, en 1992, obtuvo la licenciatura en Informática en la misma universidad, realizando más tarde su tesis doctoral en la Universidad de Málaga.",
        "response": "Maite Martín Valdivia es doctora en informática. Se diplomó en Informática en la Universidad de Granada en 1990 y se licenció en Informática en la misma universidad en 1992. Realizó su tesis doctoral en Informática en la Universidad de Málaga. Desde 2007 es miembro del Consejo Asesor de la Sociedad Española para el Procesamiento del Lenguaje Natural (SEPLN), en cuya Junta Directiva fue tesorera desde 2007 hasta 2019.",
        "reference_contexts": "['María Teresa (ó Maite) Martín Valdivia (Jaén) es doctora en informática. Desde 1995 trabaja en la Universidad de Jaén como profesora del área de Lenguajes y Sistemas Informáticos del Departamento de Informática. Desde 2019 es catedrática de universidad. Forma parte del equipo de investigación SINAI (Sistemas Inteligentes de Acceso a la Información) desde su creación en 2001.\\u200b Su área de especialización es el Procesamiento del Lenguaje Natural, y en la actualidad investiga dentro de los temas de análisis de opiniones y emociones, minería de textos, aprendizaje automático y búsqueda y recuperación de información en biomedicina. Biografía Se diplomó (1990) y licenció (1992) en Informática en la Universidad de Granada. Realizó su tesis doctoral en Informática en la Universidad de Málaga Desde 2007 es miembro del Consejo Asesor de la Sociedad Española para el Procesamiento del Lenguaje Natural (SEPLN), en cuya Junta Directiva fue tesorera desde 2007 hasta 2019.\\u200b\\u200b Fue directora del Secretariado de Investigación de la Universidad de Jaén del 27 de noviembre de 2017 al 29 de abril de 2019. Del 30 de abril de 2019 al 31 de octubre de 2022 fue vicerrectora de Universidad Digital de la Universidad de Jaén. Actualmente, a partir del 1 de noviembre de 2022, es gestora de investigación en el panel TIC para la Agencia Estatal de Investigación española. Desde noviembre de 2021, es miembro del Consejo asesor de la Agencia Digital Andaluza donde ha participado en la elaboración de la estrategia de Inteligencia Artificial para Andalucía. Desde 2022 pertenece al comité Mujer en Informática de la SCIE en representación de la SEPLN. Desde 2023 es miembro de la comisión de acreditación de profesorado de la ANECA en la Comisión 14 (Informática). En 2016 fue socia fundadora de YottaCode, S.L., spin-off de la Universidad de Jaén. Posteriormente, en 2018, la empresa YottaCode obtuvo una financiación de 50.000 euros en la convocatoria del instrumento europeo PyME. El 8 de marzo de 2021 creó la comunidad DiverTLes: Diversidad en Tecnologías del Lenguaje en España, una red de mujeres que trabajan e investigan en las tecnologías del lenguaje y que tiene como objetivo principal la divulgación y fomento de herramientas y recursos de PLN mostrando el potencial que tiene esta área tan importante de la inteligencia artificial. A través de esta red, formada por más de 150 mujeres, ha fomentado la colaboración, el intercambio de conocimientos y la visibilidad de las mujeres que trabajan e investigan en PLN, promoviendo así la diversidad y el empoderamiento femenino. Premios La doctora Maite Martín ha ganado varios premios en su vida profesionalː 2021: Primer premio en el Hackathon \"Neologismos y tecnicismos en el ámbito energético y medioambiental\" con el proyecto POEMA 2018: II Premio Hackathon de Tecnologías Lingüísticas. en la categoría de ‘Corpus General’ por el prototipo ‘Monitor de dispersión geográfica de enfermedades’ 2016: ISCA Award for the best paper published in Computer Speech & Language 2012-2016, por el artículo “Ranked WordNet graph for sentiment polarity classification in Twitter”. 2014: Premio Historias de Luz. Finalistas en el premio a la innovación por la aplicación “OpenBook: lectura accesible para personas con autismo”. 2007: Best Poster Award MICA. International Conference on Artificial Intelligence and the Mexican Society of Artificial Intelligence.']",
        "retrieved_contexts": [
            "María Teresa (ó Maite) Martín Valdivia (Jaén) es doctora en informática. Desde 1995 trabaja en la Universidad de Jaén como profesora del área de Lenguajes y Sistemas Informáticos del Departamento de Informática. Desde 2019 es catedrática de universidad. Forma parte del equipo de investigación SINAI (Sistemas Inteligentes de Acceso a la Información) desde su creación en 2001.​ Su área de especialización es el Procesamiento del Lenguaje Natural, y en la actualidad investiga dentro de los temas de análisis de opiniones y emociones, minería de textos, aprendizaje automático y búsqueda y recuperación de información en biomedicina. Biografía Se diplomó (1990) y licenció (1992) en Informática en la Universidad de Granada. Realizó su tesis doctoral en Informática en la Universidad de Málaga Desde 2007 es miembro del Consejo Asesor de la Sociedad Española para el Procesamiento del Lenguaje Natural (SEPLN), en cuya Junta Directiva fue tesorera desde 2007 hasta 2019.​​ Fue directora del Secretariado de Investigación de la Universidad de Jaén del 27 de noviembre de 2017 al 29 de abril de 2019. Del 30 de abril de 2019 al 31 de octubre de 2022 fue vicerrectora de Universidad Digital de la Universidad de Jaén. Actualmente, a partir del 1 de noviembre de 2022, es gestora de investigación en el panel TIC para la Agencia Estatal de Investigación española. Desde noviembre de 2021, es miembro del Consejo asesor de la Agencia Digital Andaluza donde ha participado en la elaboración de la estrategia de Inteligencia Artificial para Andalucía. Desde 2022 pertenece al comité Mujer en Informática de la SCIE en representación de la SEPLN. Desde 2023 es miembro de la comisión de acreditación de profesorado de la ANECA en la Comisión 14 (Informática). En 2016 fue socia fundadora de YottaCode, S.L., spin-off de la Universidad de Jaén. Posteriormente, en 2018, la empresa YottaCode obtuvo una financiación de 50.000 euros en la convocatoria del instrumento europeo PyME. El 8 de marzo de 2021 creó la comunidad DiverTLes: Diversidad en Tecnologías del Lenguaje en España, una red de mujeres que trabajan e investigan en las tecnologías del lenguaje y que tiene como objetivo principal la divulgación y fomento de herramientas y recursos de PLN mostrando el potencial que tiene esta área tan importante de la inteligencia artificial. A través de esta red, formada por más de 150 mujeres, ha fomentado la colaboración, el intercambio de conocimientos y la visibilidad de las mujeres que trabajan e investigan en PLN, promoviendo así la diversidad y el empoderamiento femenino. Premios La doctora Maite Martín ha ganado varios premios en su vida profesionalː 2021: Primer premio en el Hackathon \"Neologismos y tecnicismos en el ámbito energético y medioambiental\" con el proyecto POEMA 2018: II Premio Hackathon de Tecnologías Lingüísticas. en la categoría de ‘Corpus General’ por el prototipo ‘Monitor de dispersión geográfica de enfermedades’ 2016: ISCA Award for the best paper published in Computer Speech & Language 2012-2016, por el artículo “Ranked WordNet graph for sentiment polarity classification in Twitter”. 2014: Premio Historias de Luz. Finalistas en el premio a la innovación por la aplicación “OpenBook: lectura accesible para personas con autismo”. 2007: Best Poster Award MICA. International Conference on Artificial Intelligence and the Mexican Society of Artificial Intelligence.",
            "Juan Pascual Valdivia y Valenzuela (Alcalá la Real, c. 1737 - Olivares, 12 de marzo de 1811) fue un compositor y maestro de capilla español.​ Vida Juan Pascual Valdivia y Valenzuela nació en Alcalá la Real, en la provincia de Jaén, hijo de Gregorio Valenzuela y Valdivia y Ana Valdivia, hacia 1735 o 1737.​ La fecha de su nacimiento se calcula por su ordenación de sacerdote en 1762. En ese momento la edad mínima para ordenarse era de 25 años, por lo que debió nacer hacia 1737 o poco antes. No se ha encontrado la documentación de su bautizo en Alcalá la Real, posiblemente porque los archivos eclesiásticos de las iglesias parroquiales y la Colegiata de Alcalá la Real fueron destruidos durante la Guerra de la Independencia Española en 1812 y durante la Guerra civil en 1936. Se desconoce cuál fue su formación musical, pero es de suponer que sería en la Colegiata de Alcalá la Real, con la capilla de música. De hecho, se desconoce la trayectoria de Valdivia hasta su llegada a Olivares.​ Oposiciones al magisterio de la Colegiata de Olivares El 10 de septiembre de 1759 fallecía el maestro de la Colegiata de Olivares, Antonio González Guerrero. Antes de su fallecimiento ya debía estar muy enfermo y el capellán músico Francisco Mayés y el organista Juan Mayorga ejercían sus funciones en sustitución. Se decidió que el tribunal de las oposiciones fuese presidido Juan Roldán, organista segundo de la Catedral de Sevilla, «sujeto mui avil en composición, y de mucha consiencia». Otros participantes del tribunal de las oposiciones serían el citado Juan Mayorga, el racionero Juan Bejarano y el secretario capitular José Hernández Araujo. Solo se presentaron dos aspirantes: Francisco Delgado Montero y Juan Domingo Vidal. Tras un duro examen que duró una semana, los examinadores entregaron su juicio al cabildo, que finalmente decidió que ninguno de los dos cumplía con las condiciones necesarias. De todo ello fue informado el patrono, el Duque de Alba, Fernando de Silva y Álvarez de Toledo.​ Las fiestas de Navidad se pasaron sin maestro, siendo Miguel de Castro, capellán músico, quien ejerció las funciones. El 29 de diciembre Juan Domingo Vidal renunció a su candidatura al haber aprobado las oposiciones al magisterio de la Colegiata de San Salvador de Sevilla. En enero de 1760 se publicaron nuevos edictos para unas nuevas oposiciones que presidiría de nuevo Juan Roldán, asistido en el tribunal por el racionero Bejano, el organista Mayorga y el nuevo secretario, José Hernández Araujo. A estas nuevas oposiciones se presentaría solo candidato: Juan Pascual Valdivia, que aun así tuvo que realizar las mismas pruebas que los candidatos de las oposiciones anteriores a lo largo de una semana: componer un salmo sacado al azar del Breviario en un plazo de 16 horas; componer en 24 horas un villancico a cuatro voces y dos violines del que se le había dado la letra; ejercicio de la dirección de la capilla de música; además de preguntas y algunos ejercicios escritos breves; «el paso forzado de motete con término de cuatro horas»; se tocó el salmo en la capilla de música con el cabildo en pleno; y finalmente se interpretó el villancico.​ Según los estatutos de la Colegiata, el cabildo debía presentar a dos candidatos al patrono, el mencionado Duque de Alba, para que este eligiese. En este caso el cabildo tenía dos candidatos «malos» y uno «bueno», y de los dos «malos», el «menos malo» había renunciado. Se informó al Duque, que el 24 de mayo aceptaba a Valdivia, «[y] sin que sirba de exemplar el no haberme propuesto dos personas segun costumbre por no hallar otros opositores a proposito». El 4 de junio de 1760 Valdivia tomaba posesión del cargo, aunque no de forma definitiva, ya que sin ser sacerdote no podía ocupar una ración. Entre tanto, se decidió concedérsela en «encomienda».​ Magisterio en la Colegiata de Olivares Su estancia en Olivares transcurrió sin grandes sobresaltos y su nombre no aparece muy a menudo en las actas. En agosto de 1671 cayó enfermo y tuvo que ser sustituido durante las fiestas patronales de la Virgen de las Nieves por el organista Mayorga. Se ausentaría una segunda vez según las actas, pero no se indica la razón.​ En marzo de 1672 el cabildo apremió a Valdivia para que «se ordenase de orden sacro». En abril se realizó un segundo aviso, al que Valdivia respondió en junio de ese año con la ordenación de subdiácono. El 22 de diciembre se celebró oficialmente la toma de posesión del cargo en una ceremonia que no pudo finalizarse ya que faltaban los estatutos. Esta parte de la ceremonia, en la que se leían los estatutos, fue finalizada cuatro días más tarde. A partir de ese momento comenzó a participar como miembro del cabildo colegial.​ En 1674 hubo problemas con el cumplimiento en el magisterio de Valdivia y se decidió fijar sus obligaciones en el Libro blanco, escrito por Felipe Berejano y Juan Mayorga. Entre sus obligaciones estaba la de dar clases de canto de órgano a todo el que lo solicitase, en una clase diaria, pero durante años fue el músico Miguel Gascón el que daba estas clases a los mozos del coro hasta por lo menos 1772. Una vez superado el asunto, el mayor problema de la capilla era la financiación. De hecho, de las ocho plazas de cantores fijadas en los estatutos, solo se crearon cuatro y de ellas solo se ocuparon tres. Incluso se especuló con la eliminación del bajonista, lo que finalmente no se llevó a cabo. En 1770 el cabildo le recordó al maestro que debía adaptarse a las circunstancias de la capilla de música, «con arreglo a las vozes que tiene en la Capilla». También le recordó que la capilla no ensayaba lo suficiente.​ Hasta 1792 la vida en la capilla de música transcurrió sin sobresaltos. En ese año el cabildo se queja de la falta de composiciones nuevas del maestro, además del uso de composiciones de otros compositores. El maestro iba repitiendo sus composiciones una y otra vez de forma que 20 obras suyas fueron usadas en 72 ocasiones. En 1800 hubo una epidemia de fiebre amarilla, que se llevó a tres mozos del coro: Plácido Cotán, José María Espinosa y Manuel de Jesús Martín.​ Además del magisterio, con el tiempo llegó a ocupar otros cargos: secretario capitular en una ocasión, mayordomo comunal en 20 ocasiones, colector o contador durante dos años y clavero en seis ocasiones. Su último cargo fue de mayordomo comunal en 1808. En 1810 pasaron las tropas francesas por Olivares, lo que llevó a la Colegiata a reducir las actividades musicales, hasta el punto de que en 1810 el Cabildo decide «qe interin las tropas permaneciesen en el pueblo se tubiesen las oras canonicas rezadas.»​ Últimos años y fallecimiento En 1809 y 1810 se notan en las actas numerosas ausencias de Valdivia y el 14 de julio de 1810 las actas notan:​ Las siguientes noticias son ya de su fallecimiento en Olivares, el 12 de marzo de 1811:​ De sus testamentos, uno de su propia mano y uno por poder, se deduce que Valdivia tenía una posición acomodada. Poseía una casa y un terreno agrícola en su propiedad. Sus deudas con la Colegiata, 1328 reales en trigo y 3000 en efectivo, causadas por la crisis de 1804, debían ser pagadas poco a poco con rentas que le pertenecían hasta ser extinguidas. Entregó ambos en usufructo a Catalina Cedillos, la ama que se encargaba de la casa, y a Isabel Pallares. Cedillos falleció poco después y fue solamente Isabel Pallares quien disfrutaría de los bienes. El caso de Pallares es curioso: se crio en la casa de Valdivia con la ama, sin ser familia de ambos ni huérfana, ya que los padres seguían viviendo en el pueblo. De hecho, Vladivia dejó mencionado explícitamente que los padres de Pallares no debían interferir con el disfrute de las propiedades. Las propiedades mismas irían para su sobrino.​ Parece ser que el reverendo Valdivia no se dedicaba exactamente a ser prestamista, pero hubo muchos deudores que le debían dinero. Valdivia, como canónigo, poseía un salario estable y los olivarenses acudían al maestro para cubrir sus necesidades. En el testamento se citan a los mayores deudores, de los que a dos se les perdonan las deudas. También se perdonaron todas las deudas a aquellos que no llegasen a cien reales de vellón, que debían ser un número considerable.​ Obra Se conservan un número extraordinario de composiciones de Valdivia: 221 obras en la Colegiata de Olivares. Entre ellas se cuentan 148 villancicos y «cantadas» en romance, y 73 obras litúrgicas en latín. De hecho forman el 42% de las obras conservadas en el archivo, convirtiéndole en el compositor más prolífico de la colegiata.​​ Su obra sigue interpretándose, como fue el caso en 2015 en Córdoba​ y 2016 en Baeza.​",
            "Andrés de Valdivia y Salido (Úbeda, 1517​- San Juan de Úbeda —actual Valdivia—, 25 de abril de 1575)​ fue un escribano y conquistador español de mediados del siglo xvi, muerto por los indios en la comarca de su gobernación en San Andrés de Cuerquia en 1575. Era escribano de Anserma. Biografía Andrés de Valdivia nació en el barrio del Alcázar de la castellana ciudad de Úbeda, siendo sus padres Rodrigo de Valdivia e Inés Salido, y bautizado el 13 de enero de 1517.​ Casó en Úbeda con Juana de Loaisa y tuvo cuatro hijos llamados Luis, Luisa, María y Elena. Solo Luisa y Elena tuvieron descendencia.​ En 1569 es nombrado por el rey de España gobernador y capitán general de las provincias del Nuevo Reino de Granada —la actual Colombia— de Antioquia, Ituango, Nive y Brenduco, la tierra entre los dos ríos y la provincia de Urabá hasta en mar del Norte.​ De carácter exaltado y belicoso, se internó con sus huestes en las vertientes del norte de la Cordillera Central colombiana, y llegó en su exploración hasta la hoya del río Cauca, donde gobernaban los caciques Guarcama, Cuerpia, Pipimán, Ozeta, Maquira y Aguarizí. El 24 de junio de 1574 fundó en la Loma de Noava con el nombre de San Juan de Úbeda un asentamiento en recuerdo a su ciudad natal —en el entonces Reino de Jaén— en España.​ Avanzado el siglo xvi, en marzo de 1575,​ cuando era gobernador de Antioquia y antes de que don Gaspar de Rodas fuera el siguiente gobernador de esta provincia, los guerreros del cacique Guarcama, de la etnia indígena de los nutabes, tras feroces combates, dieron muerte a Valdivia y todos sus soldados en una acción conocida como «la Matanza».​ La muerte de Valdivia fue especialmente cruel. El jefe indígena insultó al gobernador, tratándolo de «bellaco gobernador, tú eres un perro y bellaco ladrón y como perro bellaco me lo tengo que comer ahora en pago de los males que ha hecho a mí y a los míos. Dele que yo me lo comeré a él ahora como conejo o venado, y que cuando su Rey envíe acá otros españoles, también habrá manos y dientes para ellos», según palabras de fray Pedro Simón, citado por Roberto Cadavid Misas en su Historia de Antioquia, quien finaliza diciendo: «Al punto arremetieron cuatro y, desnudándolo, le cortaron la cabeza y se bebían la sangre a cual más podía, como perros en el matadero. Hiciéronlo en un punto cuartos y le comieron los hígados allí luego, sin llegarlos al fuego, repartieron la carne entre los más principales». Los indígenas cortaron las cabezas de los españoles y las exhibieron en palos durante un buen tiempo como escarmiento. No obstante, poco después el gobernador Gaspar de Rodas tomaría represalias y acabaría con los indígenas.",
            "Andrés de Vandelvira, Vandaelvira o Valdelvira (Alcaraz, c. 1505-Jaén, 1575)​ fue un arquitecto y cantero renacentista español. Fue un varón de gran cultura; estudió los tratados más famosos de la época, y los puso en práctica gracias a los mecenas que encontró, principalmente en la provincia de Jaén, como la misma Diócesis, quien le encomendó la Catedral jiennense, y los nobles relacionados con la familia Cobos en Úbeda, como Francisco de los Cobos y Molina, quien le mandó construir la Sacra Capilla del Salvador. Conocedor y heredero de la larga tradición gótica en la península, fue el inventor de la bóveda vaída y de otras ingeniosas soluciones constructivas. Biografía Primeros años De posible origen flamenco, atendiendo a su apellido,​ debe descartarse que se formase al lado de su supuesto padre al que Antonio Ponz y Eugenio Llaguno y Amirola llamaron Pedro de Vandelvira, que había estudiado en Italia.​ En todo caso, ya en 1523, cuando rondaría los dieciocho años, se le documenta haciendo modestos trabajos de cantería en Alcaraz, como el convento de San Francisco y la iglesia de San Ignacio.​ Pudo aprender el oficio con Francisco de Luna, maestro de cantería, pues contrajo matrimonio con su hija Luisa de Luna, de Villacarrillo, con la que tuvo siete hijos, uno de los cuales, Alonso de Vandelvira, escribió un Libro de cortes de piedra, en el cual difunde la disciplina de la montea o estereotomía o plano constructivo en tres dimensiones, que ayudó a que la obra técnica de su padre fuera conocida en Europa. Con 21 años aparece Vandelvira en unas ambiciosas obras del Convento de Uclés, obra iniciada por Francisco de Luna en 1529; su participación, «a la sombra de la escuela plateresca toledana», es uno de los ingredientes formativos de su personalidad. Llevado por esta influencia realizó en 1531 la plaza mayor de su localidad natal, en Alcaraz, y numerosas construcciones civiles y religiosas alrededor de esta como la portada del Alhorí y la torre del Tardón.​ Provincia de Jaén Existen evidencias de que en 1533 habitó en Villacarrillo, comenzando su etapa en la provincia de Jaén, donde intervino en iglesia de la Asunción, realizada en tres naves divididas por cinco columnas corintias por banda y el retablo mayor y colaterales. En dicha parroquia fundó una capellanía a favor de su hijo el presbítero y licenciado Pedro de Vandelvira. En este municipio fue donde nacieron la mayoría de sus hijos, donde acopió la mayor parte de su patrimonio e incluso adquirió una vivienda que conservó hasta su muerte. Gracias a su mentor Francisco de Luna, trabajó en pequeñas obras en Orcera, Hornos y Segura de la Sierra.​ Úbeda En esos años se encontraba Francisco de los Cobos, secretario de Estado del emperador Carlos I, realizando un gran proyecto de modernización de la ciudad de Úbeda con la construcción de nuevas y grandes instalaciones. Vandelvira, conocedor de estos hechos, marchó hacia Sabiote y, más tarde, Úbeda, donde se adjudicó las obras de la Sacra Capilla del Salvador en 1536, proyecto iniciado por Diego de Siloé para la construcción de un templo funerario para De los Cobos, y del convento de Santa Clara.​ A partir de entonces los encargos no pararon: el deán Fernando Ortega le encomendó la denominada iglesia de San Nicolás, así como el palacio del Déan Ortega, junto a la iglesia del Salvador; mientras que el Consejo de Úbeda le encargó el puente Ariza y otras obras civiles. Estas construcciones llevaron al inicio del establecimiento de mansiones para la familia Cobos como el palacio de las Cadenas, realizado para el también secretario de Estado Juan Vázquez de Molina; el palacio Vela de los Cobos, encargado por Francisco Vela de los Cobos, alcalde de la ciudad; el Hospital de Santiago, para el obispo de Jaén Diego de los Cobos; o el palacio del marqués de la Rambla. Todas esta construcciones le llevaron a residir en Úbeda aproximadamente entre 1536 y 1555.​ La catedral de Jaén y otras obras provinciales Entre otras actuaciones en la provincia, fue el encargado de edificar para Rodrigo Messia Carrillo, señor de La Guardia de Jaén, el convento de Santo Domingo, también conocido como de Santa María Magdalena; el proyecto de la iglesia de Santa María de Cazorla, actualmente en ruinas. En Baeza, probablemente queriendo replicar el modelo de Francisco de los Cobos, Diego Valencia de Benavides, noble local, encargó a Vandelvira la construcción de una capilla funeraria en la iglesia de San Francisco en 1558, conocida como capilla de los Benavides, por desgracia perdida en parte tras el terremoto de 1755.​ Centrado en su época de mayor madurez artística, Vandelvira participó en el concurso para la realización de la Catedral de Jaén, al que ya habían sido convocados otros artistas de renombre como Jerónimo Quijano y Pedro Machuca, aunque finalmente fue Vandelvira quien adquirió el puesto de maestro mayor de obras en 1553. Durante su vida solo pudo terminar un cuerpo adicional, donde se encontraba la sacristía, la sala capitular y la bóveda de enterramiento con las dependencias altas. El contrato en la catedral jiennense evocaba la necesidad de recuperar también otros proyectos dirigidos por la Diócesis de Jaén, como la modernización de otros templos religiosos del estilo gótico al renacentista, tal y como se encomendó en la Catedral de Baeza, así como la iglesia de la Inmaculada Concepción de Huelma, la basílica de Santa María la Mayor de Linares y el santuario de la Virgen de la Cabeza.​ También se le atribuye la traza de la nave central de la iglesia de La Asunción en Jódar. Vandelvira mostró su disposición a ser enterrado en la basílica de San Ildefonso de Jaén con la túnica de la cofradía de la Vera Cruz, aunque sus restos mortales aún no han sido localizados.​ Otros Fueron numerosos los encargos de Vandelvira fuera de la provincia de Jaén, destacando los elaborados en la provincia de Cuenca, donde intervino en la Catedral de Cuenca, donde alcanzó de puesto de maestro mayor (1560-1567) sin obligación de residencia, comprometido en Jaén; el puente de San Pablo en la misma ciudad, así como en la iglesia de Santiago Apóstol y la Casa Consistorial de la ciudad de San Clemente (1554). Asimismo, fue consultado para el diseño de la Catedral de Málaga (1550), nuevas dependencias en la Catedral de Sevilla o la tasación de las remodelaciones en una capilla de la Catedral de Guadix.​ Iglesia de la Asunción en Hellín con réplicas de la catedral de Jaén. Honores En noviembre de 2011 levantó columnas en la ciudad de Jaén la Respetable Logia Andrés de Vandelvira, n.º 175 de la Gran Logia de España (GLE), la cual trabaja el Rito Francés. En su honor se le puso nombre a la Autovía A-32 Linares-Albacete «Andrés de Vandelvira». También lleva su nombre en su honor el Colegio Cooperativa Andrés de Vandelria de Jaén, el Instituto de Educación Secundaria Andrés de Vandelvira de Albacete y el Instituto de Educación Secundaria Andrés de Vandelvira de Baeza, Jaén.",
            "Juan Martínez Martí (Cocentaina, 1708 - Jaén, 23 de julio de 1767) fue un compositor y maestro de capilla español.​​​ Vida Hay poca información sobre la vida de Juan Martínez. Fue hijo de Juan Martínez y Vicenta Martí, habiendo nacido en 1708 en Cocentaina, en la provincia de Alicante.​ Gembero Ustárroz identifica a Martínez con el maestro de capilla de la Iglesia de Santa Anta de Sevilla, que compuso villancicos de maitines en 1729, 1730 y 1731, dedicadas respectivamente a Felipe Alonso Coeces, Francisco de Craywinckel y José de Rivas. El villancico dedicado a Felipe Alonso Coeces, Para liberar su reino, tiene tintes políticos, haciendo referencia a la Guerra de sucesión española. En 1732 los estudiantes del colegio mayor de Santo Tomás de Aquino celebraron su fiesta en la parroquia de Santa Ana con un villacinco compuesto por Martínez y dedicado a la Duquesa de Osuna.​ En 1732 se presentó al magisterio de la Capilla Real de Granada sin éxito.​ Tras la partida del maestro Pedro de Arteaga y Valdés hacia la Catedral de Guadix, Martínez consiguió finalmente el cargo de maestro de capilla de la Capilla Real de Granada en 1736. Fue ordenado en 1740 y permaneció en el cargo hasta 1754.​ En 1754, tras el fallecimiento del maestro Juan Manuel de la Puente, el cabildo de la Catedral de Jaén promulgó los edictos para ocupar el cargo vacante: «Que en la provisión del magisterio de capilla se practique lo mismo que en la provisión precedente y que el término de los edictos sea de 50 días». A las oposiciones, aparte de Martínez, se presentaron Cristóbal de Arjona, maestro de la Abadía de Alcalá la Real, y Domingo Graell, maestro de la Colegiata de Baza. Finalmente Martínez tomó posesión del cargo el 27 de noviembre de 1754:​​ Poco más se conoce de la vida de Martínez. Parece que su magisterio en Jaén transcurrió sin conflictos, componiendo para las ocasiones y participando en los exámenes de los músicos de la capilla catedralicia.​ En 1760 realizó un inventario de la música de la catedral.​ Falleció en Jaén a las once y media de la noche, el 23 de junio de 1767.​ Obra En la Catedral de Jaén solo se conserva una obra de Martínez, un Miserere para tinieblas (1763) a cuatro voces.​ Existen diversas obras suyas en el archivo de la Capilla Real de Granada.​"
        ]
    },
    "test_4": {
        "question": "Dame un resumen de la Leyenda del Lagarto de la Malena",
        "reference": "Aunque existen varias versiones, la más aceptada es la siguiente: \"En el barrio de la magdalena había un temible lagarto que atacaba a todas las personas que pasaban por allí a por agua, pues Jaén es muy rica en agua. Los ciudadanos ya estaban hartos y pidieron al rey que enviase a alguien a combatir contra el lagarto. Un preso que estaba condenado se ofreció a cambio de que le liberasen. Pidió la piel de una oveja, pólvora, panes y un caballo. Fue hacía el raudal y empezó a tirarle los panes al enorme lagarto. llegó a una calle sin salida y le tiro la oveja con la pólvora dentro. El lagarto se la tragó. Al cabo de unos minutos explotó y el preso retomó su libertad.\"",
        "response": "La Leyenda del Lagarto de la Malena es una de las más famosas de Jaén. Cuenta la historia de un lagarto que aterrorizaba a los pastores en el siglo XV, comiéndose sus ovejas. Los ciudadanos pidieron ayuda al rey, quien envió a un preso a combatir al lagarto. El preso, con la piel de una oveja, pólvora, panes y un caballo, logró atrapar al lagarto y liberar a la ciudad de su terror. La leyenda se ha convertido en un símbolo de la ciudad, presente en su arquitectura, tradiciones y cultura.",
        "reference_contexts": "['La Leyenda del Lagarto de la Malena (o Lagarto de la Magdalena, o simplemente Lagarto de Jaén) es la más famosa de la capital jienense. La influencia de esta leyenda es tal, que el lagarto ha llegado a convertirse en uno de los símbolos de la ciudad, estando presente en su arquitectura (en el barrio de la Magdalena hay una estatua del lagarto en la fuente junto a la que se supone que habitaba, obra de Damián Rodríguez Callejón), en sus cabalgatas, en sus conciertos (el famoso festival Lagarto Rock), en sus dichos populares y hay quien dice que hasta en la forma de la ciudad, semejante a la de un lagarto, debido a la forma enroscada en torno al cerro de Santa Catalina. Lo cierto es que la tradición de que la ciudad tiene forma de Dragón (en realidad el \"Lagarto de Jaén\" es, según las crónicas antiguas y la propia leyenda, una gran Sierpe o Dragón), cuenta con una antigüedad considerable pues, incluso, en el escudo de la Catedral de Jaén se duda si la figura del Dragón simboliza el mal o la propia ciudad de Jaén, simbolizada por un monte circundado de murallas y sobre el mismo una Virgen con el Niño Jesús en sus brazos. Ya en el siglo XVI se escribió, y así figura en escrito anónimo custodiado en la Biblioteca Nacional, que Jaén tenía las funciones vitales distribuidas al igual que el cuerpo de un dragón. Parte de la fama de la leyenda fuera de la provincia de Jaén —principalmente en Granada, Ciudad Real, Albacete y Almería— le viene por el uso local de la expresión \"Así revientes como el lagarto Jaén\", utilizada para maldecir. En la ciudad de Jaén es más común el uso de \"reventar como el lagarto la Malena\", pues el barrio y la leyenda son conocidos y es tanto una maldición como un dicho tradicional cuando alguien come en exceso, a modo de una advertencia. Actualmente es candidata a ser catalogada por la UNESCO como Patrimonio Cultural Inmaterial de la Humanidad, ya que previamente, el día 2 de julio de 2009 fue declarada como uno de los diez Tesoros del Patrimonio Cultural Inmaterial de España\\u200b por parte del Bureau Internacional de Capitales Culturales.\\u200b Posteriormente el Ayuntamiento de Jaén decidió declarar el 2 de julio como Día del Lagarto de La Magdalena.\\u200b\\u200b Leyenda Según el mito, cuya primera referencia escrita data de 1628, en una cueva junto a la fuente de la Magdalena apareció un lagarto de grandes dimensiones (Gran Sierpe o Dragón), que atemorizaba a la gente y (dependiendo de la versión) se comía a quien iba a por agua o a las ovejas de los alrededores. Los vecinos de la Magdalena, asustados, no se atrevían a salir al manantial, por lo que buscaron una solución al problema del lagarto. En este punto, la leyenda se diversifica, habiendo tres versiones distintas de la muerte del reptil: El preso y los panes Un preso condenado a muerte solicitó su libertad a cambio de matar al lagarto. Tal era la desesperación de los vecinos que se le concedió la oportunidad de intentarlo. Para ello, solicitó un caballo, un costal de panes calientes y un saco con pólvora. Por la noche, el preso se presentó junto a la cueva y fue dejando una hilera de panes. El animal se despertó y se los fue comiendo tras el preso, que continuaba lanzando panes mientras huía a caballo. Al llegar a la plaza de San Ildefonso, en lugar de un pan le lanzó el saco de pólvora, que el animal devoró del mismo modo y, acto seguido, explotó. Según estudiosos del tema como Alfredo Cazabán y Juan Eslava Galán, esta versión es la más verosímil de las tres, ya que en la Iglesia de San Ildefonso durante mucho tiempo se expuso una piel de reptil, seguramente de un caimán, sobre la que más tarde se pintó un retrato de San Cristóbal con el niño Jesús a hombros. El pastor y la piel de oveja Un pastor, harto de que el lagarto se comiera a sus ovejas, ideó una treta para acabar con el lagarto. Tomó a una de sus ovejas y la mató, sacándole parte de la carne y rellenando el pellejo con yesca encendida. El reptil, al oler el cordero ensangrentado, lo engulló y murió al abrasarle la yesca las entrañas. Esta versión es la más representada y popular. Sin embargo, a veces se mezcla con la primera, cambiando la yesca por pólvora, o al contrario, insertando el detalle de la piel del cordero en la versión del preso. En cualquier caso, estas dos últimas versiones conviven en la sabiduría popular y alimentan el dicho de reventar como el lagarto de Jaén. El caballero y los espejos Los vecinos fueron a pedir ayuda a un guerrero, que se atavió para la ocasión con una armadura hecha de espejos relucientes. Al acercarse al lagarto, el sol reflejado en los cristales cegó al lagarto. El caballero aprovechó ese momento para atravesar al monstruo con su espada. Tal fue la fuerza con la que atravesó al animal que tropezó con una de las piedras del sendero cayendo por uno de los terraplenes cercanos a él. «La sangre del lagarto» «La sangre del lagarto» es un brebaje que se prepara en la ciudad el Día Oficial del Lagarto de la Magdalena. Se prepara calentando sin hervir vino tinto con tres clavos, canela en rama, azúcar, cáscara de limón o naranja y anís. Se puede tomar frío o caliente. Durante su preparación se recita el «conjuro del lagarto».\\u200b Posible interpretación histórica Existe la creencia de que la leyenda podría no ser completamente inventada, y que tendría una motivación histórica. Lo más seguro es que también pertenezca al ingenio popular (especialmente contrastando fechas), pero no deja de ser una interpretación verosímil y curiosa. En uno de los primeros viajes de Colón al Nuevo Mundo, viajaba un jienense como carpintero de a bordo de la carabela. Al llegar a tierra, le asombró un pequeño lagarto, algo más grande que los que había visto en el Viejo Continente, por lo que decidió llevárselo para poder mostrarlo. Ya una vez en Jaén, el animal comenzó a aumentar en voracidad y en tamaño, mientras que su dueño, que desconocía que lo que había transportado era una cría de caimán, se ocupaba en buscarle carne para tenerlo saciado. Con el tiempo, el reptil necesitaba carne en abundancia, por lo que el propio dueño era quien robaba los corderos a sus vecinos para alimentar al animal. Harto de tener que llevar esta actitud, liberó al reptil, que al ser visto por la gente de la zona fue descrito como un lagarto enorme, un monstruo. Pese a que esta historia parece concordar con la piel de caimán expuesta en la Iglesia de San Ildefonso, lo más probable es que sea inventada, ya que no consta explícitamente tal carpintero en los viajes de Colón y parece difícil que una persona pudiera mantener a un caimán. La piel expuesta posiblemente no fuera más que un regalo traído desde la propia América, algo bastante común en los años siguientes a su descubrimiento. Trabajos científicos sobre el mito del Lagarto de la Magdalena Existe un trabajo riguroso sobre el mito de la Leyenda del Lagarto de Jaén, que entronca la leyenda con la misma familia de mitos mediterráneos y que considera que su origen es indo-mesopotámico y sería portada hasta esa ciudad andaluza por los buscadores de metales sirio-fenicios o por los judíos, estos últimos una comunidad porcentualmente importante a lo largo de los siglos medievales en la ciudad (entre el 8 y el 10% de la población local). El Lagarto de Jaén no es sino el mito del Dragón, localizado e incardinado de tal modo en el panorama cultural y popular a nivel local que se ha convertido en todo un símbolo de la ciudad y de sus propios habitantes desde hace siglos. Todos los recientes estudios apuntan a la localización en Jaén de un mito universal, el del Dragón, que una vez llegado a la ciudad en un periodo indeterminado entre dos y tres milenios atrás, se incardinó fuertemente y se vio reforzado por las sucesivas culturas dominantes, en cuya mitología también figuraba el mito del Dragón. La festividad del Lagarto de la Magdalena Anualmente, durante los últimos días de junio y primeros de julio, la asociación cultural IUVENTA, en colaboración con el Ayuntamiento de Jaén y Diputación, organizan una serie de actividades dedicadas a la Leyenda: Visitas guiadas, teatro, música, cuentacuentos y un gran pasacalles que recorre el mismo itinerario que, según la tradición, realizó el Lagarto de la Malena antes de ser derrotado. La nueva pieza musical «En apoyo a la leyenda: obra musical del Lagarto de la Magdalena» El 27 de junio de 2024 se presentó, a iniciativa del Ayuntamiento de Jaén, la nueva obra musical «En apoyo a la leyenda: obra musical del Lagarto de la Magdalena». Se trata de la primera vez que una leyenda local cuenta con una banda sonora como si de una película se tratase. La pieza musical, de unos 9 minutos de duración, está compuesta mediante música programática y está segmentada en seis episodios, acordes al desarrollo de la historia de la leyenda. La idea es reforzar, complementar y enfatizar la legendaria historia a través de la música, con la intención de facilitar la transmisión del patrimonio cultural a las generaciones futuras.\\u200b']",
        "retrieved_contexts": [
            "La Leyenda del Lagarto de la Malena (o Lagarto de la Magdalena, o simplemente Lagarto de Jaén) es la más famosa de la capital jienense. La influencia de esta leyenda es tal, que el lagarto ha llegado a convertirse en uno de los símbolos de la ciudad, estando presente en su arquitectura (en el barrio de la Magdalena hay una estatua del lagarto en la fuente junto a la que se supone que habitaba, obra de Damián Rodríguez Callejón), en sus cabalgatas, en sus conciertos (el famoso festival Lagarto Rock), en sus dichos populares y hay quien dice que hasta en la forma de la ciudad, semejante a la de un lagarto, debido a la forma enroscada en torno al cerro de Santa Catalina. Lo cierto es que la tradición de que la ciudad tiene forma de Dragón (en realidad el \"Lagarto de Jaén\" es, según las crónicas antiguas y la propia leyenda, una gran Sierpe o Dragón), cuenta con una antigüedad considerable pues, incluso, en el escudo de la Catedral de Jaén se duda si la figura del Dragón simboliza el mal o la propia ciudad de Jaén, simbolizada por un monte circundado de murallas y sobre el mismo una Virgen con el Niño Jesús en sus brazos. Ya en el siglo XVI se escribió, y así figura en escrito anónimo custodiado en la Biblioteca Nacional, que Jaén tenía las funciones vitales distribuidas al igual que el cuerpo de un dragón. Parte de la fama de la leyenda fuera de la provincia de Jaén —principalmente en Granada, Ciudad Real, Albacete y Almería— le viene por el uso local de la expresión \"Así revientes como el lagarto Jaén\", utilizada para maldecir. En la ciudad de Jaén es más común el uso de \"reventar como el lagarto la Malena\", pues el barrio y la leyenda son conocidos y es tanto una maldición como un dicho tradicional cuando alguien come en exceso, a modo de una advertencia. Actualmente es candidata a ser catalogada por la UNESCO como Patrimonio Cultural Inmaterial de la Humanidad, ya que previamente, el día 2 de julio de 2009 fue declarada como uno de los diez Tesoros del Patrimonio Cultural Inmaterial de España​ por parte del Bureau Internacional de Capitales Culturales.​ Posteriormente el Ayuntamiento de Jaén decidió declarar el 2 de julio como Día del Lagarto de La Magdalena.​​ Leyenda Según el mito, cuya primera referencia escrita data de 1628, en una cueva junto a la fuente de la Magdalena apareció un lagarto de grandes dimensiones (Gran Sierpe o Dragón), que atemorizaba a la gente y (dependiendo de la versión) se comía a quien iba a por agua o a las ovejas de los alrededores. Los vecinos de la Magdalena, asustados, no se atrevían a salir al manantial, por lo que buscaron una solución al problema del lagarto. En este punto, la leyenda se diversifica, habiendo tres versiones distintas de la muerte del reptil: El preso y los panes Un preso condenado a muerte solicitó su libertad a cambio de matar al lagarto. Tal era la desesperación de los vecinos que se le concedió la oportunidad de intentarlo. Para ello, solicitó un caballo, un costal de panes calientes y un saco con pólvora. Por la noche, el preso se presentó junto a la cueva y fue dejando una hilera de panes. El animal se despertó y se los fue comiendo tras el preso, que continuaba lanzando panes mientras huía a caballo. Al llegar a la plaza de San Ildefonso, en lugar de un pan le lanzó el saco de pólvora, que el animal devoró del mismo modo y, acto seguido, explotó. Según estudiosos del tema como Alfredo Cazabán y Juan Eslava Galán, esta versión es la más verosímil de las tres, ya que en la Iglesia de San Ildefonso durante mucho tiempo se expuso una piel de reptil, seguramente de un caimán, sobre la que más tarde se pintó un retrato de San Cristóbal con el niño Jesús a hombros. El pastor y la piel de oveja Un pastor, harto de que el lagarto se comiera a sus ovejas, ideó una treta para acabar con el lagarto. Tomó a una de sus ovejas y la mató, sacándole parte de la carne y rellenando el pellejo con yesca encendida. El reptil, al oler el cordero ensangrentado, lo engulló y murió al abrasarle la yesca las entrañas. Esta versión es la más representada y popular. Sin embargo, a veces se mezcla con la primera, cambiando la yesca por pólvora, o al contrario, insertando el detalle de la piel del cordero en la versión del preso. En cualquier caso, estas dos últimas versiones conviven en la sabiduría popular y alimentan el dicho de reventar como el lagarto de Jaén. El caballero y los espejos Los vecinos fueron a pedir ayuda a un guerrero, que se atavió para la ocasión con una armadura hecha de espejos relucientes. Al acercarse al lagarto, el sol reflejado en los cristales cegó al lagarto. El caballero aprovechó ese momento para atravesar al monstruo con su espada. Tal fue la fuerza con la que atravesó al animal que tropezó con una de las piedras del sendero cayendo por uno de los terraplenes cercanos a él. «La sangre del lagarto» «La sangre del lagarto» es un brebaje que se prepara en la ciudad el Día Oficial del Lagarto de la Magdalena. Se prepara calentando sin hervir vino tinto con tres clavos, canela en rama, azúcar, cáscara de limón o naranja y anís. Se puede tomar frío o caliente. Durante su preparación se recita el «conjuro del lagarto».​ Posible interpretación histórica Existe la creencia de que la leyenda podría no ser completamente inventada, y que tendría una motivación histórica. Lo más seguro es que también pertenezca al ingenio popular (especialmente contrastando fechas), pero no deja de ser una interpretación verosímil y curiosa. En uno de los primeros viajes de Colón al Nuevo Mundo, viajaba un jienense como carpintero de a bordo de la carabela. Al llegar a tierra, le asombró un pequeño lagarto, algo más grande que los que había visto en el Viejo Continente, por lo que decidió llevárselo para poder mostrarlo. Ya una vez en Jaén, el animal comenzó a aumentar en voracidad y en tamaño, mientras que su dueño, que desconocía que lo que había transportado era una cría de caimán, se ocupaba en buscarle carne para tenerlo saciado. Con el tiempo, el reptil necesitaba carne en abundancia, por lo que el propio dueño era quien robaba los corderos a sus vecinos para alimentar al animal. Harto de tener que llevar esta actitud, liberó al reptil, que al ser visto por la gente de la zona fue descrito como un lagarto enorme, un monstruo. Pese a que esta historia parece concordar con la piel de caimán expuesta en la Iglesia de San Ildefonso, lo más probable es que sea inventada, ya que no consta explícitamente tal carpintero en los viajes de Colón y parece difícil que una persona pudiera mantener a un caimán. La piel expuesta posiblemente no fuera más que un regalo traído desde la propia América, algo bastante común en los años siguientes a su descubrimiento. Trabajos científicos sobre el mito del Lagarto de la Magdalena Existe un trabajo riguroso sobre el mito de la Leyenda del Lagarto de Jaén, que entronca la leyenda con la misma familia de mitos mediterráneos y que considera que su origen es indo-mesopotámico y sería portada hasta esa ciudad andaluza por los buscadores de metales sirio-fenicios o por los judíos, estos últimos una comunidad porcentualmente importante a lo largo de los siglos medievales en la ciudad (entre el 8 y el 10% de la población local). El Lagarto de Jaén no es sino el mito del Dragón, localizado e incardinado de tal modo en el panorama cultural y popular a nivel local que se ha convertido en todo un símbolo de la ciudad y de sus propios habitantes desde hace siglos. Todos los recientes estudios apuntan a la localización en Jaén de un mito universal, el del Dragón, que una vez llegado a la ciudad en un periodo indeterminado entre dos y tres milenios atrás, se incardinó fuertemente y se vio reforzado por las sucesivas culturas dominantes, en cuya mitología también figuraba el mito del Dragón. La festividad del Lagarto de la Magdalena Anualmente, durante los últimos días de junio y primeros de julio, la asociación cultural IUVENTA, en colaboración con el Ayuntamiento de Jaén y Diputación, organizan una serie de actividades dedicadas a la Leyenda: Visitas guiadas, teatro, música, cuentacuentos y un gran pasacalles que recorre el mismo itinerario que, según la tradición, realizó el Lagarto de la Malena antes de ser derrotado. La nueva pieza musical «En apoyo a la leyenda: obra musical del Lagarto de la Magdalena» El 27 de junio de 2024 se presentó, a iniciativa del Ayuntamiento de Jaén, la nueva obra musical «En apoyo a la leyenda: obra musical del Lagarto de la Magdalena». Se trata de la primera vez que una leyenda local cuenta con una banda sonora como si de una película se tratase. La pieza musical, de unos 9 minutos de duración, está compuesta mediante música programática y está segmentada en seis episodios, acordes al desarrollo de la historia de la leyenda. La idea es reforzar, complementar y enfatizar la legendaria historia a través de la música, con la intención de facilitar la transmisión del patrimonio cultural a las generaciones futuras.​",
            "La Leyenda de El Pósito es una hermosa leyenda que forma parte del “Romancero de Jaén” (1861). Cuenta la historia de amor entre un capitán de los Tercios de Flandes, Diego de Osorio, y una hermosa dama de la ciudad de Jaén, Beatriz de Uceda . Argumento Cuenta esta antigua historia un triste acontecimiento de amor entre un apuesto galán y una hermosa dama de la ciudad de Jaén. Dicen que llegó a Jaén un capitán, posiblemente de los Tercios de Flandes, galante, uniformado, de mirada penetrante, rostro curtido y de valerosos carácter. Se comentaba que el valiente y apuesto galán era muy rico. Tan grande era su fortuna personal que contar lo que tenía causaba un increíble asombro en aquel que lo escuchara. Se hablaba de él en toda la ciudad. Las doncellas casaderas de Jaén, clavaban en él sus ojos y lo observaban con esmerado interés cuando salía a pasear por la villa. A pesar de tener a tantas hermosas damas a sus pies, el galán se enamoró intensamente de una joven llamada Dª Beatriz de Uceda. Tenía esta doncella una belleza extraordinaria, un contorno perfecto y una discreción propia de las señoras de su clase. Era ejemplo de virtudes: noble, sincera, prudente, dulce y cándida. El apuesto galán, cuyo nombre era Don Diego de Osorio, quedó tan prendado de ella que ocupaba Doña Beatriz todos sus pensamientos. Constantes fueron sus regalos y atenciones hacia la joven. Siempre solícito a lo que ella deseara, siguiendo sus pasos allá por donde fuera y propiciando decenas de encuentros para impresionar a la hermosa dama. Sin embargo Doña Beatriz, tenía el corazón ocupado por otro caballero. Aun así, por las circunstancias que fueran, casó finalmente Beatriz de Uceda con el Capitán Osorio, dejando en el recuerdo a aquel hombre que tan intensamente amó. La boda se celebró por todo lo alto, que si rico era el novio no menos lo era la novia. Dicen que disfrutaron de días alegres, donde todo fue tranquilidad y sosiego. Doña Beatriz intentó ser feliz en su matrimonio, entregándose en cuerpo y alma a Don Diego. Poco tiempo habría de pasar, para tener Beatriz que volver a dar muestras de su bondad y dulzura innatas. Soportó abnegada a su esposo, que si en otro tiempo fue galante y educado en extremo, se transformó el caballero en hombre de malos caminos , juntando en sus espectaculares juergas la noche con el día, enviciándose en el juego y en lo más infames placeres terrenales. Conforme pasaba el tiempo más se endeudaba Don Diego de Osorio, perdiendo su dinero en los más fracasados juegos, viéndose inmerso en encrespadas riñas...Una batería de tormentos para su sufrida esposa, la triste Beatriz, quien ahogaba sus sentimientos hacia la actitud de su marido. Soportando a duras penas tan desdicha y fracasada vida matrimonial. Y al final, el desenlace a tan desesperante situación llegó. Hasta la última moneda gastó el Capitán Osorio. Nadie quedaba en la ciudad que le diera prestado y obligado estaba a pagar las pérdidas acumuladas en sus desafortunados juegos. Viéndose desesperado y necesitado de dinero en medio de uno de sus juegos, ordenó a un sirviente que fuera hasta su casa, y que Doña Beatriz le entregara de inmediato la alhaja que él le regaló en señal de matrimonio. Rápido fue el escudero a trasladar a Doña Beatriz tan desagradable e inconcebible recado. Escuchó Doña Beatriz con cara de asombro el relato del criado, agachó su lloroso rostro y, llena de coraje, mandó de nuevo al sirviente con un recado para su Señor. Si quería su esposo esa alhaja que con tanto celo guardaba, que se la pidiera a ella en persona, sin intermediarios, que ella misma, con sus propias manos se la entregaría. Volvió el escudero, apenado por su señora, a trasladar el mensaje al Capitán Diego de Osorio, comunicándole a este lo que de Doña Beatriz escuchó. Duras burlas levantó el mensaje de su esposa en la concurrida sala. Avergonzado y furioso de que Beatriz no cumpliera la petición que él le hizo, acostumbrado hasta entonces a una impecable sumisión de sus esposa, se dirigió hacia el punto establecido por Doña Beatriz para encontrarse, la plaza del Pósito. Allí la vio al instante, al pie de la cruz que se alza en medio del lugar, se acercó, extendió ella su mano y le entregó la alhaja, disimulando su llanto, como quién entrega su más valioso tesoro. Él le arrebató la joya con un insolente tirón, y una vez la tuvo en su poder, visiblemente enfurecido, clavó en Doña Beatriz una daga que acabó de inmediato con la sufrida vida de la dama. Pronto corrió la noticia y toda la ciudad se enteró de la tragedia. Fue entonces cuando el novio, Don Lope de Haro, despechado lo retó y mató durante una lucha que tuvo lugar en la famosa Plaza del Pósito de Jaén. Con visible dolor por todo lo ocurrido, Lope de Haro pronunció las palabras \"Pater Noster\", en el momento en que con su mano apagó la vida del Capitán Osorio. Cuenta la leyenda que, desde entonces, el afligido fantasma de Don Lope de Haro, vuelve hasta la cruz del Pósito a rezar un Padre Nuestro, todos los aniversario de este trágico día. La versión actual es que el joven, arrepentido de haber acabado con la vida de otro hombre, decidió tomar los hábitos de San Francisco como fraile en el convento que aquellos tiempos existía el actual Palacio de la Diputación Provincial de Jaén. La leyenda cuenta que algunas noches de frío ven en la Plaza del Pósito vagar a un fantasma negro que se para ante la cruz y reza arrepentido por haber matado a otra persona. Distintos historiadores de la provincia de Jaén y más concretamente de su capital, han recogido estos curiosos hechos sobre la Plaza del Pósito y hay quien dice que, como en toda leyenda, en sus detalles existe algo que es aún fiel a la verdad.",
            "Cuadrilla de costaleros de la cofradía del Nazareno de Linares, que realiza su estación de penitencia cada viernes santo de la Semana Santa de Linares, portando a Nuestra Señora del Mayor Dolor (popularmente, \"la Niña\"). Orígenes Las antiguas imágenes, normalmente de pequeño tamaño, solían disponerse en una plataforma (“andas”) que descansaba sobre una serie de varales, o grandes listones (en forma de viga) longitudinales al sentido de la marcha. Entonces, los portadores, horquilleros u hombres de trono quedan visibles, por lo que su compostura y decoro ha de ser acorde con el orden y decoro exigidos. Coincidiendo con la renovación de las cofradías tras la guerra civil, existen grandes dificultades para completar las cuadrillas necesarias para portar los tronos. Por ello, se recurre a portadores “profesionales”, normalmente, descargadores de mercancías en los mercados de abastos quienes recibían algún tipo de compensación a cambio. En ocasiones, el comportamiento y estética de estos colectivos distaba mucho de ser la esperada.​ En las anteriores circunstancias, se modifica la estructura del trono para colocar a los portadores en su interior, tras unos cortinajes, por lo que desde el exterior apenas son visibles sus pies. El peso sigue siendo soportado en los hombros, bien a través de un varal por portador, o incluso dos varales (uno por hombro). Probablemente este tipo de portadores o descargadores profesionales introdujeron el costal por lo familiar y habitual en su trabajo; en su trabajo empleaban distintos protectores, la mayoría para la espalda, y utilizando la cabeza como sustento del mismo para evitar movimientos o posiciones incorrectas. Un costal es un saco de arpillera que no sólo servía para contener y transportar mercancía (habitualmente grano, frutas con cáscara dura o alimentos en general con gran consistencia), sino que también servía de medida para su contenido; este saco se enrolla sobre un relleno alargado y mullido (\"morcillo\") que será donde se apoye el peso a portar quedando a la altura de las cervicales. El costal es la herramienta de trabajo del costalero, y su preparación y elaboración constituye una auténtica muestra de su oficio. También existen variaciones en la que los varales de madera son reemplazados por grandes tiras de cuero, y así saldría la Niña (como cariñosamente se le conoce a María Santísima del Mayor Dolor) desde 1943, hasta el estreno del trono que Guillermo Francoso tallase en 1965. En esta época comienza a emplearse la denominación de “Paso” en lugar de “Trono”, dado que el movimiento de la imagen se asemeja al caminar con una oscilación lateral menos pronunciada. Palio del Mayor Dolor Es en 1986 cuando se decide renovar el trono de la Niña, en forma de paso de palio, estrenándose el 28/3/1986, haciendo realidad los deseos de los nazarenos y del pueblo de Linares (durante la última parte del itinerario de 1986, las personas que empujaban el chasis fueron balanceando el trono, dando la sensación de que era portado por costaleros; el ambiente creado era la confirmación de que al año siguiente tenía que ser así).​ En todo este proceso, Alfonso Reyes Estévez (hermano de las Hermandades de Nuestra Señora de la Oliva y Vera Cruz de Salteras) se constituyó en una persona fundamental; desde Salteras, todas las Semanas Santas venía a ayudar a vestir a la Niña, y aportar su buen gusto y originalidad en el montaje del paso; regalo suyo fue el relicario con la imagen de Ntra. Sra. de la Oliva que ha acompañado al paso durante tantos años. También, de sus talleres “Vera-Cruz” salió el techo de palio, y bambalinas, que se realizaron entre los años 1986 y 1987. Las bambalinas estaban bordadas en oro y sedas de colores sobre terciopelo azul marino, en estilo neobarroco. También realizó la saya azul marino o toca que lució aquellos años, hasta 2003 en el que estrenara el bordado de Artesanías San José de Linares. Así como el manto púrpura-burdeos con el escudo de la Cofradía. El palio se sustentaba sobre doce varales plateados (cada uno de ellos donado por un hermano / familia de la cofradía) obra de Manuel de los Ríos (1986), y que a su vez descansaban sobre basamentos circulares; la base de los mismos eran querubines en diferentes posiciones y portando una banda con el nombre de cada apóstol (exceptuando la posición de Judas Iscariote, que se sustituyó por la de San Pablo). Los varales dividían las bambalinas laterales en cinco paños con idénticos bordados. Las frontales se dividían en tres paños separados por unos borlones o cordones dorados; en el central estaba bordado el escudo de la cofradía, rompiendo la corona del mismo el nivel de la crestería. El techo palio está dedicado a Nuestra Señora de Linarejos, patrona de Linares, con lienzos de José Gascón Mateos: La imagen de la Patrona, que se sitúa en el centro del techo, de manera que las caras de ambas imágenes permanezcan lo más próximas entre sí. Cuatro arcángeles réplica de los que encontramos en los frescos del crucero del Santuario de la Patrona, que rodean y encierran a la anterior pintura. De esta manera, el Viernes Santo del 28/3/1988,​ tuvo lugar la primera levantá de los Costaleros del Mayor Dolor, y la de aquel paso para 35 costaleros, en siete trabajaderas. Carlos Chamorro fue su primer capataz, con la ayuda de Luis Rayo (que luego sería capataz del paso del Nazareno y Javier Valcárcel (que al año siguiente sería el primer capataz de las Costaleras de San Juan) y Nacho Viedma como contraguías. En 1990 se completan los espacios entre varales con unas ánforas neobarrocas obra también del orfebre Manuel de los Ríos (1990). En 1993 se estrenó la corona en alpaca plateada, sobredorada, realizada por Orfebrería Sevillana, y que sería restaurada y enriquecida al año siguiente. Y dos años más tarde, el alfiler con el nombre de “Mayor Dolor”. El martillo actual es obra de Ramón León (1994), en forma de volutas y hojas de acanto, destacando una pareja de querubines sobre la visagra del mismo. La primera parte de la candelería se estrena en 1995; es de alpaca plateada, obra del orfebre sevillano Ramón León Peñuelas. Está constituida por 74 candelabros, dispuestos en siete filas a distintas alturas. Los más grandes (“marías”) miden casi un metro, y los más pequeños uso 30 centímetros. En opinión de su autor,​ “Es de las mejoras que he realizado, dado lo rico de su diseño, como posterior desarrollo del mismo, debido a la influencia del pie sobre el fuste o caña, pues mantiene su personalidad de tres caras, rematada por la cabeza o parte alta de forma redonda, tiene además detalles que enriquecen la obra, como las cabezas de ángeles en cada ángulo del pie, dándole ese efecto que las distingue de las demás, es estilo barroco, recordando un poco a los grandes blandones de las catedrales”. El conjunto se completa con el escudo de la cofradía en su parte central. Se completaría en el año 1997. En 2006 se estrenó la bambalina delantera, bordada a mano con oro por Francisco Pérez (Córdoba). También los actuales varales de alpaca plateada y los dos faroles de cola, cincelados a mano en los talleres Angulo de Lucena (Córdoba). Así como el respiradero, también en alpaca, con una clara división en dos niveles para dar la sensación de las estructuras habituales de respiradero más canasto, decorado con cartelas doradas en el frontal y laterales. CMD La primera cuadrilla de los Costaleros del Mayor Dolor se crea en 1988 con 35 costaleros, sin relevos, y demostraron que era posible hacer un itinerario tan diverso y extenso (en kilómetros, pendientes, y en horas) como el que hacía la Cofradía en aquellos años (incluyendo la subida al Paseo de Linarejos). Esta experiencia fue fundamental para reafirmar y motivar aún más si cabe, en el empeño de crear el resto de cuadrillas de la cofradía; y entre ambos hitos, la creación de la cuadrilla de costaleras de San Juan (1989). El bagaje y experiencia de tantos años (la manera de hacerse la ropa, la técnica, el saber andar, las composiciones, … en definitiva todo lo que influye en la forma de cargar) se ha conseguido conservar, compartir y traspasar a las nuevas generaciones de costaleros, año tras año, consiguiendo crear y mantener una personalidad e identidad propia en la forma de llevar a la Nuestra Señor del Mayor Dolor, popularmente la “Niña”. Ello sólo ha sido posible gracias a la ilusión, compromiso, compañerismo y ambiente de la cuadrilla de cada año, que es en realidad una gran familia formada tanto por los actuales como antiguos costaleros. El oficio y saber acumulado no es suficiente para que el paso ande como merece la Niña; por eso, cada año y acabada la Navidad, se preparan los ensayos. Las noches de los fines de semana previos a la Semana Santa, y con 1.600 kilos (el Viernes Santo \"el paso no pesa\"), la parihuela del palio del Mayor Dolor sale a las calles de Linares y vuelven a sonar \"Según San Juan\", Margot,... Durante estos años, también se ha trabajado tanto en recuperar tradiciones, como en convertir en ellas algunas costumbres: los acercamientos al paso de Jesús, las Salves, etc.",
            "La oración del huerto de Getsemaní es un lienzo realizado por el Greco, que se encuentra actualmente en la Iglesia de Santa María la Mayor de Andújar (Jaén).​ Introducción En su catálogo razonado de obras del Greco, Harold Wethey distingue dos variaciones bastante diferentes sobre el tema de la Oración del huerto de Getsemaní. El tipo I comprende tres pinturas de formato apaisado, mientras que los lienzos de formato vertical componen el tipo II. El presente lienzo se considera el prototipo y la mejor versión de este segundo modelo.​ Tema de la obra Este episodio se cita en los cuatro evangelios canónicos, brevemente en el evangelio de Juan, (Jn 18: 1-3),​ y con más detalle en los otros tres. La composición del Greco se basa en el relato del evangelio de Mateo (Mt 26:36-46)​y en el del evangelio de Marcos (Mc 14: 32-42)​—que son casi iguales— pero añadiendo elementos del evangelio de Lucas (Lc. 22: 39-4) como la presencia del ángel, y la representación de Jesús arrodillado y no prosternado, como lo hacen los otros dos evangelios sinópticos.​ Análisis de la obra Datos técnicos y registrales Pintura al óleo sobre lienzo; Dimensiones: 169 x 112 cm; Datación: hacia 1605-1610; Firmado con letras griegas en cursiva, en la parte inferior derecha, sobre una piedra: δομήνικος Θεοτοκóπουλος ε`ποíει.​ Catalogado por Wethey con el n º. 32 y por Tiziana Frati con la referencia153-a.​ Descripción de la obra El grupo de los tres apóstoles durmientes —Pedro, Juan y Santiago— está representado en primer plano, bajo la roca donde se encuentra Jesús. Los elementos del paisaje y la vegetación no tienen un carácter naturalista, sino que son más bien indicaciones. La luz juega con los colores, creando una atmósfera un tanto esquemática. Cada detalle revela una ejecución primorosa, realizada dentro de un espacio más comprimido que el de los lienzos del tipo apaisado.​ Destaca el escorzo de los apóstoles, en actitudes propios del manierismo. mientras que la postura de Cristo tiene ecos del arte bizantino. En la parte central derecha se sitúan Judas y los soldados, acercándose desde la distancia.​ La característica más notable de este lienzo -—y del tipo II en general-—es su colorido rico y fresco, con una sutil variedad de tonos. Jesús lleva una túnica de color rojo -—como en el tipo I— y está arrodillado sobre su manto azul, que contrasta con el color verde del suelo. En la parte superior derecha destaca el ángel, con una resplandeciente vestimenta blanca. El apóstol de la izquierda viste una túnica azul verdosa y un manto anaranjado, mientras que el de la derecha porta una túnica azul oscura, bajo un manto amarillo oscuro. El vestido del apóstol del centro es amarillo, pero de un tono diferente.​ El dibujo de La oración en el Huerto (El Greco) fue tal vez un croquis para alguna de las versiones de este tema.​",
            "Potenciana de Villanueva (Villanueva de la Reina, Jaén, ¿siglo XV? - ¿siglo XVI?) fue una tejedora que vivió retirada como eremita. Es venerada como santa por la Iglesia católica. Biografía Se sabe muy poco de la vida de Potenciana y ni tan siquiera se puede asegurar en qué época vivió. Sabemos ciertamente que fue una mujer sencilla, que vivió austeramente haciendo el oficio de tejedora y vida eremítica retirada en una habitación cerca de la ermita de Los Santos de Villanueva de la Reina, a orillas del río Guadalquivir, en un edificio conservado hoy y llamado «Batán». Vivió y murió con fama de santidad, posiblemente en el siglo XV o XVI, ya que cuando comenzó el proceso de confirmación del culto, en 1628, aún había testimonios que dicen haber visto el telar donde trabajaba la santa; además, en esta época no era extraña la reclusión voluntaria de algunas mujeres beatas.​ Murió y fue enterrada en la Iglesia de Los Santos donde recibió la veneración de los habitantes de Villanueva y su comarca. Veneración El prior del pueblo Juan Acuña del Adarve inició el proceso de confirmación del culto. En 1628 se abrió el sepulcro y las reliquias fueron llevadas a Villanueva mientras se construía una nueva ermita; algunas se enviaron a Andujar y otras a la catedral de Jaén. En 1636 se oficializó el culto por decreto del obispo Baltasar Moscoso y Sandoval y fue canonizada en 1638 durante el papado de Urbano VIII. Las reliquias se instalaron en la nueva ermita el 15 de abril de 1640, pero años después, por el temor a que una crecida del río las pusiese en peligro, fueron nuevamente llevadas a la iglesia de Villanueva, donde reposaron hasta que en 1936, durante la Guerra civil española, fueron profanadas y lanzadas al río, donde se perdieron definitivamente. En el altar de la misma iglesia hay una urna con un hueso de la santa que llegó hasta Villanueva cuando la santa era patrona de Andújar, aunque dejó de serlo en 1909. En las cercanías del sepulcro se le atribuyen propiedades milagrosas, especialmente contra las fiebres palúdicas, que eran frecuentes en la región. La romería de santa Potenciana se celebra en Villanueva el segundo fin de semana de mayo, peregrinando los habitantes del pueblo a El Batanejo y llevando en procesión la imagen de la patrona. Al llegar se hace una comida y por la tarde la procesión vuelve a la iglesia. Bajo su advocación se levantó la iglesia parroquial de Sibaltán, un barrio rural del municipio filipino de primera categoría de El Nido perteneciente a la provincia de Paragua en Mimaro, Región IV-B. Forma parte del Distrito 2 de la Vicaría Apostólica de Taytay sufragánea de la Arquidiócesis de Lipá.​ Leyenda El tiempo borró los detalles de su biografía y comenzaron a elaborar leyendas que quería explicarla de una manera más «heroica». Se conservaba el sepulcro y la memoria que había sido una tejedora pobre que vivía cerca de la iglesia. Al vivir voluntariamente recluida y sin salir de su cámara era, como se llamaba entonces, una «emparedada».​ Con el tiempo, el término se interpretó mal y se pensó que Potenciana había muerto martirizada y que había sido emparedada expresamente para que muriera. La leyenda trasmitida del martirio, para hacerlo posible, trasladaba la santa a épocas remotas y bajo el dominio musulmán, de manera que tuviera lógica esta muerte: así, se situaba en el Califato, hacia los siglos IX-X, o más tarde, pero antes de la conquista cristiana. Así, la versión popular dice que era una joven tejedora de época mozárabe y que, para no renegar de su fe cristiana, fue torturada por los musulmanes y condenada a morir emparedada. La imagen de la iglesia de Villanueva, que se saca anualmente en procesión, la representa con palma de martirio. A pesar de ello, en ningún lugar consta que fuese martirizada y el oficio de su culto es de communi virginum non martyrum. Notas Bibliografía Textos con el informe de Alonso Medina Arellano sobre la historicidad de la santa. Web-Blog de la Hermandad de Santa Potenciana, Patrona de Villanueva de la Reina"
        ]
    },
    "test_5": {
        "question": "¿Cuando sale la procesión del Abuelo?",
        "reference": "La procesión de \"El Abuelo\" sale a las calles el Viernes Santo, puesto que es una marcha que representa a Jesucristo llevando la cruz.",
        "response": "La procesión del Abuelo, Nuestro Padre Jesús Nazareno, es muy especial en Jaén. Se celebra en honor a él y es una de las más importantes de la Semana Santa. La procesión Magna, que incluye a Nuestro Padre Jesús Nazareno, se organiza con motivo del Jubileo de 2025 y tendrá lugar el 4 de octubre de 2025. Sin embargo, la fecha exacta de la procesión del Abuelo puede variar cada año, así que te recomiendo consultar el calendario oficial de la Semana Santa de Jaén para obtener la fecha exacta.",
        "reference_contexts": "['Nuestro Padre Jesús es una marcha procesional compuesta por Emilio Cebrián Ruiz en 1935. Dicha marcha fue compuesta siendo Emilio Cebrián Ruiz director de la Banda Municipal de Jaén efectuándose el estreno e María (Jaén)|plaza de Santa María]] de Jaén el 10 de noviembre de 1935. La marcha fue compuesta expresamente para Nuestro Padre Jesús Nazareno, conocido popularmente como \"El Abuelo\", perteneciente a la Antigua, Insigne y Real Cofradía de Nuestro Padre Jesús Nazareno y María Santísima de los Dolores de Jaén. Esta especial dedicación de la marcha a esta talla, que goza de una gran devoción, quedó reflejado cuando el autor decidió incluir parte del Himno a Jaén en la propia marcha. En otras provincias como en Málaga es muy común que se toque en honor a Nuestro Padre Jesús Nazareno, así ocurre en Almogía, donde se toca en honor al sagrado titular de la Hermandad de Culto y Procesión de Nuestro Padre Jesús Nazareno, conocido también como \"El Nuestro Padre\". Igualmente ocurre en Alhaurín el Grande, donde la Banda de Música de la Real Hermandad de Nuestro Padre Jesús Nazareno la toca en honor a \"Nuestro Padre Jesús\", mientras los portadores de su trono de procesión lo depositan en el suelo y cantan alrededor del mismo el Himno a Nuestro Padre Jesús Nazareno, letra compuesta por Loli Romero. Composición Siendo Emilio Cebrián Ruiz director de la Banda Municipal de Jaén desde 1932 al haber ganado el concurso oposición celebrado al quedar vacante la plaza, el fabricano del paso de Nuestro Padre Jesús Nazareno de Jaén, D. Antonio Delgado, le pidió que compusiera una marcha procesional para el Señor, pues hasta ese momento durante la procesión tan sólo se interpretaban las marchas \"Pobre Carmen\" y \"España llora\". El Viernes Santo de 1934, durante el trascurso de la procesión, el maestro Emilio Cebrián Ruiz abandonó momentáneamente su condición de director de la Banda Municipal para portar el paso de Nuestro Padre Jesús desde el “Cantón de la Ropa Vieja” al “Campillejo de Santiago”. Al salir de los faldones del paso, notablemente emocionado por la experiencia vivida con la imagen a cuestas de Nuestro Padre Jesús Nazareno, se abrazó al fabricano don Antonio Delgado y le aseguró que trasladaría lo vivido a una marcha procesional. Así, el maestro Emilio Cebrián Ruiz comenzó a componer la marcha dedicada a Nuestro Padre Jesús. La expectación que se creó en la ciudad en torno a la creación se acrecentó cuando la Banda Municipal comenzó a ensayar su interpretación siendo del agrado del pueblo de Jaén desde estos primeros ensayos. Posteriormente, para dejar constancia de la ligazón de la marcha con la imagen de Nuestro Padre Jesús Nazareno y la ciudad de Jaén el maestro Emilio Cebrián Ruiz decidió incorporar algunas estrofas del Himno a Jaén que él mismo había compuesto tomando como base la letra del \"Canto a Jaén\" escrito por don D. Federico de Mendizábal en 1932. Al existir una disposición legal que impedía la inscripción el registro de la propiedad de una marcha con advocación específicamente religiosa, en principio se registró con el nombre de “El Abuelo. Marcha fúnebre”. Posteriormente el maestro Emilio Cebrián Ruiz cambiaría su denominación por la actual “Nuestro Padre Jesús Nazareno. Marcha de procesión” Está compuesta sobre varios motivos populares andaluces, incluido el Himno a Jaén del propio compositor, constando de fanfarria, tema principal, fuerte de bajos, puente y trío. Está escrita para plantilla habitual de banda de música (flauta travesera, clarinete, oboe, requinto, saxofón alto, saxofón tenor, saxofón barítono, trompeta, fliscorno, trompa, trombón, tuba y percusión). Tiene una duración de entre 9-10 minutos los cuales se derivan de que al llegar al final, se regresa Da Capo hasta antes de comenzar la segunda introducción la cual desemboca en la famosa coda, compuesta por el Himno a Jaén, aun así, es raro oírla entera por su extensión, por lo que las bandas, al llegar al último compás dan por finalizada la marcha. Nuestro Padre Jesús es, sin duda alguna la marcha más universal en España, siendo considerada por expertos la obra cumbre de la Música Procesional de nuestro país, estando presente en los atriles de bandas de toda la geografía nacional. Es por ello que ha sido grabada por numerosas bandas y es interpretada asiduamente en las procesiones de Semana Santa de toda España como las de Castilla-La Mancha, Murcia, Andalucía, Extremadura, Madrid, Canarias y Comunidad Valenciana. Bibliografía Carmona Rodríguez, M. Un siglo de música procesional en Sevilla y Andalucía. Edición de Rosario Solís. Castilleja de la Cuesta (Sevilla), 2000.']",
        "retrieved_contexts": [
            "Procesión de los Hachones - 3 de mayo. Con la procesión del Rosarío de Los Hachones se inician las fiestas patronales de San Francisco de Paula, celebradas del 3 al 6 de mayo. Los participantes recorren las calles portando los hachones, teas hechas con esparto y pez. Al paso de la procesión se prenden cuatro luminarias, grandes piras de leña y ramas de olivo, a las que se echa sal para que crepiten e impidan el paso de la comitiva. La luz de los hachones y luminarias en la oscuridad de la noche recuerda al albor de la Aurora, en un ritual que sintetiza el carácter del fuego como elemento mágico-simbólico y la tradición cristiana de rezo del Rosario. Las Colgaduras de San Juan - 23 de junio. La noche de San Juan se celebra una tradición relacionada con el enamoramiento. Los mozos colocan las colgaduras en las puertas y balcones de las mozas, con distinto significado dependiendo del tipo de adorno: las flores son prueba de cariño, las ramas de higuera significan que la moza es algo locuela, samiento de parra indica que la han visto beber vino, y un cardo, que su carácter es duro. Los Bordos de Carnaval. En Albanchez perdura la costumbre de echar los bordos a las mozas. Los bordos son el fruto de la enea. Se recogen durante el verano y se guardan en las cámaras de las casas, entre pajas, para que se sequen. El domingo de carnaval se sacan para arrojárselos a las muchachas. Al pelarlos, desprenden una pelusa blanquecina y melosa que se adhiere al pelo y a la ropa. Se dice que cuanto más se quiere a una muchacha, más bordos debe arrojarle su pretendiente a la cara, de tal suerte que ese día las calles del pueblo quedarán alfombradas con la molesta pelusilla, en tan curiosa 'demostración' de amor. Procesión de San Francisco de Paula - 4 de mayo. Procesión en honor de San Francisco de Paula, patrón de Albanchez, protector de las cosechas y propiciador de la lluvia. Durante el recorrido los vecinos arrojan trigo, desde los balcones, sobre las andas del trono, como símbolo de agradecimiento por la cosecha habida y rogativa por la venidera. Procesión de la virgen de la Asunción de María - 15 de agosto. Procesión en honor a la coopatrona Asunción de María, nombre de la iglesia del municipio y de la cooperativa de aceite. En el recorrido, se baja a la virgen desde la iglesia con una cruz delante hasta la \"Era Nueva\" donde se celebra la Eucaristía en su honor. A la vuelta, es exactamente lo mismo pero los vecinos del municipio van detrás hasta la parroquia.",
            "Nuestro Padre Jesús es una marcha procesional compuesta por Emilio Cebrián Ruiz en 1935. Dicha marcha fue compuesta siendo Emilio Cebrián Ruiz director de la Banda Municipal de Jaén efectuándose el estreno e María (Jaén)|plaza de Santa María]] de Jaén el 10 de noviembre de 1935. La marcha fue compuesta expresamente para Nuestro Padre Jesús Nazareno, conocido popularmente como \"El Abuelo\", perteneciente a la Antigua, Insigne y Real Cofradía de Nuestro Padre Jesús Nazareno y María Santísima de los Dolores de Jaén. Esta especial dedicación de la marcha a esta talla, que goza de una gran devoción, quedó reflejado cuando el autor decidió incluir parte del Himno a Jaén en la propia marcha. En otras provincias como en Málaga es muy común que se toque en honor a Nuestro Padre Jesús Nazareno, así ocurre en Almogía, donde se toca en honor al sagrado titular de la Hermandad de Culto y Procesión de Nuestro Padre Jesús Nazareno, conocido también como \"El Nuestro Padre\". Igualmente ocurre en Alhaurín el Grande, donde la Banda de Música de la Real Hermandad de Nuestro Padre Jesús Nazareno la toca en honor a \"Nuestro Padre Jesús\", mientras los portadores de su trono de procesión lo depositan en el suelo y cantan alrededor del mismo el Himno a Nuestro Padre Jesús Nazareno, letra compuesta por Loli Romero. Composición Siendo Emilio Cebrián Ruiz director de la Banda Municipal de Jaén desde 1932 al haber ganado el concurso oposición celebrado al quedar vacante la plaza, el fabricano del paso de Nuestro Padre Jesús Nazareno de Jaén, D. Antonio Delgado, le pidió que compusiera una marcha procesional para el Señor, pues hasta ese momento durante la procesión tan sólo se interpretaban las marchas \"Pobre Carmen\" y \"España llora\". El Viernes Santo de 1934, durante el trascurso de la procesión, el maestro Emilio Cebrián Ruiz abandonó momentáneamente su condición de director de la Banda Municipal para portar el paso de Nuestro Padre Jesús desde el “Cantón de la Ropa Vieja” al “Campillejo de Santiago”. Al salir de los faldones del paso, notablemente emocionado por la experiencia vivida con la imagen a cuestas de Nuestro Padre Jesús Nazareno, se abrazó al fabricano don Antonio Delgado y le aseguró que trasladaría lo vivido a una marcha procesional. Así, el maestro Emilio Cebrián Ruiz comenzó a componer la marcha dedicada a Nuestro Padre Jesús. La expectación que se creó en la ciudad en torno a la creación se acrecentó cuando la Banda Municipal comenzó a ensayar su interpretación siendo del agrado del pueblo de Jaén desde estos primeros ensayos. Posteriormente, para dejar constancia de la ligazón de la marcha con la imagen de Nuestro Padre Jesús Nazareno y la ciudad de Jaén el maestro Emilio Cebrián Ruiz decidió incorporar algunas estrofas del Himno a Jaén que él mismo había compuesto tomando como base la letra del \"Canto a Jaén\" escrito por don D. Federico de Mendizábal en 1932. Al existir una disposición legal que impedía la inscripción el registro de la propiedad de una marcha con advocación específicamente religiosa, en principio se registró con el nombre de “El Abuelo. Marcha fúnebre”. Posteriormente el maestro Emilio Cebrián Ruiz cambiaría su denominación por la actual “Nuestro Padre Jesús Nazareno. Marcha de procesión” Está compuesta sobre varios motivos populares andaluces, incluido el Himno a Jaén del propio compositor, constando de fanfarria, tema principal, fuerte de bajos, puente y trío. Está escrita para plantilla habitual de banda de música (flauta travesera, clarinete, oboe, requinto, saxofón alto, saxofón tenor, saxofón barítono, trompeta, fliscorno, trompa, trombón, tuba y percusión). Tiene una duración de entre 9-10 minutos los cuales se derivan de que al llegar al final, se regresa Da Capo hasta antes de comenzar la segunda introducción la cual desemboca en la famosa coda, compuesta por el Himno a Jaén, aun así, es raro oírla entera por su extensión, por lo que las bandas, al llegar al último compás dan por finalizada la marcha. Nuestro Padre Jesús es, sin duda alguna la marcha más universal en España, siendo considerada por expertos la obra cumbre de la Música Procesional de nuestro país, estando presente en los atriles de bandas de toda la geografía nacional. Es por ello que ha sido grabada por numerosas bandas y es interpretada asiduamente en las procesiones de Semana Santa de toda España como las de Castilla-La Mancha, Murcia, Andalucía, Extremadura, Madrid, Canarias y Comunidad Valenciana. Bibliografía Carmona Rodríguez, M. Un siglo de música procesional en Sevilla y Andalucía. Edición de Rosario Solís. Castilleja de la Cuesta (Sevilla), 2000.",
            "La Oración en el Huerto (Hermandad y Cofradía de Nazarenos de Nuestro Padre Jesús en la Oración en el Huerto y Nuestra Madre y Señora de Gracia) es una de las catorce que componen la Semana Santa de Linares. Sale en procesión el Lunes Santo a las cinco de la tarde de la iglesia de Santa María la Mayor. El número aproximado de hermanos que realizan la estación de penitencia es de 425. Los hábitos que visten tanto en el Tercio de Misterio como en el Tercio de Palio son túnica y capa color hueso, caperuz y cíngulo en terciopelo verde botella. El color de la cera en ambos tercios es blanco. El acompañamiento musical para el Paso de Misterio es la Agrupación Musical “Nuestro Padre Jesús de la Pasión” de Linares y para el Paso de Palio se estrena en la Semana Santa de 2015, la Sociedad Filarmónica \"María Inmaculada\" de Linares. El Paso de Misterio va llevado por 45 costaleros y está cubierto con pan de oro y el Paso de Palio lleva 35 costaleros y está cincelado en plata con detalles en oro, con aproximadamente dos cuadrillas de costaleros más por paso. La Historia El 9 de marzo de 1941 se reorganiza la hermandad de la Oración en el Huerto. En principio, con las evidentes pretensiones de volver a su sede en la parroquia de Santa María, pero al estar el templo en reconstrucción residirá sus primeros años en la parroquia de San José. La nueva etapa comienza con un equipo que afronta la primera reunión de la junta directiva con el propósito de adquirir una nueva imagen de Jesús Orante. El escultor granadino Eduardo Espinosa Cuadros será el encargado de hacer la nueva talla, unas imágenes que a su llegada a Linares serán expuestas en un local en la calle Santiago. Espinosa talla un conjunto compuesto por Jesús y el Ángel confortador sin grandes alardes escultóricos, pero de gran fuerza expresiva. En este sentido, el genio creador del imaginero se pudo ver limitado por la condición expresa de la cofradía de reproducir fielmente la iconografía del anterior misterio destruido en la guerra civil española. Este conjunto, como se basa en el anterior misterio, se refiere a una escena que prolifera sobre todo desde el siglo XIX, por eso Jesús se nos presenta arrodillado y posando sus brazos sobre una peña. Sus manos entrelazadas, a la vez que mira al cielo y frente a frente sobre una nube un ángel contempla al Mesías ofreciéndole el “cáliz de amarguras” que pide que se aleje. En su original de los años cuarenta, las dos esculturas formaban una sola pieza pero divisible en dos desde mitad de la roca. Hasta los años ochenta su ubicación en capilla era de esta manera. En este año las dos esculturas fueron separadas, lo que quedaron independientes, además de la imprimación de una nueva policromía y del arreglo de los desperfectos que el tiempo había causado durante cuarenta años. Se respeta la forma para el montaje del paso de enfrentar a los dos iconos, pero ya se muestran independientemente en capilla. Una nueva restauración, en los noventa, dotará a las esculturas de una nueva impronta. Fernando Alvarado enriquece la policromía y aumenta el ornato de las túnicas con bordados en oro para las bocamangas y petos, tanto del Cristo como del ángel. En esta segunda restauración se adapta nuevamente, en este caso para facilitar su salida procesional en un nuevo paso que talla el sevillano Ángel de la Feria. Se suprime, por tanto, la peña que sostiene la nube sobre la que va el ángel. En la Semana Santa de 2005 en el misterio de la Oración en el Huerto se hizo una nueva configuración. Se optó por cambiar la posición con la que se creara en sus inicios. La poca visibilidad en el paso de la imagen de Jesús fue uno de los motivos para tal decisión. Por tanto, desde este año, Jesús va en el frontal del paso y al lado de él una nueva imagen del mensajero. El autor de la restauración es el imaginero Antonio Dubé de Luque quién también adaptó la policromía de Jesús y redujo las dimensiones de la peña sobre la que se apoya para orar. Ahora su túnica es burdeos y su manto de color azul. La Pasión En cuanto a la referencia evangélica, la Oración en el Huerto se sitúa cronológicamente justo al término de la Cena. Los cuatro evangelistas aluden al momento que es descrito por alguno de ellos como “agonía”. Aunque, no entren en muchos detalles como puede ocurrir con otros pasajes de la Pasión. San Lucas habla de “monte de los Olivos” más en la tradición que nos ha llegado del huerto de los olivos. Y puntualiza que “se le apareció un ángel venido del cielo que lo confortaba”. Pero en su texto lo que más llama la atención es la referencia al extraño proceso fisiológico que sufre Cristo: “Y su sudor era como gruesas gotas de sangre, que iban cayendo hasta la tierra”. En referencia a este texto la imaginería tradicional ha querido plasmar el llamado “sudor de sangre” en la escenificación de la Oración en el Huerto. Son varios los ejemplos de este efecto, pero en Linares el escultor optó por no pintar las gotas de sangre en su rostro. Tras la última restauración Dubé de Luque ha impreso en la faz las marcas hematológicas. Lo cierto es que la referencia es clara y por ello no pocos estudiosos han querido buscar causas a este fenómeno. Mientras los más apegados a la concepción divina de Jesús de Nazaret han argumentado históricamente un hecho milagroso otros han buscado causas más humanas. En este sentido, los médicos del siglo XX que han estudiado este asunto hablan de hematidrosis que es una reacción poco común del organismo ante ocasiones extremas que provoca el sudor sanguíneo. Respecto a la tradición bíblica el pasaje ha sido discutido ampliamente por la religión hasta el punto de no ser dado por verídico hasta el Concilio de Trento (siglo XVII). Se acepta entonces que el sudor de Getsemaní era una prueba más de la sangre prometida a los hombres desde la humanidad del hijo de Dios. Los textos sagrados recogen en varias ocasiones la palabra “cáliz”, que dentro de la escenografía pasional cobre importancia al constituirse como uno de los símbolos del cristianismo. Cierto es que la imaginería, en su afán de representar el amplio elenco de símbolos del cristianismo, ha tendido ha esquematizarlos en sus representaciones. Y de hecho lo que porta el ángel pasional de Linares es un cáliz pero su significado es distinto. La palabra se puede interpretar como la suerte reservada a alguien o como una plasmación gráfica de la amargura. De ahí el sintagma “cáliz de amarguras”. Por lo tanto lo que el enviado celestial ofrece al Mesías en esta representación escultórica no es algo tangible sino el símbolo de lo que pide al Padre que le aparte. Nuestra Madre y Señora de Gracia La historia de la imagen de Nuestra Señora de Gracia es un claro ejemplo del proceso de recuperación cofrade del Linares de posguerra. En un clima de carestía y penuria económica las cofradías comienzan a renacer casi al mismo término de la contienda. Los orígenes de la talla hay que buscarlo no en el cortejo de la Oración en el Huerto sino en la de la Sentencia de Cristo, precedente de la del Prendimiento. De su autoría poco se sabe aunque ya en los años anteriores a la II República Española la imagen procesiona por las calles de la ciudad en el paso de la titular de la cofradía de la Sentencia. Los testimonios gráficos existentes nos muestran a dos imágenes en las mismas andas, una de ellas la actual Virgen del Rosario, la otra, una representación de María Magdalena que servirá de base para la nueva imagen de la Señora de Gracia. Se trata, pues, de una de las pocas imágenes del patrimonio cofrade linarense que se salva de la destrucción del patrimonio cofrade linarense de la Guerra Civil. A nuestros oídos ha llegado el nombre de Antonio Lara Pardo como el salvador de las tallas (únicamente el busto), el hecho de que las escondiera “en el hueco de una escalera de su domicilio particular, que posteriormente tapizó” hizo que la quema no llegara a ellas. Quizá el guardar ornamentos o accesorios eclesiásticos es más repetido pero no tanto el de aventurarse a guarecer las propias vírgenes o cristos, sacándolas del templo de donde recibían culto. La tradición oral nos cuenta que el resto del grupo escultórico de la Sentencia sí fue destruido con el convencimiento por la mayoría de los cofrades de que en él también se encontraban sus queridos titulares. Lo cierto es que en 1944 se reorganiza la cofradía de la Sentencia, pero ahora bajo el nuevo título de Hermandad de Jesús del Prendimiento. Y en la búsqueda de lo que había quedado a salvo tras el paréntesis de la guerra vuelven a la luz las imágenes que habían estado ocultas durante años. El Prendimiento comienza su nueva etapa, sin embargo María Magdalena no parece entrar en la nueva iconografía pasional de la recuperada cofradía. La Hermandad de la Oración en el Huerto pasa sus primeros años en la parroquia de San José. Y durante algún tiempo convive con las que ya están asentando en esta sede canónica. Entre ellas la del Prendimiento. La vinculación entre ambas cofradías se estrecha de tal manera hasta el punto en el que llegan a hermanarse mientras llega el traslado de Jesús orante a la parroquia de Santa María (actual sede en la que se encuentre la Oración en el Huerto). De este hermanamiento nace la solución que ambas cofradías dan a la ausencia de la imagen de la Virgen María para que acompañe a la Oración en el Huerto en su estado de penitencia. El Prendimiento cede a la Oración el busto de la Magdalena para la creación de una nueva obra que representase a la actual Virgen de Gracia. Sin embargo parece que todo no lo había perdido la hermandad “del olivo” en el incendio de Santa María. Según el último alférez de la hermandad, fue un hermano quién rescató los restos que quedaron de la Virgen tras el incendio del templo. Con todo, aún quedaba terminar el trabajo hasta la consecución de la nueva titular. Parece medianamente claro que fue el cordobés Juan Martínez Cerrillo quien readaptó la Magdalena para convertirla en Nuestra Señora de Gracia. Su gubia dejó su impronta en esa talla que, por los antecedentes que tiene, difiere del resto de su producción en la ciudad. Pero, por qué se elige a Martínez Cerrillo para el trabajo de readaptación de la imagen. La relativa cercanía con la capital cordobesa donde trabajaba, la repercusión de sus obras en la Semana Santa andaluza y el hecho de que ya tuviera imágenes en Linares pudieron hacerlo aconsejable. Cerrillo por tanto tiene el reto de crear una nueva dolorosa sobre el soporte de una efigie ya existente. Por eso deja su importancia aunque sin soslayar por completo el original. La Virgen tiene una expresión de desconsuelo con la boca entreabierta que deja ver los dientes tallados superiores e inferiores, el entrecejo fruncido y la mirada baja. Y esta es la imagen de la Virgen de Gracia que hemos conocido con algunos retoques hasta el año 1994. En este año Antonio Dubé de Luque se encarga de su restauración. Este retoca las proporciones para adaptarla a otras más idóneas, talla un nuevo candelero y crea las nuevas manos. En cuanto al rostro, retira los aditamentos existentes sobre la madrea y perfila los contornos de la faz. La nueva Virgen de Gracia mantiene los rasgos básicos pero tras su restauración se adivina el leve giro de cuello que estaba oculto, y la expresión se dulcifica. Sin embargo no retoca sus ojos para evitar que pudiera cambiar de gesto. Bibliografía Sagrada Biblia. Martínez Cerrillo. Catálogo de la Exposición. Cruz de Guía agrupación de Hermandades y Cofradías de Linares.",
            "La Ilustre Hermandad del Santísimo Sacramento y Cofradía de Nazarenos de Jesús del Perdón, Cristo del Amor en su Prendimiento, María Santísima de la Esperanza, San Pedro y San Juan Apóstoles es una cofradía con sede canónica en la Iglesia de Cristo Rey, Jaén, España. Realiza su salida procesional durante la Semana Santa jiennense, en la tarde del Miércoles Santo. Historia Se fundó en 1952 y realizó su primera salida procesional en la tarde del Domingo de Ramos de 1954, hasta 1980 que cambió a la tarde del Miércoles Santo. En 1955 adquirió la actual imagen titular de Jesús del Perdón y en 1958 le fue cedida la imagen de Nuestra Señora de la Esperanza, que fue adquirida en un primer momento por el Colegio Oficial de Agentes Comerciales de Jaén, del cual es patrona.​ En 1965 incorporó la advocación del Cristo del Amor.​ El 15 de junio de 2013, Año de la Fe, la cofradía participó en la Fides Sancti Regni con el misterio del Stmo. Cristo del Amor en su Prendimiento.​ Liberación de un preso Entre 1955 y 1974 la cofradía liberaba anualmente un preso de la Prisión Provincial de Jaén, por lo que el cuerpo de prisiones es gobernador honorario de la cofradía. Sede La sede fundacional de la cofradía es la Iglesia de Santa Isabel, aunque realizó estación de penitencia, sus dos primeros años, la tarde del Domingo de Ramos desde la iglesia de San Ildefonso. Desde 1956, la sede la cofradía es la Iglesia parroquial de Cristo Rey. Esta iglesia es también sede de la Hermandad del Silencio. La iglesia es obra del arquitecto Ramón Pajares Pardo​ y fue consagrada en 1955 por el nuncio Ildebrando Antoniutti, el obispo de Jaén Félix Romero Mengíbar y el arzobispo de Granada Rafael García y García de Castro. Es un templo de grandes dimensiones, de planta rectangular con tres naves, siendo las laterales de mucho menores que la central, y un amplio presbiterio en cuyo testero frontal se encuentra una pintura mural obra de Francisco Baños Martos en 1956. La pintura representa a Cristo Rey, rodeado de Dios Padre y el Espíritu Santo, la Virgen, santos y mártires, y miembros anónimos del clero secular y regular y del Pueblo de Dios. La fachada principal está enmarcada por dos torres y salva el desnivel con la calle mediante una escalinata. Traje de estatutos Para el Cristo del Amor llevan túnica blanca con cíngulo y bocamangas azules, caperuz y capa azul; para el Cristo del Perdón una túnica blanca con cíngulo y bocamangas rojas, caperuz y capa roja; para la Virgen de la Esperanza una túnica blanca con cíngulo y bocamangas verdes, caperuz blanco y capa verde. Iconografía Santísimo Cristo del Amor, obra de José Antonio Navarro Arteaga en 1992 y restaurada en 2009. Procesiona representando el prendimiento de Cristo acompañado de las imágenes de Judas, san Juan, san Pedro, un sayón y dos soldados romanos. Jesús del Perdón, de Francisco Palma Burgos en 1955. María Santísima de la Esperanza, de Antonio Eslava Rubio en 1952, fue restaurada en 1990 por María José López de la Casa y en 2007 por Luis Álvarez Duarte.​ Pasos procesionales Santísimo Cristo del Amor El paso fue realizado en madera de cedro por Gonzalo Merencio Álvarez y Manuel Caballero Farfán en 1999. Presenta medallones con elementos de la vida de Cristo. En las esquinas se encuentran los cuatro Evangelistas obra de Lourdes Hernández Peña. Los faldones son de color azul prusia bordados por Javier García y Martín Suárez en hilo de plata. En ellos se encuentran oleos de la vida de Jesús niño pintados por Trinidad de la Casa Adán. El paso se ilumina por candelabros cimbreantes en las esquinas y en los laterales que presentan como base un pelícano de orfebrería, símbolo del amor. Jesús del Perdón El paso fue realizado en madera de pino de flandes en Jaén por Vicente Castillo Gutiérrez en 1965. Es de estilo barroco pandorado, decorado con motivos vegetales. Los son de color rojo-burdeos adornados con galones bordados. Esta iluminado por doce tulipas alrededor de Cristo que representan a los apóstoles, y por cuatro candelabros arbóreos realizados por Manuel Palomo y dorados por Manuel Verdugo que realizó también unos ángeles que se ubican al pie. Escoltan la imagen de Jesús dos arcángeles de Rafael del Río. María Santísima de la Esperanza El paso de palio es obra de orfebrería Villareal de Sevilla. El manto y las bambalinas fueron bordadas por Teresa Degiuli, mientras que el techo y los faldones lo fueron por Javier García y Martín Suárez. La corona de la Virgen es también de Villareal. Patrimonio musical AGRUPACION MUSICAL: Beso y Traición (José Manuel Mena Hervás, 1998) Al compás del Amor (José Mª Sánchez Martín, 2005) Costaleros del Amor (Alejandro Moreno Rodríguez, 2008) Por Amor te traicionaron (Cristóbal López Gándara, 2010) Eterna Alianza (Luis Fernández Ramos, 2012) Al Dios del Amor (José M. Sánchez Crespillo, 2013) Esperanza, Madre del Amor (Ignacio José García Pérez, 2014) Christus Rex (Ignacio José García Pérez, 2016) El Reencuentro (Abraham Padilla Consuegra, 2017) CORNETAS Y TAMBORES: Y en tu Perdón (Pedro Manuel Pacheco Palomo, 2004) Amor en tu Santo Prendimiento (José M. Chávez Ramírez, 2004) Perdón en tu mirada (Raúl Rodríguez, 2011) el perdón BANDA DE MÚSICA: Jesús del Perdón (Antonio Manzano Vázquez, 1980) Virgen de la Esperanza (Antonio Manzano Vázquez) Perdón, Amor y Esperanza. 50 Años (Carlos Cerveró, 2002) Cristo del Perdón (Carlos Cerveró, 2005) Esperanza Jaenera (Jesús Alcántara, 2007) En tu cielo de Esperanza (Jacinto M. Rojas Guisado, 2011) Esperanza, verde olivo (Fco. José Sánchez Sutil, 2011) Tu Perdón, es Amor y Esperanza (Fco José. Sánchez Sutil, 2011) Esperanza Nuestra (Juan R. Vilchez Checa, 2013) Esperanza (Alberto Barea Tejada, 2013) Salve esperanza del santo reino Esperanza mía (Luis Pradas Fernández, 2017) Fuente: Música procesional de Jaén Paso por la carrera oficial",
            "La Hermandad de Penitencia y Cofradía de Nazarenos de Silencio del Santísimo Cristo de la Humildad y María Santísima Madre de Dios es una cofradía con sede canónica en la Iglesia de Cristo Rey de la ciudad de Jaén (España). Realiza su salida procesional durante la Semana Santa jiennense, en la tarde noche del Martes Santo y que es una de las procesiones más bonitas de la Semana Santa jienense. Presenta una imagen propia de una cofradía antigua, propia del Medioevo español, tal y como han evocado conferenciantes, comentaristas y pregoneros de la Semana Santa. Sin embargo, es una de las cofradías más jóvenes de la ciudad. Historia Fundación y primeros años La primera referencia documental que existe de la Hermandad data de 1954, año en el que un grupo de cofrades giennenses, encabezados por Juan María Cobo Vera, se propusieron fundar una Cofradía de Silencio al estilo de las existentes en otros lugares del país. La Junta Constituyente se celebró el 15 de marzo de 1955 en la antigua ermita de San Clemente, actualmente convento de clausura, siendo sus primeros Estatutos aprobados el 18 de abril por el Obispo de la Diócesis, Félix Romero Mengíbar, quedando constituida como Hermandad del Santísimo Cristo de la Humildad (El Silencio). La Hermnandad tuvo que esperar dos años para hacer la primera Estación de Penitencia debido al lamentable estado de conservación en que se encontraba la imagen elegida como titular de la Hermandad, el conocido como Cristo de la Misericordia que se encontraba en la ermita de San Clemente, a la cual llegó por la ruina del antiguo convento de San Agustín, y que fue titular de la «Antigua y Primitiva Cofradía de las Angustias y Cinco Llagas de Nuestro Señor Jesucristo» durante los siglos XVI, XVII y XVIII,​ y de la «Cofradía del Santo Cristo de Burgos» en el siglo XVIII,​ ambas cofradías extinguidas en la actualidad. La restauración fue realizada por Constantino Unghetti Álamo y la Hermandad se trasladó a la Iglesia de Cristo Rey en la Cuaresma del año 1957. Ese año celebró un Triduo y realizó hizo su primera salida procesional en la noche del Miércoles Santo, 17 de abril. En esa época existía un número limitado de Hermanos que sólo podían ser varones mayores de dieciocho años. La crisis cofrade de los años setenta hizo que estuviese cerca de desaparecer. Esto fue evitado especialmente por la labor del que era secretario y posteriormente hermano mayor, Bartolomé Cerezo Cerezo, en la actualidad el único Hermano Mayor Honorario que tiene la Hermandad. Crecimiento de la hermandad A partir de los años ochenta la Hermandad fue recuperándose e incrementando su número de hermanos. El 16 de octubre de 1986 el Obispo D. Miguel Peinado Peinado aprobó sus unos nuevos estatutos, desapareciendo la limitación de hermanos así como la prohibición de que las mujeres pertenecieran a la misma. se recuperó el triduo cuaresmal como culto principal.​ En el año 2009, ante la redacción de la Ley de la interrupción voluntaria del embarazo, fue una de las primeras cofradías en posicionarse en contra de esta y en defensa de la vida humana,​ portando desde entonces un lazo blanco en el remate de su guion. El 18 de diciembre de 2010, se reunieron los miembros de la hermandad en asamblea general hermanos, acordándose la aprobación de unos nuevos estatutos, que fueron ratificados por el Obispo de la Diócesis, Ramón del Hoyo López el 27 de enero de 2010. Entre los cambios más significativos, con respecto a los estatutos de 1986, destacan la inclusión de una titular mariana, María Santísima Madre de Dios, y el nuevo título de la hermandad, Hermandad de Penitencia y Cofradía de Nazarenos de Silencio del Santísimo Cristo de la Humildad y María Santísima Madre de Dios.​ Año de la Fe Tiempo después, el 16 de enero de 2013, Año de la fe, la hermandad fue autorizada a realizar la talla de María Santísima Madre de Dios, por parte de la diócesis. La obra fue encargada al imaginero Israel Cornejo Sánchez,​ fue bendecida el 9 de noviembre en su sede canónica ante numerosos fieles.​ Fue apadrinada por la Congregación de Esclavas del Santísimo Sacramento y de la Inmaculada, por encontrarse en la sede fundacional de la Hermandad; la Congregación de Hermanas Misioneras de Acción Parroquial, por tener su sede en la parroquia de Cristo Rey; la Cofradía de la Limpia Concepción de Nuestra Señora y Santa Capilla de San Andrés, por ser la primera institución mariana de la Ciudad de Jaén; y por la Cofradía del Perdón, Amor y Esperanza, por ser la cofradía de pasión con la que comparte sede canónica.​ El 15 de junio de ese año, la hermandad participó en la Fides Sancti Regni con su titular.​ Al ser este un acto extraordinario, la hermandad realizó su recorrido de ida hasta la catedral acompañada por la «Banda de Cornetas y Tambores “Monte Calvario”» de Martos que interpretó marchas clásicas,​ mientras que la vuelta la realizó en completo silencio, como es habitual en ella y al igual que el resto de cofradías.​ Iconografía Cristo de la Humildad La imagen es anónima del siglo XVI, se relaciona con los círculos de Jerónimo Quijano y Gutierre Gierero.​ Está realizada madera de abedul y presenta una altura de 1,30 metros. Ha sido restaurada en 1957, por Constantino Unguetti Álamo y Francisco Cerezo Moreno, y en 1993, por Eloisa Arcos Quesada.​ Representa a Jesús muerto en la cruz, sobre tres clavos, teniendo el pie derecho sobre el izquierdo, con la cabeza inclinada a la derecha y corona de espinas de gruesas ramas trenzadas, tallada en el mismo bloque. Presenta los ojos semicerrados, labios muy abiertos y dentadura tallada. La barba y el cabellos son ondulados, partidos en el centro dejando entrever ambas orejas. Tiene los brazos rectos, las manos semicerradas y los dedos flexionados. El vientre aparece plegado y hundido, marcando el arco condrocostal bajo unos pectorales bien definidos. La cintura está protegida por un paño de pureza que da varias vueltas antes de formar un lazo en el lado izquierdo.​ María Madre de Dios Imagen realizada por Israel Cornejo Sánchez en el año 2013. Es una imagen de tamaño natural con manos entrelazadas en actitud orante y suplicante, presenta la cabeza inclinada hacia la izquierda con la mirada baja, con un marcado gesto de dolor y belleza. La cara es ovalada con la boca entreabierta en gesto de suspiro con la barbilla tersa, los ojos hinchados y las cejas con forma de “S” para trasmitir pena. Está peinada con raya central y rodete en la nuca recogiendo el pelo que deja ver los pabellones auditivos. El torso está tallado con la forma anatómica femenina y el candelero es de forma ovalada para ser vestida. Está tallada en madera de cedro, aparejada y estucada para policromía al óleo a usanza del siglo de oro, las pestañas son de pelo natural y las lágrimas de cristal. Tiene un segundo juego de manos abiertas en actitud de diálogo.​​ Fue bendecida el 9 de noviembre de 2013 en la iglesia de Cristo Rey.​ Ese día estrenó una saya de terciopelo negro bordada en oro por el astigitano Jesús Rosado,​ un manto negro del mismo autor, así como, una corona de plata sobredorada cincelada en estilo rococó.​ Pasos Paso de Cristo El paso es de estilo rococó, tallado por José Carlos Rubio Valverde en 2005, en el frontal lleva una Cruz de Santiago, a los costeros una alegoría de San Ildefonso, el escudo parroquial de Cristo Rey, a la trasera el escudo del Obispo que aprobó sus estatutos, Félix Romero Mengíbar. Los respiraderos, llevan el escudo de las Esclavas del Santísimo, una alegoría a San Francisco de Asís, otra a Santiago, y en la trasera San Eufrasio patrón de la Diócesis. El llamador está diseñado por Rubio y es una hojarasca estilo rocalla, con una Inmaculada Concepción. En el año 2011 se estrenaron unos candelabros arbóreos situados en las cuatro esquinas y en ambos costeros que suman 38 puntos de luz, hasta entonces estaba iluminado por cuatro hachones ubicados en las esquinas del paso. Acompañan, en capillas laterales situadas en el canasto, los cuatro evangelistas, obra de Manuel Luque Bonillo. Los faldones, estrenados en su primera fase en 2010, fueron bordados en hilo fino de oro por el cordobés Rafael Jódar González.​ El faldón delantero lleva representado el Espíritu Santo a través de una paloma, mientras que el trasero lleva bordado una concha, símbolo del bautismo y recuerdo del origen peregrino de la Hermandad. En uno de los costeros aparece una alegoría a Dios Padre, mientras que en el otro se encuentra el Agnus Dei. El adorno floral está compuesto por estatice morado y algunos cardos en el monte que dan aspecto de sencillez y humildad. A los píes de la Cruz hay una calavera y dos tíbias cruzadas, que simbolizan la tradición de que Cristo fue crucificado sobre la tumba de Adán y, al caer la sangre de Cristo sobre la calavera, Adán resucitó a la vida eterna.​ Paso de palio La Hermandad ha proyectado un paso en estilo manierista soberbio, elegante, valiente y adecuado a su idiosincrasia en el que no hay candelería, la iluminación será mediante candelabros, está decorado con crestería, incluye una peana centrada de gran tamaño y el manto de la Virgen será corto. El diseño es del bordador Jesús Rosado.​ Escudo y emblema Escudo El escudo fundacional de la Hermandad era la Cruz de la Orden de Santiago, esto es, una cruz latina de gules simulando una espada, con forma de flor de lis en la empuñadura y en los brazos. En el centro, una Cruz de Santiago, de gules. En la parte inferior de esta cruz se disponen dos escudos acolados en campo oval. En el de la diestra, en campo púrpura, el Crismón potenzado de oro. El de la siniestra, en campo de azur, el anagrama de María en oro, sobre él doce estrellas también en oro. Ambos óvalos están sostenidos por una orla e rocallas. Emblema El emblema de la Hermandad es la Cruz de Santiago. Lema El lema de la Hermandad son las palabras de San Francisco de Asís: Paz y bien. Sede La primera sede canónica de la Hermandad fue la ermita de San Clemente, lugar en el que fue fundada en 1955. Este es templo de pequeñas dimensiones, construido en el siglo XV, fue remodelado en 1956, presenta una planta de cajón con tres naves separadas por pilares y arcos formeros. En la capilla mayor se encuentra el camarín de la imagen de la Virgen de los Remedios, obra de Luis Sánchez en 1716. Desde su remodelación acoge una comunidad de la congregación de las Esclavas del Santísimo Sacramento y de la Inmaculada. En Cuaresma de 1957 se trasladó a la que es actualmente su sede, la Iglesia parroquial de Cristo Rey. Esta iglesia es también sede de la Cofradía Sacramental del Perdón. La iglesia es obra del arquitecto Ramón Pajares Pardo​ y fue consagrada en 1955 por el nuncio Ildebrando Antoniutti, el obispo de Jaén Félix Romero Mengíbar y el arzobispo de Granada Rafael García y García de Castro. Es un templo de grandes dimensiones, de planta rectangular con tres naves, siendo las laterales de mucho menores que la central, y un amplio presbiterio en cuyo testero frontal se encuentra una pintura mural obra de Francisco Baños Martos en 1956. La pintura representa a Cristo Rey, rodeado de Dios Padre y el Espíritu Santo, la Virgen, santos y mártires, y miembros anónimos del clero secular y regular y del Pueblo de Dios. La fachada principal está enmarcada por dos torres y salva el desnivel con la calle mediante una escalinata. Salida procesional Antes de salir los hermanos rezan la «Oración al Santísimo Cristo de la Humildad», hacen las «Renuncias y Protestación de Fe», y realizan el «Voto de Silencio». La Hermandad hace su itinerario en absoluto silencio, apagándose el alumbrado público en algunos tramos del recorrido. A la entrada a la iglesia, se rezan unas preces por la estación de penitencia y una oración por los hermanos difuntos. El cuerpo de Hermanos se divide en una primera sección de hermanos de luz que portan un farolillo, y una segunda de hermanos de penitentes que portan una cruz. Traje de Estatutos Túnicas de estameña con caperuz sin capirote en color marrón. El caperuz lleva bordada la Cruz de Santiago roja. La túnica recuerda al hábito de la Orden Franciscana. Cinturón de esparto de 15 cm, guantes negros y esparteñas negras sin calcetines o completamente descalzo. Todos los nazarenos van unidos entre sí con una cadena. Publicaciones La Hermandad realiza dos publicaciones anuales que son presentadas en cuaresma por personas vinculadas a la Hermandad y a la Semana Santa de Jaén. Humildad y Silencio: Es un boletín creado en 1989, en el que se trata la historia y la vida de la Hermandad y la Semana Santa. Destaca por sus abundantes colaboraciones y por la calidad de sus artículos. Humilitas: Es un cartel fotográfico en el que destaca siempre un texto bíblico,​ como, «Ven y lo verás» (Juan 1:39) en 2008, «Manteneos firmes en la fe» (Colosenses 2:7) en 2009 o «Creo, creemos» en 2013. Para la elección tanto de la portada y contraportada del boletín como del cartel la Hermandad realiza un concurso fotográfico, en el que puede participar todo el que lo desee para optar al premio económico, presentando fotografías relacionadas con la Hermandad. Con todas las fotografías presentadas al concurso la Hermandad realiza una exposición.​ Patrimonio musical Madre de Humildad (Jacinto Manuel Rojas Guisado, 2011)​ Cruz de Humildad (José Luis Hernández Linares, 2012)​ Paso por la carrera oficial"
        ]
    },
    "test_6": {
        "question": "¿Qué lleva el ochío?",
        "reference": "El ochío está hecho con pan de aceite de oliva virgen extra, pimentón y anís. Es un plato tradicional de Úbeda, Jaén.",
        "response": "El ochío es un producto de panadería tradicional que lleva aceite de oliva virgen extra, pimentón y anís. Es un pan de aceite de oliva virgen extra, pimentón y anís.",
        "reference_contexts": "['El ochío\\u200b —a veces también escrito hochío—\\u200b es un producto de panadería tradicional típico de Ubeda en la provincia de Jaén aunque se puede encontrar en otras ciudades de Andalucía; especialmente de la comarca de la Loma, aunque también en la comarca metropolitana de Jaén pero aquí elaborado de otra manera. Consiste en un pan de aceite de oliva virgen extra, pimentón y anís. El nombre le viene dado por ser la octava parte de la masa de un pan. Se elaboran de distinta forma, dependiendo de la zona de Andalucía en donde se haga. El ochío salado con pimentón es muy tradicional de la comarca de La Loma, y el dulce con azúcar por encima, es tradicional de Jaén capital. Características Es elaborado de forma tradicional, según recetas ancestrales de las monjas, con azúcar y anís. Antiguamente el azúcar se sustituía por miel vieja —deshidratada—. Su origen se remonta a los conventos que poblaron la cuenca del Guadalquivir y su consumo se limitaba a la Pascua de Resurrección, a modo de festejo por esta. De aquí también proceden los famosos hornazos, que se hace con un huevo duro entero y sin pelar en su centro. El intercambio de monjas y monjes entre conventos propinó su extensión por distintas zonas de Andalucía. Con posterioridad, ya en los años 1930 y en la comarca de La Loma, se modificó la receta primitiva, untando con una mezcla de pimentón dulce con aceite de oliva virgen extra y sazonado por encima con sal gruesa. Su forma tradicional es aplanada y redonda, con borde trenzado, aunque en la actualidad se comercializa con distintas formas y tamaños —como los crujientes, en barritas para picar, rellenos de chocolate, etc.— siendo su consumo a diario, tanto dulces como salados.\\u200b El ochío con pimentón salado\\u200b se puede consumir solo, o bien acompañado de habas verdes y bacalao salado, siendo ritual en las romerías de la Virgen de Guadalupe, patrona de Úbeda, de la romería de la Virgen de La Yedra de Baeza, en la romería de Santiago Apóstol de Torreperogil y en la romería de la Virgen de la Estrella de Sabiote . También es común rellenarlo de atún o con tomate, paté, jamón, embutido —salchichón, mortadela, salami...—, morcilla en caldera\\u200b o de picadillo de chorizo.\\u200b Los escolares de la zona lo llevan de desayuno al colegio como alternativa a la bollería industrial, y en las tabernas y bares de la comarca de La Loma es acompañamiento habitual a la hora de tapear. También se ven versiones completamente diferentes en otras poblaciones andaluzas, como en Jaén, La Roda de Andalucía o Estepa donde pasa por ser un dulce típico de Semana Santa junto a pestiños, magdalenas y gachas.']",
        "retrieved_contexts": [
            "El ochío​ —a veces también escrito hochío—​ es un producto de panadería tradicional típico de Baeza y Úbeda en la provincia de Jaén aunque se puede encontrar en otras ciudades de Andalucía; especialmente de la comarca de la Loma, aunque también en la comarca metropolitana de Jaén pero aquí elaborado de otra manera. Consiste en un pan de aceite de oliva virgen extra, pimentón y anís. El nombre le viene dado por ser la octava parte de la masa de un pan. Se elaboran de distinta forma, dependiendo de la zona de Andalucía en donde se haga. El ochío salado con pimentón es muy tradicional de la comarca de La Loma, y el dulce con azúcar por encima, es tradicional de Jaén capital. Características Es elaborado de forma tradicional, según recetas ancestrales de las monjas, con azúcar y anís. Antiguamente el azúcar se sustituía por miel vieja —deshidratada—. Su origen se remonta a los conventos que poblaron la cuenca del Guadalquivir y su consumo se limitaba a la Pascua de Resurrección, a modo de festejo por esta. De aquí también proceden los famosos hornazos, que se hace con un huevo duro entero y sin pelar en su centro. El intercambio de monjas y monjes entre conventos propinó su extensión por distintas zonas de Andalucía. Con posterioridad, ya en los años 1930 y en la comarca de La Loma, se modificó la receta primitiva, untando con una mezcla de pimentón dulce con aceite de oliva virgen extra y sazonado por encima con sal gruesa. Su forma tradicional es aplanada y redonda, con borde trenzado, aunque en la actualidad se comercializa con distintas formas y tamaños —como los crujientes, en barritas para picar, rellenos de chocolate, etc.— siendo su consumo a diario, tanto dulces como salados.​ El ochío con pimentón salado​ se puede consumir solo, o bien acompañado de habas verdes y bacalao salado, siendo ritual en las romerías de la Virgen de Guadalupe, patrona de Úbeda, de la romería de la Virgen de La Yedra de Baeza, en la romería de Santiago Apóstol de Torreperogil y en la romería de la Virgen de la Estrella de Sabiote . También es común rellenarlo de atún o con tomate, paté, jamón, embutido —salchichón, mortadela, salami...—, morcilla en caldera​ o de picadillo de chorizo.​ Los escolares de la zona lo llevan de desayuno al colegio como alternativa a la bollería industrial, y en las tabernas y bares de la comarca de La Loma es acompañamiento habitual a la hora de tapear. También se ven versiones completamente diferentes en otras poblaciones andaluzas, como en Jaén, La Roda de Andalucía o Estepa donde pasa por ser un dulce típico de Semana Santa junto a pestiños, magdalenas y gachas.",
            "Procesión de los Hachones - 3 de mayo. Con la procesión del Rosarío de Los Hachones se inician las fiestas patronales de San Francisco de Paula, celebradas del 3 al 6 de mayo. Los participantes recorren las calles portando los hachones, teas hechas con esparto y pez. Al paso de la procesión se prenden cuatro luminarias, grandes piras de leña y ramas de olivo, a las que se echa sal para que crepiten e impidan el paso de la comitiva. La luz de los hachones y luminarias en la oscuridad de la noche recuerda al albor de la Aurora, en un ritual que sintetiza el carácter del fuego como elemento mágico-simbólico y la tradición cristiana de rezo del Rosario. Las Colgaduras de San Juan - 23 de junio. La noche de San Juan se celebra una tradición relacionada con el enamoramiento. Los mozos colocan las colgaduras en las puertas y balcones de las mozas, con distinto significado dependiendo del tipo de adorno: las flores son prueba de cariño, las ramas de higuera significan que la moza es algo locuela, samiento de parra indica que la han visto beber vino, y un cardo, que su carácter es duro. Los Bordos de Carnaval. En Albanchez perdura la costumbre de echar los bordos a las mozas. Los bordos son el fruto de la enea. Se recogen durante el verano y se guardan en las cámaras de las casas, entre pajas, para que se sequen. El domingo de carnaval se sacan para arrojárselos a las muchachas. Al pelarlos, desprenden una pelusa blanquecina y melosa que se adhiere al pelo y a la ropa. Se dice que cuanto más se quiere a una muchacha, más bordos debe arrojarle su pretendiente a la cara, de tal suerte que ese día las calles del pueblo quedarán alfombradas con la molesta pelusilla, en tan curiosa 'demostración' de amor. Procesión de San Francisco de Paula - 4 de mayo. Procesión en honor de San Francisco de Paula, patrón de Albanchez, protector de las cosechas y propiciador de la lluvia. Durante el recorrido los vecinos arrojan trigo, desde los balcones, sobre las andas del trono, como símbolo de agradecimiento por la cosecha habida y rogativa por la venidera. Procesión de la virgen de la Asunción de María - 15 de agosto. Procesión en honor a la coopatrona Asunción de María, nombre de la iglesia del municipio y de la cooperativa de aceite. En el recorrido, se baja a la virgen desde la iglesia con una cruz delante hasta la \"Era Nueva\" donde se celebra la Eucaristía en su honor. A la vuelta, es exactamente lo mismo pero los vecinos del municipio van detrás hasta la parroquia.",
            "Las Bandas de Cabecera son bandas de Semana Santa que se sitúan al principio de la procesión. Tienen una gran tradición en Linares (Jaén) donde, a día de hoy, hay 7: Santa Cena Sacramental, Siete palabras, Rescate, Nazareno, Expiración, Descendimiento y Santo Entierro por orden de salida. Historia de las bandas de cabecera Las bandas de cabecera nacen en Linares en 1969 como consecuencia de la falta de bandas de soldados romanos (\"Armaos\") que sufrían algunas cofradías, como la de la Expiración. Tanto es así que, hartos de la situación, algunos hermanos de la Expiración deciden crear una banda propia que, hoy día, sigue siendo una de las más importantes. Unos pocos años después le seguirían la banda del Rescate (1972) y las del Nazareno y la Santa Cena (1975). Aunque la mayoría de estas bandas nacieron como bandas de cornetas y tambores poco a poco se fueron transformando en agrupaciones musicales añadiendo nuevos instrumentos, como clarinetes y saxofones. Sin embargo, el cambio más radical fue la introducción de los contragolpes de percusión por un componente de la Expiración. Más tarde, Don Tomás Arboledas Rivera (Caja principal del Nazareno hasta 1998) desarrolló esta idea dotando a estas bandas de un ritmo más propio de una batería que de una banda de Semana Santa propiamente dicha. Hoy día aún se escuchan en la madrugada Linarense algunas de sus marchas de percusión. También en la banda del Nazareno se empezaron a cambiar las marchas clásicas por adaptaciones de temas musicales más populares como \"Going Home\" de Mark Knopfler o la ya célebre \"Aida\" de Verdi; cambios que poco a poco se fueron extendiendo por el resto de bandas.Con el paso de los años cada una ha desarrollado su propio estilo, por lo que cada banda de cabecera es única. Igualmente, Tomás Arboledas padre ha pasado a la historia como ser el creador y fijador de la norma general de la percusión de las bandas de cabecera. A él se debe el invento del \"Golpe de Aro\", que en Linares, es utilizado por las bandas de cabecera para indicar al viento el hecho de que una determinada marcha va a ser interpretada. Igualmente, fue el creador del particular ritmo de contratiempos, y preguntas y respuestas que se realiza en las percusiones de las Bandas de cabecera, que cuentan con una caja principal, un bombo principal, un platos, cajas y timbales en proporción variable según la banda. Las Bandas de Cabecera han sido las artífices, en gran parte, de que la Semana Santa de Linares sea de Interés Turístico Nacional, y conocida en toda España. Bandas de cabecera actuales Banda de cabecera de la Santa Cena Nombre completo: Agrupación Musical Santa Cena Sacramental Esta banda nació tras desaparecer la de la OJE durante la transición 1975-6. Y se mantuvo hasta pasada la Semana Santa de 1998 donde desfilo por última vez, desapareciendo por problemas internos durante algunos años, pero desde el 2004 ha vuelto a procesionar. En el 2006 ocurren otros problemas por lo que el anterior director (David Cejudo Emanuel) abandona la dirección la banda. siguiendo como componente en la misma. Tras estos hechos, toma las riendas de esta banda de cabecera José Miguel Escuín, quien ya fuera en su día director de otras bandas y como director de percusión David Calero Moreno. Estos directores, consiguen en pocos meses recuperar el repertorio original así como renovar completamente las marchas de percusión y sacar varias más de viento completamente nuevas. En 2013 estuvo a punto de no salir por diferentes motivos, pero consiguió reorganizarse y logró salir adelante hasta ahora. Actualmente, el director de la banda es Antonio Failde Barrios y el director de percusión es Víctor Perez. En el repertorio de esta banda de cabecera cabe destacar: \"Nunc Coepi\" con el magnífico solo de trompeta y \"Luz del Reino\", marchas estrenadas con gran aceptación en 2015, junto con \"Desde que tú te fuiste\" y \"Deus Lucem\". Las tradicionales son \"Monte Calvario\", \"La Cena\" o \"El Cantar del Arriero\", así como las marchas ligeras de \"Longinos\" y \"Bellatorum\" siendo esta última incorporada en 2017. Por último no podemos olvidar \"Triunfal\", marcha insigne de la Hermandad de la Santa Cena, propietaria de la banda de cabecera, y considerada durante décadas el himno de la hermandad. En total, en esta banda se interpretan en las diferentes marchas distintas adaptaciones de temas como \"El Cantar del Arriero\" (Zarzuela del mismo nombre), o \"Triunfal\" Marcha procedente del canto litúrgico \"Cantemos al amor de los Amores\", adaptada a banda de Palio por J. Blanco. Cuenta aproximadamente con 100 miembros, distribuidos en 60/65 de viento, y 35 aproximadamente de percusión. Banda de cabecera del Rescate Nombre completo: Agrupación Musical de Nuestro Padre Jesús del Rescate y María Santísima de los Dolores. Esta banda se fundó en el año 1972 por Pedro Martos Ayala y Francisco Martínez Zapata. Actualmente está dirigida por Enrique Maestre Infantes y Joaquín Ruiz Martínez. Esta es, a día de hoy, la única banda de cabecera que ha participado en la muestra cofrade MUNARCO de Sevilla, haciéndolo, además, dos años consecutivos, en 1999 y 2000. En la década de los 90, grabó un disco junto a la banda de cabecera de la Expiración, interpretando cada una sus mejores piezas musicales. En 2005, presentó su primer trabajo discográfico en solitario \"Noche de Jueves Santo\". En el año 2010, vio la luz su segundo trabajo discográfico titulado \"Rescate de Dolores\", con nuevas marchas como \"Massada\", \"Noche de Rescate\"... y una sorprendente versión del \"Concierto de Aranjuez\". Su presentación tuvo lugar el 21 de marzo de 2010 en el Teatro Cervantes de Linares, el cual fue abarrotado por el pueblo cofrade linarense. En noviembre de 2010, fue invitada a participar en la I Muestra de Arte Cofrade Andaluz (ARCOAN) celebrada en Jaén, realizando un aplaudido desfile por las calles del auditorio que no dejó indiferente a ningún cofrade jiennense. Cuenta con aproximadamente 150 miembros entre viento y percusión (100 de ellos en viento y el resto percusión), siendo, por ello, la más grande de Linares y la que más variedad de instrumentos posee. Entre su repertorio destacan marchas como el \"Concierto de Aranjuez\", \"Expiración\", \"Rescate de Dolores\", \"Getsemaní\"... entre otras. Banda de cabecera del Nazareno Nombre completo: Banda de Cabecera del Nazareno de Linares. Nace en el año 1975 y ya el año de su primera salida causó un gran impacto por su calidad musical. Aún resuenan en la memoria de los linarenses los redobles de Tomás Arboledas (tanto padre como hijo). Algunas de las marchas más conocidas y que actualmente son tocadas son Aida, Going Home, Príncipe de Egipto, Oración, Cirineo, Marcha Eslava, Benedictus y en la última Semana Santa de 2010 se ha añadido la adaptación de la mítica banda de película de Titanic. Cuenta esta banda con un trabajo discográfico titulado \"Alma de Dios\". En el año 2009 fue una de las bandas integrantes del I Congreso de desfiles de bandas en Sevilla, siendo el día 8 de diciembre la clausura de este congreso donde la banda del Nazareno fue a tocar a un pasacalles que se hizo por las calles de Sevilla, tocando con sus túnicas y caperuces, tal y como lo hacen en el día de la procesión, e interpretando las marchas del repertorio y sobre todo con su marcha más conocida como es la de AIDA. En el año 2012 estrenó una nueva marcha ligera titulada \"Hermanos Trompeteros\" dedicada especialmente a ellos. En el año 2013 estrenó el pregón de la hermandad dos marchas, una de ellas de bendición, con una pequeña adaptación de Bohemian Rhapsody; y La Reconquista, dedicada a la Virgen de la hermandad, ¨La Niña¨. Banda de cabecera de la Expiración Nombre completo: Banda del Stmo. Xto. de la Expiración. La Banda del Santísimo Cristo de la Expiración fue creada en el año 1969, si bien, surgió de una idea en Junta de Cabildo de mayo de 1968, porque entonces era un hermano más de la Cofradía, Antonio Martín García (actualmente director perpetuo) y siendo Hermano Mayor, Fernando Gaitán Barragán. En principio fue concebida como una banda de cornetas y tambores, contando con una veintena de componentes, todos ellos hermanos de la Cofradía. El 4 de abril de 1969, Viernes Santo, la Banda del Santísimo Cristo de la Expiración, hizo, por primera vez, estación de penitencia acompañando a sus Titulares y creando lo que se convertiría en santo y seña de la Semana Santa de Linares, las bandas de cabecera. Esta Banda, la primera en su género, se caracterizó por ir vestida con túnica de Estatutos; su ubicación, detrás de la Cruz de Guía y su estilo, sobrio y solemne. Rasgos que hoy día siguen siendo sus señas de identidad. Con el tiempo, tanto el número de componentes como los instrumentos utilizados fue creciendo, llegando a adoptar la fisonomía de una banda de música, con sus secciones de viento (metal y madera) y una nutrida sección de percusión. En la actualidad, la Banda del Santísimo Cristo de la Expiración, la componen un centenar de hermanos, todos ellos aficionados a la música, bajo la dirección de José Antonio García Expósito y al frente de la percusión Javier Pérez Padilla , Hermano Mayor D. Francisco Cuevas Anguita. , herederos de aquellos fundadores y de cientos de linarenses que, generación tras generación, han formado parte de sus filas. Hoy en día en la Banda suenan marchas como: \"La Decana\" \"Expiración\", \"El Paraíso\", \"Arca de Noé\", \"Eterna Esperanza\", \"Adagio de Yanni\", etc. Y suenan también increíbles adaptaciones de películas como: \"Gladiator\", \"Memorias de África\", \"Carmina Burana\" de la película \"Carros de Fuego\", etc. Banda de cabecera del Descendimiento Nombre completo: Banda de Cabecera Sagrado Descendimiento Esta banda ha sufrido varias transformaciones, estando en la actualidad en un momento álgido, tanto en calidad como en número de componentes. Comenzó su andadura en el año 1979 siendo D. Antonio Jódar Gómez hermano mayor de la Hermandad del Descendimiento; constando la primera formación musical que procesionó con 12 Flautas, 2 Flautines, 3 piccolos, 3 clarinetes, dos saxos altos, un saxo tenor, un trombón, un bombardino y tres trompetas. Llegando a interpretar obras fúnebres compuestas por el Director de la misma. En el año 1985 la banda sufrió su primera transformación, al añadirle su, por aquel entonces, director J. M. Jódar nuevos instrumentos a la sección de viento. Convirtiéndola en una Banda de Cabecera clásica y realizando las típicas adaptaciones de este tipo de banda. A finales de la década de los 90 la banda vuelve a transformarse, añadiendo cornetas y marchas propias de Agrupación Musical, pero la idea no llegó a cuajar En el año 2000. Esta agrupación tuvo el orgullo de viajar hasta la Feria Internacional del Turismo (FITUR) en Madrid (junto a los trompeteros de la hermandad del Nazareno de Linares) para realizar una actuación representando a la Semana Santa Linarense. Y en el año 2001 toma el relevo Rafael Peralta Torrecilla, reconocido músico linarense que consigue llevar la banda a un dulce momento musical que tuvo su recompensa cuando en el 2003 la Banda del Descendimiento consiguió el premio de la asociación Disminusport a la mejor banda de cabecera junto a la Expiración. Tras esta gran etapa de la banda, Rafael Peralta deja al cargo de la misma como director a Nacho González Cañavate en junio de 2003, continuando como Fiscal de la misma José Antonio Lumbreras Núñez y entrando como caja principal Adrián Ruíz Gómez. Continua la entrada de nuevos componentes a la banda y la percusión sigue creciendo, haciendo que la banda cuente en su actualidad con 95 componentes. En el año 2004 la banda cumpliría su XXV aniversario, realizando un concierto extraordinario en el Teatro Cervantes de Linares con motivo del mismo. Todos los años, con motivo de la Exaltación a la Mantilla que realiza la cofradía del Descendimiento, la banda realiza un pasacalles por las principales calles de la ciudad interpretando todo su repertorio antes de su actuación en el teatro. Cada año este pasacalles va ganando más adeptos. A principios del año 2006 la banda recibe una gran noticia, la cual es fruto del esfuerzo y de la ilusión de todos sus componentes, era la confirmación de la realización del trabajo discográfico tan esperado por todos. Llegados a este punto todos se ponen manos a la obra para preparar este esperado Cd. En la mañana del domingo de Ramos de este año 2007 la banda tiene el orgullo de acompañar de cabecera a la cofradía de La Borriquilla de Torredonjimeno ( Jaén). Ya en el Año 2009, dicha Banda celebra el 30.º aniversario de la Fundación siendo por aquel entonces Hermano Mayor de la Hermandad D. Antonio Jódar Gómez. Esta Formación realizó un Pasacalles Extraordinario al igual que muy multitudinario por las calles más emblemáticas de la Ciudad como: C/Carniceria, C/Rosario, C/ Teniente Ochoa o la Plaza San Francisco entre otras. Dicho Pasacalles terminó en la Casa de Hermandad del Descendimiento donde se le hizo entrega a la Banda de Cabecera \"Sagrado Descendimiento\" de su nuevo banderín, el cual estrenaran en la Cuaresma de este mismo año, siendo muy del gusto de los Cofrades que pudieron contemplarlo. En el año 2011 se queda al cargo de la sección de percusión Antonio Gazquez, dándole otro giro de tuerca a la calidad del sonido de la misma. Son invitados a actuar en ARCOAN 2011 en Jaén. La banda cuenta en la actualidad en sus filas con 124 componentes entre viento y percusión. En septiembre de 2012 se queda al cargo de la Banda Francisco Mariano Cueto Mihi quién le da un giro de tuerca al sonido de la sección de viento y quién recupera marchas que ya se quedaron en el olvido. En mayo de 2013 entra al cargo de la percusión Rubén Rodríguez Fernández. Esta banda ( al igual que la mayoría de las bandas de cabecera de Linares) se caracteriza por vestir la túnica de su cofradía durante el desfile procesional, interpretar adaptaciones de obras clásicas y bandas sonoras, las marchas de percusión más espectaculares y su paso lento. Banda de cabecera del Santo Entierro Nombre completo: Banda de Cabecera \"Quinta Angustia\". Toma este nombre ya que antiguamente la cofradía del Santo Entierro se la conocía como la Hermandad de la Quinta Angustia. La actual banda se recuperó en el año 2001 siendo fiscal de banda Antonio Valencia Fernández y director de percusión Valentín Perales Barbero.La componían entonces 20 tambores y cajas y 4 bombos. A partir del año 2002, ya se incorporan los instrumentos de viento, siendo director musical Valentín Perales hasta la actualidad y donde el número de componentes va aumentando considerablemente. Desde 2006, el fiscal de banda es Antonio López Cano, y continua como director Valentín Perales y como hermano mayor José Moreno Delgado. En este año 2007, la banda cuenta con 85 componentes aprox. y el repertorio musical de marchas es el siguiente: Santo Sepulcro(de la Marcha Fúnebre de F. Chopin) Réquiem Quinta Angustia Soledad (\"Muerte de Ase\" de la Suite Peer Gynt de E.Grieg) Lacrimosa (W.A. Mozart) Rostro Lacerado (J.S. Bach) Sufrir en soledad (\"Pavana\" de G. Fauré) Muerte y Resurrección Como marchas ligeras: Legión romana El Señor de los Anillos Banda de cabecera de las siete palabras \"Estudiantes\" Nombre completo: Banda Infantil Salesiana del Santísimo Cristo de la Buena Muerte. Esta banda se fundó a finales del año 2008 estrenándose en la Semana Santa del año 2009 con 16 tambores 5 timbales 2 bombos 1 platos y una caja principal en total 25 componentes (22 niños). Es la más joven de la ciudad y está formada por una sección de percusión, y una sección de viento compuesta a finales del año 2011 y con su primera salida en el año 2012. Los ciudadanos de linares esperan que esta banda de cabecera tenga gran auge, ya que causa gran expectación entre los vecinos. En su repertorio cuentan con las siguientes marchas de viento: - \"Cónan\" el bárbaro en lenta. -\" Su concierto\" en lenta y ligera. - \"Himno del XXV Aniversario\" del colegio Salesiano de Linares en ligera. Marchas que se han dejado de tocar en esta banda: - \"Willow\" se tocaba en lenta, después se cambió a ligera y finalmente se ha quitado del repertorio. Bandas que ya no existen Además de las citadas anteriormente, hace años otras muchas hermandades también tuvieron sus respectivas bandas de cabecera; por motivos diversos, éstas ya no procesionan. Banda de Cabecera de la Borriquilla (desaparecida en el año 1999) Banda de Cabecera de la Oración en el Huerto (se transformó en banda de acompañamiento de cristo y desapareció definitivamente en el 2003). Banda de Cabecera del Prendimiento (primero se transformó en Agrupación Musical y desde hace pocos años en la Banda de Cornetas y Tambores Nuestra Señora del Rosario) Banda de Cabecera de la Columna (desaparecida, en el año 2002.) Banda de Cabecera del Resucitado (sólo existió durante 6 años, finalmente en el 2004 la banda desapareció)",
            "Cuadrilla de costaleros de la cofradía del Nazareno de Linares, que realiza su estación de penitencia cada viernes santo de la Semana Santa de Linares, portando a Nuestra Señora del Mayor Dolor (popularmente, \"la Niña\"). Orígenes Las antiguas imágenes, normalmente de pequeño tamaño, solían disponerse en una plataforma (“andas”) que descansaba sobre una serie de varales, o grandes listones (en forma de viga) longitudinales al sentido de la marcha. Entonces, los portadores, horquilleros u hombres de trono quedan visibles, por lo que su compostura y decoro ha de ser acorde con el orden y decoro exigidos. Coincidiendo con la renovación de las cofradías tras la guerra civil, existen grandes dificultades para completar las cuadrillas necesarias para portar los tronos. Por ello, se recurre a portadores “profesionales”, normalmente, descargadores de mercancías en los mercados de abastos quienes recibían algún tipo de compensación a cambio. En ocasiones, el comportamiento y estética de estos colectivos distaba mucho de ser la esperada.​ En las anteriores circunstancias, se modifica la estructura del trono para colocar a los portadores en su interior, tras unos cortinajes, por lo que desde el exterior apenas son visibles sus pies. El peso sigue siendo soportado en los hombros, bien a través de un varal por portador, o incluso dos varales (uno por hombro). Probablemente este tipo de portadores o descargadores profesionales introdujeron el costal por lo familiar y habitual en su trabajo; en su trabajo empleaban distintos protectores, la mayoría para la espalda, y utilizando la cabeza como sustento del mismo para evitar movimientos o posiciones incorrectas. Un costal es un saco de arpillera que no sólo servía para contener y transportar mercancía (habitualmente grano, frutas con cáscara dura o alimentos en general con gran consistencia), sino que también servía de medida para su contenido; este saco se enrolla sobre un relleno alargado y mullido (\"morcillo\") que será donde se apoye el peso a portar quedando a la altura de las cervicales. El costal es la herramienta de trabajo del costalero, y su preparación y elaboración constituye una auténtica muestra de su oficio. También existen variaciones en la que los varales de madera son reemplazados por grandes tiras de cuero, y así saldría la Niña (como cariñosamente se le conoce a María Santísima del Mayor Dolor) desde 1943, hasta el estreno del trono que Guillermo Francoso tallase en 1965. En esta época comienza a emplearse la denominación de “Paso” en lugar de “Trono”, dado que el movimiento de la imagen se asemeja al caminar con una oscilación lateral menos pronunciada. Palio del Mayor Dolor Es en 1986 cuando se decide renovar el trono de la Niña, en forma de paso de palio, estrenándose el 28/3/1986, haciendo realidad los deseos de los nazarenos y del pueblo de Linares (durante la última parte del itinerario de 1986, las personas que empujaban el chasis fueron balanceando el trono, dando la sensación de que era portado por costaleros; el ambiente creado era la confirmación de que al año siguiente tenía que ser así).​ En todo este proceso, Alfonso Reyes Estévez (hermano de las Hermandades de Nuestra Señora de la Oliva y Vera Cruz de Salteras) se constituyó en una persona fundamental; desde Salteras, todas las Semanas Santas venía a ayudar a vestir a la Niña, y aportar su buen gusto y originalidad en el montaje del paso; regalo suyo fue el relicario con la imagen de Ntra. Sra. de la Oliva que ha acompañado al paso durante tantos años. También, de sus talleres “Vera-Cruz” salió el techo de palio, y bambalinas, que se realizaron entre los años 1986 y 1987. Las bambalinas estaban bordadas en oro y sedas de colores sobre terciopelo azul marino, en estilo neobarroco. También realizó la saya azul marino o toca que lució aquellos años, hasta 2003 en el que estrenara el bordado de Artesanías San José de Linares. Así como el manto púrpura-burdeos con el escudo de la Cofradía. El palio se sustentaba sobre doce varales plateados (cada uno de ellos donado por un hermano / familia de la cofradía) obra de Manuel de los Ríos (1986), y que a su vez descansaban sobre basamentos circulares; la base de los mismos eran querubines en diferentes posiciones y portando una banda con el nombre de cada apóstol (exceptuando la posición de Judas Iscariote, que se sustituyó por la de San Pablo). Los varales dividían las bambalinas laterales en cinco paños con idénticos bordados. Las frontales se dividían en tres paños separados por unos borlones o cordones dorados; en el central estaba bordado el escudo de la cofradía, rompiendo la corona del mismo el nivel de la crestería. El techo palio está dedicado a Nuestra Señora de Linarejos, patrona de Linares, con lienzos de José Gascón Mateos: La imagen de la Patrona, que se sitúa en el centro del techo, de manera que las caras de ambas imágenes permanezcan lo más próximas entre sí. Cuatro arcángeles réplica de los que encontramos en los frescos del crucero del Santuario de la Patrona, que rodean y encierran a la anterior pintura. De esta manera, el Viernes Santo del 28/3/1988,​ tuvo lugar la primera levantá de los Costaleros del Mayor Dolor, y la de aquel paso para 35 costaleros, en siete trabajaderas. Carlos Chamorro fue su primer capataz, con la ayuda de Luis Rayo (que luego sería capataz del paso del Nazareno y Javier Valcárcel (que al año siguiente sería el primer capataz de las Costaleras de San Juan) y Nacho Viedma como contraguías. En 1990 se completan los espacios entre varales con unas ánforas neobarrocas obra también del orfebre Manuel de los Ríos (1990). En 1993 se estrenó la corona en alpaca plateada, sobredorada, realizada por Orfebrería Sevillana, y que sería restaurada y enriquecida al año siguiente. Y dos años más tarde, el alfiler con el nombre de “Mayor Dolor”. El martillo actual es obra de Ramón León (1994), en forma de volutas y hojas de acanto, destacando una pareja de querubines sobre la visagra del mismo. La primera parte de la candelería se estrena en 1995; es de alpaca plateada, obra del orfebre sevillano Ramón León Peñuelas. Está constituida por 74 candelabros, dispuestos en siete filas a distintas alturas. Los más grandes (“marías”) miden casi un metro, y los más pequeños uso 30 centímetros. En opinión de su autor,​ “Es de las mejoras que he realizado, dado lo rico de su diseño, como posterior desarrollo del mismo, debido a la influencia del pie sobre el fuste o caña, pues mantiene su personalidad de tres caras, rematada por la cabeza o parte alta de forma redonda, tiene además detalles que enriquecen la obra, como las cabezas de ángeles en cada ángulo del pie, dándole ese efecto que las distingue de las demás, es estilo barroco, recordando un poco a los grandes blandones de las catedrales”. El conjunto se completa con el escudo de la cofradía en su parte central. Se completaría en el año 1997. En 2006 se estrenó la bambalina delantera, bordada a mano con oro por Francisco Pérez (Córdoba). También los actuales varales de alpaca plateada y los dos faroles de cola, cincelados a mano en los talleres Angulo de Lucena (Córdoba). Así como el respiradero, también en alpaca, con una clara división en dos niveles para dar la sensación de las estructuras habituales de respiradero más canasto, decorado con cartelas doradas en el frontal y laterales. CMD La primera cuadrilla de los Costaleros del Mayor Dolor se crea en 1988 con 35 costaleros, sin relevos, y demostraron que era posible hacer un itinerario tan diverso y extenso (en kilómetros, pendientes, y en horas) como el que hacía la Cofradía en aquellos años (incluyendo la subida al Paseo de Linarejos). Esta experiencia fue fundamental para reafirmar y motivar aún más si cabe, en el empeño de crear el resto de cuadrillas de la cofradía; y entre ambos hitos, la creación de la cuadrilla de costaleras de San Juan (1989). El bagaje y experiencia de tantos años (la manera de hacerse la ropa, la técnica, el saber andar, las composiciones, … en definitiva todo lo que influye en la forma de cargar) se ha conseguido conservar, compartir y traspasar a las nuevas generaciones de costaleros, año tras año, consiguiendo crear y mantener una personalidad e identidad propia en la forma de llevar a la Nuestra Señor del Mayor Dolor, popularmente la “Niña”. Ello sólo ha sido posible gracias a la ilusión, compromiso, compañerismo y ambiente de la cuadrilla de cada año, que es en realidad una gran familia formada tanto por los actuales como antiguos costaleros. El oficio y saber acumulado no es suficiente para que el paso ande como merece la Niña; por eso, cada año y acabada la Navidad, se preparan los ensayos. Las noches de los fines de semana previos a la Semana Santa, y con 1.600 kilos (el Viernes Santo \"el paso no pesa\"), la parihuela del palio del Mayor Dolor sale a las calles de Linares y vuelven a sonar \"Según San Juan\", Margot,... Durante estos años, también se ha trabajado tanto en recuperar tradiciones, como en convertir en ellas algunas costumbres: los acercamientos al paso de Jesús, las Salves, etc.",
            "La pardilla oretana (Iberochondrostoma oretanum) es una especie de pez teleósteo de la familia de los ciprínidos. Descripción Especie que no suele superar los 9 cm de longitud. Biología y ecología Especie bentopelágica de agua dulce. Habita en ríos de aguas claras con lecho de arenas y piedras en tramos con escasa corriente y vegetación sumergida. Distribución Su distribución se limita a los ríos Robledillo y Fresneda, ambos son unos pequeños ríos tributarios del río Jándula, perteneciente a la cuenca del Guadalquivir. Conservación Esta especie se encuentra categorizada a nivel mundial por la UICN como Críticamente Anemazada (A2ace y B2ab(ii,iii)). Las poblaciones de I. oretanum han sufrido un declive de más de un 80% en los últimos 10 años. En un estudio realizado en 2004 sólo se capturaron 8 individuos. El área de ocupación es menor de 10 km² pero además, existe un constante declive en la calidad del habitat y del mismo área de ocupación, se está produciendo la construcción de presas y la introducción de especies.​"
        ]
    },
    "test_7": {
        "question": "¿En qué equipos ha jugado Imanol Alguacil?",
        "reference": "Durante su etapa como jugador, Imanol Alguacil ha jugado en la Real Sociedad, en el Villarreal, en el Real Jaén, en el Cartagonova y en el Burgos.",
        "response": "Imanol Alguacil jugó en el Real Sociedad y en el Villarreal CF.",
        "reference_contexts": "['Imanol Alguacil Barrenetxea (Orio, 4 de julio de 1971) es un exfutbolista y entrenador español que actualmente dirige al primer equipo de la Real Sociedad. Fue conocido futbolísticamente como Imanol.\\u200b Jugó en el puesto de lateral derecho en la Real Sociedad y Villarreal CF a lo largo de la década de 1990. Con estos dos equipos disputó un total de 121 partidos en la Primera División de España a lo largo de 9 temporadas. Trayectoria como jugador Imanol Alguacil nació en 1971 en la localidad guipuzcoana de Orio. Imanol destacó como un lateral derecho de gran proyección ofensiva, lo que le permitía jugar también en el centro del campo. Fue un jugador habitual en la Real Sociedad a principios de los años 1990, pero nunca acabó de consolidarse del todo en el equipo y finalmente su carrera fue a menos. Fue integrante de la plantilla del Villarreal CF, que debutó en Primera división en la temporada 1998-99, y acabó jugando en varios equipos en Segunda y Segunda B antes de retirarse. Hasta juveniles, militó en las filas del Orioko Fútbol Taldea, equipo de fútbol de su pueblo. En su último año de juvenil fue fichado por la Real Sociedad. Pasó por el juvenil de la Real y a partir de 1989 jugó en el San Sebastián CF, filial de la Real que militaba en la Segunda División B. Con el Sanse Imanol jugó 56 partidos durante dos temporadas. Imanol debutó el 29 de septiembre de 1990 en la Primera división española de fútbol en un partido de Liga jugado por la Real en el Estadio Carlos Tartiere de Oviedo. Sin embargo esa temporada 1990-91 no volvió a jugar en Primera y siguió militando en el filial. John Toshack decidió subirlo a la primera plantilla de la Real Sociedad al comienzo de la temporada 1991-92. Perteneció a la misma generación que Bittor Alkiza, Luis Pérez o Andoni Imaz, jugadores de la cantera realista que debutaron casi a la vez en el primer equipo de la Real. Durante sus primeras temporadas Imanol tuvo su sitio en la banda derecha de la Real y jugó un buen número de partidos con la Real. Disputó 23 partidos en la temporada 1991-92 y 30 en la campaña 1992-93. Sin embargo nunca llegó a ser indiscutible y sus problemas con las lesiones no contribuyeron a ello. En la temporada 1993-94 su aportación comenzó a decrecer, aunque en la 1994-95 todavía llegó a jugar 20 partidos. Sin embargo a partir de 1996 dejó de ser habitual en las alineaciones y finalmente acabó relegado al ostracismo en su última temporada, la 1997-98, en la que solo jugó los primeros 4 partidos de Liga. Durante las 7 temporadas en las que perteneció a la primera plantilla de la Real Sociedad disputó 131 partidos oficiales con la Real, de los cuales 113 fueron en la Primera división. Marcó 7 goles con la Real en Primera, destacando un gol que marcó al Real Madrid en una victoria a domicilio en el Santiago Bernabéu durante la temporada 1993-94. A nivel colectivo obtuvo dos clasificaciones para la Copa de la UEFA, en la temporada 1991-92 (5.º puesto) y en la 1997-98 (3.er puesto). Al finalizar la temporada 1997-98 dejó el club vasco para fichar por el Villarreal CF. El equipo castellonense acababa de ascender por primera vez en su historia a la Primera división española y buscaba reforzar su plantilla con jugadores con experiencia en la máxima categoría. Sin embargo Imanol no entró demasiado en los planes de José Antonio Irulegui, técnico de los amarillos, y solo jugó 8 partidos de Liga con su club en la temporada 1998-99. El Villarreal descendió de categoría al acabar la temporada. En la temporada siguiente, en Segunda división Imanol dispuso de más minutos y contribuyó al ascenso del Villarreal, pero al configurar el equipo castellonense la plantilla de cara al regreso a Primera, no contó con el jugador vasco. Al finalizar la temporada 1999-2000 Imanol fichó por el Real Jaén, recién ascendido a la Segunda, con el que jugaría 30 partidos de Liga, aunque la mayor parte de ellos como suplente. El Jaén logró la permanencia. En la temporada 2001-02 fichó por el Cartagonova FC (actual FC Cartagena) de Segunda División A. Finalmente Imanol se retiró jugando su última temporada en el Burgos CF, también en la Segunda B. Imanol colgó las botas al finalizar la temporada 2002-03 a punto de cumplir 32 años de edad. Selección nacional Nunca llegó a ser internacional absoluto con la Selección de fútbol de España, pero llegó a disputar 3 partidos amistosos internacionales con la Selección de fútbol de Euskadi, que carece de reconocimiento oficial por parte de la FIFA. Fue en 1994, 1995 y 1997 ante las selecciones de Rusia, Paraguay y Yugoslavia. Trayectoria como entrenador Inicios Comenzó su carrera en los banquillos siendo entrenador del Orioko Fútbol Taldea.\\u200b Zarautz KE juvenil En la temporada 2010-11, entrenó al Zarautz KE juvenil, junto a Mikel Lasa.\\u200b Real Sociedad juvenil En la temporada 2011-12, fue el técnico del equipo juvenil de la Real Sociedad.\\u200b En la temporada 2012-13, dirigió al juvenil B de la Real Sociedad.\\u200b Real Sociedad \"B\" Entre 2013 y 2014, trabajó como segundo entrenador de la Real Sociedad de Fútbol \"B\".\\u200b En noviembre de 2014, pasó a ser el entrenador de la Real Sociedad de Fútbol \"B\".\\u200b Real Sociedad En marzo de 2018, se hizo cargo del primer equipo de la Real Sociedad hasta final de temporada, sustituyendo a Eusebio Sacristán.\\u200b Obtuvo 16 puntos en los 9 partidos en los dirigió al equipo donostiarra, finalizando como 12.º clasificado en la Liga. Regresó al filial txuri urdin para la temporada siguiente, hasta que en diciembre de 2018, tras la destitución de Asier Garitano, volvió a ser promocionado a entrenador de la Real Sociedad.\\u200b Su llegada supuso el revulsivo esperado y llevó al conjunto vasco a la 9.ª posición al término de la Liga. El 3 de enero de 2020, firmó la renovación de su contrato por una temporada adicional.\\u200b El elenco donostiarra acabó la Liga en 6.ª posición, clasificándose para la Liga Europa. El 3 de abril de 2021, su equipo se proclamó campeón de la Copa de Rey 19-20 que había sido aplazada por la pandemia del COVID-19. La final terminó 0–1 en el Estadio de La Cartuja de Sevilla ante el Athletic Club con gol de Mikel Oyarzabal. En consecuencia, la Real Sociedad levantó un título tras 34 años de sequía.\\u200b Además, también consiguió hacerse con la 5.ª posición en la Liga, por lo que se clasificó nuevamente para la Liga Europa. Clubes y estadísticas Como jugador Como entrenador Actualizado de acuerdo al último partido dirigido el 13 de enero de 2025. Fuente: Transfermarkt - Ceroacero. Resumen por competiciones Actualizado de acuerdo al último partido dirigido el 13 de enero de 2025. Trivia Durante sus temporadas en la Real Sociedad la afición realista adoptó la costumbre de jalear las acciones de Imanol Alguacil cantando el estribillo de la canción Imanol del grupo de rock Platero y Tú. Palmarés Campeonatos nacionales']",
        "retrieved_contexts": [
            "Imanol Alguacil Barrenetxea (Orio, 4 de julio de 1971) es un exfutbolista y entrenador español que actualmente dirige al primer equipo de la Real Sociedad. Fue conocido futbolísticamente como Imanol.​ Jugó en el puesto de lateral derecho en la Real Sociedad y Villarreal CF a lo largo de la década de 1990. Con estos dos equipos disputó un total de 121 partidos en la Primera División de España a lo largo de 9 temporadas. Trayectoria como jugador Imanol Alguacil nació en 1971 en la localidad guipuzcoana de Orio. Imanol destacó como un lateral derecho de gran proyección ofensiva, lo que le permitía jugar también en el centro del campo. Fue un jugador habitual en la Real Sociedad a principios de los años 1990, pero nunca acabó de consolidarse del todo en el equipo y finalmente su carrera fue a menos. Fue integrante de la plantilla del Villarreal CF, que debutó en Primera división en la temporada 1998-99, y acabó jugando en varios equipos en Segunda y Segunda B antes de retirarse. Hasta juveniles, militó en las filas del Orioko Fútbol Taldea, equipo de fútbol de su pueblo. En su último año de juvenil fue fichado por la Real Sociedad. Pasó por el juvenil de la Real y a partir de 1989 jugó en el San Sebastián CF, filial de la Real que militaba en la Segunda División B. Con el Sanse Imanol jugó 56 partidos durante dos temporadas. Imanol debutó el 29 de septiembre de 1990 en la Primera división española de fútbol en un partido de Liga jugado por la Real en el Estadio Carlos Tartiere de Oviedo. Sin embargo esa temporada 1990-91 no volvió a jugar en Primera y siguió militando en el filial. John Toshack decidió subirlo a la primera plantilla de la Real Sociedad al comienzo de la temporada 1991-92. Perteneció a la misma generación que Bittor Alkiza, Luis Pérez o Andoni Imaz, jugadores de la cantera realista que debutaron casi a la vez en el primer equipo de la Real. Durante sus primeras temporadas Imanol tuvo su sitio en la banda derecha de la Real y jugó un buen número de partidos con la Real. Disputó 23 partidos en la temporada 1991-92 y 30 en la campaña 1992-93. Sin embargo nunca llegó a ser indiscutible y sus problemas con las lesiones no contribuyeron a ello. En la temporada 1993-94 su aportación comenzó a decrecer, aunque en la 1994-95 todavía llegó a jugar 20 partidos. Sin embargo a partir de 1996 dejó de ser habitual en las alineaciones y finalmente acabó relegado al ostracismo en su última temporada, la 1997-98, en la que solo jugó los primeros 4 partidos de Liga. Durante las 7 temporadas en las que perteneció a la primera plantilla de la Real Sociedad disputó 131 partidos oficiales con la Real, de los cuales 113 fueron en la Primera división. Marcó 7 goles con la Real en Primera, destacando un gol que marcó al Real Madrid en una victoria a domicilio en el Santiago Bernabéu durante la temporada 1993-94. A nivel colectivo obtuvo dos clasificaciones para la Copa de la UEFA, en la temporada 1991-92 (5.º puesto) y en la 1997-98 (3.er puesto). Al finalizar la temporada 1997-98 dejó el club vasco para fichar por el Villarreal CF. El equipo castellonense acababa de ascender por primera vez en su historia a la Primera división española y buscaba reforzar su plantilla con jugadores con experiencia en la máxima categoría. Sin embargo Imanol no entró demasiado en los planes de José Antonio Irulegui, técnico de los amarillos, y solo jugó 8 partidos de Liga con su club en la temporada 1998-99. El Villarreal descendió de categoría al acabar la temporada. En la temporada siguiente, en Segunda división Imanol dispuso de más minutos y contribuyó al ascenso del Villarreal, pero al configurar el equipo castellonense la plantilla de cara al regreso a Primera, no contó con el jugador vasco. Al finalizar la temporada 1999-2000 Imanol fichó por el Real Jaén, recién ascendido a la Segunda, con el que jugaría 30 partidos de Liga, aunque la mayor parte de ellos como suplente. El Jaén logró la permanencia. En la temporada 2001-02 fichó por el Cartagonova FC (actual FC Cartagena) de Segunda División A. Finalmente Imanol se retiró jugando su última temporada en el Burgos CF, también en la Segunda B. Imanol colgó las botas al finalizar la temporada 2002-03 a punto de cumplir 32 años de edad. Selección nacional Nunca llegó a ser internacional absoluto con la Selección de fútbol de España, pero llegó a disputar 3 partidos amistosos internacionales con la Selección de fútbol de Euskadi, que carece de reconocimiento oficial por parte de la FIFA. Fue en 1994, 1995 y 1997 ante las selecciones de Rusia, Paraguay y Yugoslavia. Trayectoria como entrenador Inicios Comenzó su carrera en los banquillos siendo entrenador del Orioko Fútbol Taldea.​ Zarautz KE juvenil En la temporada 2010-11, entrenó al Zarautz KE juvenil, junto a Mikel Lasa.​ Real Sociedad juvenil En la temporada 2011-12, fue el técnico del equipo juvenil de la Real Sociedad.​ En la temporada 2012-13, dirigió al juvenil B de la Real Sociedad.​ Real Sociedad \"B\" Entre 2013 y 2014, trabajó como segundo entrenador de la Real Sociedad de Fútbol \"B\".​ En noviembre de 2014, pasó a ser el entrenador de la Real Sociedad de Fútbol \"B\".​ Real Sociedad En marzo de 2018, se hizo cargo del primer equipo de la Real Sociedad hasta final de temporada, sustituyendo a Eusebio Sacristán.​ Obtuvo 16 puntos en los 9 partidos en los dirigió al equipo donostiarra, finalizando como 12.º clasificado en la Liga. Regresó al filial txuri urdin para la temporada siguiente, hasta que en diciembre de 2018, tras la destitución de Asier Garitano, volvió a ser promocionado a entrenador de la Real Sociedad.​ Su llegada supuso el revulsivo esperado y llevó al conjunto vasco a la 9.ª posición al término de la Liga. El 3 de enero de 2020, firmó la renovación de su contrato por una temporada adicional.​ El elenco donostiarra acabó la Liga en 6.ª posición, clasificándose para la Liga Europa. El 3 de abril de 2021, su equipo se proclamó campeón de la Copa de Rey 19-20 que había sido aplazada por la pandemia del COVID-19. La final terminó 0–1 en el Estadio de La Cartuja de Sevilla ante el Athletic Club con gol de Mikel Oyarzabal. En consecuencia, la Real Sociedad levantó un título tras 34 años de sequía.​ Además, también consiguió hacerse con la 5.ª posición en la Liga, por lo que se clasificó nuevamente para la Liga Europa. Clubes y estadísticas Como jugador Como entrenador Actualizado de acuerdo al último partido dirigido el 23 de febrero de 2025. Fuente: Transfermarkt - Ceroacero. Resumen por competiciones Actualizado de acuerdo al último partido dirigido el 23 de febrero de 2025. Trivia Durante sus temporadas en la Real Sociedad la afición realista adoptó la costumbre de jalear las acciones de Imanol Alguacil cantando el estribillo de la canción Imanol del grupo de rock Platero y Tú. Palmarés Campeonatos nacionales",
            "Emilio López Fernández, deportivamente conocido como Emilio (Vigo, Pontevedra, España, 9 de julio de 1965) es un exfutbolista y entrenador español. Trayectoria Formado en la cantera del Celta de Vigo, jugó en el entonces filial celtiña, el Gran Peña, y luego en el Arosa, hasta que la temporada 1989/90 llegó al primer equipo. Durante cuatro años formó parte de la plantilla celeste –dos temporadas en Primera División y dos más en Segunda-, aunque la presencia de Javier Maté primero y Santiago Cañizares después le dejó sin opciones de ser titular. A partir de la temporada 1993/94, inició un periplo por varios equipos, buscando minutos de juego. Pasó una campaña en Segunda B con la Unió Esportiva Figueres, antes de recalar en el Club Deportivo Badajoz. Tras compartir un año la titularidad con el veterano Ángel Lozano, se marchó una temporada al CD Leganés. A su regreso a Badajoz, la temporada 1996/97, se convirtió en uno de los puntales del equipo, que luchó por el ascenso a Primera División. Esa campaña Emilio logró el Trofeo Zamora del Diario Marca como portero menos goleado de la categoría. Tras dos años más con los extremeños, la temporada 1999/00 defendió la meta del CA Osasuna, que esa campaña logró ascender a Primera División. Pero el futuro de Emilio continuaba ligado a la categoría de plata, ya que fichó por el Real Jaén. El verano de 2001, ya con 36 años, inició la última etapa de su carrera, con el Hércules CF en Segunda B. En el equipo alicantino se retiró en 2003. Tras su retirada, pasó a ser entrenador de porteros en el Celta de Vigo B. Ahora entrena al primer equipo del Getafe (en 1º División de España) Clubes Palmarés Campeonatos nacionales Distinciones individuales",
            "Carlos Hernández Alarcón (Jaén, 15 de septiembre de 1990) es un futbolista español que juega como defensa en la A. D. Ceuta F. C. de la Primera Federación. Trayectoria Entre 2013 y 2015 disputó cerca de 70 partidos con el C. E. Sabadell F. C. En campañas anteriores militó en las filas del Zaragoza y el Real Jaén. En verano de 2015 rescindió su contrato con el conjunto catalán y firmó uno de dos años con el C. D. Lugo.​ El 28 de junio de 2017 fichó por el Real Oviedo.​ Allí estuvo cuatro temporadas, y el 28 de junio, pero de 2021, se incorporó a la Agrupación Deportiva Alcorcón por dos temporadas.​ En su primer año en Alcorcón el equipo descendió a la Primera División RFEF,​ categoría en la que iba a jugar con el C. D. Eldense tras anunciarse su fichaje por el club en agosto de 2022.​ Allí militó un par de campañas, habiendo logrado un ascenso a Segunda División en la primera de ellas.​ El 12 de julio de 2024 firmó por la A. D. Ceuta F. C.​ Estadísticas Actualizado al 5 de diciembre de 2024.​",
            "Luis Artime (Palmira, Mendoza, 2 de diciembre de 1938) es un exfutbolista argentino que jugó de delantero. Fue uno de los más destacados delanteros sudamericanos durante los años sesenta e inicios de la década de 1970, destacandose en equipos como River Plate, Independiente, Nacional y Palmeiras. Consagrado cuatro veces como máximo goleador de la Primera División de Argentina, y en tres oportunidades del Campeonato Uruguayo, fue más notablemente figura del Club Nacional de Football campeón de América y del mundo en 1971, siendo el máximo goleador del torneo continental. Integró la selección argentina que alcanzó los cuartos de final en el Mundial de Inglaterra 1966, anotando tres goles en cuatro partidos. Asimismo, fue el goleador del Campeonato Sudamericano de 1967, terminando subcampeón. Goleador empedernido, poseía una intuición excepcional para ubicarse dentro del área en el lugar preciso para con un toque corto o de cabeza convertir el gol. Trayectoria Se inició en Independiente de Junín, de la provincia de Buenos Aires. En 1958 pasó a Atlanta, donde debutó en primera división. Allí se produjo su lanzamiento y su explosión como delantero goleador. Formó un gran equipo junto a Errea, Gatti, Clariá, Griguol, Bettinotti, Gonzalito, Guenzatti, y otros buenos jugadores que forman parte de la historia de Atlanta En 1962 fue vendido a River Plate, donde fue goleador en 1962 y 1963. En 1966 es transferido a Independiente, donde salió campeón en 1967. En el Independiente estuvo formando una legendaria delantera junto a Raúl Emilio Bernao, Raúl Armando Savoy, Héctor Yazalde y Aníbal Tarabini. Una verdadera aplanadora que ostenta el segundo mayor porcentaje de efectividad en la historia del profesionalismo argentino con el 86,67% de los puntos. Jugó 15, ganó 12, empató 2 y apenas perdió un encuentro, frente a San Lorenzo. Fue máximo goleador del Campeonato argentino en dos ocasiones con la camiseta de CA Independiente, en 1966 con 23 goles y en el Metropolitano de 1967 con 11 tantos. Inició su carrera en el exterior en 1969 en el club brasileño Palmeiras, donde ayudó a ganar el cuarto título brasileño del club y salió con 49 goles en 57 partidas disputadas. En ese mismo año llegó a Nacional, de Uruguay, donde ganó muchos títulos y dejó un grato recuerdo. Se consagró tricampeón del campeonato uruguayo (1969, 1970 y 1971), convirtiéndose en el goleador de esos tres torneos anotando 24, 21 y 16 goles respectivamente. También en Nacional ganó la Copa Libertadores (1971), la Copa Intercontinental (1971) y la Copa Interamericana (1971). En 1972 jugó en Fluminense de Brasil. Finalmente en 1973 regresó a Nacional, donde culminó su carrera como futbolista en el año 1974, Fue el máximo goleador de los últimos 30 años en este equipo al convertir 158 goles en 5 temporadas. Selección nacional Fue internacional con la Selección Argentina. en donde jugó 25 partidos y convirtió 24 goles, logrando uno de los máximos promedios de efectividad de todos los tiempos: 0.96, casi un gol por partido. En la cantidad de tantos, es el octavo más alto en la selección de su país. Participó de la Copa Mundial de 1966, donde Argentina llegó a cuartos de final. En dicha cita fue unos de los mejores de Argentina, anotando tres goles: dos en la gran victoria frente a España por dos tantos a uno, y otro en el triunfo frente a los suizos por 2-0. En 1967 participó de la Copa América, resultando el goleador de Argentina, con cinco tantos. Participaciones en Copas del Mundo Estadísticas Actualizado de acuerdo al último partido jugado el 19 de febrero de 1974. Resumen estadístico (*) Datos oficiales de RSSSF (**) Datos de livefutbol (***) Datos oficiales de RSSSF Palmarés Campeonatos nacionales Copas nacionales Copas internacionales Otros Títulos Distinciones individuales",
            "Manuel Pancorbo Chica (n. Torredelcampo, Jaén (España); 7 de julio de 1966), atleta de fondo y medio fondo español, siendo uno de los principales atletas españoles desde finales de los años 1980 hasta principios del siglo XXI. Trayectoria Casi toda su carrera deportiva estuvo ligado al club madrileño Larios A.A.M., que luego pasó a denominarse Airtel A.A.M., aunque sus mayores éxitos los consiguió como miembro de la selección española a la que representó en 24 ocasiones. Primero destacó en 1500 m, se perfilaba como uno de los herederos de José Luis González y José Manuel Abascal, y así en los juegos olímpicos de Barcelona 1992, consiguió alcanzar la final, en la que su compatriota Fermín Cacho se hizo con el oro, mientras Pancorbo se quedaba con un meritorio undécimo puesto, fuera de los diplomas olímpicos. Volvería a participar en la prueba de 1500 m en los mundiales de 1993 y en los europeos de 1994, consiguiendo puesto de finalista al quedar sexto en esta última competición. En 1994 en la final que se clasificaba sexto, los otros dos españoles, Fermín Cacho e Isaac Viciosa ganaban el oro y la plata respectivamente. Este hecho y la irrupción de otra joven promesa del 1500 m hizo que Manuel se pasara a la prueba de 5000 m. En esta prueba participaría sin mucho éxito en los Juegos Olímpicos de Atlanta 1996, no logrando clasificarse para la final, sí lo consiguió en los mundiales de 1997 y 1999 en los que no consiguió plaza de finalista aunque sí tuvo actuaciones destacadas. A nivel continental le llegaron sus mejores éxitos especialmente la medalla de plata que consiguió en el Campeonato de Europa de 1998, siendo superado solo por su compatriota Isaac Viciosa. También obtuvo meritorias actuaciones en la superliga de atletismo durante los años de 1995 a 1998. También consiguió una medalla de plata en 3000 m en el campeonato de Europa de Pista cubierta de 1998. Palmarés Internacional Europeo Aire Libre Budapest 1998 — 5000 m — medalla de Plata con una marca de 13:38.03 Europeo pista Cubierta Valencia 1998 — 3000 m — medalla de Plata con una marca de 7:55.23 Europeo de Cross Ferrara 1998 — Manuel Pancorbo participa en la selección española que consigue la medalla de Bronce por equipo con 68 ptos. Campeonato Iberoamericano México 1998 — 1500 m — medalla de Oro con una marca de 3:52.11 Superliga Lillle 1995 — 5000 m — obtuvo un 3.º puesto cn una marca de 13:48.93 Superliga Madrid 1996 — 5000 m — obtuvo un 2.º puesto con una marca de 13:55.18 Superliga Múnich 1997 — 3000 m — obtuvo un 2.º puesto con una marca de 7:41.60 Superliga San Petersburgo 1998 — 3000 m — 2.º puesto con una marca de 7:42.24 Nacional Campeonato de España de 5000 m al Aire libre: 1997, 1998 1997 14:01.84 1998 13:51.88 Campeonato de España de 1500 m en Pista cubierta: 1994 1994 3:51.88 Campeonato de España de 3000 m en Pista cubierta: 1998 1998 8:04.74 Premios, reconocimientos y distinciones Medalla de Bronce de la Real Orden del Mérito Deportivo, otorgada por el Consejo Superior de Deportes (1999)"
        ]
    },
    "test_8": {
        "question": "¿En qué categoría juega el equipo de fútbol de Torredonjimeno?",
        "reference": "El Unión Deportiva Ciudad de Torredonjimeno compite actualmente en el grupo nueve de la Tercera División.",
        "response": "La Unión Deportiva Ciudad de Torredonjimeno juega en el Grupo IX de la Tercera División de España.",
        "reference_contexts": "['La Unión Deportiva Ciudad de Torredonjimeno es un club de fútbol de la ciudad de Torredonjimeno, (Jaén) que en la actualidad compite en el Grupo IX de la Tercera División de España. Historia Fundación y primeros años La UDCT nació en 2009 para sustituir al histórico Torredonjimeno C. F., que había desaparecido ese mismo año debido a las deudas que arrastraba. Se confeccionó una plantilla compuesta por jugadores procedentes de las categorías inferiores del desaparecido club, comenzando su andadura desde la Segunda división provincial de Jaén. Ascenso a Tercera División Consiguió ascender a Tercera división al finalizar la temporada 2015/2016 tras acabar tercero en la clasificación de Primera División Andaluza. La temporada 2016/2017 fue su primera temporada en categoría nacional tras su refundación. Escudo Uniforme Uniforme titular: Camiseta de rayas rojas y blancas, pantalón azul y medias rojiblancas. Uniforme alternativo: Camiseta verde, pantalón y medias negras. Estadio Juega sus partidos como local en el Estadio Municipal Matías Prats, inaugurado en el año 1934 por Matías Prats (padre) y con una capacidad de 4500 espectadores de los cuales 3000 son sentados. El estadio posee césped natural y está considerado uno de los mejores de la provincia de Jaén. Durante los años se han ido realizando reformas en el estadio para adecuarlo a los requerimientos de la competición. En el año 2020 está prevista la sustitución del césped natural del estadio por uno artificial de última generación. También se llevará a cabo el cambio de asientos, nueva iluminación led, nueva publicidad, megafonía. Datos del club Temporadas en Primera División: 0 Temporadas en Segunda División: 0 Temporadas en Segunda División B: 0 Temporadas en Tercera División: 6 (incluida la 2021-22) Temporadas en División de Honor Andaluza: 0 Temporadas en Primera Andaluza: 4 Temporadas en Segunda Andaluza: 1 Temporadas en Tercera Andaluza: 2 Plantilla 2021/22 Actualizado el 1 de agosto de 2021. Juan Gabriel Parrales es un futbolista peruano que se ha destacado como extremo izquierdo, jugando casi toda su carrera en el UD Ciudad de Torredonjimeno, un club de la Primera Andaluza. Su talento y dedicación lo llevaron a ser reconocido con la \"Paloma de Oro\", un galardón que se otorga al máximo goleador de la selección absoluta de Perú. Parrales es conocido por su velocidad y habilidad en el campo, consolidándose como un referente en el fútbol peruano. Sin duda es una de las leyendas de este club. Lucas SC es un futbolista español, conocido por su estilo de juego rudo y rústico, que ha dejado huella en el UD Ciudad de Torredonjimeno. A lo largo de su carrera en la Primera Andaluza, ha establecido el récord de más tarjetas rojas y más lesiones causadas, lo que lo convierte en un ejemplo de dureza en el campo. Su enfoque agresivo y su determinación lo han hecho destacar, aunque también han generado controversia en el mundo del fútbol. Lucas es, sin duda, un jugador que representa la esencia del fútbol combativo Nicholas Avendaño Cera es un central inglés que juega para el UD Ciudad de Torredonjimeno, donde es conocido por su apodo \"el guiri de la cera\". Su habilidad para robar balones es impresionante, ya que parece tener un \"pegote de cera\" en los pies y en la cabeza que le permite mantener la posesión y evitar que los adversarios le quiten el balón. Con su estilo defensivo sólido y su astucia en el campo, Cera se ha convertido en un pilar fundamental para su equipo, destacándose por su capacidad para desbaratar ataques rivales.']",
        "retrieved_contexts": [
            "La Unión Deportiva Ciudad de Torredonjimeno es un club de fútbol de la ciudad de Torredonjimeno, (Jaén) que en la actualidad compite en el Grupo IX de la Tercera División de España. Historia Fundación y primeros años La UDCT nació en 2009 para sustituir al histórico Torredonjimeno C. F., que había desaparecido ese mismo año debido a las deudas que arrastraba. Se confeccionó una plantilla compuesta por jugadores procedentes de las categorías inferiores del desaparecido club, comenzando su andadura desde la Segunda división provincial de Jaén. Ascenso a Tercera División Consiguió ascender a Tercera división al finalizar la temporada 2015/2016 tras acabar tercero en la clasificación de Primera División Andaluza. La temporada 2016/2017 fue su primera temporada en categoría nacional tras su refundación. Escudo Uniforme Uniforme titular: Camiseta de rayas rojas y blancas, pantalón azul y medias rojiblancas. Uniforme alternativo: Camiseta verde, pantalón y medias negras. Estadio Juega sus partidos como local en el Estadio Municipal Matías Prats, inaugurado en el año 1934 por Matías Prats (padre) y con una capacidad de 4500 espectadores de los cuales 3000 son sentados. El estadio posee césped natural y está considerado uno de los mejores de la provincia de Jaén. Durante los años se han ido realizando reformas en el estadio para adecuarlo a los requerimientos de la competición. En el año 2020 está prevista la sustitución del césped natural del estadio por uno artificial de última generación. También se llevará a cabo el cambio de asientos, nueva iluminación led, nueva publicidad, megafonía. Datos del club Temporadas en Primera División: 0 Temporadas en Segunda División: 0 Temporadas en Segunda División B: 0 Temporadas en Tercera División: 6 (incluida la 2021-22) Temporadas en División de Honor Andaluza: 0 Temporadas en Primera Andaluza: 4 Temporadas en Segunda Andaluza: 1 Temporadas en Tercera Andaluza: 2 Plantilla 2021/22 Actualizado el 1 de agosto de 2021. Juan Gabriel Parrales es un futbolista peruano que se ha destacado como extremo izquierdo, jugando casi toda su carrera en el UD Ciudad de Torredonjimeno, un club de la Primera Andaluza. Su talento y dedicación lo llevaron a ser reconocido con la \"Paloma de Oro\", un galardón que se otorga al máximo goleador de la selección absoluta de Perú. Parrales es conocido por su velocidad y habilidad en el campo, consolidándose como un referente en el fútbol peruano. Sin duda es una de las leyendas de este club. Lucas SC es un futbolista español, conocido por su estilo de juego rudo y rústico, que ha dejado huella en el UD Ciudad de Torredonjimeno. A lo largo de su carrera en la Primera Andaluza, ha establecido el récord de más tarjetas rojas y más lesiones causadas, lo que lo convierte en un ejemplo de dureza en el campo. Su enfoque agresivo y su determinación lo han hecho destacar, aunque también han generado controversia en el mundo del fútbol. Lucas es, sin duda, un jugador que representa la esencia del fútbol combativo Nicholas Avendaño Cera es un central inglés que juega para el UD Ciudad de Torredonjimeno, donde es conocido por su apodo \"el guiri de la cera\". Su habilidad para robar balones es impresionante, ya que parece tener un \"pegote de cera\" en los pies y en la cabeza que le permite mantener la posesión y evitar que los adversarios le quiten el balón. Con su estilo defensivo sólido y su astucia en el campo, Cera se ha convertido en un pilar fundamental para su equipo, destacándose por su capacidad para desbaratar ataques rivales.",
            "El Torredonjimeno Club de Fútbol fue un club de fútbol español de la ciudad de Torredonjimeno en Jaén. Fue fundado en 1940 y desapareció en 2009, año en que se funda la Unión Deportiva Ciudad de Torredonjimeno para sustituir al desaparecido club. Historia El Torredonjimeno Club de Fútbol fue fundado en 1940. Curtido en las categorías regionales, a finales de los 90 se acomoda en Tercera División, consiguiendo en el año 2002 la que hasta ahora es su mayor gesta en lo deportivo, el ascenso a Segunda División B. La temporada 2007-2008 descendió de Tercera División por impagos. La temporada 2008-2009 empieza jugándola en el Grupo 3 de la Primera División Andaluza pero en la jornada 14 anuncia su retirada de la competición y con su posterior desaparición. Presidentes Entre los presidentes del Torredonjimeno destaca la figura de Javier Checa, también alcalde de la ciudad y dueño de diversos negocios como Capital TV (televisión local de Málaga). Durante su mandato, el equipo organizó partidos excéntricos, como el que le enfrentó a la división femenina del Levante UD en favor de la lucha contra el cáncer o, especialmente, el conocido como Trofeo Escocia,​ en el que tanto el Torredonjimeno como sus rivales jugaban con falda escocesa en lugar de pantalón, y al que sólo podían acudir mujeres,​ ya que se vetaba la entrada al estadio a los hombres. Uniforme Uniforme titular: Camiseta a rayas verticales rojas y blancas, pantalón azul y medias rojas. Uniforme alternativo: Camiseta y pantalón oro y medias negras. Estadio El Polideportivo Municipal Matías Prats, debe su nombre al famoso periodista deportivo Matías Prats Cañete, quien lo fundó. Situado en la calle Fuente del Mármol, cuenta con aforo para 4500 espectadores. Datos del club Temporadas en 1ª: 0 Temporadas en 2ª: 0 Temporadas en 2ª B: 1 (2002/03) Temporadas en 3ª: 8 Temporadas en Regional Preferente: 23 Temporadas en Primera Regional: 9 Jugadores Plantilla 2007/08 Entrenadores Su último entrenador fue Antonio Calahorro Alcaraz. Palmarés Subcampeón de Tercera División (1): 2004/05 Campeón Fase autonómica Copa Federación de Andalucía Oriental: (1) 2001-02 Campeón de Regional Preferente (3): 1990/91, 1991/92, 1997/98 Campeón de Primera Regional (2): 1967/68, 1985/86",
            "Antonio Jesús Caballero (Martos, Andalucía, 6 de enero de 1994) es un futbolista español. Juega como centrocampista en las filas de la U. D. Logroñés de la Segunda Federación. Trayectoria Originario de Martos, Jaén, se formó en las categorías inferiores del Séneca.​ En 2013 fichó por el Martos C. D. donde estuvo una temporada.​ Al año siguiente se marchó al Lucena C. F.​ En 2015 fichó por la UD Ciudad de Torredonjimeno, y en ese mismo año se marchó al Atlético Mancha Real. Al año siguiente fichó por el Elche C. F. Ilicitano donde estuvo temporada y media, además, debutó con el primer equipo en la Segunda División.​ En la temporada 2017-18 jugó para el Rápido de Bouzas y la temporada 2018-19 lo hizo en el C. D. Castellón.​ En junio de 2019 fichó por el C. D. Badajoz,​ con el que jugó el playoff de ascenso a Segunda División.​ En esa categoría jugó la campaña siguiente después de llegar al C. D. Mirandés.​ El 26 de julio de 2021 firmó por el UCAM Murcia C. F.​ Jugó 16 encuentros durante la primera vuelta de la competición antes de recalar a finales de año en el San Fernando Club Deportivo, rival entonces del conjunto universitario en la Primera División RFEF.​ Allí estuvo doce meses antes de fichar el Córdoba C. F. en enero de 2023 para lo que quedaba de temporada.​ La siguiente se marchó a la U. E. Cornellà,​ con la que jugó 37 partidos en Primera Federación, y la 2024-25 se unió a la U. D. Logroñés.​ Clubes",
            "La Clásica Ciudad de Torredonjimeno es una clásica prueba ciclista de categoría amateur que se celebra en España, en la localidad jienense de Torredonjimeno. Esta prueba forma parte de la Copa de España de Ciclismo.​​​ Palmarés Palmarés por países Notas y referencias",
            "La Copa Presidente de la Diputación de Jaén de Fútbol 2014 es la 1ª edición de dicha competición. Este torneo comenzó el 18 de agosto de 2014 y terminó el 18 de septiembre de ese mismo año. La edición constó de una fase con 16 equipos de la Provincia de Jaén. El campeón de esta edición fue el Linares Deportivo tras ganar (0-3) al Atlético Porcuna. Fase final Final La final de este torneo se disputó en el estadio Matías Prats, en Torredonjimeno. La fecha del partido fue el 18 de septiembre y el ganador de esta edición de copa fue el Linares Deportivo tras imponerse al Atlético Porcuna por (3-0) en un partido en el que el Linares fue muy superior."
        ]
    },
    "test_9": {
        "question": "¿Cómo se llama el estadio del equipo de fútbol sala de Jaén?",
        "reference": "El estadio del Jaén Fútbol Sala es el Olivo Arena.",
        "response": "El estadio del equipo de fútbol sala de Jaén es el Estadio de La Victoria.",
        "reference_contexts": "['El Palacio de Deportes Olivo Arena , conocido simplemente como Olivo Arena es un pabellón de la ciudad de Jaén (España). En él juega sus partidos de Primera División de fútbol sala el Jaén Paraíso Interior y también se albergan grandes eventos.\\u200b Historia El pabellón se inaugura en 2021 y se convierte en la nueva casa del Jaén Paraíso Interior para disputar sus partidos de Primera División de fútbol sala.\\u200b Puede albergar distintos tipos de eventos. Del 31 de marzo al 3 de abril de 2022 se disputó la Copa de España de fútbol sala 2022.\\u200b Instalaciones El pabellón dispone de una pista principal, mayormente utilizada para el fútbol sala o baloncesto y también dispone de: vestuarios, camerinos, salas polivalentes, oficinas, salas de prensa Y salón de actos. Eventos Se disputan los partidos de Primera División de fútbol sala del Jaén Paraíso Interior. Se celebran distintos eventos, especialmente deportivos. El 5 de marzo de 2022 se disputó el Campeonato de España Junior de taekwondo. Del 31 de marzo al 3 de abril de 2022 se disputó la Copa de España de fútbol sala 2022. Del 14 de mayo al 15 de mayo de 2022 se disputó la Final Four de la Copa del Rey de fútbol sala 2022.\\u200b El 16 de mayo de 2022 los Harlem Globetrotters llevaron a cabo un espectáculo.\\u200b El DJ argentino Bizarrap actuó, junto con otros 10 artistas, el sábado 18 de junio de 2022.\\u200b Del 4 al 10 de septiembre de 2022 se disputó la fase final de la Eurocopa sub-19 de fútbol sala de la UEFA.']",
        "retrieved_contexts": [
            "El estadio de La Victoria es un estadio de fútbol localizado en Jaén, España, en el cual disputa sus partidos como local el Real Jaén Club de Fútbol. Heredó su nombre del anterior estadio, que se encontraba situado en el céntrico barrio jienense de La Victoria. Historia Se inauguró el 29 de agosto de 2001, celebrándose el primer partido oficial el 2 de septiembre. Hasta entonces, el Real Jaén disputaba sus partidos en el Antiguo Estadio de la Victoria. El partido inaugural, de Segunda división, enfrentó al Real Jaén con el Poli Ejido, y acabó con victoria por 3 a 1 del equipo jiennense. El primer gol oficial marcado en el estadio fue obra de Goran Milošević en el minuto 10, en el lanzamiento de una falta cometida sobre Jurado en el borde del área. Los otros dos goles del Jaén fueron obra de Jurado y Rueda, mientras que el gol ejidense lo marcó Cañas. Su primer aforo completo se produjo en la fase de ascenso a Segunda División 2009, cuando se enfrentó a la SD Ponferradina en la segunda eliminatoria, ganando por 1 a 0 con gol de Joseba Arriaga, lo que supuso el paso a la tercera y última ronda.​ En el siguiente partido, contra el Villarreal B, por primera vez se amplió el aforo con gradas supletorias hasta conseguir 4650 localidades más.​​ Para el año 2023, el estadio de la Victoria fue reformado con la dotación de una nueva cubierta metálica (sustituyendo a la antigua que se encontraba en estado de ruina), creación de un nuevo parking de 500 plazas y nuevas zonas ajardinadas así como la sustitución y siembra de un nuevo césped para el terreno de juego. Eventos deportivos En este estadio el Real Jaén ha disputado encuentros oficiales de Segunda División, Segunda B, Promoción de ascenso a Segunda, Copa del Rey y Copa Federación. El Real Jaén B, pese a contar con el Estadio Municipal Sebastián Barajas, también disputa ocasionalmente sus encuentros en La Victoria cuando el calendario de ambos equipos lo permite. También se han disputado dos encuentros de la Selección Española Sub-21. El primero de ellos terminó con resultado favorable para el conjunto español por 2-1 contra la Selección Portuguesa Sub-21. El segundo encuentro se disputó en septiembre de 2023 ante la Selección Escocesa Sub-21 con resultando en 1-0 favorable al conjunto español. Eventos extradeportivos Durante algunos veranos, en sus instalaciones tuvo lugar la zona de ocio Oliva.va (rebautizada como Oliva.va Estadio), donde se instalaban casetas, atracciones y un escenario en el que se hacían conciertos, para que los jóvenes jiennenses disfrutasen de un espacio al aire libre bastante retirado de la ciudad.",
            "El Jaén Fútbol Sala \"B\" es el equipo filial del Jaén Paraíso Interior. Fue fundado en 2011 y después refundado en 2014. Milita actualmente en la 2B Historia El equipo filial del Jaén Fútbol Sala pasó a competir en categoría sénior cuando el club consiguió suficiente dinero como para tener un equipo \"B\" que luchase por estar en lo más alto y conseguir un hipotético ascenso a categoría nacional, es decir, que no sólo sirviese para formar jugadores, sino que pudiese jugar más allá de la provincia de Jaén. Para la temporada 2011/12, el club decidió crear un equipo filial. Empezó en la que era la categoría de menor nivel de la época, la Primera Provincial de Jaén, donde terminó 11.º​ en una liga de 16 equipos. Tras no obtener los resultados esperados el proyecto del equipo filial se canceló temporalmente. El equipo filial que conocemos hoy en día, se fundó en 2014 y empezó en, la categoría más baja, la Segunda Andaluza. En esta categoría debuta ganando el título de liga y consigue el ascenso directo a Primera Andaluza. Aquí, consigue quedar segundo tras perder en la última jornada con el otro aspirante al título.​ Este subcampeonato no le permitía poder luchar por el ascenso a Tercera División, sin embargo, el campeón de liga, el Tito Candi C. D. renuncia a disputar el play-off de ascenso por lo que este puesto pasa al filial jiennense. En esta eliminatoria gana por un global de (11-3) al Atco. Huelin F. S. y consigue el ascenso a Tercera.​ En la temporada 2017/18 hace su debut en la Tercera División, ocupando puestos altos y peleando el título de liga hasta las jornadas finales, donde cae a la 6.ª posición. La siguiente temporada, 2018/19, consigue ser campeón de liga del grupo 18 de Tercera División y jugar el play-off de ascenso con el campeón del grupo 17, el Nazareno Dos Hermanas, equipo al que doblega en el cómputo global de la eliminatoria jugada a ida y vuelta. Consiguiendo así el ascenso a la Segunda División B del fútbol sala español. La temporada 2019/20 se estrena en la Segunda División B realizando un gran papel, consiguiendo su mejor clasificación al final de la primera vuelta, siendo 2.º. Durante toda la temporada, el equipo estuvo en los cuatro primeros puestos que daban derecho a jugar el play-off de ascenso a la Segunda División. Tras la 23.ª jornada cayó al quinto puesto, momento justo en el que se suspendió la competición por el Covid-19. Cabe destacar que el Jaén Paraíso Interior \"B\" juega la Copa Diputación desde su II edición, y no el primer equipo como sucedió en la I edición la cual ganó. Trayectoria Palmarés Torneos nacionales Tercera División de España (1): 2018/2019. Torneos regionales Copa Presidente de la Diputación (2): 2019 y 2021. Subcampeón de Copa Presidente de la Diputación (1): 2018. Subcampeón de Segunda División de Andalucía (1): 2016/17. Tercera División de Andalucía (1): 2015/2016.",
            "El antiguo estadio de La Victoria (Jaén) fue el estadio donde disputó sus partidos como local el Real Jaén C. F. entre 1944 y 2001. Se inauguró el 29 de octubre de 1944, cuando al Real Jaén CF todavía se le conocía como la Olímpica Jiennense. El equipo militaba por aquel entonces en Tercera División, y a esta categoría correspondió el partido inaugural, que enfrentó al equipo jiennense contra el Algeciras CF y que terminó con empate a 2 goles. Por sus reducidas dimensiones y la cercanía de las gradas, durante mucho tiempo La Victoria fue un fortín para el Real Jaén CF, ya que los equipos que acudían a enfrentarse a él se veían atenazados por la afición jiennense o no se desenvolvían bien en un campo de esas dimensiones. Por su localización en el centro de la ciudad, eran muchos los aficionados que veían el partido no desde el estadio, sino desde edificios colindantes, especialmente en la azotea del Colegio El Almadén y en los pasillos de la Escuela Politécnica Superior, cuyas ventanas daban a La Victoria. En este estadio, el Real Jaén CF disputó encuentros en las cuatro máximas categorías del fútbol español: Primera División, Segunda División, Segunda B y Tercera División. El último partido disputado en La Victoria fue el correspondiente a la última jornada de la liga 2000/01 en Segunda división, celebrado el 17 de junio de 2001, que enfrentó al Real Jaén CF y al Real Betis Balompié y que concluyó con un resultado de 0-2, con dos goles de Gastón Casas, lo que supuso el ascenso del Betis a Primera División. El último acontecimiento que acogió fue un concierto de Julio Iglesias en agosto de 2001, tras el cual el estadio quedó cerrado hasta su demolición. Fue reemplazado por el actual Estadio de la Victoria el 2 de septiembre de 2001, y se demolió casi 4 años más tarde, en abril de 2005, junto con la Escuela Politécnica Superior de Jaén. Actualmente, en su localización se encuentra un edificio de El Corte Inglés y un parque público.",
            "El Jaén Fútbol Sala, por razones de patrocinio Jaén Paraíso Interior, es un equipo profesional de fútbol sala fundado en 1987 en Jaén, España. Actualmente juega en la Primera División de la LNFS, máxima categoría nacional. Historia Fundado en 1987, el Jaén Fútbol Sala ha sufrido diferentes cambios de nombre por motivos de patrocinio: Jaén Paraíso Interior, Alvic Jaén, Cajasur Jaén F. S., Cánava, Oliva Secavi, Zeluán, Fuconsa, Cafetería Zúrich, Real Jaén F. S., Adenta Real Jaén F. S. , Fuconsa Jaén F.S. y más. Por todos estos nombres se ha ido conociendo a lo largo de su historia al equipo de la capital del Santo Reino. En los años 80 y 90, y bajo el nombre de Oliva Secavi vive sus primeros años de gloria tras conseguir 2 Copas de Europa de la UEFS, 3 Ligas españolas y 2 Copas Ibéricas. Todas ellas conseguidas en el fútbol sala pre-FIFA y sin estar inscrito en la LNFS. Tras estos primeros años compitiendo en competiciones ajenas a la LNFS, el Jaén se inscribe partiendo desde Primera Nacional \"B\" en la temporada 1991/92. Tras el cambio de patrocinador, que pasaba a ser Cajasur, el cual patrocinaba al Córdoba (equipo de se encontraba en la División de Honor), el equipo ascendía a División de Honor, en el Grupo C. Queda 5.º en un grupo de 8 equipos y disputa la promoción de permanencia en el Grupo Par, donde consigue la salvación. A la siguiente campaña, en la 1993/94, queda 9.º en un grupo de 12 equipos y en la promoción de permanencia no consigue la salvación. El equipo, ya en División de Plata, compite tres temporadas seguidas en esta categoría buscando el ascenso que finalmente consigue en la 1996/97, quedando campeón. Cuando Jaén vuelve a la máxima categoría del fútbol sala nacional, en la edición 1997/98, ya se había reestaurado de nuevo la competición y se eliminaron los grupos para hacer una liga en la que se enfrentasen todos los equipos. Consigue la permanencia. Sin embargo en la siguiente campaña, queda en puestos de descenso y baja a la División de Plata. A la temporada siguiente, en la 1999/00, Jaén busca el ascenso, ascenso que casi consigue al quedar subcampeón. Durante 3 temporadas seguidas, Jaén se queda a las puertas del ascenso, sin embargo, en la 2002/03 tras una mala gestión deportiva y económica, el equipo desciende al quedar 15.º a la Primera Nacional \"A\". El club pese a las adversidades se marcó el objetivo de ascender. Tras unas primeras temporadas un tanto decepcionantes, el equipo se veía sumergido en una crisis institucional. Estos hechos hacen que Jaén permanezca 7 años en la categoría de bronce. Sin embargo, en la temporada 2009/10, el club consigue formar un buen equipo y consigue quedar campeón de grupo logrando de esta manera el ascenso. Además, el equipo se proclamó campeón de la Copa de Andalucía, competición en la que participaba por primera vez. La temporada 2010/11, la disputa en División de Plata, sin embargo, el equipo tiene graves problemas económicos y necesita 38.000 euros para mantener la categoría. Aquí apareció Nicolás Sabariego con su empresa Fuconsa para hacerse cargo del club y conseguir el dinero. Convenció a empresas locales y a jugadores andaluces para jugar en el club. Se consiguió menos dinero de lo acordado pero finalmente, el club se pudo inscribir en la LNFS con un presupuesto limitado que se notó en los desplazamientos cuando el equipo viajaba en furgonetas e incluso en coches particulares. En la temporada siguiente el equipo termina 4.º en liga y disputa el Play-Off de ascenso, pero finalmente no consigue ascender. Sin embargo, en la siguiente campaña, queda 5.º y asciende de manera directa por los problemas de otros clubes que quedaron por delante de él. El Jaén, tras 14 años, vuelve a la máxima categoría del fútbol sala nacional. En la 2013/14, el objetivo era la salvación, el cual consigue con varias jornadas de antelación al finalizar 10.º en la liga. En la temporada 2014/15 el club quería seguir creciendo y se marcaron 2 objetivos con un presupuesto de 450.000 euros. El primero era meterse en la Copa de España y el segundo luchar por el Play-Off al título. Para ello, Sabariego renovó el contrato con las administraciones públicas: Junta de Andalucía, Ayuntamiento y especialmente la Diputación de Jaén, principal patrocinador y quien le da el nombre al equipo: “Jaén Paraíso Interior”; y con las empresas locales. Además, bajó el precio de los abonos para pasar de los 700 a los 1000 socios. Una vez se consiguió todo, Sabariego dejó su cargo para pasar a ser el director deportivo del club y la presidencia la dejó en manos de Germán Aguayo, actual presidente. Esa misma campaña, el equipo consigue su objetivo al clasificarse para ambas competiciones. La primera de ellas, en la Copa de España 2015, el Jaén llegaba a Ciudad Real, sede del torneo, sin ningún papel de favorito pero con el cartel de equipo revelación en la Primera División por estar 4.º en la tabla y clasificados para el Play-Off al título de Liga. A pesar de esos galones, nadie apostaba por ellos y el primer día salieron del Quijote Arena por la puerta grande al eliminar a ElPozo Murcia por (2-4). En semifinales ganarían en los penaltis (5-4) después de un (2-2) al Burela Pescados Rubén, conjunto gallego que eliminó a otro histórico, Inter Movistar. Ganaron su primera final de la Copa de España ante el F. C. Barcelona por (4-6), donde el conjunto jiennense fue claro dominador del partido convirtiéndose así en el primer equipo andaluz en ganar esta competición y también en el primer equipo debutante en hacerlo. Fue un claro ascenso de competitividad y con los años se fue dejando claro que era un equipo que no solo competía sino que llegaba a estar mínimo entre los 4-8 primeros de todas las copas que jugaba. Al finalizar la liga regular el Jaén F. S. quedó 4.º lo que le permitía jugar por primera vez en su historia el Play-Off por el título de Liga 2015 como uno de los cabezas de serie. El Jaén partía como favorito en la primera eliminatoria que disputaba, los cuartos de final contra el Palma Futsal, pero cayó en los dos primeros partidos disputados lo que le dio el pase a semifinales al Palma Futsal. Perdió el primero en casa del Palma por (5-4) y cayó en casa en los últimos segundos por (1-2) en un emocionante partido. Al haber sido campeón de la Copa de España, le correspondía el derecho de participar en la Supercopa de España frente al campeón de Liga que era el Inter Movistar. Esta se celebró en Ciudad Real y los jiennenses cayeron por (6-2) en un partido dominado por Inter Movistar. Esa misma temporada el Jaén obtuvo una mala clasificación en liga lo que le privó de jugar la Copa de España y el Play-Off por el título de liga. Por otra parte, el Jaén llegó a los 1/4 de final en la Copa del Rey. Tras dos años, Jaén Paraíso Interior, volvía a disputar una edición de Copa de España. Casualmente, la Copa de España 2017 se volvía a disputar en Ciudad Real, donde el Jaén alzó su primera Copa de España. En cuartos, el equipo venció a Peñíscola RehabMedic por (2-3). Sin embargo, cayó en semifinales frente a Movistar Inter tras un partido de infarto que finalizó (1-2). Esa misma campaña, la 2016/17, el club consigue igualar su mejor posición en la liga regular, logrando la 4.ª plaza en la última jornada frente al F. C. Barcelona, el cual se jugaba finalizar segundo, en el último segundo. Esta cuarta posición le permite disputar el Play-Off por segunda vez en su historia, y además, como cabeza de serie. Sin embargo cayó derrotado ante Magna Gurpea en dos de los tres partidos disputados, dando el pase a semifinales a los navarros, volviendo Jaén así a caer en los 1/4 de final por el título de Liga. Al comienzo de la temporada 2017/18 ganó la Copa de Andalucía 2017, tras superar a Universidad de Málaga Antequera por (0-7) en la semifinal y a Real Betis Futsal en la final por (4-0). Fue la segunda edición de este torneo en la que participa, proclamándose en ambas ediciones campeón. Tras clasificarse para la Copa de España 2018, Jaén se proclamó campeón tras un fabuloso torneo eliminando en cuartos a Plásticos Romero Cartagena por (2-5), en semifinales a Ríos Renovables Zaragoza por (3-2) y en la final a Movistar Inter por (3-4) tras marcar el gol decisivo en la prórroga. Esa misma temporada, Jaén consiguió clasificarse para la final de la Copa del Rey, final que perdió (4-3) en la prórroga tras un igualado partido frente al F. C. Barcelona. En Liga, el equipo repitió su mejor clasificación quedando 4.º. En Play-Off llegó hasta la semifinal, consiguiendo así su mejor clasificación en esta competición y haciendo la mejor temporada de su historia. En la Supercopa de España 2018 disputada en Ciudad Real en el pabellón Quijote Arena contra Inter Fútbol Sala perdieron el duelo (2-2) (4-3 penaltis) en una supercopa apasionante. En esa misma temporada consiguieron participar en la copa de España pero en Cuartos de final perdieron contra Fútbol Club Barcelona por 3-0 a favor del equipo cule. Ese mismo año se clasificaron para la final four en el Quijote Arena en la que perdieron en la final ante Fútbol Club Barcelona (5-2). Ese año el club llegó hasta las semifinales de los Play off por el título en la que perdió los dos partidos contra el Pozo Murcia (4-2) y (3-4). Himno El himno fue presentado el 26 de enero de 2017 en un acto repleto de ilusión, donde figuras como el presidente de la Diputación de Jaén, estuvieron presentes. Fue compuesto por Modesto Martínez Elías y José Luis López-Mingo, reconocidos músicos nacionales. En el acto, Francisco Reyes y Germán Aguayo intervinieron en primer lugar. El presidente de la Diputación de Jaén se mostró orgulloso con el crecimiento del equipo que lleva su marca y levantó los aplausos cuando pidió la construcción del palacio de deportes. El presidente del club, agradeció el himno a los creadores y recalcó la labor que realiza Modesto hacia su club. Los compositores, Modesto y José Luis también pasaron por el atril. Modesto Martínez Elías emocionó al público presente con un discurso que tocó numerosos puntos de los amarillos. José Luis López-Mingo Ballesteros habló sobre el proceso de elaboración del himno, junto a sus respectivas anécdotas. Al final, los asistentes vibraron al son del grupo musical. Plantilla 2023/24 Entrenador: Daniel Rodríguez Martínez - Dani Rodríguez Trayectoria Palmarés Torneos nacionales Copa de España (3): 2015, 2018 y 2023 Subcampeón Liga Primera División (1): 2022/23 Subcampeón de Copa del Rey (3): 2017/18, 2018/19 y 2019/20. Subcampeón de Supercopa de España (2): 2015 y 2018. División de Plata (1): 1996/97. Subcampeón de División de Plata (3): 1994/95, 1995/96 y 1999/00. Primera Nacional \"A\" (1): 2009/10. Torneos internacionales European Cup of Champion Clubs (2): 1990/91 y 1991/92. Torneos regionales Copa de Andalucía (5): 2010, 2017, 2018, 2021 y 2024. Subcampeón de Copa de Andalucía (1): 2020. Copa Diputación de Jaén (1): 2015. Torneos amistosos Trofeo del Olivo (7): 2012, 2014, 2015, 2016, 2018, 2019 y 2020 Subcampeón de Trofeo del Olivo (4): 2013, 2017, 2021 y 2022 Trofeo Juan Beteta (1): 2021 Trofeo Ciudad de Jumilla (2): 2014 y 2016 Otros premios y reconocimientos Mejor afición 2015, entregado por la Liga Nacional de Fútbol Sala. Mejor afición 2016, entregado por la Liga Nacional de Fútbol Sala. Mejor afición 2018, entregado por la Liga Nacional de Fútbol Sala. Mejor afición 2019, entregado por la Real Federación Española de Fútbol. Trofeos individuales Jugador revelación 2015, entregado a Emilio Buendía por la Liga Nacional de Fútbol Sala. Mejor entrenador 2015, entregado a Daniel Rodríguez por la Liga Nacional de Fútbol Sala. Mejor cierre 2018, entregado a Antonio Manuel Sánchez (Boyis) por la Liga Nacional de Fútbol Sala. Premio a la humildad, entregado a Jordi Campoy, buen jugador, mejor persona, por la Liga Nacional de Fútbol Sala Estadísticas A continuación se muestra una tabla con las estadísticas del club en competiciones organizadas por la Liga Nacional de Fútbol Sala. Actualizado al término de la temporada 2019/20.",
            "El Palacio de Deportes Olivo Arena , conocido simplemente como Olivo Arena es un pabellón de la ciudad de Jaén (España). En él juega sus partidos de Primera División de fútbol sala el Jaén Paraíso Interior y también se albergan grandes eventos.​ Historia El pabellón se inaugura en 2021 y se convierte en la nueva casa del Jaén Paraíso Interior para disputar sus partidos de Primera División de fútbol sala.​ Puede albergar distintos tipos de eventos. Del 31 de marzo al 3 de abril de 2022 se disputó la Copa de España de fútbol sala 2022.​ Instalaciones El pabellón dispone de una pista principal, mayormente utilizada para el fútbol sala o baloncesto y también dispone de: vestuarios, camerinos, salas polivalentes, oficinas, salas de prensa Y salón de actos. Eventos Se disputan los partidos de Primera División de fútbol sala del Jaén Paraíso Interior. Se celebran distintos eventos, especialmente deportivos. El 5 de marzo de 2022 se disputó el Campeonato de España Junior de taekwondo. Del 31 de marzo al 3 de abril de 2022 se disputó la Copa de España de fútbol sala 2022. Del 14 de mayo al 15 de mayo de 2022 se disputó la Final Four de la Copa del Rey de fútbol sala 2022.​ El 16 de mayo de 2022 los Harlem Globetrotters llevaron a cabo un espectáculo.​ El DJ argentino Bizarrap actuó, junto con otros 10 artistas, el sábado 18 de junio de 2022.​ Del 4 al 10 de septiembre de 2022 se disputó la fase final de la Eurocopa sub-19 de fútbol sala de la UEFA.​"
        ]
    },
    "test_10": {
        "question": "¿Cuando se prevé que acabarán las obras del CETEDEX?",
        "reference": "Se prevé que para diciembre de 2026 se alcance una capacidad inicial, mientras que para finales de 2029 sería la capacidad completa.",
        "response": "El Centro Tecnológico de Desarrollo y Experimentación o CETEDEX se proyecta entre 2023 y 2029 en Jaén.",
        "reference_contexts": "['El Centro Tecnológico de Desarrollo y Experimentación o CETEDEX es un centro dependiente del Ministerio de Defensa, y adscrito al Instituto Nacional de Técnica Aeroespacial (INTA) anunciado en diciembre de 2022\\u200b y cuya construcción se proyecta entre 2023 y 2029 en Jaén. El centro contará con un campus principal de 8 hectáreas y un campo de pruebas avanzado de 600 hectáreas\\u200b en el Parque Empresarial Nuevo Jaén. Programas El proyecto ubicado en el norte de Jaén, está diseñado por la firma de arquitectura Morph Estudio en Madrid junto a la Ingeniería Typsa. Es un proyecto generativo que desarrolla su propuesta integrando arquitectura con el paisaje existente adaptándose al relieve y a su entorno. El resultado es una construcción flexible, desmontable, innovadora y circular. Inicialmente el Campus CETEDEX se distribuye a través de varios edificios independientes y autónomos y plantea tres pilares de actuación\\u200b: Sistemas de defensa anti-dron. Sistema completo con capacidad de detección y neutralización, una zona de radiación controlada y una zona de vuelo e instalación de sensores. Vehículos autónomos e inteligentes. Área de ensayos y certificación para sistemas avanzados de ayuda a la conducción, tanto de vehículos militares como industriales y agrícolas. Inteligencia artificial. Análisis automático e inteligente de grandes volúmenes de datos, desarrollo de tecnologías para el mantenimiento predictivo, análisis de múltiples fuentes de información y aplicaciones de tecnologías biométricas. Obras La construcción del campus principal se compone de dos fases: Vallado. Licitación prevista para abril de 2023 y ejecución entre julio y diciembre de 2023. Urbanización y edificaciones. Licitación prevista para septiembre de 2023 y ejecución de las obras durante 24 meses, a partir de julio de 2024. Por su parte, la recepción de la capacidad inicial se espera para diciembre de 2026 y la capacidad completa para finales de 2029\\u200b. El proyecto aún no tiene concreción alguna en planos o presupuesto. En documentos internos del propio INTA, en su Plan de Actuación Anual de 2023\\u200breconoce que el proyecto depende de la aprobación del PERTE de Defensa y de los fondos finalmente asignados, el cual no está ni en fase de borrador. Por el momento, a mediados de 2024 y una vez vallado el recinto, si no se acumulan nuevos retrasos, se espera que las obras comiencen a finales de 2024. \\u200b Polémica El anuncio de la construcción del CETEDEX se produjo en medio de la polémica por la asignación del Plan Colce a Córdoba, cuando la ciudad de Jaén parecía contar con el apoyo de las administraciones autonómica y nacional para la asignación de la Base Logística del Ejército de Tierra, lo que supuso la denuncia por prevaricación contra el Ministerio de Defensa\\u200b. Esta decisión conllevó grandes manifestaciones contra el ninguneo percibido hacia la provincia de Jaén\\u200b, así como el auge del partido Jaén Merece Más\\u200b y su posterior concurrencia a las Elecciones al Parlamento de Andalucía de 2022 (como parte de la plataforma de la España Vaciada), en las que se quedaron a las puertas de conseguir un escaño. Esto hizo que la concesión del CETEDEX se viera como compensación con la provincia de Jaén, afirmando el propio presidente Pedro Sánchez durante su presentación que “durante años, Jaén ha visto pasar muchas oportunidades. Por eso, la deuda del Estado con Jaén tiene que saldarse, es momento de romper inercias históricas y de agravios injustificados”\\u200b.']",
        "retrieved_contexts": [
            "El Centro Tecnológico de Desarrollo y Experimentación o CETEDEX es un centro dependiente del Ministerio de Defensa, y adscrito al Instituto Nacional de Técnica Aeroespacial (INTA) anunciado en diciembre de 2022​ y cuya construcción se proyecta entre 2023 y 2029 en Jaén. El centro contará con un campus principal de 8 hectáreas y un campo de pruebas avanzado de 600 hectáreas​ en el Parque Empresarial Nuevo Jaén. Programas El proyecto ubicado en el norte de Jaén, está diseñado por la firma de arquitectura Morph Estudio en Madrid junto a la Ingeniería Typsa. Es un proyecto generativo que desarrolla su propuesta integrando arquitectura con el paisaje existente adaptándose al relieve y a su entorno. El resultado es una construcción flexible, desmontable, innovadora y circular. Inicialmente el Campus CETEDEX se distribuye a través de varios edificios independientes y autónomos y plantea tres pilares de actuación:​ Sistemas de defensa anti-dron. Sistema completo con capacidad de detección y neutralización, una zona de radiación controlada y una zona de vuelo e instalación de sensores. Vehículos autónomos e inteligentes. Área de ensayos y certificación para sistemas avanzados de ayuda a la conducción, tanto de vehículos militares como industriales y agrícolas. Inteligencia artificial. Análisis automático e inteligente de grandes volúmenes de datos, desarrollo de tecnologías para el mantenimiento predictivo, análisis de múltiples fuentes de información y aplicaciones de tecnologías biométricas. Obras La construcción del campus principal se compone de dos fases: Vallado. Licitación prevista para abril de 2023 y ejecución entre julio y diciembre de 2023. Urbanización y edificaciones. Licitación prevista para septiembre de 2023 y ejecución de las obras durante 24 meses, a partir de julio de 2024. Por su parte, la recepción de la capacidad inicial se espera para diciembre de 2026 y la capacidad completa para finales de 2029.​ El proyecto aún no tiene concreción alguna en planos o presupuesto. En documentos internos del propio INTA, en su Plan de Actuación Anual de 2023​reconoce que el proyecto depende de la aprobación del PERTE de Defensa y de los fondos finalmente asignados, el cual no está ni en fase de borrador. Por el momento, a mediados de 2024 y una vez vallado el recinto, si no se acumulan nuevos retrasos, se espera que las obras comiencen a finales de 2024. ​ Polémica El anuncio de la construcción del CETEDEX se produjo en medio de la polémica por la asignación del Plan Colce a Córdoba, cuando la ciudad de Jaén parecía contar con el apoyo de las administraciones autonómica y nacional para la asignación de la Base Logística del Ejército de Tierra, lo que supuso la denuncia por prevaricación contra el Ministerio de Defensa.​ Esta decisión conllevó grandes manifestaciones contra el ninguneo percibido hacia la provincia de Jaén,​ así como el auge del partido Jaén Merece Más​ y su posterior concurrencia a las Elecciones al Parlamento de Andalucía de 2022 (como parte de la plataforma de la España Vaciada), en las que se quedaron a las puertas de conseguir un escaño. Esto hizo que la concesión del CETEDEX se viera como compensación con la provincia de Jaén, afirmando el propio presidente Pedro Sánchez durante su presentación que “durante años, Jaén ha visto pasar muchas oportunidades. Por eso, la deuda del Estado con Jaén tiene que saldarse, es momento de romper inercias históricas y de agravios injustificados”.​",
            "El retablo de la Inmaculada Concepción es una obra realizada por Andrés Bautista Carrillo y Ambrosio de Valois entre 1699 y 1701. Está ubicado en la Santa Capilla de la Iglesia de San Andrés de Jaén (Andalucía, España). Historia Retablo primitivo Gracias al libro de cuentas, el cual comienza en el año 1523, se sabe que en la Santa Capilla hubo un retablo anterior «que se trujo de Toledo», mientras que en un testamento fechado en 1527 firmado por Mari Ortiz,[nota 1]​ esposa de Gutierre Gierero,[nota 2]​ figura que el retablo procedía de Toledo y que el mismo había sido elaborado por Juan de Borgoña,[nota 3]​ si bien en el mismo colaboró Gierero, siendo habitual entonces que los retablos fuesen pintados, dorados y estofados una vez instalados en su emplazamiento definitivo. Se cree que la pieza, financiada por Gutierre González Doncel, fundador de la Santa Capilla, debió llegar de Toledo poco antes de 1523 con sus tablas ya pintadas por Borgoña aunque con la labor de talla de los tableros aún sin finalizar puesto que en ese año se levantaron y desclavaron un total de seis tablas «que faltaban por entallar por el primer entallador que lo hizo»; se ordenó en consecuencia a Gierero que terminase la talla y que ensamblase y dorase el mueble con pan de oro,​: 26–27 constando en los libros de cuentas, con fecha del 6 de junio de 1524, que el entallador debía «de asentarlas [las tablas] en el retablo y de clavos pa ello dos Rles y mo. a me. GutieRe».​: 73 Además del retablo, en 1530 se abonó a Mercado,[nota 4]​ platero oriundo de Córdoba, una lámpara de plata comisionada por los mandatarios de Doncel más un portapaz y varios cálices destinados a dar servicio al altar.​: 27–28 Por su parte, en 1528 consta que Alonso Espinosa se encontraba trabajando en la Santa Capilla de acuerdo con los libros de cuentas: «Alonso Espinosa entallador q hizo un trabajo para un retablo DXL mo.».​: 78 De esta misma época data el conocido como «terno rico», cuyo precio fue acordado en 30 000 maravedíes con el brocador Diego del Arco y su sobrino; este terno está confeccionado en terciopelo o felpa colorada y «once onzas de oro hilado que trujo Medina de Granada para los cordones del terno rico», pieza que se cree es la que se conserva actualmente, la cual se emplea el día de la fiesta de San Andrés. Junto con los anteriores enseres se encargaron casullas a Juan Tenorio, bordador procedente de Granada, pagando Diego Sánchez de Bonilla, administrador de la capilla, seis ducados de oro por un trozo de gamelote de seda blanca para confeccionar una capa pluvial. Numerosos libros corales de gran valor datan a su vez de este periodo del mismo modo que varias bulas, un misal jienense y diversos libros litúrgicos, biblias y decretales, destacando por su parte algunas obras incunables.​: 27–28 En el siglo xvii el barroco empezó a imponer la decoración de las tallas con ricas vestimentas independientemente de si eran imágenes de vestir o de talla completa, siendo en esta centuria cuando se procedió a instalar en el retablo, carente de camarín, una imagen de candelero representativa de la Limpia Concepción de María; en el cabildo celebrado el 20 de junio de 1627 se decidió que «porque la imagen de Nuestra Señora en la Santa Capilla no está con la decencia que se debe, descubierta todos los días, se dispuso que un escultor disponga un tabernáculo embebido en el retablo principal, como mejor parezca y se le pongan dos o tres velos que se descorran en las fiestas principales». La devoción de los fieles a esta talla mariana aumentó con gran rapidez y consta que se le obsequiaron una corona, una media luna y un cetro elaborados en plata más una serie de alhajas y doce atuendos de distintos colores, compuestos cada uno por un vestido con su correspondiente manto. Esta ferviente demostración de fe, junto con problemas de humedad en la capilla, llevaría al acuerdo de reemplazar el retablo por otro que contase con un camarín en el que poder exhibir mejor la imagen de la Virgen.​: 32 Retablo actual En 1698, cuando Luis de Gámiz Torres y Portugal fungía como gobernador de la Santa Capilla, la existencia de goteras en la bóveda motivó la retirada del retablo de Borgoña y Gierero, el cual se encontraba además en pésimas condiciones de conservación debido al paso del tiempo y el abandono al que fue sometida la obra, ennegrecida a mayores a causa del hollín procedente del humo de las velas, situación que Doncel había tratado de evitar.[nota 5]​ Antes de proceder a su desinstalación se hizo un intento de salvarlo mediante una restauración en la que se gastaron ocho reales en el retoque de una de las pinturas, si bien el resultado no debió de ser satisfactorio para las autoridades gubernamentales puesto que en el cabildo del 31 de diciembre de 1698 el gobernador declaró lo siguiente:​: 33 Atendiendo al estatuto undécimo del tratado tercero, donde Doncel disponía que no se llevasen a cabo grandes gastos en plata, órganos, rejas ni retablos, por muy primorosas que fueran estas obras, medida que además protegía de manera indirecta lo que él había ordenado, incluyendo el retablo, Gámiz solicitó que se pidiera el asesoramiento de la escuela del Convento de San Francisco de Jaén y de los religiosos en él condecorados, de quienes deseaba obtener un informe sobre la interpretación de este documento. En el cabildo celebrado el 8 de enero de 1699 en la Santa Capilla se procedió a leer el informe elaborado por la comunidad franciscana, plagado de argumentos tan engañosos que del escrito se desprende una clara intención por parte de los religiosos de complacer al gobernador a la vez que el mismo denota una gran ignorancia y desconsideración hacia el patrimonio artístico. En el informe, redactado sin que los franciscanos hubiesen llegado nunca a ver en persona el retablo (tan solo contaban con el testimonio del gobernador), se hizo constar lo siguiente:​: 33–34 Una vez expuestas estas circunstancias, casi con toda seguridad exageradas, los frailes, tras comprobar los estatutos de la capilla, consideraron que los cofrades podían comisionar sin problema la factura de un nuevo retablo a costa de la pérdida del anterior, aunque con la advertencia de no realizar un gasto excesivo, tomándose una parte de la vivienda colindante a la capilla para colocar en ella el camarín. La talla de la nueva obra fue ajustada en 700 ducados con Andrés Bautista Carrillo, quien ya en aquel entonces era uno de los mejores escultores de la ciudad.[nota 6]​ Por su parte, el dorado corrió a cargo de Ambrosio de Valois, quien probablemente trabajaba de manera habitual con Carrillo puesto que los gremios de la época impedían que los escultores policromasen o dorasen sus propias obras, labor que debía ser ejecutada por un pintor. Además del dorado, Valois pintó el cuadro de la Inmaculada Concepción que decora el ático y otro representativo de una santa sin identificar ubicado frente a la reja de la capilla, obra de Bartolomé Ruí; la firma del lienzo fue descubierta a mediados del siglo xx por Francisco Cerezo Moreno mientras restauraba el cuadro de Ánimas, pieza atribuida a Valois.​: 34–35 El dorado tanto del retablo como del frontis del altar tuvo un coste total de 5530 reales, culminando toda la obra en 1701, si bien la imagen de la Virgen ya había sido colocada con gran pompa el 8 de diciembre de 1699 en el nuevo camarín, costando este ceremonial más de 240 reales en concepto de sermones, cohetes y obsequios para los festejos solemnes. La instalación de la talla en el camarín motivó que para el día de la ceremonia se tuviesen adecentadas las dos capillas colaterales del templo, elaborando el carpintero Juan de Morales tres marcos para las pinturas de San Martín, San Francisco de Asís y Santo Cristo de la Columna, esta última original o réplica de la custodiada en el Museo Catedralicio, la cual está firmada por Alfonso de Baena. Con el fin de dorar y policromar el camarín, se trajeron de Madrid 98 libras (casi 45 kilos) de oro así como todos los colores necesarios, efectuando el dorado tanto Carrillo como Valois. Así mismo, se confeccionó un nuevo guardarropa para la talla de la Virgen y se elaboró también una cuidada ornamentación en el arco toral donde se encastra la reja de Ruí. Se procedió a su vez a platear los candeleros, los pies de los ciriales y los ambones, realizando Antonio de Guzmán un sagrario sobredorado y trabajando en otros elementos de la capilla el platero oriundo de Córdoba Gerónimo Sánchez de Payba.​: 35 En lo que respecta al retablo de Borgoña y Gierero, descrito como «de poco valor», este debía de ser sin embargo una obra muy preciada ya que sería permutado en 1699 a través de un escrito de trueque por un censo impuesto sobre sus bienes por Juan de Acuña, quien se llevó consigo la pieza, la cual se considera a día de hoy perdida puesto que desde entonces no se han vuelto a tener noticias de la misma. Por su parte, la imagen de la Virgen no permaneció mucho tiempo en su nuevo emplazamiento ya que en 1733 Eugenio de Miranda, conde de Sevilla la Nueva y gobernador de la Santa Capilla, debido a que la talla era de candelero, algo prohibido en ese entonces en virtud de varios decretos, propuso reemplazarla por otra «muy decente» de su propiedad que sería aceptada por las autoridades del gobierno e instalada en consecuencia el 8 de diciembre de ese mismo año. No obstante, esta talla sería retirada tan solo dos años después: los motivos de este hecho resultan desconocidos, pudiendo deberse a que la misma no era del gusto de los fieles o los gobernadores de la capilla; a que la talla constituía un préstamo de Miranda, quien seguía siendo su legítimo propietario; o a que su tamaño no se ajustaba a las dimensiones del camarín. En 1735 Fernando de Aranda, gobernador de la Santa Capilla, comisionó la hechura de una nueva imagen a Felipe de Mesa,[nota 7]​ quien por su labor percibió 430 reales, dentro de los cuales se incluía la creación de cinco querubines para la peana.[nota 8]​ Respecto al dorado y estofado de la talla mariana, la encarnación de los ángeles y las cartelas, esto corrió a cargo de Francisco de Pancorbo,[nota 9]​ quien por su trabajo cobró 575 reales.​: 36 La nueva imagen, por acuerdo del cabildo el 6 de agosto de 1736, fue colocada en el camarín el 12 de septiembre, día de la festividad del Dulce Nombre de María, decretándose a su vez que en esta fecha se oficiase una función solemne con sermón a la que fuese invitada la Cofradía de la Santa Capilla de San Andrés. A la nueva talla se le añadió la corona de la anterior, pieza que requirió un pequeño ajuste que hace suponer que la talla prestada por Miranda era de tamaño inferior, pudiendo tratarse de la imagen mariana que hoy se conserva, muy repintada, en la sacristía. La labor de aderezo de la corona fue acometida por Alonso Antonio de Martos, a quien se le pagaron 200 reales.​: 36–37 Descripción El retablo es de estilo puramente barroco y se dota con dos pilares salomónicos coronados por capiteles corintios y decorados en el fuste con pámpanos de vid y racimos dorados. Muy similar al retablo de la Virgen de la Capilla de la Basílica de San Ildefonso de Jaén, obra de Cristóbal Téllez en 1600, existe la posibilidad de que Carrillo tomase este como modelo para el de la Santa Capilla, el cual carece de originalidad en su composición, aunque resulta proporcionado y atractivo a nivel estético. Compuesto por un cuerpo de una sola calle con ático y banco, el cuerpo se flanquea con los pilares salomónicos mientras que en el centro luce un arco de medio punto, en cuya zona superior se ubica un motivo de rocalla con el anagrama MA (María), cobijándose en su interior el camarín, coronado por una bóveda de ocho gajos ornamentados con motivos florales pintados en tonos pastel. El cuerpo cuenta así mismo con paneles entre el arco y las columnas decorados con florituras y rematados con cabezas infantiles en alto relieve. Respecto al banco, este luce en el centro el sagrario, pieza que se decora en el frente con una pintura en la que se representa a San Juan Bautista en su infancia y acompañado de un cordero. A ambos lados del sagrario destacan columnillas salomónicas y volutas que sirven de marco a la custodia, mientras que en los laterales se hallan paneles idénticos a los presentes en el cuerpo, todo cercado en los extremos por los netos que soportan los pilares, ornamentados al igual que los paneles con cabezas infantiles en alto relieve. Por su parte, el ático se halla separado del cuerpo mediante una delgada y simple cornisa de cuya sección central parte un frontón curvo también de sencilla factura sobre el que se ubica el lienzo pintado por Valois, muy similar a la pintura María Nueva Eva, obra de Miguel de Santiago conservada en el Convento de San Agustín de Quito (Ecuador).​: 56 El lienzo de Valois exhibe una interpretación muy personal del tema concepcionista: la Virgen, representada como la nueva Eva, aparece rodeada por una gloria en un entorno de oscuros abismos, siendo partícipe de la cita del Génesis «IPSA CONTERET CAPUT TUUM» puesto que desciende la pierna derecha de la media luna sobre la que se erige para aplastar con su pie desnudo al Demonio bajo forma de serpiente, esta parte de la obra casi imperceptible ya que se encuentra tapada por el frontón de la cornisa. El cuerpo de María deja entrever la repulsión que le provoca el establecer contacto físico con el reptil, mostrando ambos brazos alzados a modo de precaución, la cabeza baja y los ojos puestos fijamente en la figura demoníaca para captar su reacción. El rostro muestra desconfianza y un leve gesto de repugnancia, destacando la ausencia en la composición de querubines, símbolos apocalípticos y cualquier atributo de la iconografía inmaculista (exceptuando la media luna), como las doce estrellas en representación de las doce tribus de Israel. En este caso la Virgen, ataviada con una túnica blanca y un manto azul ultramar, ambos colores propios de la tradición concepcionista, asume en solitario y de forma directa y activa el papel asignado en la Redención.​: 73 Teniendo en cuenta la datación de la obra, esta se erige como una aportación muy singular en una época en la que las representaciones marianas constituían ya algo convencional. Ni los libros de cuentas ni el contrato para la ejecución del retablo aportan ninguna información acerca de la autoría del lienzo, el cual se asume fue encomendado por los gobernadores de la Santa Capilla a Valois, quien pudo haberse inspirado en un grabado y, particularmente, en la Inmaculada Concepción pintada por Rubens entre 1628 y 1629 para Diego Mexía Felípez de Guzmán, marqués de Leganés; la posición de la cabeza, el torso y los brazos deja patente una notable influencia de este cuadro del mismo modo que el pie desnudo y el movimiento de la figura, si bien el entorno no tiene absolutamente nada que ver ya que el lienzo de Valois hace gala de una total austeridad destinada a dotar a la Virgen de mayor protagonismo.​: 73 A los lados, flanqueando el cuadro, se sitúan dos pilastras de profusa decoración las cuales presentan en lo alto una ménsula de rocalla y diversos motivos ornamentales en relieve en el resto del fuste. Junto a estas pilastras, a modo de cierre de la composición, destacan dos diminutos infantes desnudos de bulto redondo portando cartelas, mientras que la obra se corona con un frontón clásico decorado en el tímpano con un gran motivo de rocalla en cuya sección inferior se halla una cabeza en alto relieve del mismo tipo que las presentes en el cuerpo y el banco. En lo que atañe a la imagen de la Inmaculada Concepción, presente a su vez en el estandarte de la cofradía y procesionada hasta mediados del siglo xx,​[nota 10]​ esta se encuadra en la escuela barroca andaluza y posee un notable mérito, luciendo gran riqueza de detalles, si bien Rafael Ortega y Sagrista manifestó que la talla carecía de esbeltez, aunque destacó que las carnaduras, la policromía y el dorado eran excelentes además de hallarse en muy buen estado de conservación.​: 37 Notas",
            "Nacimiento fue un apartadero y cargadero ferroviario situado en el municipio español de Nacimiento, en la provincia de Almería. Las instalaciones pertenecían a la línea Linares-Almería y estuvieron en servicio durante algo más de un siglo, entre 1895 y 1987, cuando fueron clausuradas debido a la entrada en servicio de una nueva variante respecto del trazado original. En la actualidad la antigua estación se encuentra abandonada y semi-desmantelada. Situación ferroviaria Las instalaciones se encontraban situadas en el punto kilométrico 203,793 de la línea férrea de ancho ibérico Linares-Almería,​ entre las estaciones de Doña María-Ocaña y de Gérgal. Se encontraba a 807 metros de altitud sobre el nivel del mar.​ El trazado era de vía única y estaba sin electrificar. A la estación también llegaba un cable aéreo desde la cercana mina del Conde de Xiquena, con una longitud de 1,2 kilómetros.​ Historia La estación fue inaugurada el 26 de julio de 1895 con la apertura del tramo Guadix-Almería de la vía férrea que pretendía unir Linares con el puerto de Almería, que no se alcanzó hasta 1904 dadas las dificultades encontradas en algunos tramos.​ La gestión de las instalaciones corrió a cargo de la Compañía de los Caminos de Hierro del Sur de España, que mantuvo su titularidad hasta 1929, cuando pasaron a ser controladas por la Compañía de los Ferrocarriles Andaluces. La compañía de «Andaluces», como así se la conocía popularmente, ya llevaba años explotando la línea tras serle arrendada en 1916.​ Un alquiler no demasiado ventajoso, y que se acabó cerrando con la anexión de la compañía. En 1936, durante la Segunda República, «Andaluces» fue incautada debido a sus problemas económicos y se asignó a la Compañía Nacional de los Ferrocarriles del Oeste la gestión de las líneas que «Andaluces» explotaba. En 1941, tras la nacionalización de los ferrocarriles de ancho ibérico, las instalaciones pasaron a formar parte de la recién creada RENFE. Con el paso de los años en torno a la estación se fue formando un núcleo poblacional, dependiente del municipio de Nacimiento, que para 1950 tenía un censo de 103 habitantes.​ En junio de 1987 entró en servicio una nueva variante ferroviaria entre las estaciones de Doña María-Ocaña y Gérgal que reemplazaba al trazado original. La causa de este rediseño del trazado fue por la existencia de una fortísima pendiente ascendente desde la estación de Doña María-Ocaña, que obligaba a los convoyes de mercancías —con un peso de unas 2 000 toneladas— al uso de una cuádruple tracción diésel —dos locomotoras 313 delanteras y dos traseras— durante unos seis kilómetros del trazado.​​ El último tren en pasar por esta estación lo hizo el 18 de junio de 1987, a las 8:25 horas de la mañana, el expreso 11878 procedente de Madrid y Sevilla. Se eligió este día por ser festivo y, por tanto, no suponer un problema a la salida de material desde las Minas del Marquesado. La estación Constaba de 3 vías y 2 andenes, uno central y uno lateral. El edificio principal de la estación fue derruido a finales de los años 2000, mientras que otras instalaciones, como las barracas de los trabajadores se encuentran en ruinas. Los andenes se mantienen en condiciones aceptables, pero las vías fueron vendidas al poco tiempo de la entrada en desuso de la estación.[cita requerida]",
            "El teatro Cervantes es el teatro local de la ciudad andaluza de Linares (Jaén) ( provincia de Jaén), que actualmente tiene 558 localidades, aunque llegó a una capacidad de 1.100 en la antigüedad. Historia El edificio tiene su origen en el teatro de San Ildefonso, construido en 1864 por Ildefonso Sánchez y Cozar en la zona de expansión de la ciudad. Se trataba de un edificio de planta rectangular, con fachada a dos calles paralelas y tipología de teatro a la italiana, con sala en forma de herradura, holgado y proporcionado. Reforma de 1930 Con el fin de mejorar sus condiciones de seguridad e higiene se llevó a cabo esta reforma, siendo en 1952 cuando se convierte en cinematógrafo, mediante el desplazamiento del escenario hasta la fachada posterior, la ampliación de la sala y el anfiteatro y la supresión; salvo un vestigio testimonial en los laterales, de la planta de palcos, quedando así alterada significativamente la proporción entre sala y escenario. El aforo pasó a ser de quinientas localidades en el patio y cerca de seiscientas en el anfiteatro. En su planta rectangular se distinguían dos crujías inmediatas a la fachada de la calle Cervantes, ocupadas por el acceso, vestíbulos, escaleras y servicios de público, así como otras dos inmediatas a la Calle Fernando III, ocupadas por el escenario, su tramoya, chácena, camerinos, almacenes y demás elementos de servicio a la representación. Entre ambas, un espacio de mayores dimensiones que acoge sala y anfiteatro. Con planta baja y tres altas en las crujías contiguas a ambas fachadas, en la parte delantera contaba en planta baja con un antevestíbulo, al que daban las taquillas, y un vestíbulo, del que partían las escaleras adosadas a las paredes medianeras, junto a las que se sitúan también los aseos. En la primera planta, el vestíbulo de palcos y anfiteatro acogía un pequeño ambigú, mientras que en la segunda y tercera se situaba la cabina de proyección y un cuarto auxiliar para la misma. Intervención realizada La intervención realizada partió de la reflexión sobre los elementos que conformaban la \"memoria histórica\" del edificio y asunción de lo relativo del concepto de conservación allí donde, aún manteniendo una parte significativa de sus pautas originales, los esquemas arquitectónicos habían sido radicalmente alterados, siendo necesario un gran esfuerzo de renovación para recuperar los esquemas originales del edificio. Hecho un paréntesis en esta reflexión en lo referente a las fachadas, que, por su arraigada presencia urbana, se han conservado íntegras con algún retoque como la introducción en la delantera de un frontón, previsto pero no ejecutado en la reforma de 1952, la idea central ha sido la de recuperar el equilibrio espacial entre las partes esenciales del teatro, sala y escenario. Para ello, se ha recuperado la crujía posterior como auxiliar del escenario, desplazando éste a su posición anterior a 1952 y colocando la embocadura donde estuvo anteriormente, aunque reformándola para mejorar aspectos visuales y acústicos que arrastraba de origen. También por razones de acústica se ha modificado la curva del fondo de la sala y por razones de mejora visual la inclinación del plano del anfiteatro, del que se ha suprimido su extensión a la crujía de fachada, que generaba un aforo excesivo y de mala calidad. El aforo ha pasado a ser así de 558; veinticuatro en los palcos y el resto dividido por mitad entre patio y anfiteatro. El diálogo entre conservación y renovación queda reflejado en la convivencia de la conservación, incluso en sus elementos decorativos, de escaleras, vestíbulos y los seis palcos laterales, así como sus antepechos y los del anfiteatro, los falsos techos de éste y el emblemático anagrama de la embocadura del escenario. Como reflejo, la solución dada a las galerías técnicas, integradas entre los cerramientos laterales de la sala y los muros medianeros del teatro, creando cámaras que sirven para ventilación, iluminación, maquinaria e instalaciones, en dos bandas que unen las crujías delanteras con la tramoya del escenario y la crujía de la calle Fernando III.",
            "La línea Baeza-Utiel, a veces también denominada línea Baeza-Albacete,​ fue un ambicioso proyecto ferroviario nunca finalizado que debía unir las estaciones españolas de Baeza y Utiel, y que formaba parte de un proyecto más amplio que llegaba a Francia. Aunque la construcción empezó durante la Dictadura de Primo de Rivera, el proyecto sufrió numerosos retrasos durante más de treinta años, y en 1964 el régimen franquista decidió paralizar las obras y desechar todo el proyecto. La línea inacabada fue definitivamente desmantelada a comienzos de los años 1990, y en la actualidad varios tramos del antiguo trazado de las vías han sido recuperados como una ruta verde. Para Antonio Abellán, el ferrocarril Baeza-Utiel constituye «uno de los mayores fracasos de las construcciones ferroviarias españolas».​ Características La línea Baeza-Utiel tenía una longitud total de 366 km desde su inicio en Baeza hasta Utiel.​ En el proyecto original estaba previsto que se levantaran 28 estaciones, aunque finalmente se redujo el número y solo se construirían 12 estaciones.​ Así mismo, el trazado constaba de 107 túneles y 25 viaductos. En 1964, cuando se detuvieron las obras definitivamente, ya se habían colocado las vías entre Albacete y el límite de la provincia de Jaén, lo que suponía un total de 108 km.​ Tras llegar a Utiel esta línea estaba previsto que continuara hacia el norte, atravesando transversalmente la península, con las principales estaciones situadas en Teruel, Alcañiz, Lérida, Puebla de Segur y Saint Girons (Francia). De hecho, el tramo entre Lérida y Puebla de Segur fue el único en entrar en servicio de todo el proyecto. Historia Orígenes y construcción Si bien el planteamiento de este ferrocarril quedó plasmado en el llamado Plan Guadalhorce de 1926,​ durante los años de la dictadura de Primo de Rivera, lo cierto es que existían antecedentes que se remontaban a principios del siglo XX.​ Uno de estos proyectos abogaba por la construcción de una línea férrea entre las provincias de Jaén y Albacete, con las estaciones de Vadollano y Chinchilla como cabecera y terminal de la misma.​ Esta propuesta, sin embargo, nunca se materializó. No fue hasta la década de 1920 cuando se planteó seriamente la construcción de esta línea, dentro de un proyecto más ambicioso que buscaba el establecimiento de una conexión ferroviaria más directa del Norte de África y Andalucía con Francia.​ Otro objetivo era, además, llevar el ferrocarril a aquellas zonas de España que había quedado aisladas de las principales conexiones ferroviarias construidas durante el siglo XIX. Las obras comenzaron en 1927 y durante los siguientes años se mantuvieron a buen ritmo. Algunas instituciones locales y provinciales intentaron que la línea fuera alargada y llegase hasta Jaén, convirtiendo así a la capital de provincia en cabecera de la línea, aunque esta petición no prosperó.​ En la época destacó la intervención del general Leopoldo Saro Marín, personaje sobresaliiente de la dictadura de Primo de Rivera, que tuvo una gran influencia en el desarrollo de este proyecto; destacados caciques locales también hicieron una importante campaña en favor del nuevo ferrocarril.​ A partir de 1930 el ritmo de construcción se fue ralentizando y tras llegada de la Segunda República las obras se fueron deteniendo casi al completo. La mala situación económica del momento (consecuencia de la crisis de 1929) se hizo sentir, a lo que se unía que el nuevo gobierno republicano había derogado el Plan Guadalhorce y no se mostraba muy partidario de la construcción de nuevos ferrocarriles, en un contexto de creciente peso del transporte por carretera frente al tren. En enero de 1936 un informe titulado El problema de los ferrocarriles en construcción, que había sido publicado por las oficinas de estudio de las compañías MZA y «Norte», recomendaba que se abandonara la construcción del trazado entre Utiel, Teruel y la frontera francesa; sobre el tramo Baeza-Utiel señalaba que este era el único de todo el proyecto ferroviario que tenía cierto interés de explotación.​ El estallido de la Guerra Civil supuso una paralización de las obras que duraría varios años, hasta que la dictadura franquista autorizó nuevas inversiones y la continuación de todo el proyecto. El Ministerio de Obras Públicas decretó en 1943 la liquidación definitiva del proyecto, por lo que las obras continuaron durante los siguientes años a buen ritmo. Hacia 1960 las obras se encontraban muy avanzadas y se licitó la instalación de las vías en un tramo de 108 km situado en la zona colindante de las provincias de Jaén y Albacete. Por el contrario, los trabajos del tramo situado entre Albacete y Utiel siempre fueron muy atrasados por la escasa financiación.​ En cuanto a la financiación de todo el proyecto en su conjunto, las mayores inversiones se realizaron precisamente en esta época, a comienzos de la década de 1960.​ Cancelación y abandono En 1962 el Banco Mundial elaboró un informe donde se consideraba que este ferrocarril no sería económicamente rentable una vez estuviese operativo,​ por lo que recomendaba al gobierno español su abandono. En fechas posteriores otros informes, como el de la compañía francesa Sofrerail, mantuvieron los mismos argumentos referentes a su escasa rentabilidad. A pesar de todo el esfuerzo realizado por las distintas administraciones españolas a lo largo de tres décadas,​ hacia 1964, tras haber terminado un 78% de las obras (incluyendo las estaciones, túneles y el tendido de vías), el gobierno español detuvo la mayoría de los trabajos y la línea fue abandonada. Aunque todavía se estuvo sopesando la idea de finalizar los trabajos que estaban cercanos a completar, un informe del Ministerio de Fomento de 1968 calculaba que todavía sería necesaria la inversión de 1900 millones de pesetas y tres años más de trabajos.​ Tras el final de la dictadura y los años de la Transición, durante algún tiempo se planteó la posibilidad de finalizar las obras pendientes que existían en el tramo Baeza-Albacete y su definitiva apertura al tráfico.​ Sin embargo, en 1984 el Consejo de Ministros dio carpetazo definitivo a este proyecto y decretó el levantamiento de las vías. En 1988 el gobierno acordó la enajenación de las instalaciones ferroviarias y, en 1991, autorizó el levantamiento de las vías en el tramo en que había llegado a ser tendidas.​ Aún hoy en día se pueden ver estaciones abandonadas en la Loma de Úbeda, algunos pueblos de la Sierra de Segura, como Beas de Segura (Jaén) y en la zona de Albacete. Del previsto ferrocarril Baeza-Saint Girons solo llegó a entrar en servicio un tramo comprendido entre Lérida y Puebla de Segur, abierto al tráfico entre 1949 y 1951.​​ Décadas después, en 1984, este trazado estuvo a punto de ser clausurado por ser considerado una línea económicamente deficitaria, aunque al final se mantuvo operativo tras un acuerdo entre RENFE y la Generalidad de Cataluña, que en última instancia aceptó realizar aportaciones económicas para cubrir los déficits de explotación. En la actualidad En 2001 se constituyó el Grupo de Trabajo Provincial con la finalidad de convertir el tramo de este ferrocarril que discurre por la provincia de Albacete en dos Vías Verdes: la Vía Verde de la Sierra de Alcaraz (Villapalacios-Albacete) con una longitud de 106 km y la Vía Verde de La Manchuela (Albacete-Villamalea) de 81 km. Durante 2002, la Fundación de los Ferrocarriles Españoles realizó el proyecto de factibilidad definitivo de la Vía Verde de la Sierra de Alcaraz contando con la colaboración de la Junta de Comunidades de Castilla-La Mancha y con la financiación del Ministerio de Medio Ambiente con cargo a los Fondos Comunitarios. Posteriormente se acometerá el proyecto de reconversión del tramo norte con la denominación de la Vía Verde de La Manchuela. Una vez concluidas, estas Vías Verdes se convertirán en un eje ecológico y de turismo rural de primera magnitud de la provincia de Albacete, que permitirá enlazar el majestuoso río Cabriel, al norte, con la zona meridional de la provincia dominada por la Sierra de Alcaraz, a los pies del parque natural de las Sierras de Cazorla, Segura y las Villas. En fechas recientes desde distintos ámbitos se ha solicitado que todo el trazado de la línea se convirtiera en una vía verde.​"
        ]
    },
    "test_11": {
        "question": "¿A qué se dedica la empresa Doña Jimena?",
        "reference": "La marca comercial Doña Jimena se dedica a la producción de turrones, bombones y dulces navideños, entre otros productos.",
        "response": "Doña Jimena es una empresa dedicada a la producción de turrones, bombones y dulces navideños, así como productos chocolateros como snacks, bombones y chocolates belgas.",
        "reference_contexts": "['Doña Jimena es la marca comercial del grupo Productos J. Jiménez S. A. dedicada a la producción de turrones, bombones y dulces navideños entre otros productos. Posee tres fábricas, la principal en Alcaudete en la provincia de Jaén, otra en Sonseca, en la provincia de Toledo y la última en Noguerones (pedanía de Alcaudete) dedicada a la producción de aceite de oliva. En la actualidad está presente en 60 países, en algunos de ellos a través de filiales propias. Historia En 1961 Jerónimo Jiménez funda en Alcaudete (provincia de Jaén) la empresa Productos J. Jiménez con la intención de producir dulces navideños. Registró la marca Doña Jimena en honor a la historia y tradición española en el nombre de la esposa del Cid Campeador, Jimena Díaz (Doña Jimena). Durante los primeros 30 años, Doña Jimena produjo los típicos productos navideños como mazapanes, turrones de almendra, hojaldres, etc. Pero ya en 1990 la empresa decide fabricar también productos chocolateros como snacks, bombones y chocolates belgas entre otros. En la actualidad\\u200b La marca \"Doña Jimena\" esta hoy en día presente en más de 60 países de América, Europa, Oriente Medio y Asia. En México, Argentina, Portugal y Estados Unidos está presente a través de filiales propias. Entre sus dos fábricas emplea a unas 300 personas. En el apartado de marketing, destacan las campañas publicitarias en televisión coincidiendo con fechas como la Navidad y el día de San Valentín. A su producción de dulces y chocolates se ha unido la producción de Aceite de oliva bajo la marca Reales Castillos de Jaén, que ha ayudado a que en la actualidad la facturación de la compañía ronde los 60 millones de euros con un 40% de producción dedicada a la exportación.\\u200b Filiales Filiales del grupo Productos J. Jiménez S.A.: Productos J. Jiménez S.L. Alcaudete, provincia de Jaén, España Turrones, mazapanes y dulces de Sonseca S.L. (Tumadul) Sonseca, provincia de Toledo, España Reales Castillos de Jaén (producción de Aceite) Noguerones-Alcaudete, provincia de Jaén, España Operadora Doña Jimena de México, S.A. de C.V. México, D. F., México Doña Jimena Argentina S.A. Buenos Aires, Argentina Doña Jimena USA EE. UU. Doña Jimena Portugal S.A. Portugal']",
        "retrieved_contexts": [
            "Doña Jimena es la marca comercial del grupo Productos J. Jiménez S. A. dedicada a la producción de turrones, bombones y dulces navideños entre otros productos. Posee tres fábricas, la principal en Alcaudete en la provincia de Jaén, otra en Sonseca, en la provincia de Toledo y la última en Noguerones (pedanía de Alcaudete) dedicada a la producción de aceite de oliva. En la actualidad está presente en 60 países, en algunos de ellos a través de filiales propias. Historia En 1961 Jerónimo Jiménez funda en Alcaudete (provincia de Jaén) la empresa Productos J. Jiménez con la intención de producir dulces navideños. Registró la marca Doña Jimena en honor a la historia y tradición española en el nombre de la esposa del Cid Campeador, Jimena Díaz (Doña Jimena). Durante los primeros 30 años, Doña Jimena produjo los típicos productos navideños como mazapanes, turrones de almendra, hojaldres, etc. Pero ya en 1990 la empresa decide fabricar también productos chocolateros como snacks, bombones y chocolates belgas entre otros. En la actualidad​ La marca \"Doña Jimena\" esta hoy en día presente en más de 60 países de América, Europa, Oriente Medio y Asia. En México, Argentina, Portugal y Estados Unidos está presente a través de filiales propias. Entre sus dos fábricas emplea a unas 300 personas. En el apartado de marketing, destacan las campañas publicitarias en televisión coincidiendo con fechas como la Navidad y el día de San Valentín. A su producción de dulces y chocolates se ha unido la producción de Aceite de oliva bajo la marca Reales Castillos de Jaén, que ha ayudado a que en la actualidad la facturación de la compañía ronde los 60 millones de euros con un 40% de producción dedicada a la exportación.​ Filiales Filiales del grupo Productos J. Jiménez S.A.: Productos J. Jiménez S.L. Alcaudete, provincia de Jaén, España Turrones, mazapanes y dulces de Sonseca S.L. (Tumadul) Sonseca, provincia de Toledo, España Reales Castillos de Jaén (producción de Aceite) Noguerones-Alcaudete, provincia de Jaén, España Operadora Doña Jimena de México, S.A. de C.V. México, D. F., México Doña Jimena Argentina S.A. Buenos Aires, Argentina Doña Jimena USA EE. UU. Doña Jimena Portugal S.A. Portugal",
            "Jimena es un municipio español de la provincia de Jaén, Andalucía, situado en la comarca de Sierra Mágina, con 1223 habitantes según datos del INE en 2016.​ Geografía y patrimonio Está en el noroeste de la comarca de Sierra Mágina, cuya porción sureste es de orografía montañosa e incluida en el parque natural de Sierra Mágina. El resto del territorio es terreno de cultivo en el que predomina el olivar. La actividad económica está basada en su cultivo y su industria transformadora, complementándose con el cultivo de la higuera para aprovechamiento de la breva y el higo. El pinar de Cánavas (bosquete de pinos carrascos centenarios y de tamaño excepcional) ha sido declarado Monumento Natural por su valor ecológico y paisajístico. Sus fiestas patronales se celebran del 7 al 10 de septiembre, donde se puede disfrutar de su procesión y de sus carrozas, a las que acuden numerosos vecinos de otros pueblos de alrededor. Breva e higo En el año 2013 se recogieron en la localidad unos 60 000 kilos de breva, en la que participaron unos 150 productores. Se consideró una campaña \"medio buena\". La producción media de brevas en Jimena suele rondar los 40 kilos por higuera, en una campaña sin incidencias meteorológicas. Se comercializan según dos categorías, una vez que han sido seleccionadas: de primera, que es la que supera los 50 gramos de peso; y de segunda, que no varía de calidad pero sí es de menor peso.​ Según den una o dos clases de frutos al año, las higueras cultivadas en Jimena se clasifican en los siguientes grupos: las higueras braveras, brevales o bacoreras, que dan las brevas en junio/julio, y más tarde, en agosto/septiembre/octubre, dan los higos. Las brevas tienen un alto valor comercial por su tamaño, superior al de los higos, su aspecto atractivo (color, volumen, tersidad) y por las fechas en que maduran, con fácil comercialización en fresco.​ otra variedad de higuera, más estimada por la calidad de sus brevas, es la colar, también conocida como negra y como florancha, dando frutos más grandes y redondeados.​ la variedad de higuera verda, que produce higos de color verde de una gran calidad, con forma pendular y cuya maduración es más tardía.​ De toda la producción, aproximadamente un 10 por ciento se distribuye en la provincia de Jaén, alrededor de un 25 por ciento llega a los mercados de Andalucía, y el resto (la mayor parte) exportada a zonas de Barcelona, Madrid y Valencia.​ Historia Jimena cuenta con un rico legado de época prehistórica, un grupo de pinturas rupestres, en la Cueva de la Graja, que ponen de manifiesto la cultura de los grupos de pastores que entre el IV y III milenio a. C. poblaban las Sierras Meridionales. De esta etapa se han inventariado varios asentamientos en su término municipal, entre los que sobresale el de Cerro Alcalá, referencia fundamental para la prehistoria e historia antigua de esta localidad así como para época medieval. En la etapa ibérica Cerro Alcalá será uno de los oppida del siglo VI a. C. que seguirá ocupado en los siglos siguientes hasta época romana. Algunos investigadores han relacionado Cerro Alcalá con la Ossigi a la que hacen referencia las fuentes escritas. Numerosos hallazgos epigráficos y constructivos demuestran que este asentamiento ostentaría algún tipo de estatus romano como Municipium. En época árabe se produjo una intensa ocupación del término municipal de Jimena por pequeñas poblaciones rurales o alquerías. Esta población contaba con varias fortificaciones para refugio, Fuente del Moro, Cerro Alcalá o el que se menciona en las crónicas como San Istibin o San Astabin, topónimo que ha quedado en un paraje próximo a Jimena, Santisteban. Según las crónicas este fue uno de los castillos en los que se rebelaron los Banu Hábil contra el poder del emir cordobés. Jimena (Xemena) pudo ser otro de estos castillos o una alquería fortificada tras la conquista cristiana. Jimena fue conquistada por Fernando III el día de Santiago de 1234 e integrada en las tierras del Concejo de Baeza. En 1284 pasó a ser propiedad de don Pedro Ruy de Berrio. Durante los siglos XIV y XV fue un pequeño señorío hasta que en 1434 el rey Juan II la entregó a la Orden de Calatrava, que constituyó la encomienda de Torres, Canena, Jimena y el heredamiento de Recena. En el siglo XVI Jimena, alineada junto a Baeza, participó en el conflicto comunero en la Castilla de Carlos V, incluso sirvió de reducto oculto a comuneros. Terminados estos sucesos fue vendida por el emperador Carlos V a su secretario don Francisco de los Cobos. Desde esta fecha Jimena fue señorío de don Francisco de los Cobos y después de sus descendientes los marqueses de Camarasa, hasta la extinción de los privilegios señoriales en 1812. Geografía humana Demografía Cuenta con una población de 1234 habitantes (INE 2024). Patrona de Jimena Nuestra Señora de los Remedios Cuenta la voz popular que esta advocación mariana se apareció, en el mes de agosto, al escribano real Luis Martínez. En el lugar del hallazgo se edificó una ermita para que la Virgen recibiera culto y es adonde los romeros se dirigen para honrar a la que desde 1600 es su Patrona y alcaldesa perpetua de la villa. Santuario de Cánava Ermita construida en honor a la Virgen de los Remedios. Al encontrarse Luis Martínez la imagen en el año 1600, se alzó en el mismo lugar de la aparición dicha ermita, que mejor podría llamarse \"cueva\" o \"nicho\" y allí estuvo la imagen por muchos años, hasta que el pueblo decidió edificar un verdadero templo. Fiestas 3 de mayo: Fiesta de la Cruz: hay una parte religiosa que consiste en la procesión hacia los campos de Nuestro Padre Jesús, con la cruz a cuestas, patrocinada por su hermandad que tras la procesión celebran ágape, que cada año cobra mayor dimensión, dado que cada Hermano Mayor que se sucede, trata de superar la del año anterior. Y otra fiesta pagana, llamada de \"Los Tíos de Ricia\", tanto la una como la otra se celebran el 3 de mayo, y esta última consiste en adornar las calles de Jimena con monigotes que los vecinos fabrican rellenando ropa con paja, teniendo por cabeza una vasija de cerámica y un pimiento o picante, según esté a la mano, en la bragueta que, dicen, representan a las personas de paja que se encontraron los recaudadores cuando fueron a cobrarle los diezmos, y, como dice la expresión popular, se tuvieron que volver como \"el gallo de Morón\": sin plumas y cacareando. Se establece un concurso en el que no ganará la cruz más bella sino el \"tío de ricia\" más conseguido, pero no por lo del pimiento o picante, sino por la escenificación que represente. Esta fiesta ha cogido mayor pujanza en los últimos años. 6 al 10 de septiembre: Feria y Fiestas en Honor de la Patrona la Virgen de los Remedios: jinetes y carrozas enjaezadas se desplazan hacia el Santuario de Cánava (a un kilómetro de Jimena) para participar en un concurso y pasar una alegre jornada campera que finaliza con la bajada de la imagen de la Virgen a la iglesia parroquial. Durante cuatro días permanece la Patrona en el pueblo, donde el día 8 procesiona por toda la vecindad y el día 10 se devuelve la imagen mariana a su santuario, cuyos aledaños son el lugar que, durante los días 8 y 9, acoge las glamurosas \"verbenas de Cánava\" que aseguran la diversión de todos sus visitantes, condición indispensable, entrar con chaqueta y corbata los hombres y traje de noche, andaluz o faralaes y/o mantón de manila, las señoras o señoritas. Se eligen la miss y míster, Jimena y Turismo, la del vestido de Fiesta, el mejor traje de \"Gitana\" y \"Lady\" o señora-madura más elegante. 1 de noviembre: Festividad de Todos los Santos: con sus famosas \"gachas\", día muy entrañable que reúne a multitud de emigrantes y forasteros, sobre todo por su costumbre (no del agrado de todo el mundo) de pegar las \"gachas sobrantes\" en las puertas de todos los vecinos del pueblo. 13 de diciembre: Lumbres de Santa Lucía: el Ayuntamiento invita a la concurrencia a degustar productos típicos de la zona (calabaza, maíz, dulces...) en torno a las luminarias que se encienden durante la madrugada del día 13 de diciembre, donde no falta la imagen de la protectora de los invidentes. Su lugar de celebración ha ido variando en el tiempo según las necesidades, haciéndose en lugares tales como la Plazuela de Santa Lucía, el paraje conocido como \"El Molino del Pan\", junto a la Biblioteca Municipal o incluso junto a la \"Fuente del Buñuelo\" (antiguo solar del Sindicato) en el Barrio Bajo. Organización político-administrativa Elecciones municipales Alcaldía Economía Evolución de la deuda viva municipal El concepto de deuda viva contempla sólo las deudas con cajas y bancos relativas a créditos financieros, valores de renta fija y préstamos o créditos transferidos a terceros, excluyéndose, por tanto, la deuda comercial.",
            "La Casa Castillo de Jimena se encuentra situada en el extremo Noroeste del núcleo urbano de Jimena, provincia de Jaén, sobre una elevación rocosa, la Peña Bermeja, que configura el límite occidental del centro histórico de la población.​ Descripción El edificio es el resultado de la suma de una serie de construcciones durante un proceso histórico a lo largo del cual el castillo medieval se va adaptando a las necesidades funcionales de una vivienda, hasta adquirir la doble naturaleza de Casa y Castillo que presenta en la actualidad. Aprovechando las estructuras de un recinto defensivo de época medieval, del que se conservan varios lienzos de muralla, la Torre del Homenaje y el Cuerpo de Guardia, se construyen a partir de época moderna y hasta época contemporánea una serie de cuerpos edificados que configuran una tipología de casa-patio unifamiliar de carácter señorial. En general, el proceso de reutilización de las estructuras medievales consiste en el adosamiento a los lienzos de muralla, en un primer momento al interior y en una segunda fase al exterior, de una serie de volúmenes construidos que generan crujías cubiertas y divididas en dos o tres alturas, en las que se distribuyen las dependencias de la vivienda. El aspecto y volúmenes del edificio en la actualidad están condicionados, por tanto, y especialmente al exterior, por las estructuras de la vivienda que literalmente forran los restos del recinto medieval, con excepción de la Torre del Homenaje, que permanece exenta en altura, siendo visible desde el entorno inmediato.​​ Historia En la intervención arqueológica de apoyo a la restauración en la Casa Castillo de Jimena, realizada entre mayo de 1998 y junio de 1999, se han documentado las siguientes fases de ocupación, por lo que respecta al castillo: Primera Fase Islámica. De ella se han identificado dos lienzos de muralla de mampostería y tapial, pertenecientes a sendos laterales de un recinto fortificado. La topografía del espolón rocoso sobre el que se asientan y el trazado y volúmenes de las estructuras pertenecientes a fases posteriores permiten suponer que el recinto, de mediano tamaño, tuvo una planta cuadrangular delimitada por cuatro grandes lienzos murados. La documentación del mismo tipo de fábrica de tapial en el nivel superior del denominado Cuerpo de Guardia, levantado en época cristiana, permite suponer que este primer recinto defensivo musulmán contó posiblemente con una estructura de torreón en este mismo punto del ángulo Sureste, que después sería reforzado y ampliado mediante la incorporación de la Torre del Homenaje y dicho Cuerpo de Guardia. En cuanto a los lienzos de muralla, se conservan dos de una fábrica de mampostería y tapial, con una longitud de 19,40 metros el lienzo Este, y de 12,20 metros el lienzo Norte. Su grosor es de 1,50 metros. Están dispuestos en ángulo recto, configurando dos de los laterales del primer recinto medieval. También se ha documentado el fragmento de un tercer lienzo (el lienzo Oeste), perteneciente a otra esquina, de 2,90 metros de longitud y construido en mampostería. El aparejo de los lienzos mayores es mixto de mampostería en la base y en las esquinas, y tapial en el resto de los alzados, levantado directamente sobre el sustrato geológico, y adaptándose a las distintas cotas de nivel de éste. En cuanto al fragmento de lienzo del ángulo Noroeste, presenta un tipo de fábrica en todo su alzado de las mismas características que el resto de las partes construidas en mampostería. En su cara interna se ha documentado la huella del nivel del suelo del adarve que probablemente debió recorrer la parte superior de todos los lienzos murados, así como el remate del mismo construido con sillarejos, siendo posible que el tramo visible corresponda a un merlón. El relleno interno de este lienzo, por debajo del nivel de adarve, fue desmontado en una fase posterior, reutilizando este espacio para la construcción de parte de los peldaños de una escalera de conexión entre las dos plantas de la vivienda incorporada al castillo medieval, que a su vez fueron desmontados reutilizando el hueco como alacena. Primera Fase Cristiana: Tras la conquista cristiana, se construyen a partir del siglo XIV la Torre del Homenaje y el Cuerpo de Guardia, adosados al ángulo Sureste del primitivo castillo, forrando en el caso del Cuerpo de Guardia, con la nueva fábrica, parte de una estructura de hormigón de arena y cal, perteneciente probablemente a un torreón de fase islámica o a uno de los ángulos del recinto murado. El enorme grosor de los muros de la Torre del Homenaje y la constatación de que en la planta baja de la misma se localiza una estructura de aljibe, podrían ser indicativos de que tal vez la Torre de fábrica cristiana también se construyera forrando estructuras de época islámica, extremo éste no confirmado en la excavación. En cuanto al flanco Oeste del castillo, no se conservan estructuras pertenecientes a ninguna de estas dos primeras fases de ocupación, ni relleno arqueológico que permita efectuar una lectura exacta de su trazado, encontrándose el sustrato rocoso inmediatamente por debajo de las solerías de época contemporánea. Por el momento solo es posible efectuar una aproximación hipotética del trazado original en función a los volúmenes y alineaciones seguidas en épocas posteriores para la construcción de la Crujía Oeste de la vivienda. La Torre del Homenaje tiene planta cuadrada (9 metros de lado y 20 de alzado), y está construida en mampostería regular con las esquinas reforzadas mediante sillares dispuestos a soga y tizón. Al interior, se organiza en tres plantas. La planta baja está incorporada en la actualidad a la fábrica de aceite colindante con el Castillo, y sólo tiene acceso desde la bodega de ésta. De planta cuadrada y cubierta con bóveda de cañón, probablemente de ladrillo, se identifica con una estructura de aljibe. Se conserva la huella de un acceso interno que comunica con la primera planta y un hueco cegado en la cara Norte que comunicó en un momento desconocido con el nivel de calle. La planta primera tiene estructura octogonal cubierta por una bóveda gallonada decorada con ocho nervios acanalados de yesería, que se sustentan en otras tantas semicolumnas adosadas construidas en ladrillo semicircular. Las semicolumnas apoyan en basas de piedra tallada y decorada con una pequeña bola en cada ángulo, y se rematan mediante capiteles decorados con talla en bajorrelieve de palmetas y otros motivos vegetales. En algunos sectores de los paramentos, y bajo varias capas de enlucidos de cal, se observan restos de pintura mural que representan una escena naval, adscribibles a época contemporánea, probablemente a finales del siglo pasado o principios del presente. Debajo de este nivel y al menos de tres enlucidos de yeso, se observan varios fragmentos de restos de pintura mural realizada sobre lo que parece ser un mortero original, estrato que descansa directamente sobre la mampostería de los paramentos. En tonos negro y rojo se aprecian algunas representaciones de figuras humanas y ramas muy esquematizadas. En algunos fragmentos de las semicolumnas se observan también restos de pintura, con los mismos colores aplicados de forma alterna en cada ladrillo. Cada uno de los lienzos de muro tiene una saetera abocinada: la Sur fue remodelada como puerta al balcón-terraza incorporado durante la construcción de la vivienda contemporánea y las Este y Oeste, cegadas y reutilizadas como alacenas. La planta segunda presenta un esquema espacial y formal similar a la anterior, si bien no se conserva la bóveda original ni las columnas adosadas, desaparecidas en un momento sin precisar. Del conjunto de elementos decorativos sólo se conservan los capiteles, también de piedra tallada con decoración vegetal. Esta planta sólo presenta dos saeteras, en el lienzo Oeste y en el Norte. Esta última fue remodelada en un momento indeterminado como ventana decorada con un par de arquitos polilobulados y parteluz, hoy desaparecido. Cuerpo de Guardia: Se trata de una construcción rectangular que funciona como antesala de acceso a la Torre del Homenaje, y que se adosa al lienzo de muralla Este de fase islámica. La cimentación es de mampostería careada irregular mientras que el alzado, documentado en la cara externa Norte, presenta fábrica de mampostería irregular alternando con verdugadas de ladrillo de una hilada colocados en su mayor parte a soga. Se organiza espacialmente en dos plantas, repitiendo la superior el mismo esquema que la baja. Ambas están cubiertas con bóveda de cañón de ladrillo. El acceso original desde el patio de armas se efectuaba por una puerta con dintel y jambas de sillería decorada con un par de ménsulas simples en la línea de imposta. En cuanto al acceso a la planta segunda, tanto de esta sala como de la torre, en la actualidad se realiza por las dos puertas abiertas posteriormente para conexión con la planta primera de las crujías de la vivienda, no habiéndose documentado hasta el momento el acceso original de época medieval, localizado probablemente en el grueso interno de uno de los muros de la Torre. Segunda Fase Cristiana: en ella se construyó la Torre del Alcaide. Con este nombre, al parecer acuñado por el cronista D. Mariano Sanz en virtud a un documento del siglo XVIII por él analizado en un archivo privado de Madrid, se designa la estructura muy fragmentada que se conserva en el ángulo Suroeste del Castillo. Está formada por dos lienzos de muro de mampostería concertada dispuesta en hiladas regulares en su cara externa y la esquina de encuentro entre ambos, reforzada con sillares dispuestos a soga y tizón (dos por hilada). El lienzo Oeste es visible desde el exterior, mientras que el Sur queda oculto por la construcción medianera con el Castillo de la fábrica de aceite. La construcción se levanta cimentada directamente sobre la roca, y tras efectuar la limpieza de la base externa, tan sólo se ha podido documentar alguna piedra de la hilada inferior, que al igual que el alzado seccionado presentan una dirección Sur-Norte. La caracterización de estos restos no permite, por tanto, relacionarlos con una estructura de torre de planta cuadrangular más o menos definida y con alguna de sus caras exenta. Por otra parte, la morfología y disposición de su aparejo difieren, tanto de las de la Torre del Homenaje como del resto de estructuras de mampostería del Castillo. La conexión entre este extremo y el Cuerpo de Guardia está formada por una sucesión de paramentos sometidos a numerosas reestructuraciones y añadidos, con uso de distintos materiales, que no han podido ser documentados en todo su trazado estableciendo una secuencia evolutiva completa, y cuyo estudio se ve afectado por el hecho de que todo este sector constituye medianera con la fábrica de aceite colindante. Los arqueólogos encargados del estudio del monumento sugieren como hipótesis que parte del cerramiento Sur conservado, y los lienzos de la denominada Torre del Alcaide pertenezcan a una segunda fase constructiva de época cristiana, de un sector de las defensas como consecuencia de su pérdida o deterioro, adscribible a fines del siglo XV. En cuanto al cerramiento del recinto defensivo por su flanco Oeste, no se conserva ningún resto de construcción original o relleno que permita efectuar una lectura exacta de su trazado, encontrándose el sustrato rocoso inmediatamente debajo de los pavimentos de la vivienda contemporánea.​ Casa-castillo Bajo esta denominación se engloban todas las estructuras que se adosan e incorporan a las preexistentes del castillo medieval, con un claro carácter funcional de vivienda, hasta configurar el actual aspecto del edificio. La lectura evolutiva de la vivienda en tanto o más compleja que la del propio castillo, pues la gran superposición de elementos y materiales constructivos denotan una gran actividad de fábrica relacionada con pequeñas fases de remodelaciones parciales del inmueble, a veces en un período corto de tiempo (modificaciones en los vanos, tabiquería, solerías, revocos y enlucidos). La práctica inexistencia de materiales arqueológicos motivó que los arqueólogos encargados del estudio realizaran el análisis y la interpretación de la evolución del edificio a través de la caracterización de los elementos constructivos: morfología, materiales y técnicas constructivas, y modificaciones de los elementos estructurales y acabados. Se diferencian tres grandes fases que suponen la incorporación de nueva planta y/o alteraciones de elementos constructivos estructurales. Primera fase: En la que se lleva a cabo la remodelación estructural del castillo medieval para su adaptación como vivienda, construyéndose los volúmenes localizados al interior del recinto murado, ocupando gran parte del espacio abierto del patio de armas original. Mediante la disposición de muros de carga paralelos a las caras internas de los lienzos de muralla que a su vez son reutilizados también como muros de carga, se generan una serie de crujías en las que se distribuirían las distintas estancias de la vivienda articulada en torno a un patio central, a partir de este momento, de dimensiones más reducidas. Para la implantación de los nuevos muros de carga se procedió a una explanación del interior del recinto medieval, picando el sustrato sobre el que éste se cimenta, con el objetivo de conseguir espacio útil en profundidad en determinados puntos, cuadrar la orientación de las crujías y a la vez utilizar el material extraído como mampuestos para la construcción de la base de las nuevas estructuras. Esta acción de vaciado interno del edificio, que en algunos casos llega a una profundidad de 1,70 metros por debajo del nivel de cimentación sobre la roca de las estructuras del recinto defensivo, supone la desaparición de todos los niveles originales de suelo de época medieval y la consiguiente ausencia de restos materiales correspondientes a esta fase histórica. El análisis de las cotas de los niveles en los que el sustrato rocoso aparece picado en relación con la caracterización y orientación de los muros de carga parece indicar que toda esta actividad constructiva se hizo en un mismo momento. Los muros de carga se cimientan directamente sobre la roca y se levantan con una base de mampostería y resto del alzado en tapial, encontrándose en todos los casos su morfología original muy alterada por remodelaciones y parcheados con otros materiales de fases posteriores. Tres de las crujías (Norte Acceso, Sur Patio y Este Patio) estuvieron divididas en dos alturas y en el caso de la última en tres, habiéndose documentado la existencia de una planta sótano excavada en la roca, utilizando en todos los casos los lienzos de muralla medievales para la incorporación de forjados de rollizos de madera. En cuanto a la Crujía Oeste, que en la actualidad presenta una sola planta, la caracterización de materiales del muro de carga interno y su orientación hacen suponer que la disposición en planta corresponda a esta primera fase, aunque la mayor parte de su aspecto actual responda a remodelaciones sustanciales en periodos posteriores. En virtud a la técnica constructiva empleada para las construcciones de este momento y a los escasos materiales arqueológicos documentados (fragmentos de cuencos vidriados en verde, melado y amarillo, tazones esmaltados en blanco y cántaros con decoración de manchones en manganeso), cronológicamente esta fase es adscribible al siglo XVI, momento en el que el inmueble pasa a ser propiedad de Francisco de los Cobos. Segunda fase: Durante la segunda fase de reutilización del inmueble como vivienda, el proceso de ampliación continúa mediante la incorporación de las dos crujías adosadas al exterior de los lienzos de muralla Este y Norte, ambas divididas en dos y tres alturas respectivamente. En la Crujía Este se conserva el alzado original del muro de carga dispuesto en paralelo al lienzo de muralla, construido a base de cajones de tapial. Ambas crujías se remataron con cubierta de palos de madera y teja árabe a un agua vertiendo al exterior. Probablemente correspondan también a este momento varias remodelaciones documentadas en el interior del edificio. En la Crujía Este se elimina la planta del sótano, en favor de la nueva planta semisótano construida en la crujía Norte, utilizada como cantina para almacenamiento de tinajas de aceite; también se incorporan dos muros de carga transversales de tapial, y se eleva el forjado entre la planta baja y la primera, y de la cubierta a un agua vertiendo al patio. Probablemente también se produce el estrechamiento de la Crujía Norte Acceso y la modificación del emplazamiento de la caja de escalera de acceso a la primera planta, situándola donde se encuentra en la actualidad. Se abren vanos en los lienzos de muralla para permitir la comunicación entre las crujías internas y las construidas al exterior de estos. La identificación de dos tipologías diferentes de vanos hace suponer que durante esta fase se abrieran los vanos que presentan uno de sus laterales abocinados, e incluso que respondan a una ampliación como puertas, de ventanas abiertas en la fase anterior. En la misma línea se abrirá ahora el balcón-terraza adosado al exterior de la cara sur de la Torre del Homenaje. En cuanto a la distribución funcional de los distintos espacios, se sabe que la Crujía Este estuvo destinada a cuadra en planta baja y cámara para el almacenamiento de grano en planta primera, y que la planta semisótano de la Crujía Norte se destinó a cantina de almacenamiento de aceite. Todos los espacios bajocubierta de la planta primera debieron estar destinados, por su tipología, a cámaras de almacenamiento, mientras que en la planta baja se encontrarían los dormitorios y principales estancias de la vivienda, sin que se pueda concretar más su localización exacta. Cronológicamente, esta fase es adscribible a los siglos XVIII-XIX, momento en el que la vivienda responde claramente a una tipología de casa urbana vinculada a la explotación agrícola de medianos y grandes propietarios, y en la que aunque es evidente el carácter emblemático y simbólico de ocupación del Castillo medieval, todavía predomina lo funcional. Tercera fase: Durante este período, fechable a partir de 1910, se consolida la construcción de todos los volúmenes que el edificio presenta en la actualidad. Es a principios de siglo cuando se construyen los últimos adosamientos a las estructuras medievales: crujía Sur medianera con la fábrica de aceite colindante, ampliación y elevación de la cubierta de la Crujía Noroeste, así como de la terraza y escaleras de acceso al huerto-corral situado en el flanco Oeste del edificio, en la base del talud rocoso sobre el que se asienta. En este momento, también se abre, horadando la fábrica de tapial y mampostería preexistente, la serie de cuatro arcos de medio punto en el muro de carga que da al patio de la Crujía Oeste. No obstante, lo más significativo de esta fase parece ser la ejecución de toda una serie de acabados y elementos ornamentales, muchos de ellos hoy desaparecidos, que inciden en el afán de imprimir a la construcción un carácter mucho más señorial: apertura de nuevos vanos y ampliación de los ya existentes, configurando la composición de la fachada actual, con ventanas-balcón abocinadas al interior y molduradas con yeso. Ampliación de la portada de acceso adintelada por arco de medio punto flanqueado por pilastras adosadas de yeso, y recolocación de los dos escudos de la familia Cobos-Camarasa. Sustitución de la rampa empedrada que salvaba el desnivel existente entre la calle y la entrada al edificio por escalera central a eje. Ampliación de huecos en las fachadas de las crujías exteriores en favor de la construcción de balcones. Ampliación y/o apertura de puertas abovedadas excavadas en los lienzos de muralla y de alacenas. Incorporación de solería de baldosa hidráulica con decoración polícroma en planta baja. Incorporación de molduras de yeso policromadas en los falsos techos de algunas de las habitaciones de la planta baja, y colocación de apliques de yeso con bajorrelieve decorado con una torre y flor, procedentes de la antigua ermita de Cánava, demolida en 1900. En definitiva, esta fase de ocupación del edificio representa un modelo acorde con los gustos, modas y posición de sus propietarios, la familia Torres Calatrava, representantes de una burguesía acaudalada en virtud a las rentas agrícolas, que ya empezaba a despuntar a fines del siglo pasado y que se consolida durante las dos primeras décadas del presente, y que de alguna manera viene a rememorar simbólica e ideológicamente la ocupación del espacio señorial original y más emblemático de la población.​ Intervenciones recientes A partir de la segunda mitad del siglo XX, se han llevado a cabo numerosas intervenciones producto en la mayoría de los casos de actividades de mantenimiento habituales en un edificio de estas características, tales como reparación de cubiertas y forjados, parcheados de muros, sustitución de tabiquería y solerías, y adecuación de instalaciones y saneamientos. Las intervenciones que han tenido carácter estructural, condicionando la morfología del edificio son dos. En primer lugar, la llevada a cabo en 1963. Con motivo de la ampliación de la calle Audiencia, realizada a iniciativa del Ayuntamiento, se sustituyó la escalera de la portada principal, por el acceso existente en la actualidad, configurado por una escalera de un tramo que desemboca en una lonja aterrazada construida sobre un muro ataluzado de mampostería ordinaria tomada con mortero de cemento. En segundo lugar, en 1973 y con motivo de la caída de un rayo sobre la Torre del Homenaje, se sustituye la cubierta de teja árabe a cuatro aguas por la cubierta plana transitable que presenta en la actualidad, construida sobre forjado de viguetas autorresistentes. En ese mismo momento, se efectúa el recrecido de 1 metro en mampostería del alzado de la Torre y el remate de la caja de escalera de acceso a la cubierta-terraza. Durante la misma intervención se produce la sustitución de la cubierta a un agua de la Crujía Este por cubierta plana transitable, el recrecido de los lienzos de muralla con fábrica de ladrillo de 1 metro de altura y la elevación y sustitución de las cubiertas de teja árabe por las de fibrocemento que presenta el edificio actualmente. En 1995, el inmueble fue adquirido por el Ayuntamiento de Jimena y sometido a un proyecto de remodelación.​ Fuentes Este artículo incluye contenido derivado de una disposición relativa al proceso de protección, incoación o declaración de un bien cultural o natural, el cual está libre de restricciones conocidas en virtud del derecho de autor de conformidad con lo dispuesto en el artículo 13 de la Ley de Propiedad Intelectual española.",
            "Cárnicas Molina fue una empresa jiennense de alimentación dedicada a la industria cárnica porcina. Era la principal empresa cárnica andaluza,​ llegando a contar con 1.100 trabajadores y un matadero de 1.600 cerdos al día.​ Llegó a acaparar el 6 % del mercado cárnico español.​ Contaba con una infraestructura de fábrica, matadero y despiece que ocupaba unos terrenos de 50.000 metros cuadrados,​ que hoy día, en estado ruinoso, se ubican junto al polígono industrial Nuevo Jaén. Historia La empresa se fundó en 1952 de manos de la familia Molina.​ En la década de los ochenta e inicios de los noventa alcanza su mayor pujanza, facturando 15.000 millones de pesetas (90 millones de euros) y compitiendo con las principales firmas españolas del sector.​ En el año 1993, Molina decide acudir a la Junta de Andalucía para solicitar ayuda financiera.​ Poco después Cárnicas Molina entra en suspensión de pagos. En 1995, la Junta de Andalucía, a través de Instituto de Fomento de Andalucía, toma la empresa (pagó una peseta por sus nueve plantas)​ y la vende poco después, en 1999,​ a Campofrío a través de su filial andaluza Campocarne, tras haber invertido en ella 54 millones de euros de ayudas que la Comisión Europea declaró ilegales​ por vulnerar la libre competencia.​ La Junta pretendía, por medio de un ajuste de plantilla, recuperar las cuentas de la empresa.​ Campofrío se comprometió a invertir 24 millones de euros en una nueva planta de elaborados cárnicos, fijando una reducción de plantilla de 475 a 300 trabajadores.​ La compañía no cumplió sus acuerdos y la vendió poco después a Proinserga.​ El grupo segoviano Proinserga adquiere en 2004, a través de su filial Primayor Andalucía, a Cárnicas Molina.​ En 2007, con 148 trabajadores en plantilla, reconoce un déficit de 60 millones de euros y una situación de insolvencia.​ A continuación, la empresa presenta un plan de choque consistente en jornada laboral de cinco horas diarias y reducción del salario de un 30 %, comenzando con 200 cerdos diarios para pasar a 400 en seis meses. El plan fue rechazado por los sindicatos, que sospechaban de la existencia de intereses especulativos detrás de estas maniobras de la empresa sobre los terrenos de la planta, de 50.000 metros cuadrados, que serían segregados y puestos en venta por parcelas. Consideraban que la empresa trabajaría a pérdidas para así declararse en quiebra en pocos años y poder especular con el valor de los terrenos tras su liquidación.​​ Los 148 trabajadores que fueron finalmente despedidos llevaron a cabo una acampada reclamando su recolocación, durante más de un año, frente a las puertas de la Delegación de la Junta de Andalucía, en el centro de la capital jiennense, considerada la acampada más larga de un colectivo laboral en España. La Junta de Andalucía, por medio del consejero Gaspar Zarrías, y el ayuntamiento de Jaén, por medio de la entonces alcaldesa socialista Carmen Peñalver, firmaron un acuerdo para la recolocación de la mitad del colectivo en una nueva planta de la empresa Dhul, por entonces en construcción, de platos prefabricados.​ Sin embargo, la construcción de esta planta de platos prefabricados, que se levantaba a pocos metros de las antiguas instalaciones de Cárnicas Molina, considerada uno de los grandes proyectos de Dhul en Andalucía, se detuvo a mitad de su ejecución. Nueva Rumasa entró en suspensión de pagos y a continuación en concurso de acreedores,​ lo que supuso el abandono del proyecto. La planta ocuparía unos 142.000 metros cuadrados y en ella el grupo Nueva Rumasa invertiría 50 millones de euros y recolocaría a 75 antiguos trabajadores de Primayor, para poner en marcha dos líneas productivas, de caldos-zumos y de tortillas.​ Las estructuras que llegaron a construirse fueron abandonadas poco después y entraron en estado ruinoso, sufriendo posteriores incendios, principalmente de los materiales aislantes que se llegaron a instalar.​ La Junta de Andalucía había invertido 2'2 millones de euros a fondo perdido en la construcción de la planta.​​ Dinero público El dinero público invertido por la Junta de Andalucía en Cárnicas Molina (54 millones de euros),​ al que hay que sumar el que se destinó como ayuda a los grupos privados que fueron entrando en la empresa, nunca pudo ser recuperado, ya que durante los tres años que estuvo en manos de las instituciones públicas registró siempre pérdidas, y más tarde tampoco se pudo reflotar.​ Posteriormente, la Junta de Andalucía, por medio de la Agencia IDEA, invirtió nuevamente 4 millones de euros a fondo perdido en la construcción de la nueva planta de platos precocinados de Dhul, que de igual manera se vieron malogrados.​​",
            "La Academia Bibliográfica Mariana 'Virgen de la Capilla' de Jaén es una corporación académica erigida por la Diócesis de Jaén en 1981, bajo el patronato de la Real Cofradía de la Virgen de la Capilla, patrona de la ciudad de Jaén, Andalucía, España. Entre los fines de la Academia está la promoción del humanismo cristiano, de la investigación histórica, el arte, la literatura y cualquier disciplina asociada en torno a la Virgen María. Entre sus actividades destaca la organización de ciclos de conferencias, seminarios de investigación, publicación de monografías o artículos y la gestión de un importante Archivo-Biblioteca de tema mariano.​ Descripción e Historia La idea de la fundación data de 1967, coincidiendo con la peregrinación de la imagen de la patrona de Jaén hasta Lérida para presidir allí varios actos marianos y culturales. En aquella ciudad existe desde 1862 la Pontificia y Real Academia Mariana, cuya titular es patrona de la ciudad de Lérida. De esa ocasión surgió la idea de fundar en Jaén una institución de similares características. Desde ese año se fueron reuniendo donativos, de cientos de particulares e instituciones, que desinteresadamente fueron aportando dinero para la compra de una sede para la institución, donde poder acoger la celebración de sus actividades. Tras muchos años de constante trabajo, la labor fundacional alcanzó el definitivo reconocimiento de la Iglesia con el otorgamiento de su Reglamento por parte del obispo de Jaén, don Miguel Peinado Peinado (1911-1993). Entre 1984 y 1999 la Academia celebró a lo largo de la geografía provincial las ‘Asambleas de Estudios Marianos’, congresos de temática mariana que reunían a los principales estudiosos e investigadores en temas marianos. Sus actas constituyen tesoros bibliográficos para la investigación mariana en la diócesis de Jaén. En la actualidad la corporación académica la integran 44 miembros, repartidos entre los residentes en la ciudad de Jaén (académicos numerarios), y los que residen fuera (académicos correspondientes), y una colaboradora que presta su ayuda en la gestión del fondo documental.​ La Academia atesora desde su fundación un interesante Archivo-Biblioteca que guarda documentación variada sobre la historia de la devoción a la Santísima Virgen de la Capilla, patrona de la ciudad de Jaén, y un amplio fondo relativo a la mayor parte de las poblaciones de la diócesis de Jaén. Entre sus estanterías también se hallan libros y revistas especializadas en temas marianos. La Academia Mariana ‘Virgen de la Capilla’ gestiona una página web-blog, en la que se recogen información, bibliografía y documentación gráfica en torno a la devoción universal a la Virgen María, con atención especial en el territorio de la actual diócesis de Jaén. Edita de forma intermintente una Revista de estudios marianos: 'Once de Junio' dedicada a recoger estudios y noticias de tema mariano en la diócesis de Jaén. La institución tiene su sede en la ciudad de Jaén, en la Calle de Vicente Montuno Morente, 2, que fue adquirida por suscripción pública para albergar en ella la Academia, y en este lugar desarrolla sus principales actividades."
        ]
    },
    "test_12": {
        "question": "¿Qué es el Expoliva?",
        "reference": "Expoliva es una feria internacional del aceite de oliva que se celebra cada dos años en la ciudad de Jaén.",
        "response": "El Expoliva es una feria de carácter bienal promovida desde 1990 por la Fundación del Olivar, que se celebra en la ciudad de Jaén, en la Comunidad Autónoma de Andalucía, en España. Se trata de una feria internacional dedicada al sector del aceite de oliva, que se celebra desde el año 1983 y desde 1997 tiene lugar en el Recinto Provincial de Ferias y Congresos de Jaén (IFEJA). En ella se dan cita las empresas nacionales e internacionales más importantes del sector, y es considerada la referencia mundial de las ferias dedicadas al sector del aceite de oliva.",
        "reference_contexts": "['Feria Internacional del Aceite de oliva e Industrias Afines Se trata de una feria de carácter bienal promovida desde 1990 por la Fundación del Olivar, que se en la ciudad de Jaén, en la Comunidad Autónoma de Andalucía, en España. Su carácter internacional la convierte en la referencia mundial de las ferias dedicadas al sector del aceite de oliva. Se celebra desde el año 1983, y desde 1997 tiene lugar en el Recinto Provincial de Ferias y Congresos de Jaén (IFEJA). Cifras y datos En el año 2007 se cumplió la edición número 13 de Expoliva, que se cerró con un nuevo récord de visitantes y expositores. Con unos 15.000 m² de feria, distribuidos en 4 pabellones, con más de 300 empresas expositoras procedentes de 27 provincias españolas y 12 países extranjeros, y más de 100.000 visitas, de las que unas 40.000 fueron de profesionales. En ella se dan cita las empresas nacionales e internacionales más importantes del sector. La mayoría de los países participantes pertenecen a la Cuenca Mediterránea, Portugal, Italia, Marruecos, Túnez, Israel, así como Francia y Alemania. Simposium Científico-Técnico y premios Expoliva El Simposium es una actividad paralela a la feria, y que se compone de 5 foros: Foro de la Salud y el Aceite de Oliva Foro de la Industria Oleícola, Tecnología y Calidad Foro de la Cultura del Aceite de Oliva Foro Económico y Social Foro del Olivar y Medio Ambiente También se celebran los diferentes Concursos y premios que distinguen la calidad del Aceite de Oliva Virgen Extra: Premio a la Calidad del Aceite de Oliva Virgen Premio de Innovaciones Técnicas Premio mejor alimento elaborado con Aceite de Oliva Premio \"Gran Picual\" Premio de periodismo Premio al mejor diseño de Stand Organizadores Organizan: Ferias Jaén, y Fundación del Olivar']",
        "retrieved_contexts": [
            "Feria Internacional del Aceite de oliva e Industrias Afines Se trata de una feria de carácter bienal promovida desde 1990 por la Fundación del Olivar, que se en la ciudad de Jaén, en la Comunidad Autónoma de Andalucía, en España. Su carácter internacional la convierte en la referencia mundial de las ferias dedicadas al sector del aceite de oliva. Se celebra desde el año 1983, y desde 1997 tiene lugar en el Recinto Provincial de Ferias y Congresos de Jaén (IFEJA). Cifras y datos En el año 2007 se cumplió la edición número 13 de Expoliva, que se cerró con un nuevo récord de visitantes y expositores. Con unos 15.000 m² de feria, distribuidos en 4 pabellones, con más de 300 empresas expositoras procedentes de 27 provincias españolas y 12 países extranjeros, y más de 100.000 visitas, de las que unas 40.000 fueron de profesionales. En ella se dan cita las empresas nacionales e internacionales más importantes del sector. La mayoría de los países participantes pertenecen a la Cuenca Mediterránea, Portugal, Italia, Marruecos, Túnez, Israel, así como Francia y Alemania. Simposium Científico-Técnico y premios Expoliva El Simposium es una actividad paralela a la feria, y que se compone de 5 foros: Foro de la Salud y el Aceite de Oliva Foro de la Industria Oleícola, Tecnología y Calidad Foro de la Cultura del Aceite de Oliva Foro Económico y Social Foro del Olivar y Medio Ambiente También se celebran los diferentes Concursos y premios que distinguen la calidad del Aceite de Oliva Virgen Extra: Premio a la Calidad del Aceite de Oliva Virgen Premio de Innovaciones Técnicas Premio mejor alimento elaborado con Aceite de Oliva Premio \"Gran Picual\" Premio de periodismo Premio al mejor diseño de Stand Organizadores Organizan: Ferias Jaén, y Fundación del Olivar",
            "El Centro de Interpretación Olivar y Aceite es un centro de carácter turístico y museístico dedicado a divulgación del aceite de oliva virgen y situado en el edificio de la Casa de la Tercia de Úbeda en la provincia de Jaén. En la actualidad consta de más de 1 200 metros cuadrados incluyendo diferentes salas entre las que destacan un área de museo, salas de exposiciones, aulas de cocina e infantiles, salas de conferencias y formación.​ Historia El Centro es una iniciativa puesta en marcha por el Ayuntamiento de Úbeda en el año 2013 y que en la actualidad se encuentra gestionado por la Asociación Olivar y Aceite. Una asociación sin ánimo de lucro que agrupa entidades públicas y privadas tales como ayuntamientos, almazaras, organizaciones agrarias, empresas de ingeniería y servicios turísticos o empresas que trabajan con el aceite de oliva virgen extra como materia prima y todas con el objetivo de promover la cultura del aceite de oliva y el oleoturismo.​ Localización El Centro de Interpretación Olivar y Aceite se encuentra situado en la denominada Casa de la Tercia en pleno centro histórico de la ciudad de Úbeda, en la Corredera de San Fernando. Un edificio del siglo XVII​ que en el pasado acogió a la biblioteca de la UNED, a la oficina del consumidor o más recientemente a la Denominación de Origen Campiñas de Jaén.",
            "El Mármol (oficialmente EATIM de El Mármol​ o ELA de El Mármol)​ es una entidad de ámbito territorial inferior al municipio perteneciente al municipio de Rus, en la provincia de Jaén, comunidad autónoma de Andalucía, España.​​ Símbolos Escudo «Partido 1º en campo de gules una torre de oro, almenada, esclarecida de azur y mazonada de sable. Surmontada de una mitra episcopal de oro con ínfulas del mismo metal. 2º en campo de plata un Cristo oscuro con saya de gules y faja blanca, sostenido de un ondado horizontal doble de azur y truncado a ambos lados. Contorno español y corona real cerrada al timbre.» La torre de oro simboliza el torreón del siglo xiii que aún se conserva. La mitra episcopal representa a la jurisdicción episcopal a la cual perteneció El Mármol tras la conquista de Baeza por concesión del rey Fernando III a fray Domingo de Soria, obispo de Baeza. El Cristo es la representación del Cristo de las Aguas, hacia el que los vecinos de la localidad profesan una gran devoción.​ Bandera La bandera se describe como «un paño rectangular en la proporción de 11 por 18, con tres franjas paralelas entre sí y perpendiculares al asta. La distribución cromática queda de la siguiente manera: la primera y tercera de ¼ del ancho, de color rojo; la segunda o central de 2/4 y verde. Sobrepuesto y centrado en ella en el tercio más cercano al asta, el escudo heráldico de la Entidad Local.» Geografía Localización El Mármol está enclavado en la parte oriental del municipio de Rus a una distancia de 4 km del núcleo urbano de la cabecera municipal, cerca de la frontera con el término municipal de Úbeda, de la que hace las veces el Arroyo de Valdecanales, que transcurre muy próximo a la Entidad Local Autónoma y que desemboca al Guadalimar. El Mármol pertenece a la comarca de La Loma cuya capital es Úbeda, enclavándose en la ladera norte de los cerros de la zona occidental de esta unidad de relieve. Historia Hacia mediados del siglo XIX, el lugar, por entonces con ayuntamiento propio, tenía contabilizada una población de 199 habitantes.​ La localidad aparece descrita en el decimoprimer volumen del Diccionario geográfico-estadístico-histórico de España y sus posesiones de Ultramar de Pascual Madoz de la siguiente manera: Geografía humana Demografía Medios de transporte Carreteras El Mármol está conectado por carretera con su cabecera municipal y con la del municipio vecino: Desde el Oeste: JA-5103 (Carretera de Rus a El Mármol), conecta la localidad con la cabecera municipal de Rus. Desde el Sur: JA-5105 (Carretera de Úbeda a El Mármol), conecta la localidad con la capital de la comarca de La Loma..",
            "Arroturas es una entidad de población española del municipio de Villacarrillo, perteneciente a la provincia de Jaén, en la comunidad autónoma de Andalucía. Historia Hacia mediados del siglo XIX, el lugar ya pertenecía a Villacarrillo.​ Aparece descrito en el tercer volumen del Diccionario geográfico-estadístico-histórico de España y sus posesiones de Ultramar de Pascual Madoz con las siguientes palabras:​ En 2023, la entidad singular de población tenía empadronados 32 habitantes​ y el núcleo de población, los mismos.​",
            "Migas ruleras (denominadas también migas manchegas) se trata de un tipo de migas muy habitual en la Gastronomía de Castilla-La Mancha, concretamente de la región de la Mancha.​ Se trata de un plato de origen pastoril que fundamenta su elaboración en el aprovechamiento del pan que se endurecía fácilmente; para lograr que se ablande se mezclaba con otros ingredientes (generalmente de origen cárnico). La preparación hace que sea un plato nutritivo capaz de afrontar duros inviernos. Dada la alta cantidad de calorías que contiene, es aconsejable tomarlo en cantidades moderadas. Características Las migas ruleras son un plato popular y muy sencillo a la hora de elaborar. Los componentes son muy variados y parten de un pan de centeno o de trigo desmigado y mezclado con chorizo picado, tocino de cerdo (a ser posible enteverado), jamón serrano picado, ajos, aceite de oliva.​ Todo ello se cocina en una sartén y se deja tostar ligeramente. La base es el pan muy duro puesto en remojo bastante tiempo, dos o más horas, ajos, aceite de oliva, longaniza, tocino y otros ingredientes de cerdo. Se suele mezclar el pan remojado con un poco de harina. En el aceite donde se han frito los ajos y los \"tropezones\" se echa la masa de pan remojado y escurrido, y a fuego lento se le va dando vueltas con la rasera hasta que quedan hechas (bien desmigadas) y \"melosas\". Se llaman ruleras porque una vez hechas ruedan por una superficie no muy inclinada, otros dicen que debido a la cantidad de vueltas que hay que darle. El truco es cocinarlas a fuego lento, tener mucha paciencia y darles muchas vueltas. Es común comerlas con alguna fruta como puede ser uvas, granada o melón."
        ]
    },
    "test_13": {
        "question": "¿Cuántos habitantes tiene Santiago de Calatrava?",
        "reference": "Santiago de Calatrava cuenta con una población de 657 habitantes a fecha de 2023, según el INE.",
        "response": "Santiago de Calatrava tiene 609 habitantes.",
        "reference_contexts": "['Este artículo trata sobre el municipio jiennense. Para el arquitecto valenciano, véase Santiago Calatrava. Santiago de Calatrava es una localidad y municipio español situado en la parte occidental de la comarca Metropolitana de Jaén, en la provincia de Jaén. Limita con los municipios jienenses de Higuera de Calatrava, Torredonjimeno y Martos; y con los municipios cordobeses de Baena y Valenzuela. El municipio santiagueño comprende el núcleo de población de Santiago de Calatrava —capital municipal— y diversos diseminados. Historia En Santiago de Calatrava se han hallado vestigios arqueológicos de la época romana y árabe, lo que certifica la presencia en su territorio de población romana y árabe, de ahí su ancestral historia y cultura. Tras la entrega de las fortalezas de Martos al Reino de Castilla en 1225, el rey Fernando III dona Martos y su término a la Orden Religiosa-Militar de Calatrava en 1228. Martos fue designada por la Orden de Calatrava Cabeza del Partido del Andalucía, constituyéndose las Encomiendas de Martos y la del Víboras, que comprendían la propia Villa de Martos, la Villa de Torreximeno, el anexo de Xamilena, el Lugar de Santiago, la Figuera de Martos, la Torre de Alcázar y de Venzalá, el monte de Lope Álvarez, unas 200 yugadas en la heredad de Arjona y la Villa de Porcuna, esta última se haría efectiva su entrega a la Orden de Calatrava cuando fuese conquistada a los árabes. Se cree que el lugar de Santiago recibió este nombre de los caballeros de la Orden de Santiago. Como lugar de frontera el pueblo se vio afectado por las razzias que desde el reino nazarí de Granada se lanzaban contra los territorios de la Orden de Calatrava, destacando la del 29 de septiembre de 1471 que asoló las entonces Higuera de Martos y Santiago. A la muerte del maestre García López de Padilla el maestrazgo de la Orden de Calatrava pasó a manos de la Corona de Castilla, así que las villas y lugares pasaron a ser posesiones del rey. La jurisdicción de la villa de Martos duró hasta que el alcalde ordinario del Lugar de Santiago don Fernando Merchante solicitó, en fecha 18 de junio de 1551, la independencia de Santiago de la Villa de Martos, petición que fue atendida por el rey Felipe II el 20 de enero de 1593, previo pago de una elevada cantidad de doblas en oro que pagaron los ciudadanos de Santiago a la corona de Castilla, pasando a denominarse con el actual nombre de Santiago de Calatrava, con municipio propio, como al día de hoy sigue. En el siglo XVI un grupo de vecinos de Santiago acudieron como repobladores de la villa de Arenas, en Málaga. Algunos de esos repobladores se apellidaban \"Pareja\", siendo en la actualidad un apellido muy típico de esta localidad de la Axarquía malagueña. Ya en el siglo XX la Guerra Civil, como en el resto del país, supuso un antes y un después para esta población. En abril de 1939, el Ejército Franquista, aprovechando que la población había sido evacuada durante la guerra, instaló en la localidad un campo de concentración de prisioneros. Según testimonios orales los propios cautivos fueron forzados a rodear el pueblo con alambradas de espino. Se ha documentado el hacinamiento, en condiciones precarias, de 4800 personas allí.\\u200b Geografía Se encuentra a 386 m de altitud y 44 km al oeste de la capital provincial, lindando con la provincia de Córdoba. Forma parte de la Comarca Metropolitana de Jaén. Tiene 655 habitantes (según datos del INE de 2022), sobre un término municipal de 47,66 km². Geografía humana Demografía Cuenta con una población de 657 habitantes (INE 2024). Organización político-administrativa Elecciones municipales Alcaldía Economía Se trata de un municipio fundamentalmente agrícola cuya economía se basa en el olivo. Cultura Monumentos Iglesia parroquial de Nuestra Señora de la Estrella, templo barroco. Antigua Cámara Agraria (Hoy hogar del jubilado). Casa Consistorial. Fiestas Las fiestas patronales se celebran el 25 de julio, en honor a su patrón San Sebastián, y la romería de San Isidro se ha celebrado el día 15 de mayo, aunque en la última década se ha optado por la celebración de dicha romería el segundo sábado del mismo mes, en el paraje natural \"El Caño\". Cabe destacar su Semana Santa en especial la celebración del Domingo de Resurrección. Santiagueños célebres']",
        "retrieved_contexts": [
            "Este artículo trata sobre el municipio jiennense. Para el arquitecto valenciano, véase Santiago Calatrava. Santiago de Calatrava es una localidad y municipio español situado en la parte occidental de la comarca Metropolitana de Jaén, en la provincia de Jaén. Limita con los municipios jienenses de Higuera de Calatrava, Torredonjimeno y Martos; y con los municipios cordobeses de Baena y Valenzuela. El municipio santiagueño comprende el núcleo de población de Santiago de Calatrava —capital municipal— y diversos diseminados. Historia En Santiago de Calatrava se han hallado vestigios arqueológicos de la época romana y árabe, lo que certifica la presencia en su territorio de población romana y árabe, de ahí su ancestral historia y cultura. Tras la entrega de las fortalezas de Martos al Reino de Castilla en 1225, el rey Fernando III dona Martos y su término a la Orden Religiosa-Militar de Calatrava en 1228. Martos fue designada por la Orden de Calatrava Cabeza del Partido del Andalucía, constituyéndose las Encomiendas de Martos y la del Víboras, que comprendían la propia Villa de Martos, la Villa de Torreximeno, el anexo de Xamilena, el Lugar de Santiago, la Figuera de Martos, la Torre de Alcázar y de Venzalá, el monte de Lope Álvarez, unas 200 yugadas en la heredad de Arjona y la Villa de Porcuna, esta última se haría efectiva su entrega a la Orden de Calatrava cuando fuese conquistada a los árabes. Se cree que el lugar de Santiago recibió este nombre de los caballeros de la Orden de Santiago. Como lugar de frontera el pueblo se vio afectado por las razzias que desde el reino nazarí de Granada se lanzaban contra los territorios de la Orden de Calatrava, destacando la del 29 de septiembre de 1471 que asoló las entonces Higuera de Martos y Santiago. A la muerte del maestre García López de Padilla el maestrazgo de la Orden de Calatrava pasó a manos de la Corona de Castilla, así que las villas y lugares pasaron a ser posesiones del rey. La jurisdicción de la villa de Martos duró hasta que el alcalde ordinario del Lugar de Santiago don Fernando Merchante solicitó, en fecha 18 de junio de 1551, la independencia de Santiago de la Villa de Martos, petición que fue atendida por el rey Felipe II el 20 de enero de 1593, previo pago de una elevada cantidad de doblas en oro que pagaron los ciudadanos de Santiago a la corona de Castilla, pasando a denominarse con el actual nombre de Santiago de Calatrava, con municipio propio, como al día de hoy sigue. En el siglo XVI un grupo de vecinos de Santiago acudieron como repobladores de la villa de Arenas, en Málaga. Algunos de esos repobladores se apellidaban \"Pareja\", siendo en la actualidad un apellido muy típico de esta localidad de la Axarquía malagueña. Ya en el siglo XX la Guerra Civil, como en el resto del país, supuso un antes y un después para esta población. En abril de 1939, el Ejército Franquista, aprovechando que la población había sido evacuada durante la guerra, instaló en la localidad un campo de concentración de prisioneros. Según testimonios orales los propios cautivos fueron forzados a rodear el pueblo con alambradas de espino. Se ha documentado el hacinamiento, en condiciones precarias, de 4800 personas allí.​ Geografía Se encuentra a 386 m de altitud y 44 km al oeste de la capital provincial, lindando con la provincia de Córdoba. Forma parte de la Comarca Metropolitana de Jaén. Tiene 655 habitantes (según datos del INE de 2022), sobre un término municipal de 47,66 km². Geografía humana Demografía Cuenta con una población de 657 habitantes (INE 2024). Organización político-administrativa Elecciones municipales Alcaldía Economía Se trata de un municipio fundamentalmente agrícola cuya economía se basa en el olivo. Cultura Monumentos Iglesia parroquial de Nuestra Señora de la Estrella, templo barroco. Antigua Cámara Agraria (Hoy hogar del jubilado). Casa Consistorial. Fiestas Las fiestas patronales se celebran el 25 de julio, en honor a su patrón San Sebastián, y la romería de San Isidro se ha celebrado el día 15 de mayo, aunque en la última década se ha optado por la celebración de dicha romería el segundo sábado del mismo mes, en el paraje natural \"El Caño\". Cabe destacar su Semana Santa en especial la celebración del Domingo de Resurrección. Santiagueños célebres",
            "Lendínez es una pedanía que pertenece al término municipal de Torredonjimeno, en la provincia de Jaén (España). Está situada entre los pueblos de Torredonjimeno, Martos, Santiago de Calatrava e Higuera de Calatrava, siendo la distancia a este último de 5 km. La pedanía contaba en 2023 con 5 habitantes, según datos del Instituto Nacional de Estadística. Historia Pocos son los datos históricos que se conservan sobre Lendínez aunque existen numerosos restos en los alrededores que evidencian la presencia de poblados antiguos. A 1,5 km se encuentra la Nava de Martos, un conjunto histórico propiedad de Bellas Artes; también a 1 km, en el lugar llamado Cerro de Piedras Cucas, se conservan algunos restos de un templo íbero; y en los alrededores más próximos se pueden vislumbrar restos de casas romanas. Según algunos historiadores, Lendínez fue lugar de paso de la Cañada Real del Camino de Granada, que servía para que los comerciantes castellanos negociaran con los musulmanes del Reino de Granada. En 1228, durante la reconquista, Lendínez, al formar parte del territorio de Martos, pasó a ser propiedad de la Orden de Calatrava como lo demuestra el Pozo de la Orden de Calatrava que indica de la presencia de esta orden militar. Posteriormente, durante la Guerra Civil, Lendínez sería zona de frente entre nacionales y republicanos, como lo demuestran las trincheras y polvorines que aún pueden verse en el lugar, y en perfecto estado.",
            "Santiago de la Espada es una localidad perteneciente al municipio de Santiago-Pontones, Jaén (España). Era un municipio independiente hasta que en 1975 se fusionó con la localidad de Pontones. Está situado al sureste de la Comarca de Sierra de Segura. Limita con las provincias de Albacete (norte) y Granada (sur). Tiene 1492 habitantes y está situado a 1340 m de altura. Su gentilicio es hornillero debido a que en la Edad Media había un horno en el cual coincidieron unos pastores de las serranías de Cuenca para fundar lo que sería “El Hornillo”. Aunque el más comúnmente utilizado por los habitantes de la zona es el de santiagueño. Historia Nacimiento El origen de Santiago de la Espada tiene lugar en la prehistoria. En las Cuevas de “El Engarbo” (Santiago de la Espada) se ha demostrado, con fechas seguras, la ocupación humana más antigua en la provincia. En el 9250 a. C. existió en este lugar una comunidad de parentesco que vivían de la caza del ciervo, el rebeco, la cabra montés, el corzo y el jabalí. A esta primera fase de ocupación de la Cueva se superpone otra en el Neolítico, que por el material cerámico e industria lítica, se ha fechado a mediados del VI milenio a. C. A una fase más tardía pertenece el abrigo de \"Río Frío\", que alberga un sepulcro colectivo que se ha datado entre finales del III milenio y II a. C. Etapa ibérica La zona estuvo bajo la égida del gran centro ibérico de Toya (Peal de Becerro). De esta época es la necrópolis de las Quebradas. Edad Media Época musulmana Las tierras de la Sierra de Segura estuvieron pobladas por numerosas fortificaciones y alquerías o pequeñas poblaciones. Gracias a algunas de sus ciudades vecinas como Santiago-Pontones quedan vestigios de recintos fortificados entre los que destacan el Castillo de las Gorgolillas o el de Miller. ​ En 1243, el emir de la taifa de Murcia (Ibn Hud al-Dawla) firmó las capitulaciones de Alcaraz, con el rey Fernando III. El territorio de Santiago de la Espada se integra así a la Corona de Castilla dentro de Reino de Murcia hasta 1833, en que se crea la actual Provincia de Jaén. En este período la zona fue repoblada, definitivamente, por la Orden de Santiago por orden de Alfonso X, el cual concedió una serie de privilegios a sus habitantes en 1266. Época cristiana Los Reyes Católicos la hicieron villa de fuero Real, por las ayudas dadas en la conquista de Antequera y Granada. El Villazgo le fue confirmado rotundamente en 1637. El antiguo nombre de El Hornillo, a raíz de la visita realizada por el Mariscal de León y por el gobernador del Partido don Cristóbal López de Aguilera, se cambió por el de Puebla de Santiago. Don Cristóbal López hizo que se fundase una iglesia sobre la antigua ermita, bajo el mismo patrocinio. Durante el reinado de Felipe II se estableció su frontera o término municipal, aunando aldeas de los valles del río Zumeta y del río Segura como Tobos, Marchena (Jaén), Las Gorgollitas o Miller (Jaén). ​ Edad Moderna Pontones fue aldea de Segura de la Sierra, hasta su independencia en 1837. Actualidad El actual término municipal procede de 1975 con la fusión de los municipios de Pontones y de Santiago de la Espada. Aprovechamiento del territorio El 3% es tierra labrada, con cultivos herbáceos debido a que su territorio, que es el más frío de la comarca, impide el cultivo del olivo. Su accidentada orografía hace apto al municipio para los aprovechamientos forestales y ganaderos, dotándolo, además, de innumerables espacios naturales de interés, tanto por la fauna y la flora, como por el paisaje y la grandiosidad de los espacios. Actividad económica Está basada en el turismo, la ganadería, los aprovechamientos forestales, como la caza o la pesca, actividades que se complementan con la emigración temporal a la recolección de la aceituna y de productos hortícolas (en las regiones de Murcia y Valencia) e incluso a la hostelería en otras regiones. Cultura Posee una Iglesia, la Iglesia parroquial de Santiago Apóstol. Edificada en los siglos XVI-XVIII sobre una antigua ermita y reformada en el siglo XVIII. Tiene algún elemento mudéjar. Tiene arcos diafragma de medio punto. La iglesia posee el esquema de las iglesias levantinas del gótico final, retablos barrocos y un amplio coro de madera. Tiene un curioso artesonado y un estandarte de las ánimas de la cofradía de los Hermanacos, extinta. El retablo mayor de estilo barroco data del siglo XVIII. Fiestas Las fiestas patronales de Santiago de la Espada en honor a La Purísima, son en la segunda semana del mes de agosto (del 14 al 20). El acontecimiento principal de las fiestas gira en torno a los tradicionales encierros de reses bravas y posterior suelta de estas, celebrados del 17 al 20. Además, las carreras de cintas a caballo en las cuales participan muchos jóvenes y las animadas y divertidas verbenas nocturnas hacen que sea una buena ocasión para ir a este pueblo. También posee una feria ganadera, la cual se celebra durante tres días del mes de septiembre (del 15 al 17). Tiene su origen en una muestra ganadera que actualmente se ve incrementada con expositores de los más variados productos (ropa, artesanía, ganadería) y que destina el día 16 para la celebración de otra verbena nocturna.",
            "Santo Tomé es una localidad y municipio español de la provincia de Jaén, Andalucía, de 2105 habitantes (INE 2022) situado en el valle del alto Guadalquivir, en la comarca de Cazorla. Geografía humana Demografía Cuenta con una población de 2077 habitantes (INE 2024). Organización político-administrativa Eleciones municipales Alcaldía Economía Municipio principalmente agrícola, su mayor fuente de ingresos proviene principalmente del olivar, elaborando un aceite de oliva de alta calidad, cuya denominación de origen es Sierra de Cazorla y predominando la aceituna de variedad picual. En menor medida otra parte de los ingresos procedentes de la agricultura son de cereales y hortalizas, debido a su privilegiada ubicación en los fértiles valles de los ríos Guadalquivir y Cerezuelo. Igualmente, el cultivo del espárrago se está haciendo frecuente en la vega del Guadalquivir. Se ubica a las puertas de la Sierra de Cazorla y comienza a dar frutos el plan de conservación de cortijos y casas típicas tomeseñas para el desarrollo de un turismo en auge como el turismo rural. Evolución de la deuda viva municipal Historia Los restos arqueológicos más antiguos encontrados en su término municipal, que delatan la presencia humana, se remontan, por ahora, a la época del Neolítico final, con el hallazgo de cerámica fabricada a mano, con carena baja y mamelones, además de varios útiles líticos: puntas de flecha, dientes de hoz, machacadores, etc. Entre finales del IV milenio a. C. y los primeros siglos del III milenio, hubo un pequeño asentamiento en las inmediaciones de Santo Tomé. Se trataba de un grupo de personas que buscaban nuevas tierras para cultivo y pastoreo, mejores suelos para el aprovechamiento hortícola y cerealista empleando la técnica de quemar el bosque usando las cenizas como fertilizantes y explotar el suelo hasta su agotamiento. El asentamiento estaba constituido por una agrupación de pequeñas cabañas de forma circular, sin cimentación o ligeramente excavadas, construidas con piedras pequeñas en la base, y el resto con cañas y ramas trabadas con barro. De la Edad del Cobre existe un yacimiento cercano a la Agrupación de Santo Tomé (conocida también por Montiel), que ha sufrido diversas y recientes devastaciones. En 1983 un equipo de arqueólogos del entonces Colegio Universitario de Jaén llevaron a cabo dos catas para determinar su estratigrafía, confirmando un asentamiento con varias cabañas circulares pertenecientes a esta época, con superposición de sucesivas culturas. Tras el dominio cartaginés, durante la segunda guerra púnica se libró en Santo Tomé, entonces quizá conocida como Baecula, la llamada batalla de Baecula, ganada por el general romano Escipión contra el cartaginés Asdrúbal Barca. El Centro Andaluz de Arqueología Ibérica de la Universidad de Jaén ha llevado a cabo desde 2002 varias prospecciones arqueológicas que han concluido que en el Cerro de las Albahacas, en las cercanías de Santo Tomé, tuvo lugar esta batalla,​ aunque el asunto permanece aún en estado de discusión.​ Durante el dominio romano de la península, la zona estuvo ocupada por numerosas villas rústicas, como la de Las Graveras. En el Museo Provincial se conservan varias lápidas y otros objetos de este periodo. De la época visigoda se conserva una lápida funeraria (en el Museo Arqueológico Provincial) cuya traducción viene a decir: \"Avilia Marcela, de treinta y cinco años de edad, aquí está sepultada.- Séale la tierra ligera, sus compañeros le dedicaron este recuerdo\".​ En época musulmana fue una de las alquerías que se dieron en la zona y contaba con una torre para su protección. La torre, mencionada en las crónicas cristianas inmediatas a la conquista, fue posteriormente transformada en campanario de la iglesia parroquial. Santo Tomé pasó a formar parte del Adelantamiento de Cazorla, patrimonio del arzobispo de Toledo, junto con otras poblaciones de la comarca. En 1438 el arzobispo autorizó la fundación de esta población a Pero Díaz de Toledo, quien relató que al llegar al lugar sólo existían un cortijo y una vieja torre.​ En el año 1543, Día Sánchez de Quesada, sexto señor de Garcíez y de la Torre de Santo Tomé, se casó con Leonor de Acuña, señora del castillo y heredamiento de Nínchez y Chozas en Baeza. Posteriormente, el Vizcondado de Santo Tomé fue creado en 1627 por Felipe IV a favor de Hernando de Quesada Mendoza y Toledo.​ Patrimonio La construcción más antigua que alberga Santo Tomé es la torre del campanario de la iglesia de Santo Tomás. Esta torre, de origen cristiano (siglo XIV), cumplía funciones defensivas, al funcionar como atalaya. Tras la fundación del pueblo, la torre se anexó a la iglesia para ser reutilizada como campanario. Junto a la iglesia, se encuentra la Casa Grande, la construcción civil con más antigüedad de la localidad (siglo XVI). Sobre la puerta, se puede observar el escudo de armas de la familia que la habitaba. Esta casa-palacio fue incluida en el Catálogo General del Patrimonio Histórico Andaluz en 1997. En 2006 se rehabilitó como residencia para la tercera edad. Fiestas La noche del 2 de febrero (víspera del día de San Blas), tradicionalmente los vecinos realizan una luminaria con leña procedente del olivar y en torno a ella gira la fiesta con canciones tradicionales, corros, bebidas y carnes hechas en sus brasas. Al final de la temporada de recogida de la aceituna, en torno al mes de marzo, cada tajo (grupo de trabajadores), al finalizar la campaña, organiza su \"botijuela\", donde los compañeros de trabajo comen y beben durante todo el día para celebrar la recogida de la cosecha. El 15 de mayo, con motivo de la festividad del patrón de los agricultores, San Isidro Labrador, los tomeseños realizan una romería hasta el río Guadalquivir, donde pasan un día campero y se cocina una paellada por parte de la \"Hermandad de San Isidro\". El primer fin de semana de agosto se celebran las \"Fiestas del Emigrante\", en las que la población del municipio suele aumentar debido a los numerosos familiares que regresan, principalmente desde Cataluña, adonde tuvieron que emigrar hace décadas en busca de trabajo. Entre los días 23 y 27 del mes de septiembre tiene lugar la feria patronal en honor a la Virgen de los Remedios, siendo el día grande el 24. Por la mañana se celebra una misa en su honor y por la tarde su imagen es sacada en procesión por las calles de la localidad. Agrupación de Santo Tomé A 2 km del núcleo urbano se encuentra la Agrupación de Santo Tomé, también conocida como Montiel. Con una iglesia y una escuela ya cerradas, el único servicio del que disponen este centenar de casas es un bar, por lo que sus habitantes han de desplazarse al colegio, iglesia, centro médico, etc. Es uno de los núcleos de nueva creación consecuencia de la colonización agraria en Andalucía.",
            "Cárcheles es un municipio español de la provincia de Jaén, Andalucía. Situado en la comarca de Sierra Mágina, está formado por las localidades de Cárchel y Carchelejo, que hasta 1975 fueron municipios independientes. Está emplazado en la ladera noreste de las Sierras de los Grajales y de Alta Coloma, descendiendo hasta el río Guadalbullón. Cuenta con una población de 1320 habitantes según el padrón del INE del año 2021, los cuales están repartidos entre los dos núcleos de población principales que conforman el municipio. Historia Orígenes y formación La primera documentación escrita que se conoce a cerca de los tres núcleos (Carchelejo, Cárchel y Cazalla) y cuyo III Centenario de su creación como municipio independiente se conmemoró en 1996, está fechada en la época de la conquista de estas tierras por los reyes castellanos. Hacia la segunda mitad del siglo XIII - 1256 -, Alfonso X el Sabio donó al Obispo de Jaén el Castillo de Cárcheles, cuyas ruinas se ubican en lo que conocemos como Castillejo. En 1271, aparece un señorío que poseía don Día Sánchez, sobre Cárchel y Cazalla, enclaves fronterizos que en pocos años conocieron diversas jurisdicciones, pasan por varios propietarios y a finales del siglo XV pertenecen de nuevo al Obispado de Jaén. En 1485, lo Reyes Católicos conquistan la villa de Cambil y pasa a depender esta villa de la ciudad de Jaén. En 1558, Cambil, se separa de la jurisdicción de Jaén y cuando se decide el deslinde y amojonamiento del nuevo término surgido, quedan incluidos en éste los cortijos de Carchelejo, Cárchel y Cazalla. Tenemos pues, en pleno siglo XVI, a nuestros núcleos que son unos cortijos que pertenecían al término de Cambil, y con una demografía de 12 vecinos Cárchel, 33 vecinos Carchelejo y 26 vecinos Cazalla. El reinado de Carlos II (1665-1700) es una de las épocas más tristes que haya conocido España. Está prácticamente desmembrada y la economía está arruinada. En este contexto histórico, cuando ante los agobios financieros de la Hacienda Real, decide vender estos lugares a Don Antonio de Arellano y Contreras, en la cantidad de tres millones de maravedís, equivalentes a ochomil ducados. En 1696, y tras varios años de pleitos, decide volver a reintegrarlos a la Corona de España. Pero al hacerlo de nuevo realengos los exime de la jurisdicción de Cambil, y pasan a formar un nuevo Concejo, desde el 24 de mayo de 1696. La casa del Concejo, es decir el Ayuntamiento, se instaura en Carchelejo, ya que en esta época era el núcleo de mayor entidad demográfica. Así que para nuestros núcleos finaliza el siglo XVII, el siglo de la decadencia en España, formando un nuevo municipio con centro administrativo en Carchelejo.​ Siglo XVIII Carchelejo que tiene a comienzos de siglo 388 habitantes y entre mediados y finales de este mismo siglo una población de 1024 habitantes es un pueblo donde la mayor parte de su población se dedica al sector agropecuario y el resto de la población está vinculado al campo de una manera u otra, hay que tener en cuenta que la tierra se repartía entre tres tipos de propietarios: particulares, comunales y de la Iglesia. Con respecto a la propiedad particular, estaba desigualmente repartida, si tenemos en cuenta que de todos los propietarios, en torno al 50 % poseían solo el 1´76 % del total de la tierra. En cambio, solo dos propietarios poseían más del 50 % de la tierra. En Carchelejo, las propiedades de la Iglesia alcanzan un porcentaje de 5´78 % del total de la tierra del término, siendo una proporción baja comparada con la nacional. La vida en el municipio giraba en torno a dos ejes: el sistema de Administración local y la Iglesia: fiestas, asistencia, educación, etcétera, ya que el Estado no asumía ninguna de estas funciones. Carchelejo en este siglo pertenecía al Corregimiento de Jaén, y es a éste Corregidor a quién pertenecía la administración de la Justicia Civil y Criminal. El Concejo del lugar de Carchelejo y sus anejos lo formaban los siguientes cargos: los Alcaldes Ordinarios, máxima autoridad en el gobierno municipal; tres Regidores, cuyas funciones serían equivalentes alas de los actuales concejales; un Alcalde de la Santa Hermandad, encargado de organizar y recabar personas, en un caso urgente, para perseguir bandidos y malhechores; un Alguacil Mayor, un Sindico Personero, defensor de los intereses de la comunidad ante abusos o desvíos cometidos por el Cabildo. Las disposiciones económicas del Concejo de Carchelejo eran mínimas pues no percibía renta alguna ni tenía propios ni dehesas, de ahí que los costes derivados de las tareas anteriores correrían a cargo de los vecinos. Al igual las fiestas, como la Festividad del Corpus, que era costeada a expensas de los vecinos por devoción. Importante resaltar el tema impositivo. Había dos clases de Impuestos: -Los que percibía la Hacienda Real. -Los que recaudaba la Iglesia en concepto de diezmo.​ Siglos XIX y XX En el siglo XIX, el hecho de mayor relevancia es la separación administrativa del núcleo de Cárchel. Separación que resultó traumática para ambas localidades. Fue iniciada a instancias de Antonio de Almazán, segundo regidor del Concejo de Carchelejo y vecino de Cárchel, en el año 1841. La consumó en el mes de abril de 1843. Durante el proceso el cura don Manuel García fue separado y desterrado a la distancia de seis leguas de su curato, por el gobernador del Obispado de Jaén, dadas sus implicaciones políticas en dicho proceso. Entre los siglos XIX y XX, ambas poblaciones siguen creciendo demográficamente. En 1899 la cifra de habitantes ascendía a 2565 para alcanzar el máximo en 1930 con 3652 habitantes. Este máximo esplendor demográfico de los dos núcleos comienza a decaer a partir de la guerra civil, debido al descenso de natalidad durante este período. La emigración definitiva de familias, a final de la década de los cincuenta y sobre todo en los años sesenta, a países extranjeros y en España al País Vasco, Madrid y Cataluña, estuvo motivada por el pobre desarrollo agrícola de la comarca, propio de todas las zonas que dependen de un monocultivo, que hace muy vulnerable la economía de estos pueblos ante años de malas cosechas y por el carácter estacional del cultivo del olivo. Un cultivo escaso en el siglo XVIII, pero que a lo largo del XIX y, principalmente, en el siglo XX se convierte en el cultivo esencial. Las consecuencias del monocultivo del olivo en la zona son: -Altas tasas de desempleo, siendo la emigración la única salida para mejorar el nivel de vida de las familias. -Envejecimiento de la población que queda, pues emigran las personas jóvenes y más activas, lo que da lugar a una reducción del crecimiento vegetativo, pasando de un índice del 19,6 % en 1930 a 2,8 % en 1970 y llegando a ser nulo en 1980. Ante esta cruda realidad económica y demográfica, por Decreto 450/74 de 7 de febrero de 1974 (BOE n.º 44 de 20 de febrero de 1974), se fusionan los municipios de Carchelejo y Cárchel, formando un solo municipio como había ocurrido hasta 1843, pero ahora con la denominación de los Cárcheles.​ Demografía Cuenta con una población de 1293 habitantes (INE 2024). Economía La base de la economía carchuna es el cultivo del olivar, al igual que en la mayoría de localidades jiennenses. Destaca también como actividad económica la industria cárnica de transformados del cerdo, de muy buena calidad. En la parte noroeste existen pastos permanentes destinados a la ganadería. Evolución de la deuda viva municipal El concepto de deuda viva contempla sólo las deudas con cajas y bancos relativas a créditos financieros, valores de renta fija y préstamos o créditos transferidos a terceros, excluyéndose, por tanto, la deuda comercial. Comunicaciones El municipio de Cárcheles se encuentra a unos 30 kilómetros de la ciudad de Jaén, desde la que se puede llegar tomando la A-44 en dirección a Granada-Motril, para luego coger la salida 59 y enlazar con la JA-3206.​ Escudo y bandera Una vez que el municipio de Cárcheles quedó constituido como tal en 1974, era necesario elaborar un escudo y una bandera que le diera identidad corporativa al mismo. Con tal motivo, los historiadores Andrés Nicás y Jorge González elaboraron, en 1996, un informe técnico para la rehabilitación del escudo y la bandera de Cárcheles y enviado para su aprobación a la Real Academia de Ciencias, Bellas Artes y Nobles Artes de Córdoba, organismo competente para el estudio de las insignias relativas a los ayuntamientos de Andalucía. El escudo de Cárcheles sintetiza elementos de las insignias de los dos núcleos de población a los que comprende y presenta las siguientes características: -Contorno español. -Torre en campo de color rojo. -A la derecha de la torre una llave y a la izquierda, una escalera que se apoya en ella. Todo el conjunto se encuentra coronado por una corona real española de oro y pedrería. La bandera contiene el escudo. Es de color verde oliva y tiene forma rectangular, con una proporción de tres módulos de larga por dos de ancha.​ Organización político-administrativa Resultados electorales Alcaldía Patrimonio histórico Ruinas de Castillejo El Castillejo de Cárchel es de origen musulmán y en los aledaños han aparecido multitud de fragmentos de cerámica hispano-musulmana vidriada y sin vidriar, y entre todos los restos arqueológicos encontrados en la zona, destaca la cabeza de una figurilla de barro cocido, encontrada en 1997 por el niño José M. Ruiz. Posiblemente se trate de una pervivencia de los exvotos ibéricos en época musulmana.​ Ruinas de Castellón En Cazalla hay un conjunto arqueológico formado por una necrópolis, con unas 15 tumbas perfectamente identificadas. Además está constatada la existencia de un poblado junto a la necrópolis, así como una fortaleza o torreón defensivo, actualmente llamado Castellón. En la Venta de la Ramona se constata la existencia de un asentamiento romano, donde se han encontrado numerosos restos de tégulas romanas.​ Convento de Cazalla Desde el siglo XV existía un monasterio de agustinos en el lugar de Cazalla, que en 1578 pasó a ser de la orden de S. Basilio Magno. De dicho convento, alcanzó su máximo esplendor en el siglo XVIII llegando a tener 13 monjes, 3 legos, 8 sirvientes, y más de 200 fanegas de cultivo (130 hectáreas aproximadamente) En cuanto a los restos existentes en la actualidad, solo se conserva una portada, con un arco de medio punto cegado que daba acceso al templo y, sobre él, la estatua de S. Basilio Magno, en una hornacina tapiada hasta la mitad. Es una talla de yeso de proporciones reducidas, que solo deja ver la cabeza del santo titular, con una luenga barba y una mitra. La talla ha sido recientemente restaurada. Este convento está muy ligado a Nuestra Señora de la Esperanza. A menudo, Nuestra Señora de la Esperanza, es automáticamente asociada a Sevilla y a su Semana Santa. Sin embargo, algo que mucha gente desconoce, es que su origen se sitúe en la provincia de Jaén, concretamente en la comarca de Sierra Mágina, a tenor de algunos estudios y del hallazgo de un documento, de gran importancia sobre este tema. En la toponimia del convento de Cazalla aparece una referencia a la Virgen Macarena, en el año de 1749, coincidiendo con la época de máximo esplendor de la Orden de los Basilios, como bien refleja el Catastro del Marqués de la Ensenada. Esta acta que presentamos, que se refiere a una guía de transporte de ganado, es el único documento encontrado en el archivo municipal, hasta el momento, donde se confirma algo que avalan estudios anteriores, como el publicado por Rafael Ortega y Sagrista, “El monasterio de Nuestra Señora de la Esperanza, en el barranco de Cazalla, perteneciente a la orden de San Basilio Magno,” donde se determina el origen de tal advocación mariana, la famosa Virgen Esperanza Macarena de Sevilla, en estos lugares. Lo que si parece constatado plenamente es que el centro difusor de los monjes basilios en el sur peninsular proviene de la comarca de Sierra Mágina, en concreto Mata-Begid y el mencionado Convento de Cazalla, como lo demuestra Vicente Oya, o el libro de Hilario Arenas González \"La Macarena de Sevilla\". Es aún todo ello una interesante línea de investigación en ciernes.​ Patrimonio monumental Iglesia Parroquial de \"Nuestra Señora de los Ángeles\" de Carchelejo La actual iglesia parroquial de Carchelejo está construida sobre otra anterior edificada en el último tercio del siglo XVI, según Lázaro Damas. En 1582, Juan Ruiz Castejo \"El Viejo\" y su hijo Juan Ruiz Castejón, naturales de Jaén, se comprometen a construir una iglesia diseñada por Francisco de Quesada, maestro mayor de la obra. Según se desprende del contrato, tenía que construirse una iglesia de una nave, con la capilla mayor destacada y separada por arco toral del templo y la sacristía. Parece se que tenía que construirse un campanario en el testero, por lo que el muro tuvo que ser más grueso en este lugar. El día 9 de octubre de 1680 se produjo un fuerte terremoto que causó graves desperfectos en la iglesia. Durante todo el siglo XVII se realizaron las obras de reconstrucción de la iglesia. La construcción actual, en estilo neoclásico, se realizó a finales del siglo XVIII. La fachada restaurada en el siglo XIX presenta una sencilla disposición vertical compuesta. El presbiterio, que ya había sido ampliado en los años 60 del siglo actual, ha sido recientemente remodelado, con diseño del arquitecto Luis Alonso Salcedo.​ Iglesia Parroquial de \"Nuestra Señora de los Remedios\" de Cárchel La iglesia de Cárchel se asienta junto a un antiguo cementerio visigodo y sobre otra iglesia más antigua. Junto a un patio antiguo de la iglesia, apareció en los años 60 una lápida visigoda que nos documenta la existencia de un enterramiento visigodo en la zona. Esta lápida se encuentra, actualmente expuesta en la Sala Visigoda del Museo Provincial de Jaén. Echando una ojeada a los elementos constructivos de la iglesia, puede apreciarse que su construcción se ha realizado sobre unos muros anteriores, formados por grandes sillares de piedra pertenecientes a otra iglesia de mayores proporciones, que abarca parte de la actual sacristía y casa del párroco. La primera noticia que tenemos de la actual, es la que figura en la portada, 1743. Esta portada es de estilo neoclásico y con una pequeña espadaña como campanario. Junto a la iglesia está la casa del párroco.​ Ermita de San Marcos, Carchelejo Situada en la calle S. Marcos, fue trasladada de su emplazamiento a mediados de la década de los ochenta y su lugar es ocupado en la actualidad por una plaza pública junto a la actual ermita. De su anterior estructura, solo se ha mantenido el arco de entrada y la pequeña espadaña de piedra, rematada por una cruz del mismo material.​ Ermita de San Marcos, Cárchel Modificada en el mismo período que la anterior, tiene una pequeña espadaña con una campana pequeña con un arco de medio punto en la entrada y flanqueada por dos ventanas.​ El convento de Cazalla Desde el siglo XV existía un monasterio de agustinos en el lugar de Cazalla, que en 1578 pasó a ser de la orden de S. Basilio Magno. De dicho convento, como se conocen a los restos existentes en la actualidad, solo queda una portada, con un arco de medio punto cegado que daba acceso al templo y, sobre él, la estatua de S. Basilio Magno, en una hornacina. Es una talla de yeso de proporciones reducidas, con una luenga barba y una mitra, y en su mano derecha un convento. La talla ha sido recientemente restaurada. Patrimonio natural Cárcheles dispone de gran diversidad de parajes naturales como el Barranco del Monasterio, la Cueva del Puerto de las Palomas, Cazalla y el Convento, etcétera, donde realizar excursiones, utilizando toda clase de medios de transporte: a pie, en caballería, bicicleta, moto o coche, etc. La vegetación autóctona predominante son las encinas y quejigos, monte bajo de romero, lentisco y sabina. Algunas rutas muy conocidas son la Carchelejo- Cazalla- Convento, Cárchel a Carchelejo por el Barranco de la Parrilla o la ascensión a la Cueva del Puerto de las Palomas. En la periferia urbana de los dos núcleos existen varias zonas recreativas, como el Parque de la Fuente, el Haza de la Viuda y las instalaciones deportivas de Carchelejo y Cárchel. También existe un conjunto de fuentes y abrevaderos construidos en piedra que recuerdan la importancia de las bestias en la vida rural, hasta que los vehículos de motor comenzaron a sustituirlas. Se puede destacar la Fuente de Carchelejo, compuesta por seis pilones.​ Fiestas 13 de diciembre: Lumbres de Santa Lucía. 17 de enero: Fiesta de San Antón. Lumbres en la tarde-noche del día 16. Jueves anterior al último domingo de abril: Llegada de la Hermandad de la Virgen de la cabeza. 13 de junio: Verbena de San Antonio de Padua. 3 de mayo: Cruces. 13-16 de agosto: Fiestas patronales de la Virgen del Rosario y de San Roque. 14 de agosto: Avanzadillas de Moros y Cristianos, declaradas de Interés Turístico Regional en Andalucía. Último domingo de agosto: Fiesta de la Virgen de los Remedios."
        ]
    },
    "test_14": {
        "question": "¿Qué animales se pueden encontrar en Despeñaperros?",
        "reference": "En Despeñaperros se pueden encontrar principalmente ciervos y jabalíes, aunque también pueden encontrarse con menor probabilidad linces, lobos y zorros. En cuanto a aves, destacan el águila imperial y el buitre leonado.",
        "response": "En Despeñaperros se pueden encontrar animales como ciervos, jabalíes, muflones, gamos, lobos, linces, mangostas, gatos salvajes, nutrias, buitres negros y águilas imperiales.",
        "reference_contexts": "['El Parque natural de Despeñaperros es un espacio natural protegido situado en el municipio de Santa Elena, al norte de Andalucía y excavado por el río Despeñaperros. Fue declarado Parque natural por la Junta de Andalucía por sus valores geológicos, paisajísticos, así como por su flora y fauna destacables, y cuenta con una extensión de 7649 ha. Se trata de un desfiladero de paredes abruptas, con desniveles de más de 500 m de altura y muy utilizado por el hombre a lo largo de la historia, al ser paso natural de la Sierra Morena y punto de conexión principal entre Andalucía y la Meseta por Castilla-La Mancha. Por Despeñaperros han pasado históricamente importantes vías de comunicación tanto por carretera, con la autovía del Sur, como por ferrocarril. Desde 1985, era uno de los dos únicos accesos ferroviarios que conectaban Andalucía con el exterior (junto con la línea Mérida-Sevilla) y el más importante hasta 1992, cuando se concluyó la línea de alta velocidad Madrid–Sevilla (90 km al oeste). Nombre El nombre de «Despeñaperros» tiene su origen entre la meseta castellana y Andalucía, surgida de deformaciones fonéticas del lenguaje de la época, de ahí surgiría el término Bezpañaperros, que daría con el tiempo el nombre actual del desfiladero.\\u200b La primera palabra, Bezpaña, es una variante confusa de la palabra \"Hespaña\", es decir España, de pronunciación deformada o viciada. La segunda palabra, perros , se basa nuevamente en las palabras confusas \"besparras\" y \"Hesperia\". Hesperia en la mitología griega y romana se refería a la tierra mítica en los márgenes, en lo que cabe decir el lucero del Véspero/Hespero y las Hespérides. De igual manera, en el Atlas de El Escorial, del XVI, el paso aparece representado con el nombre de «puerto del Muladar».\\u200b por lo que algunos presuponen que su actual nombre es posterior a esa fecha. Pese a que el significado del nombre parece claro, no se conoce su origen. Existen varias leyendas al respecto. La más conocida de ellas dice que en la batalla de las Navas de Tolosa las tropas cristianas, invictas, precipitaron a las tropas almohades, a los cuales llamaban perros, por los desfiladeros del lugar. Algunos mencionan la batalla de Bailén en su lugar.\\u200b Geología Está situado en los límites orientales de la Sierra Morena, de orientación este-oeste, pero que es atravesada por algunos ríos orientados de norte a sur, haciendo que algunas zonas de la Meseta Central drenen hacia el sur, hacia el río Guadalquivir, atravesando la teórica barrera natural de la Sierra Morena. Este es el caso del río Despeñaperros que ha excavado este desfiladero, pero también el del río Guarrizas, que discurre unos 11 km al este, y que forma la hermosa cascada de Cimbarra, protegida como paraje natural. Hay que señalar que el río Despeñaperros es afluente del Guarrizas, al que se une unos 10 km al sur del desfiladero. Por otro lado, el desfiladero pone al descubierto parte de la historia geológica del entorno, paredes verticales compuestas por cuarcitas, principalmente de la formación denominada cuarcita armoricana, de gran dureza, formada en el mar hace 500 millones años a comienzos del Paleozoico, que posteriormente sería cubierta por materiales más modernos y que en el Carbonífero, hace unos 320 millones de años, en la orogenia varisca por colisión de los continentes Laurussia y Gondwana, quedarían elevados y expuestos a la erosión durante millones de años, hasta su completa denudación. Es en el Cenozoico, durante la orogenia alpina, cuando se forma el relieve actual, elevándose las sierras interiores de la península ibérica por el choque entre las placas africana y europea. En los estratos de la cuarcita armoricana quedan a veces al descubierto espectaculares ondulitas o rizaduras de oleaje, como las que podemos observar en cualquier fondo marino somero arenoso, lo que nos desvela su origen. También excepcionalmente quedan al descubierto crucianas, rastros fósiles de organismos que dejaron su marca en el sedimento arenoso hace casi 500 millones de años. De entre las formaciones rocosas y laderas rocosas que se observan en Despeñaperros, destacan algunas con nombre propio, como El Salto del Fraile, Las Correderas, o Los Órganos, en los que la cuarcita ha sido plegada hasta quedar en estratos verticales, a los que la erosión ha dado formas de tubos puntiagudos, que evocan el órgano musical. Flora La vegetación dominante es similar en toda la Sierra Morena oriental, el bosque mediterráneo, con predominio de encinas y alcornoques, pero también quejigo, roble melojo, arizónicas y pinos (piñonero, carrasco y negral). El matorral es de madroños, brezos, jaras, mirtos y coscojas. También merecen mención los bosques galería que aparecen en los distintos ríos y arroyos, más umbríos y húmedos, con alisos, fresnos y sauces. Por otra parte, en el parque natural existen treinta endemismos únicos en el mundo y otras especies únicas en la península ibérica. Fauna Hay una importante presencia de ciervo y jabalí, sobre los que se mantienen autorizadas monterías de caza, pero es más destacable la existencia de algunos pocos ejemplares de lince ibérico y de lobo ibérico, así como pequeños carnívoros como el zorro, el meloncillo y el gato montés. Entre las aves que habitan Despeñaperros destaca el águila imperial y el buitre leonado. Historia Tanto en Despeñaperros como en la cascada de Cimbarra y las cuevas del entorno se presentan importantes ejemplos de pinturas rupestres neolíticas, prueba del valor estratégico que este territorio tuvo como lugar de paso obligado de civilizaciones desde la Meseta Central hacia Andalucía, entre las que destacan las de la Cueva de los Muñecos y las de las Cuevas de las Vacas del Retamoso. Imágenes']",
        "retrieved_contexts": [
            "El Parque natural de Despeñaperros es un espacio natural protegido situado en el municipio de Santa Elena, al norte de Andalucía y excavado por el río Despeñaperros. Fue declarado Parque natural por la Junta de Andalucía por sus valores geológicos, paisajísticos, así como por su flora y fauna destacables, y cuenta con una extensión de 7649 ha. Se trata de un desfiladero de paredes abruptas, con desniveles de más de 500 m de altura y muy utilizado por el hombre a lo largo de la historia, al ser paso natural de la Sierra Morena y punto de conexión principal entre Andalucía y la Meseta por Castilla-La Mancha. Por Despeñaperros han pasado históricamente importantes vías de comunicación tanto por carretera, con la autovía del Sur, como por ferrocarril. Desde 1985, era uno de los dos únicos accesos ferroviarios que conectaban Andalucía con el exterior (junto con la línea Mérida-Sevilla) y el más importante hasta 1992, cuando se concluyó la línea de alta velocidad Madrid–Sevilla (90 km al oeste). Nombre El nombre de «Despeñaperros» tiene su origen entre la meseta castellana y Andalucía, surgida de deformaciones fonéticas del lenguaje de la época, de ahí surgiría el término Bezpañaperros, que daría con el tiempo el nombre actual del desfiladero.​ La primera palabra, Bezpaña, es una variante confusa de la palabra \"Hespaña\", es decir España, de pronunciación deformada o viciada. La segunda palabra, perros , se basa nuevamente en las palabras confusas \"besparras\" y \"Hesperia\". Hesperia en la mitología griega y romana se refería a la tierra mítica en los márgenes, en lo que cabe decir el lucero del Véspero/Hespero y las Hespérides. De igual manera, en el Atlas de El Escorial, del XVI, el paso aparece representado con el nombre de «puerto del Muladar».​ por lo que algunos presuponen que su actual nombre es posterior a esa fecha. Pese a que el significado del nombre parece claro, no se conoce su origen. Existen varias leyendas al respecto. La más conocida de ellas dice que en la batalla de las Navas de Tolosa las tropas cristianas, invictas, precipitaron a las tropas almohades, a los cuales llamaban perros, por los desfiladeros del lugar. Algunos mencionan la batalla de Bailén en su lugar.​ Geología Está situado en los límites orientales de la Sierra Morena, de orientación este-oeste, pero que es atravesada por algunos ríos orientados de norte a sur, haciendo que algunas zonas de la Meseta Central drenen hacia el sur, hacia el río Guadalquivir, atravesando la teórica barrera natural de la Sierra Morena. Este es el caso del río Despeñaperros que ha excavado este desfiladero, pero también el del río Guarrizas, que discurre unos 11 km al este, y que forma la hermosa cascada de Cimbarra, protegida como paraje natural. Hay que señalar que el río Despeñaperros es afluente del Guarrizas, al que se une unos 10 km al sur del desfiladero. Por otro lado, el desfiladero pone al descubierto parte de la historia geológica del entorno, paredes verticales compuestas por cuarcitas, principalmente de la formación denominada cuarcita armoricana, de gran dureza, formada en el mar hace 500 millones años a comienzos del Paleozoico, que posteriormente sería cubierta por materiales más modernos y que en el Carbonífero, hace unos 320 millones de años, en la orogenia varisca por colisión de los continentes Laurussia y Gondwana, quedarían elevados y expuestos a la erosión durante millones de años, hasta su completa denudación. Es en el Cenozoico, durante la orogenia alpina, cuando se forma el relieve actual, elevándose las sierras interiores de la península ibérica por el choque entre las placas africana y europea. En los estratos de la cuarcita armoricana quedan a veces al descubierto espectaculares ondulitas o rizaduras de oleaje, como las que podemos observar en cualquier fondo marino somero arenoso, lo que nos desvela su origen. También excepcionalmente quedan al descubierto crucianas, rastros fósiles de organismos que dejaron su marca en el sedimento arenoso hace casi 500 millones de años. De entre las formaciones rocosas y laderas rocosas que se observan en Despeñaperros, destacan algunas con nombre propio, como El Salto del Fraile, Las Correderas, o Los Órganos, en los que la cuarcita ha sido plegada hasta quedar en estratos verticales, a los que la erosión ha dado formas de tubos puntiagudos, que evocan el órgano musical. Flora La vegetación dominante es similar en toda la Sierra Morena oriental, el bosque mediterráneo, con predominio de encinas y alcornoques, pero también quejigo, roble melojo, arizónicas y pinos (piñonero, carrasco y negral). El matorral es de madroños, brezos, jaras, mirtos y coscojas. También merecen mención los bosques galería que aparecen en los distintos ríos y arroyos, más umbríos y húmedos, con alisos, fresnos y sauces. Por otra parte, en el parque natural existen treinta endemismos únicos en el mundo y otras especies únicas en la península ibérica. Fauna Hay una importante presencia de ciervo y jabalí, sobre los que se mantienen autorizadas monterías de caza, pero es más destacable la existencia de algunos pocos ejemplares de lince ibérico y de lobo ibérico, así como pequeños carnívoros como el zorro, el meloncillo y el gato montés. Entre las aves que habitan Despeñaperros destaca el águila imperial y el buitre leonado. Historia Tanto en Despeñaperros como en la cascada de Cimbarra y las cuevas del entorno se presentan importantes ejemplos de pinturas rupestres neolíticas, prueba del valor estratégico que este territorio tuvo como lugar de paso obligado de civilizaciones desde la Meseta Central hacia Andalucía, entre las que destacan las de la Cueva de los Muñecos y las de las Cuevas de las Vacas del Retamoso. Imágenes",
            "La cueva de los muñecos es una cueva de interesante valor geológico, localizada a unos 86 km de Jaén y a 12 de la localidad de Santa Elena, en el parque natural de Despeñaperros. Conservación Pese al gran desgaste y a la desatención que ha recibido por parte de las instituciones públicas, la cueva conserva aún gran parte de su majestuosidad y posee asimismo un gran valor arqueológico, ya que en ella se instaló un santuario ibérico, el Santuario del Collado de los Jardines, del que se han recuperado unos dos mil quinientos exvotos de bronce y barro a pesar de los expolios.​ Localización Está enclavada en uno de los parajes más abruptos de Sierra Morena, en el interior del Parque Natural de Despeñaperros, término municipal de Santa Elena, dentro de un barranco, empotrado entre colosales bloques de piedra, en los que hay excavadas varias cuevas, la mayor de las cuales, de unos 50 metros de profundidad, formaba probablemente el límite del recinto sagrado. Organización Dentro de esta cueva en la actualidad hay un manantial de agua que probablemente debió existir ya en la antigüedad. En la zona existe hoy por hoy un \"Centro de Interpretación del Patrimonio Histórico y Cultural del Parque Natural de Despeñaperros\", así como un sendero de uso público que conduce al Santuario y a un mirador en el llamado Cerro del Castillo.",
            "El cordero segureño es una raza española de ganado ovino adaptada a la vida en las Sierras de Segura y de La Sagra y las zonas altas de la ribera del río Segura, de donde toma su nombre.​ Las provincias de Granada, Murcia, Albacete, Jaén y Almería comparten las áreas de distribución de esta raza en la península ibérica. Procede del tronco manchego de la especie, del que quedó desvinculada oficialmente por el Ministerio de Agricultura, Pesca y Alimentación en el año 1978,​ tomando el nombre de «segureña», amparando las variedades blanca, rubisca y mora. Las duras condiciones que soportan, unida a la prolificidad de la especie y calidad de su carne han contribuido a que el Gobierno de España le concediera su distintivo de origen y calidad el 23 de abril de 2008.​ Con la publicación en el Boletín Oficial del Estado (BOE), el Gobierno posibilitó que esta Indicación Geografía Protegida (IGP) comenzara a funcionar, la Unión Europea aprobó de forma definitiva la IGP Cordero Segureño el 25 de noviembre de 2013.​ La IGP 'Cordero Segureño' solo es para los corderos de la raza segureña que se produzcan en 144 municipios de las provincias de Granada, Murcia, Albacete, Jaén y Almería. En 2023 había un total de 149.731 ejemplares distribuidos en 214 ganaderos.​ La producción anual es de unos 450 000 corderos al año, que genera una riqueza de más de 60 millones de euros en estas cinco provincias. Bajo esta mención se ampara la carne fresca comercializada en canal, media canal o en partes despiezadas con o sin hueso o en unidades de venta al consumidor, obtenida a partir de los corderos (macho o hembra) procedentes de la raza ovina 'segureña'. En Granada En la zona más próxima a la comarca de Huéscar es donde se concentra la mayor parte de la cabaña ganadera de la raza segureña. Solo en la comarca oscense 600 familias viven directamente de la cría del cordero segureño. La producción anual de corderos en Huéscar es de 200 000 lo que supone unas transacciones anuales de más de 19 millones de euros. En Murcia En la Región de Murcia destaca la comarca del Noroeste, donde se encuentra la mayor parte de la producción y comercialización de cordero segureño de la región. Es entre las cumbres de Moratalla, Caravaca de la Cruz, Bullas, Cehegín o Calasparra donde se cría y reproduce este ganado y se elaboran recetas ancestrales como el asado de cordero, el guiso de cordero o la tartera caravaqueña, platos típicos de la cocina murciana.​​",
